VoyageId,VesselName,VesselRig,Destination,DepartureDate,SortDate,Tonnage,ImageID,VoyageNotes
S847E,Hopewell,Brig,Lisbon,11/21/1799,1799-11-21,141,"1007, 1008",NULL
S848E,Arthur,Schooner,Havana,07/23/1803,1803-07-23,100,"1022, 1023, 1031, 1032",NULL
S849E,Atlantic,Schooner,Surinam,12/28/1803,1803-12-28,103,"1035, 1036",NULL
S850E,Betsey,Ship,Hamburg,06/22/1803,1803-06-22,218,"1051, 1052",NULL
S851E,Betsy,Brig,West Indies,08/29/1803,1803-08-29,114,"1056, 1057",NULL
S852E,Betsey,Brig,West Indies,05/12/1803,1803-05-12,NULL,"1058, 1059",NULL
S853E,Betsey,Schooner,Havana,04/26/1804,1804-04-26,88,"1062, 1063",NULL
S854E,Catharine,Brig,Norfolk and Europe,05/18/1803,1803-05-18,158,"1069, 1070",NULL
S855E,Commerce,Brig,West Indies,07/14/1803,1803-07-14,167,"1071, 1072",NULL
S856E,Dolly,Schooner,West Indies,09/16/1803,1803-09-16,81,"1082, 1083",from Beverly
S857E,Dolphin,Brig,NULL,06/24/1803,1803-06-24,127,"1084, 1085",NULL
S858E,Dolphin,Schooner,St. Peters,06/04/1803,1803-06-04,37,"1086, 1087",Vessel of Yarmouth
S859E,Eliza,Schooner,Teneriffe & Markets,06/15/1803,1803-06-15,101,"1088, 1089, 1090, 1091",NULL
S861E,Essex,Ship,Europe (Embden),06/17/1803,1803-06-17,256,"1095, 1096",NULL
S862E,Fame,Schooner,West Indies,08/26/1803,1803-08-26,62 12/19,"1097, 1098",NULL
S863E,Fishhawk,Schooner,The West Indies,08/24/1803,1803-08-24,101,"1101, 1102",NULL
S864E,Franklin,Ship,East Indies,07/05/1803,1803-07-05,297,"1103, 1104",NULL
S865E,Hannah,Brig,Mogadore,07/15/1803,1803-07-15,138 31/95,"1119, 1120",NULL
S866E,Harriot,Brig,Naples,12/24/1803,1803-12-24,126,"1124, 1125, 1126",from Beverly
S867E,Herald,Brig,St. Vincent,05/02/1803,1803-05-02,197,"1127, 1128, 1129, 1130",of Kennebunk
S869E,Hercules,Schooner,The West Indies,05/26/1803,1803-05-26,69 78/95,"1131, 1132",NULL
S870E,Hope,Brig,Sumatra,11/25/1803,1803-11-25,185,"1135, 1136, 1137",NULL
S871E,Hopewell,Brig,Surinam,08/22/1803,1803-08-22,141,"1138, 1139",NULL
S873E,Industry,Schooner,West Indies,06/30/1803,1803-06-30,93,"1140, 1141, 1142, 1143",NULL
S874E,Java,Ship,India,05/26/1803,1803-05-26,222,"1149, 1150",NULL
S875E,John,Schooner,Madeira,06/11/1803,1803-06-11,85,"1151, 1152",NULL
S876E,Henry,Ship,Batavia,07/08/1803,1803-07-08,190,"1153, 1154, 1155, 1156",NULL
S877E,John,Schooner,West Indies,08/18/1803,1803-08-18,124,"1147, 1148, 1157, 1158, 1159",NULL
S879E,Martha,Brig,West India Isles,08/04/1803,1803-08-04,110,"1169, 1170, 1171, 1172",NULL
S880E,Mary,Ship,Mocha,12/23/1803,1803-12-23,176,"1176, 1177, 1178",NULL
S881E,Minerva,Brig,St. Lucia,05/07/1803,1803-05-07,100,"1181, 1182",NULL
S882E,Minerva,Brig,NULL,09/19/1803,1803-09-19,NULL,"1183, 1184",NULL
S883E,Mount Vernon,Ship,Europe,06/04/1803,1803-06-04,254  3/5 ,"1185, 1186",NULL
S884E,Nancy,Brig,West Indies,06/29/1803,1803-06-29,157,"1187, 1188, 1194, 1195",NULL
S885E,Nancy,Brig,Bilbao,04/25/1803,1803-04-25,143,"1189, 1190",NULL
S886E,Nancy,Brig,West Indies,12/22/1803,1803-12-22,159,"1191, 1192, 1193",NULL
S887E,Plymouth,Brig,Demerara,08/19/1803,1803-08-19,146,"1199, 1200, 1201, 1202, 1203",NULL
S888E,Rajah,Brigantine,Mediterranean,08/08/1803,1803-08-08,120,"1204, 1205, 1206, 1207, 1208, 1209",NULL
S890E,Ruthy,Brig,Bilboa,07/02/1803,1803-07-02,148,"1213, 1214",NULL
S891E,Saucy Jack,[Schooner],NULL,10/06/1803,1803-10-06,NULL,"1220, 1221",NULL
S892E,Sally,Brig,Surinam,06/24/1803,1803-06-24,143,"1225, 1226",NULL
S893E,Sukey & Betsey,Brig,Corinna,08/12/1803,1803-08-12,120,"1227, 1228",NULL
S894E,Telemachus,Brig,East Indies,06/02/1803,1803-06-02,133  5/19,"1229, 1230",NULL
S895E,Trent,Ship,Mediterranean,08/10/1803,1803-08-10,191,"1231, 1232",NULL
S896E,Trent,Ship,Leghorn,??/??/1803,0000-00-00,191,"1233, 1234",NULL
S897E,Triton,Brig,Copenhagen,06/21/1803,1803-06-21,106,"1235, 1236",NULL
S898E,Theoda,Schooner,St. Michaels,06/03/1803,1803-06-03,78,"1237, 1238",NULL
S899E,Three Friends,Brig,Martinico,05/06/1803,1803-05-06,132,"1239, 1240",NULL
S900E,Three Friends,Brig,"West Indies, Surinam",10/07/1803,1803-10-07,132,"1241, 1242, 1243, 1244",NULL
S901E,Two Brothers,Ship,Copenhagen,04/09/1803,1803-04-09,151,"1248, 1249",NULL
S902E,Union,Schooner,Surinam,08/04/1803,1803-08-04,99,"1256, 1257",NULL
S903E,Unicorn,Brig,Havana,05/??/1803,0000-00-00,172,"1258, 1259",NULL
S904E,William & Charles,Brig,Surinam,12/10/1803,1803-12-10,113,"1271, 1272, 1273",NULL
S905E,Alfred,Schooner,West Indies,08/03/1804,1804-08-03,75,"1275, 1276, 1277, 1278, 1279",NULL
S907E,Atlantic,Schooner,Surinam,05/24/1804,1804-05-24,103,"1280, 1281, 1282",NULL
S909E,American Hero,Ship,Copenhagen,07/11/1804,1804-07-11,251,"1283, 1284, 1285",NULL
S910E,Ann,Schooner,West Indies,09/28/1804,1804-09-28,93,"1286, 1287",NULL
S911E,Argus,Brig,Isle of France,05/03/1804,1804-05-03,125,"1288, 1289, 1290",NULL
S912E,Arthur,Schooner,Havanna,11/13/1804,1804-11-13,100,"1293, 1294, 1295",NULL
S914E,Mary,Ship,Leghorn,1805,0000-00-00,176,"2021, 2022",NULL
S916E,Atlantic,Schooner,West Indies,10/23/1804,1804-10-23,103,"1296, 1297, 1298",NULL
S917E,Attempt,Schooner,West Indies,07/23/1804,1804-07-23,105,"1299, 1300, 1301, 1302, 1303",NULL
S918E,Attempt,Schooner,West Indies,12/17/1804,1804-12-17,105,"1304, 1305, 1306",NULL
S919E,Bellona,Brig,Dominica,11/17/1804,1804-11-17,122 34/95,"1307, 1308",Vessel of Kennebunk
S920E,Betsy,Brig,Surinam,02/18/1804,1804-02-18,114,"1309, 1310, 1317, 1318, 1319",NULL
S921E,Betsy,Schooner,"West Indies, Havana",01/14/1804,1804-01-14,106,"1311, 1312, 1313",NULL
S923E,Betsy,Schooner,Havana,05/25/1804,1804-05-25,106,"1320, 1321, 1322",NULL
S924E,Betsey,Brig,West Indies,08/02/1804,1804-08-02,114,"1323, 1324, 1325, 1326, 1327",NULL
S925E,Betsey,Brigantine,Bordeaux,1804,0000-00-00,100,"1328, 1329",NULL
S926E,Betsey,Schooner,West Indies,1804,0000-00-00,68,"1330, 1331",NULL
S927E,Betsey,Schooner,Havana,1804,0000-00-00,88,"1332, 1333",NULL
S928E,Bonetta,Ship,Naples,03/24/1804,1804-03-24,227,"1334, 1335, 1336",NULL
S929E,Bonetta,Ship,One or more ports in Europe,12/12/1804,1804-12-12,227,"1337, 1338, 1339",NULL
S930E,Cincinnatus,Ship,Leghorn,09/05/1804,1804-09-05,226,"1340, 1341, 1342",NULL
S931E,Defiance,Schooner,St. Bartholomews,01/04/1804,1804-01-04,92,"1075, 1076, 1345, 1346, 1347, 1348",NULL
S932E,Edwin,Brigantine,Salem [From Bordeaux],09/10/1804,1804-09-10,129,"1349, 1350",NULL
S933E,Edwin,Brigantine,West Indies,12/19/1804,1804-12-19,129,"1351, 1352, 1353",NULL
S934E,Eliza,Ship,Havana,09/10/1804,1804-09-10,185,"1354, 1355",NULL
S935E,Eliza,Brig,Havana,1804,0000-00-00,101,"1356, 1357",NULL
S936E,Elizabeth,Schooner,Marseilles,07/24/1804,1804-07-24,80,"1358, 1359, 1360, 1361",NULL
S937E,Enterprize,Brig,"Bilboa [Bilbao, Spain?]",1804,0000-00-00,183,"1362, 1363",of Beverly
S938E,Enterprize,Brig,Alicante,12/28/1804,1804-12-28,182,"1366, 1367, 1368, 1369, 1370",NULL
S939E,Equality,Schooner,Leghorn,06/01/1804,1804-06-01,101,"1371, 1372",NULL
S940E,Fame,Schooner,France,1804,0000-00-00,95,"1376, 1377",NULL
S941E,Fame,Schooner,Gibraltar,1804,0000-00-00,88,"1378, 1379",NULL
S942E,Fishhawk,Schooner,West Indies,07/28/1804,1804-07-28,101,"1380, 1381",NULL
S943E,Fox,Brigantine,Leghorn,09/08/1804,1804-09-08,116,"1385, 1386, 1387",NULL
S944E,Franklin,Ship,Isle of France,05/10/1804,1804-05-10,296,"1388, 1389, 1390, 1391",NULL
S945E,Fishhawk,Schooner,Jamaica,02/21/1804,1804-02-21,101,"1382, 1383, 1384",NULL
S946E,Sally,Schooner,The fishing banks and thence to Bordeaux,08/31/1797,1797-08-31,65,"1005, 1006",NULL
S947E,Acorn,Brigantine,Lisbon,05/10/1803,1803-05-10,117,"1010, 1011, 1012, 1013",NULL
S948E,Active,Bark,Embden & a Market,08/26/1803,1803-08-26,200,"1014, 1015, 1016, 1017",NULL
S949E,Adventure,Ship,Calcutta,04/13/1803,1803-04-13,184,"1018, 1019",NULL
S950E,Alfred,Schooner,Havana,1803,0000-00-00,75,"1020, 1021",NULL
S952E,Atlantic,Schooner,Surinam,07/08/1803,1803-07-08,103,"1024, 1025",NULL
S953E,Argo,Ship,East Indies,12/15/1803,1803-12-15,325,"1026, 1027, 1028",NULL
S954E,Arthur,Schooner,Havana,04/18/1803,1803-04-18,100,"1029, 1030, 1033, 1034",NULL
S957E,American Hero,Ship,The Mediterranean,11/28/1803,1803-11-28,251,"1037, 1038, 1039",Some information cut out
S958E,Arthur,Schooner,Havana,12/17/1803,1803-12-17,100,"1040, 1041, 1042",NULL
S959E,Moses,Brig,Barbados,12/02/1803,1803-12-02,NULL,"1043, 1044, 1045",Vessel of Wells
S960E,Betsey,Schooner,"Rochelle, France",1803,0000-00-00,100,"1046, 1047",NULL
S961E,Betsey,Ship,Batavia,09/15/1803,1803-09-15,207,"1048, 1049, 1050",NULL
S962E,Belisarius,Ship,Isle of France,12/31/1803,1803-12-31,261,"1053, 1054, 1055",NULL
S963E,Harriot,Schooner,West Indies,03/25/1804,1804-03-25,87,"1398, 1399, 1400",Vessel name spelled Hariot on some documents
S964E,Good Intent,Schooner,Havana,04/24/1804,1804-04-24,90,"1395, 1396, 1397",NULL
S965E,George Washington,Brig,NULL,08/18/1804,1804-08-18,207,"1392, 1393, 1394",NULL
S966E,Fame,Ship,Copenhagen,05/12/1804,1804-05-12,363,"1373, 1374, 1375",NULL
S967E,Endeavour,Ship,Marseilles,11/21/1804,1804-11-21,NULL,"1364, 1365",NULL
S968E,Defiance,Schooner,"St. Bartholomew [From Wilmington, SC]",07/26/1803,1803-07-26,NULL,"1077, 1078, 1079",NULL
S969E,Victory,Brig,West Indies,09/22/1803,1803-09-22,107,"1268, 1269, 1270",NULL
S970E,Union,Brig,West Indies,07/08/1803,1803-07-08,109,"1266, 1267",NULL
S971E,Union,Schooner,West Indies,11/14/1803,1803-11-14,109,"1263, 1264, 1265",NULL
S972E,Ulysses,Ship,Lisbon,04/15/1803,1803-04-15,NULL,"1260, 1261, 1262",Crew list from Port of New York
S973E,Two Sons,Ship,India,12/10/1803,1803-12-10,210,"1250, 1251, 1252",NULL
S974E,Trial,Brigantine,West Indies,10/03/1803,1803-10-03,147,"1245, 1246, 1247",NULL
S975E,Sukey,Brig,Sumatra,10/26/1803,1803-10-26,145,"1222, 1223, 1224",NULL
S976E,St. Patrick,Schooner,Demerara & West Indies,12/16/1803,1803-12-16,103,"1217, 1218, 1219",NULL
S977E,St. Michael,Brig,Corunna,10/07/1803,1803-10-07,174,"1215, 1216",NULL
S978E,Plymouth,Brig,Surinam,12/28/1803,1803-12-28,146,"1210, 1211, 1212",NULL
S979E,Peacock,Schooner,West Indies,09/22/1803,1803-09-22,64,"1196, 1197, 1198",NULL
S980E,Mentor,Brig,Corunna in Spain,07/16/1803,1803-07-16,NULL,"1179, 1180",from Port of Alexandria
S981E,Minerva,Ship,Lisbon,10/26/1803,1803-10-26,231,"1173, 1174, 1175",NULL
S982E,Lydia,Brig,Corunna [From port of Baltimore],11/17/1803,1803-11-17,NULL,"1167, 1168",NULL
S983E,Lucia,Ship,India,07/28/1803,1803-07-28,310,"1165, 1166",NULL
S984E,Liberty,Brig,St. Lucia[?] [From Port of New York],11/17/1803,1803-11-17,NULL,"1162, 1163, 1164",from New York
S985E,Leopard,Brig,Corunna,10/22/1803,1803-10-22,NULL,"1160, 1161",NULL
S986E,John,Ship,Palermo,12/17/1803,1803-12-17,258,"1144, 1145, 1146",NULL
S987E,Hind,Brig,Copenhagen,06/18/1803,1803-06-18,136,"1133, 1134",NULL
S988E,Hannah,Brig,Malaga,11/03/1803,1803-11-03,138,"1121, 1122, 1123",NULL
S989E,Georgetown,Schooner,West Indies,12/22/1803,1803-12-22,136,"1117, 1118",NULL
S990E,Good Hope,Ship,NULL,11/01/1803,1803-11-01,187,"1114, 1115, 1116",NULL
S991E,Golden Age,Ship,Sealing voyage,07/02/1803,1803-07-02,219,"1112, 1113",NULL
S992E,George Washington,Brig,Isle of France,12/26/1803,1803-12-26,207,"1109, 1110, 1111",NULL
S993E,Friendship,Brig,Alicante [From Port of Baltimore],10/27/1803,1803-10-27,NULL,"1107, 1108",NULL
S994E,Georgetown,Schooner,West Indies,07/26/1803,1803-07-26,NULL,"1105, 1106","from Wilmington, NC"
S995E,Equality,Schooner,Leghorn,08/30/1803,1803-08-30,101,"1092, 1093, 1094",NULL
S997E,Derby,Ship,East Indies,10/17/1802,1802-10-17,300,"1080, 1081",NULL
S998E,Commerce,Ship,East Indies,05/24/1803,1803-05-24,239,"1073, 1074",NULL
S999E,Catherine,Brig,Europe,10/03/1803,1803-10-03,158,"1064, 1065, 1066, 1067, 1068",NULL
S1000E,Betsey,Schooner,West Indies,06/07/1803,1803-06-07,88,"1060, 1061",NULL
S1001E,Unicorn,Brig,Havana,09/30/1803,1803-09-30,172,"1253, 1254, 1255",NULL
S1002E,Fox,Brig,Corunna,12/01/1803,1803-12-01,NULL,"1099, 1100",NULL
S1003E,Concord,Ship,NULL,01/27/1804,1804-01-27,NULL,"1343, 1344",NULL
S1004E,Harriot,Schooner,West Indies,07/23/1804,1804-07-23,87,"1401, 1402, 1403, 1404, 1405",Vessel name spelled Hariot on some documents
S1005E,Hazard,Ship,East Indies,02/22/1804,1804-02-22,325,"1406, 1407",NULL
S1006E,Hector,Brig,Isle of France,06/11/1804,1804-06-11,220,"1408, 1409, 1410",NULL
S1007E,Hope,Ship,Amsterdam,[8]/15/1804,0000-00-00,236,"1411, 1412",Crew list mutilated. Some information from published Salem Ship Registers
S1008E,Hope,Brig,Leghorn,12/01/1804,1804-12-01,185,"1413, 1414, 1415",NULL
S1009E,Hopewell,Brig,Copenhagen,03/27/1804,1804-03-27,141,"1416, 1417",NULL
S1010E,Hypsia & Jane,Brig,Bilboa,10/06/1804,1804-10-06,124,"1418, 1419, 1420",NULL
S1011E,Janus,Ship,Leghorn,1804,0000-00-00,277,"1421, 1422",NULL
S1012E,Janus,Ship,East Indies,11/04/1804,1804-11-04,277,"1423, 1424",NULL
S1013E,Jeremiah,Schooner,Marseilles,09/08/1804,1804-09-08,131,"1425, 1426, 1427, 1428, 1429, 1430, 1431",NULL
S1014E,John,Ship,West Indies,06/30/1804,1804-06-30,258,"1432, 1433, 1434, 1435",NULL
S1015E,John,Schooner,Havana,03/02/1804,1804-03-02,124,"1436, 1437, 1438",NULL
S1016E,John,Schooner,Madeira,06/15/1804,1804-06-15,85,"1439, 1440, 1441",NULL
S1017E,Juno,Brig,Guadeloupe,09/07/1804,1804-09-07,113,"1442, 1443, 1444",NULL
S1018E,Industry,Brig,Salem [From Bordeaux],10/22/1804,1804-10-22,NULL,1445,NULL
S1019E,Lydia,Brig,NULL,05/28/1804,1804-05-28,152,"1446, 1447, 1448",NULL
S1020E,Margaret,Ship,East Indies,02/07/1804,1804-02-07,295,"1449, 1450, 1451, 1452",NULL
S1021E,Martha,Brig,West Indies,08/15/1804,1804-08-15,110,"1453, 1454, 1455",NULL
S1022E,Mary,Bark,Trieste,??/??/1804,0000-00-00,190,"1456, 1457",NULL
S1023E,Mary,Bark,India,09/13/1804,1804-09-13,189,"1458, 1459, 1460, 1461, 1462",NULL
S1024E,Minerva,Brig,West Indies,1804,0000-00-00,100,"1463, 1464",NULL
S1025E,Minerva,Schooner,Havana,04/24/1804,1804-04-24,103,"1465, 1466, 1467",NULL
S1026E,Minerva,Schooner,Havana,08/15/1804,1804-08-15,103,"1468, 1469, 1470",NULL
S1027E,Mount Vernon,Ship,Copenhagen,03/08/1804,1804-03-08,254,"1471, 1472, 1473",NULL
S1028E,Nancy,Brig,West Indies,10/16/1804,1804-10-16,157,"1474, 1475, 1476",NULL
S1029E,Nancy,Brig,Marseilles,12/05/1804,1804-12-05,143,"1477, 1478, 1479",NULL
S1030E,Nat & John,Schooner,West Indies,1804,0000-00-00,104,"1480, 1481",NULL
S1031E,Neptune,Schooner,West Indies,02/03/1804,1804-02-03,101,"1482, 1483",NULL
S1032E,Trent,Ship,Leghorn,12/05/1804,1804-12-05,191,"1484, 1485, 1486",NULL
S1033E,Trial,Brig,West Indies,03/31/1804,1804-03-31,147,"1487, 1488, 1489",NULL
S1034E,Trial,Brig,West Indies,12/26/1804,1804-12-26,147,"1490, 1491, 1492",NULL
S1035E,Two Brothers,Schooner,Leghorn,11/20/1804,1804-11-20,99,"1493, 1494, 1495",NULL
S1036E,Two Brothers,Ship,From New York to Sicily and the North of Europe.,01/14/1804,1804-01-14,NULL,"1496, 1497, 1498",NULL
S1037E,Two Brothers,Brig,Copenhagen,05/28/1804,1804-05-28,NULL,"1499, 1500",NULL
S1038E,Two Friends,NULL,France,??/07/1804,0000-00-00,75,"1501, 1502",NULL
S1039E,Pacific,Brig,Havana,1804,0000-00-00,146,"1503, 1504",NULL
S1040E,Pacific,Brig,Havana,07/20/1804,1804-07-20,147,"1505, 1506",NULL
S1041E,Peacock,Schooner,West Indies,10/18/1804,1804-10-18,64,"1507, 1508",NULL
S1042E,Prince,Schooner,Leghorn,10/22/1804,1804-10-22,98,"1509, 1510, 1511, 2079, 2080",NULL
S1043E,Prudent,Ship,Nantes (in France),??/??/1804,0000-00-00,200,"1512, 1513",NULL
S1044E,Rebecca,Schooner,Feecamp (from Danvers),02/06/1804,1804-02-06,137,"1514, 1515, 1516",NULL
S1045E,Restitution,Ship,Lisbon [From Baltimore],12/04/1804,1804-12-04,247,"1517, 1518",NULL
S1046E,Rising States,Ship,Europe,06/21/1804,1804-06-21,299,"1519, 1520",NULL
S1047E,Roboreus,Schooner,West Indies,07/23/1804,1804-07-23,120,"1521, 1522, 1523",NULL
S1048E,Roboreus,Brig,West Indies,12/01/1804,1804-12-01,128,"1524, 1525, 1526",NULL
S1049E,Roboreus,Schooner,West Indies,1804[?],0000-00-00,120,"1527, 1528",NULL
S1050E,Rover,Brig,Copenhagen,08/28/1804,1804-08-28,205,"1529, 1530, 1531",NULL
S1051E,St. Michael,Brig,Corunna,12/05/1804,1804-12-05,171,"1532, 1533, 1534",NULL
S1052E,St. Patrick,Schooner,West Indies,06/02/1804,1804-06-02,100,"1535, 1536, 1537",NULL
S1053E,St. Peter,Schooner,France,12/03/1804,1804-12-03,NULL,"1538, 1539, 1540",NULL
S1054E,Sally,Ship,West Indies,12/07/1804,1804-12-07,181,"1541, 1542, 1543, 1544, 1545, 1546",NULL
S1055E,Sally,Ship,West Indies,01/01/1804,1804-01-01,181,"1547, 1548",NULL
S1056E,Sally,Schooner,West Indies,06/12/1804,1804-06-12,69,"1549, 1550, 1551",NULL
S1057E,Sally,Brig,Surinam,01/18/1804,1804-01-18,143,"1552, 1553, 1554, 1555, 1556",NULL
S1058E,Sally,Brig,Surinam,07/04/1804,1804-07-04,143,"1557, 1558",NULL
S1059E,Sally,Ship,West Indies,07/??/1804,0000-00-00,181,"1559, 1560",NULL
S1060E,Sally,Brig,Surinam,12/20/1804,1804-12-20,143,"1561, 1562, 1563",NULL
S1061E,Sally,Brigantine,Teneriffe and India,04/26/1804,1804-04-26,161,"1564, 1565, 1566",NULL
S1063E,Saucy Jack,Schooner,St. Lucia,03/23/1804,1804-03-23,90 13/19,"1569, 1570, 1571, 1572, 1573",NULL
S1064E,Saucy Jack,Schooner,West Indies,12/12/1804,1804-12-12,90,"1574, 1575, 1576",NULL
S1065E,Saucy Jack,Schooner,West Indies,07/10/1804,1804-07-10,90,"1567, 1568, 1577, 1578, 1579",NULL
S1066E,Success,Schooner,West Indies,09/08/1804,1804-09-08,92,"1580, 1581, 1582",NULL
S1067E,Sukey,Brig,Naples,11/02/1804,1804-11-02,145,"1583, 1584, 1585",NULL
S1068E,Sukey & Betsy,Brig,Corunna,04/28/1804,1804-04-28,170,"1586, 1587, 1588",NULL
S1069E,Suwarrow,Brig,Cape of Good Hope,01/02/1804,1804-01-02,198,"1591, 1592, 1593",NULL
S1070E,Suwarrow,Brig,East Indies,1804,0000-00-00,198,"1589, 1590",NULL
S1071E,Telemachus,Brig,West Indies,06/30/1804,1804-06-30,135,"1594, 1595",NULL
S1072E,Three Friends,Schooner,Havana,05/14/1804,1804-05-14,126[?],"1596, 1597, 1598",NULL
S1073E,Trent,Ship,Leghorn,04/18/1804,1804-04-18,191,"1599, 1600, 1601",NULL
S1074E,Ulysses,Ship,India,09/10/1804,1804-09-10,340,"1602, 1603, 1604",NULL
S1075E,Unicorn,Brig,Havana,02/03/1804,1804-02-03,172,"1605, 1606, 1607",NULL
S1076E,Unicorn,Brig,West Indies,06/22/1804,1804-06-22,172,"1608, 1609, 1610",Vessel foundered at sea
S1077E,Union,Ship,India,02/20/1804,1804-02-20,250,"1612, 1613, 1614",NULL
S1078E,Union,Schooner,Surinam,11/22/1804,1804-11-22,99,"1615, 1616, 1617",NULL
S1079E,Union,Schooner,West Indies,1804,0000-00-00,100,"1618, 1619",NULL
S1080E,Union,Schooner,West Indies,11/03/1804,1804-11-03,109,"1620, 1621, 1622",NULL
S1081E,Union,Schooner,West Indies,01/02/1804,1804-01-02,99,"1611, 1623, 1624",NULL
S1082E,Union,Schooner,Havana,06/02/1804,1804-06-02,109,"1625, 1626, 1627",NULL
S1083E,Venus,Schooner,St. Lucia,09[?]/??/1804,0000-00-00,123,"1628, 1629",NULL
S1084E,Vengeance,Brig,Naples/Bilbao,02/27/1804,1804-02-27,181,"1630, 1631, 1632, 1633, 1634",NULL
S1085E,Victory,Brig,West Indies,01/25/1804,1804-01-25,107,"1635, 1636, 1637",NULL
S1086E,Washington,Schooner,Havana,1804,0000-00-00,NULL,"1638, 1639",NULL
S1087E,Wells,Ship,Gottenburg,03/03/1804,1804-03-03,205,"1640, 1641, 1642",NULL
S1088E,William,Schooner,West Indies,06/20/1804,1804-06-20,80,"1643, 1644, 1645, 1646, 1647",NULL
S1089E,William,Schooner,Nantes,11/20/1804,1804-11-20,79,"1648, 1649, 1650",NULL
S1090E,William & Charles,Brig,Copenhagen,1804,0000-00-00,161,"1651, 1652",No master listed
S1091E,William & Charles,Brig,St. Lucia,10/31/1804,1804-10-31,113,"1653, 1654, 1655",NULL
S1092E,Alert,Sloop,St. Bartholomew,05/15/1805,1805-05-15,58,"1657, 1658, 1659",NULL
S1093E,Alfred,Ship,Palermo,11/16/1805,1805-11-16,260,"1660, 1661, 1662, 1663, 1664",NULL
S1094E,America,Ship,Rotterdam,06/25/1805,1805-06-25,473,"1665, 1666",NULL
S1095E,Ann,Brig,Amsterdam,11/30/1805,1805-11-30,172,"1667, 1668, 1669",NULL
S1096E,Anson,Schooner,West Indies,03/09/1805,1805-03-09,106,"1670, 1671, 1672",NULL
S1097E,Anson,Schooner,West Indies,11/08/1805,1805-11-08,106,"1675, 1676, 1677",NULL
S1098E,Anson,Schooner,West Indies,07/15/1805,1805-07-15,106,"1678, 1679, 1680",NULL
S1099E,Aphia,Schooner,Salem [From Bordeaux],08/28/1805,1805-08-28,77,"1681, 1682, 1686, 1687",NULL
S1100E,Aphia,Schooner,West Indies,01/30/1805,1805-01-30,78,"1683, 1684, 1685",NULL
S1101E,Aphia,Schooner,Europe,05/24/1805,1805-05-24,78,"1688, 1689, 1690",NULL
S1102E,Aphia,Schooner,Havana,11/27/1805,1805-11-27,78,"1691, 1692, 1693",NULL
S1103E,Argus,Brig,West Indies,08/24/1805,1805-08-24,125,"1694, 1695, 1696",NULL
S1104E,Argus,Brig,West Indies,11/19/1805,1805-11-19,126,"1697, 1698, 1699",NULL
S1105E,Arthur,Schooner,Cuba,1805,0000-00-00,101,"1700, 1701",NULL
S1106E,Attempt,Schooner,West Indies,05/01/1805,1805-05-01,105,"1702, 1703, 1704",NULL
S1107E,Mary Ann,Ship,Copenhagen/Calcutta,??/??/1805,0000-00-00,240,"1705, 1706",NULL
S1108E,Anson,Schooner,West Indies,1805,0000-00-00,106,"1707, 1708",NULL
S1109E,Attempt,Schooner,West Indies,08/05/1805,1805-08-05,105,"1709, 1710, 1711",NULL
S1110E,Augusta,Brig,One or more ports in Europe.,02/25/1805,1805-02-25,127,"1712, 1713, 1714, 1717, 1718",NULL
S1111E,Augustus,Ship,Havana,12/28/1805,1805-12-28,246,"1715, 1716",NULL
S1113E,Aurora,Schooner,European ports? (from Marblehead),10/04/1805,1805-10-04,109,"1719, 1720, 1721",NULL
S1114E,Aurora,Brig,Nantes,02/11/1805,1805-02-11,118,"1722, 1723, 1724",NULL
S1115E,Aurora,Brig,Martinique,10/12/1805,1805-10-12,118,"1725, 1726",NULL
S1116E,Belleisle,Brig,Europe,03/02/1805,1805-03-02,119,"1727, 1728, 1729, 1730, 1731",NULL
S1117E,Betsey,Ship,India,??/??/1805,0000-00-00,207,"1732, 1733",NULL
S1118E,Betsey,Brig,West Indies,04/06/1805,1805-04-06,121,"1734, 1735, 1736, 1737, 1738",NULL
S1119E,Betsey,Brig,Havana,04/29/1805,1805-04-29,NULL,"1741, 1742, 1743",NULL
S1120E,Betsey,Schooner,West Indies,07/02/1805,1805-07-02,68,"1744, 1745, 1746",NULL
S1121E,Betsey,Schooner,West Indies,06/05/1805,1805-06-05,106 54/95,"1747, 1748, 1749",NULL
S1122E,Betsey,Schooner,St. Michael's,04 or 05/09/1805,0000-00-00,120,"1750, 1751, 1752",NULL
S1123E,Betsey,Brig,Leghorn,08/27/1805,1805-08-27,154,"1739, 1740, 1753, 1754",Returned 6/7/1806
S1124E,Catharine,Brig,Havana/West Indies,03/08/1805,1805-03-08,158,"1755, 1756, 1757, 1758, 1759, 1760",NULL
S1125E,Catharine,Brig,Tonningen (Denmark),06/19/1805,1805-06-19,158,"1761, 1762, 1763, 1764, 1765",NULL
S1126E,Cincinnatus,Ship,Leghorn,09/10/1805,1805-09-10,226,"1766, 1767, 1768, 1769, 1770",NULL
S1127E,Commerce,Brig,West Indies,02/15/1805,1805-02-15,170,"1771, 1772, 1773",NULL
S1128E,Cynthia,Brig,Embden,03/23/1805,1805-03-23,128,"1774, 1775, 1776",NULL
S1129E,Cynthia,Brig,West Indies,10/18/1805,1805-10-18,128,"1777, 1778, 1779, 1780, 1781",NULL
S1130E,Dolly,Schooner,Trinidad,12/31/1805,1805-12-31,81,"1782, 1783, 1784",NULL
S1131E,Defiance,Schooner,"Barbados [From Wilmington, NC]",02/21/1805,1805-02-21,NULL,"1785, 1786",NULL
S1132E,Edwin,Brig,Europe,04/30/1805,1805-04-30,128,"1787, 1788, 1789",NULL
S1133E,Eliza,Bark,Europe,06/18/1805,1805-06-18,187,"1790, 1791, 1792",NULL
S1134E,Edwin,Brigantine,Leghorn,10/26/1805,1805-10-26,129,"1793, 1794, 1795, 1796, 1797",NULL
S1135E,Eliza,Ship,Leghorn,11/23/1805,1805-11-23,241,"1800, 1801",NULL
S1136E,Endeavour,Ship,Isle of France,08/06/1805,1805-08-06,234,"1802, 1803",NULL
S1137E,Exeter,Ship,India,04/19/1805,1805-04-19,291,"1804, 1805, 1806",NULL
S1138E,Georgetown,Bark,India,02/23/1805,1805-02-23,164,"1807, 1808, 1811, 1812",NULL
S1139E,Golden Age,Ship,India,11/18/1805,1805-11-18,219,"1809, 1810",NULL
S1140E,Friendship,Brigantine,West Indies,04/20/1805,1805-04-20,157,"1813, 1814, 1815",NULL
S1141E,Freedom,Ship,India,10/08/1805,1805-10-08,213,"1816, 1817, 1818, 1819, 1820, 1821",NULL
S1142E,Freedom,Ship,France,03/02/1805,1805-03-02,213,"1822, 1823, 1824, 1825",NULL
S1143E,Fox,Brig,Corunna,05/27/1805,1805-05-27,115,"1826, 1827, 1828",NULL
S1144E,Franklin,Ship,Rotterdam,06/13/1805,1805-06-13,296,"1829, 1830",NULL
S1145E,Four Sisters,Schooner,West Indies,1805,0000-00-00,79,"1831, 1832",NULL
S1146E,Fishhawk,Schooner,West Indies,02/15/1805,1805-02-15,101,"1833, 1834",NULL
S1147E,Fame,Schooner,West Indies,10/24/1805,1805-10-24,87,"1835, 1836",NULL
S1148E,Fame,Schooner,West Indies,11/04/1805,1805-11-04,95,"1837, 1838, 1839, 1840",NULL
S1149E,Equality,Schooner,Copenhagen,03/07/1805,1805-03-07,101,"1841, 1842, 1843",NULL
S1150E,Enterprise,Brig,West Indies [From port of Baltimore],08/13/1805,1805-08-13,NULL,"1844, 1845",NULL
S1151E,Enterprise,Brig,Europe,12/13/1805,1805-12-13,183,"1846, 1847",NULL
S1152E,Fox,Brig,West Indies,11/14/1805,1805-11-14,116,"1848, 1849",NULL
S1153E,Golden Age,Ship,India,11/06?/1805,0000-00-00,290[?],"1850, 1851",NULL
S1154E,Friendship,Brig,Spanish Main,11/18/1805,1805-11-18,NULL,"1852, 1853",NULL
S1155E,Friendship,Ship,Leghorn,04/20/1805,1805-04-20,342,"1854, 1855, 1856",NULL
S1156E,Four Sisters,Schooner,Copenhagen,06/27/1805,1805-06-27,79,"1857, 1858, 1859",NULL
S1157E,Four Brothers,Schooner,A port in the West Indies [From Baltimore],08/01/1805,1805-08-01,NULL,"1860, 1861",NULL
S1158E,Fishhawk,Schooner,West Indies,02/15/1805,1805-02-15,101,"1862, 1863, 1864",NULL
S1159E,Fame,Schooner,West Indies,10/24/1805,1805-10-24,87,"1865, 1866, 1867",NULL
S1160E,Fame,Schooner,West Indies,05/22/1805,1805-05-22,87,"1868, 1869, 1870",NULL
S1161E,Equality,Schooner,Copenhagen,09/16/1805,1805-09-16,101,"1871, 1872, 1873",NULL
S1162E,Good Hope,Ship,Europe,04/19/1805,1805-04-19,189,"1874, 1875, 1876",NULL
S1163E,Hawk,Schooner,West Indies,12/05/1805,1805-12-05,69,"1877, 1878, 1879",NULL
S1164E,Hector,Brig,Island of St. Michael's [?],02/16/1805,1805-02-16,109,"1880, 1881, 1882, 1883",NULL
S1165E,Hector,Brig,Malaya,06/15/1805,1805-06-15,109,"1884, 1885",NULL
S1166E,Hector,Brig,Leghorn & a Market,11/14/1805,1805-11-14,220,"1886, 1887, 1888",NULL
S1167E,Henry,Brig,Lisbon [From Alexandria],10/28/1805,1805-10-28,NULL,"1889, 1890",NULL
S1168E,Harper,Bark,West Indies,03/22/1805,1805-03-22,141,"1891, 1892, 1893",NULL
S1169E,Hypsia & Jane,Brig,Alicante,12/24/1805,1805-12-24,124,"1894, 1895, 1896",NULL
S1170E,Hercules,Ship,Leghorn,1805?,0000-00-00,290,"1897, 1898",NULL
S1171E,Herald,Brig,Gottenburgh,02/18/1805,1805-02-18,197,"1899, 1900, 1901",NULL
S1172E,Hero,Sloop,West Indies,08/10/1805,1805-08-10,66,"1902, 1903, 1904",NULL
S1173E,Hind,Bark,Europe,02/02/1805,1805-02-02,157,"1905, 1906, 1907, 1908, 1909",NULL
S1174E,Hind,Bark,The Canaries and the East Indies,07/30/1805,1805-07-30,157,"1910, 1911",NULL
S1175E,Hope,Schooner,Senegal,02/15/1805,1805-02-15,101,"1912, 1913, 1914, 1915, 1916",NULL
S1176E,Hope,Brig,West Indies,08/17/1805,1805-08-17,186,"1917, 1918, 1919",NULL
S1177E,Hopewell,Brig,Havana [From New York],04/15/1805,1805-04-15,NULL,"1920, 1921, 1922",NULL
S1178E,Hopewell,Brig,Havana,07/13/1805,1805-07-13,141,"1923, 1924, 1925",NULL
S1179E,Industry,Brig,Havana,03/23/1805,1805-03-23,136,"1926, 1927, 1928",NULL
S1180E,Industry,Brig,Naples,06/??/1805,0000-00-00,136,"1929, 1930",NULL
S1181E,Hypsia & Jane,Brig,Copenhagen,03/30/1805,1805-03-30,124,"1931, 1932, 1933",NULL
S1182E,Hopewell,Brig,West Indies,11/18/1805,1805-11-18,141,"1934, 1935, 1936",NULL
S1184E,Iris,Schooner,Madeira,04/15/1805,1805-04-15,80,"1939, 1940",NULL
S1185E,Iris,Ship,Messina,12/20/1805,1805-12-20,227,"1937, 1938, 1941, 1942, 1943",NULL
S1186E,Jason,Schooner,Europe,11/04/1805[?],1805-11-04,93,"1944, 1945, 1946, 1947",NULL
S1187E,Java,Ship,Leghorn,04/23/1805,1805-04-23,222[?],"1948, 1949, 1950",NULL
S1188E,Jeremiah,Schooner,Bay of St. Lawrence & Europe,07/27/1805,1805-07-27,131,"1951, 1952, 1953",NULL
S1189E,John,Schooner,Western Isles,01/21/1805,1805-01-21,85,"1954, 1955, 1956",NULL
S1190E,John,Ship,One of more ports east of the Cape of Good Hope.,01/09/1805,1805-01-09,258,"1957, 1958, 1959",NULL
S1191E,Juno,Brig,West Indies/Cuba,03/16/1805,1805-03-16,114,"1960, 1961, 1962",NULL
S1192E,Leopard,Brig,West Indies,12/02/1805,1805-12-02,156,"1963, 1964, 1965",NULL
S1193E,Leopard,Brig,Havana,06/26/1805,1805-06-26,156,"1966, 1967",NULL
S1194E,Lucia,Ship,East Indies,06/26/1805,1805-06-26,310,"1968, 1969",NULL
S1195E,Lydia,Brig,West Indies [From Baltimore],02/18/1805,1805-02-18,NULL,"1970, 1971",NULL
S1196E,Madochawando,Schooner,"Bridgetown, Barbados [From Wilmington, NC]",12/18/1805,1805-12-18,115[?],"1972, 1973",NULL
S1197E,Madockawando,Schooner,West Indies,03/15/1805,1805-03-15,115,"1974, 1975, 1976",NULL
S1198E,Madockawando,Schooner,West Indies,??/??/1805?,0000-00-00,115,"1977, 1978",Master's name not listed
S1199E,Madockawando,Schooner,Martinique,06/27/1805,1805-06-27,115,"1979, 1980, 1981",NULL
S1200E,Hope,Schooner,Cadiz--a market.,08/22/1810,1810-08-22,76,"4006, 4007",NULL
S1201E,Independence,Brig,Gottenburg & a Market,08/06/1810,1810-08-06,223,"4008, 4009, 4010, 4011, 4012",NULL
S1202E,Industry,Brig,Christiana,10/12/1810,1810-10-12,136,"4013, 4014",NULL
S1203E,Janus,Ship,Sumatra,03/30/1810,1810-03-30,277,"4015, 4016",NULL
S1204E,Jason,Brig,St. Michael's & [?],02/13/1810,1810-02-13,130,"4017, 4018",NULL
S1205E,Java,Brig,Tenerife,06/30/1810,1810-06-30,222,"4019, 4020",NULL
S1206E,Java,[Ship],NULL,1810[?],0000-00-00,NULL,"4021, 4022",Not an official printed crew list
S1207E,John,Schooner,St. Bartholomew's,04/25/1810,1810-04-25,85,"4023, 4024",NULL
S1208E,John,Ship,Pernambuco,04/23/1810,1810-04-23,258,"4025, 4026, 4027, 4028, 4029, 4030",NULL
S1209E,Joanna,Schooner,Havana,12/29/1810,1810-12-29,98,"4031, 4032",NULL
S1210E,Joanna,Schooner,Mantanzies [Matanzas?],06/21/1810,1810-06-21,98,"4033, 4034",NULL
S1211E,Joanna,Schooner,Matanzas,03/29/1810,1810-03-29,98,"4035, 4036, 4037, 4038",NULL
S1212E,Jeremiah,Schooner,Havana,02/14/1810,1810-02-14,131,"4039, 4040, 4043, 4044, 4045",NULL
S1213E,Jeremiah,Schooner,Tonningen,06/29/1810,1810-06-29,131,"4041, 4042, 4046, 4047, 4048",NULL
S1214E,Julia,Sloop,"Tonningen, a market",05/07/1810,1810-05-07,82,"4049, 4050",NULL
S1215E,Juno,Brig,Teneriffe and Archangel,02/26/1810,1810-02-26,164,"4051, 4052, 4053, 4054, 4055",NULL
S1216E,Leopard,Bark,St. Petersburg,07/12/1810,1810-07-12,207,"4056, 4057, 4058, 4061, 4062",NULL
S1217E,Liberty,Schooner,St. Petersburg,08/17/1810,1810-08-17,86,"4059, 4060",NULL
S1218E,Louisa,Brig,Brazil,10/10/1810,1810-10-10,157,"4063, 4064, 4065, 4066, 4067, 4068",NULL
S1219E,Lucy,Brig,Porto Rico,11/23/1810,1810-11-23,129,"4069, 4070, 4071, 4072, 4073",NULL
S1220E,Lydia,Schooner,Martinique,05/09/1810,1810-05-09,51,"4074, 4075, 4076, 4079, 4080",NULL
S1221E,Madockawando,Schooner,Tonningen,03/01/1810,1810-03-01,115,"4077, 4078",NULL
S1222E,Mary,Brig,Havana,03/16/1810,1810-03-16,113,"4081, 4082, 4083, 4084, 4085, 4086",NULL
S1223E,Mary,Brig,Havana,06/23/1810,1810-06-23,113,"4087, 4088, 4089, 4090, 4091",NULL
S1224E,Mary,Brig,Havana,10/20/1810,1810-10-20,113,"4092, 4093, 4094, 4095, 4096",NULL
S1225E,Mary Caroline,Brig,Gottenburg,02/27/1810,1810-02-27,158,"4097, 4098",NULL
S1227E,Mentor,Ship,St. Petersburg,03/01/1810,1810-03-01,213,"4102, 4103",NULL
S1228E,Mercury,Schooner,St. Andrew,09/08/1810,1810-09-08,102,"4103, 4104",NULL
S1229E,Minerva,Brig,West Indies/Surinam,06/06/1810,1810-06-06,134,"4105, 4106, 4107, 4108, 4109",Destination changed on second crew list
S1230E,Molly,Schooner,Rio Janeiro,07/24/1810,1810-07-24,65 69/95,"4110, 4111",NULL
S1231E,Monk,Ship,Tunis and a market,10/29/1810,1810-10-29,253,"4112, 4113, 4114, 4115, 4116",NULL
S1232E,Moses,Bark,Koningsburg,05/29/1810,1810-05-29,203,"4117, 4118, 4119, 4120, 4121",NULL
S1233E,Mount Vernon,Ship,St. Petersburg,02/01/1810,1810-02-01,254,"4122, 4123, 4124",NULL
S1234E,Nabby,Brig,West Indies,06/30/1810,1810-06-30,154,"4125, 4126",NULL
S1235E,Nancy,Schooner,Cadiz,01/17/1810,1810-01-17,60,"4127, 4128, 4129, 4130, 4131",NULL
S1236E,Nancy,Schooner,St. Bartholomew,04/03/1810,1810-04-03,70,"4132, 4133, 4134, 4135, 4136",NULL
S1237E,Nancy,Schooner,Martinico,06/26/1810,1810-06-26,70,"4137, 4138",NULL
S1238E,Nancy,Schooner,Tunis & a market,10/04/1810,1810-10-04,70,"4139, 4140",NULL
S1239E,Nautilus,Brig,Tonningen & a market,05/17/1810,1810-05-17,200,"4141, 4142",NULL
S1240E,Nautilus,Schooner,West Indies,07/02/1810,1810-07-02,64,"4143, 4144, 4145, 4146, 4147",NULL
S1241E,Neptune,Brig,Gottenburg & a market,07/31/1810,1810-07-31,126,"4148, 4149, 4150, 4155, 4156",NULL
S1242E,Neptune,Schooner,St. Iago de Cuba,01/02/1810,1810-01-02,NULL,"4151, 4152, 4153, 4154",NULL
S1243E,Neptune,Schooner,Martinico,05/18/1810,1810-05-18,101,"4157, 4158, 4159, 4160",NULL
S1244E,Neptune,Schooner,West Indies,12/10/1810,1810-12-10,101,"4161, 4162, 4163, 4164, 4165",NULL
S1245E,Neutrality,Schooner,West Indies,11/15/1810,1810-11-15,123,"4166, 4167, 4168, 4169, 4170",NULL
S1246E,New Hazard,Brig,Rio de Janeiro,02/09/1810,1810-02-09,281 10/19,"4171, 4172, 4173",NULL
S1247E,Ocean,Schooner,"Martinico [From Portland, MA]",07/03/1810,1810-07-03,NULL,"4174, 4175",Vessel of Portland
S1248E,Patriot,Bark,"Gottenburg [From Petersburg, VA]",03/22/1810,1810-03-22,NULL,"4176, 4177",NULL
S1249E,Plato,Ship,Buenos Ayres,09/15/1810,1810-09-15,240,"4178, 4179, 4180, 4181, 4182",NULL
S1250E,Polly,Schooner,St. Petersburg,01/12/1810,1810-01-12,74,"4183, 4184",NULL
S1251E,Polly,Schooner,Stettin,03/15/1810,1810-03-15,71,"4185, 4186",NULL
S1252E,Prudent,Brig,River Laplata [Rio de La Plata [Argentina]?],12/29/1810,1810-12-29,170 18/19,"4187, 4188",NULL
S1253E,Rachel,Schooner,West Indies,08/23/1810,1810-08-23,71,"4189, 4190",NULL
S1254E,Rebecca,Brig,Havana,01/15/1810,1810-01-15,178,"4191, 4192",NULL
S1255E,Rebecca,Brig,Archangel,04/17/1810,1810-04-17,178,"4193, 4194, 4195, 4196",NULL
S1256E,Rebecca,Brig,Vera Cruz,12/21/1810,1810-12-21,178,"4197, 4198",NULL
S1257E,Reindeer,Schooner,Danzig,02/24/1810,1810-02-24,82,"4199, 4200",NULL
S1258E,Restitution,Ship,Gottenburgh,04/05/1810,1810-04-05,NULL,"4201, 4202",NULL
S1259E,Resolution,Brig,Tunis,06/06/1810,1810-06-06,135,"4203, 4204",NULL
S1260E,Return,Brig,Surinam,05/28/1810,1810-05-28,133,"4205, 4206, 4207, 4208, 4209",NULL
S1261E,Return,Brig,West Indies,10/29/1810,1810-10-29,133,"4210, 4211, 4212, 4213, 4214",NULL
S1262E,Reward,Brig,St. Petersburg,08/18/1810,1810-08-18,185,"4215, 4216, 4217, 4218, 4219",NULL
S1263E,Rising States,Schooner,St. Bartholomew's,05/05/1810,1810-05-05,128,"4220, 4221, 4222, 4223, 4224",NULL
S1264E,Rising States,Schooner,West Indies,08/25/1810,1810-08-25,128,"4225, 4226",NULL
S1265E,Roboreus,Bark,"Gottenburgh, Sweden [From Newport, RI]",07/12/1810,1810-07-12,NULL,"4227, 4228",NULL
S1266E,Sally,Schooner,Martinico & a market,05/31/1810,1810-05-31,70,"4229, 4230, 4231, 4232, 4233",NULL
S1267E,Sally,Schooner,West Indies,10/23/1810,1810-10-23,73,"4234, 4235",NULL
S1268E,Saucy Jack,Brig,Havana,10/06/1810,1810-10-06,129,"4236, 4237, 4238, 4239, 4240",NULL
S1269E,Saucy Jack,Brig,Havana,12/26/1810,1810-12-26,128,"4241, 4242, 4243",NULL
S1270E,Spring Bird,Schooner,? (from Portland),02/22/1810,1810-02-22,126,"4244, 4245",Top half of crew list is ripped
S1272E,Star,Brig,Laguira [La Guira?],04/16/1810,1810-04-16,156,"4248, 4249, 4250, 4251, 4252",NULL
S1273E,Star,Brig,Mediterranean,11/08/1810,1810-11-08,156,"4253, 4254, 4255, 4256, 4257",NULL
S1274E,Success,Brig,Tonningen,04/11/1810,1810-04-11,135,"4258, 4259, 4260, 4261, 4262",NULL
S1275E,Success,Brig,Mantanzes,05/22/1810,1810-05-22,105,"4263, 4264",NULL
S1276E,Success,Brig,Matanzas,09/10/1810,1810-09-10,105,"4265, 4266",NULL
S1277E,Success,Brig,Curnana,11/23/1810,1810-11-23,NULL,"4267, 4268",NULL
S1278E,Sukey,Brig,Tonningen,04/11/1810,1810-04-11,145,"4269, 4270, 4271, 4272, 4273, 4274, 4275, 4276",NULL
S1279E,Swan,Schooner,Havana,05/09/1810,1810-05-09,70,"4277, 4278, 4279, 4280, 4281",from Beverly
S1280E,Swan,Schooner,West Indies,07/24/1810,1810-07-24,70,"4282, 4283, 4284, 4285, 4286",from Beverly
S1281E,Swan,Schooner,Tangiers,01/03/1811,1811-01-03,70,"4287, 4288, 4289, 4290, 4291",of Beverly
S1282E,Swift,Schooner,West Indies,08/23/1810,1810-08-23,70,"4292, 4293",NULL
S1283E,Talbot,Ship,Tonningen (from New Orleans),03/30/1810,1810-03-30,NULL,"4294, 4295",NULL
S1284E,Telemachus,Brig,Archangel,05/21/1810,1810-05-21,133,"4296, 4297, 4298, 4299, 4300",NULL
S1285E,Telemachus,Brig,Bordeaux,12/05/1810,1810-12-05,133,"43,014,302",NULL
S1286E,Thomas,Schooner,Matanzas,06/01/1810,1810-06-01,103,"4303, 4304, 4305, 4306, 4307",NULL
S1287E,Thomas,Schooner,St. Petersburg,08/20/1810,1810-08-20,103,"4308, 4309",NULL
S1288E,Three Friends,Brig,Havana,10/13/1810,1810-10-13,132,"4310, 4311",NULL
S1289E,Trial,Brigantine,Cayenne,01/11/1810,1810-01-11,140,"4312, 4313",NULL
S1290E,Trial,Brig,Surinam,07/27/1810,1810-07-27,147,"4314, 4315",NULL
S1291E,Two Sisters,Schooner,Naples and a market in Europe,01/06/1810,1810-01-06,NULL,"4316, 4317, 4318, 4319",from Beverly
S1292E,Union,Schooner,West Indies,09/07/1810,1810-09-07,99,"4325, 4326, 4327, 4328",NULL
S1293E,Union,Ship,Calcutta,10/27/1810,1810-10-27,250,"4320, 4321, 4322",NULL
S1294E,Union,Schooner,West Indies,05/16/1810,1810-05-16,99 & 1/2,"4323, 4324",NULL
S1295E,Union,Schooner,Gibraltar & a Market,12/21/1810,1810-12-21,86,"4329, 4330, 4331, 4332, 4333",from Beverly
S1296E,Vandyck,Schooner,West Indies,12/25/1810,1810-12-25,69,"4334, 4335","bound from Wilmington, NC"
S1297E,Venus,Brig,River La Plate & a Market,10/30/1810,1810-10-30,184,"4336, 4337, 4338, 4339, 4340",NULL
S1298E,Washington,Schooner,Cuba,01/10/1810,1810-01-10,133,"4341, 4342, 4343, 4344, 4345",NULL
S1299E,Washington,Schooner,West Indies,06/21/1810,1810-06-21,133,"4346, 4347",NULL
S1300E,William,Ship,Calcutta,12/05/1810,1810-12-05,304,"4348, 4349",NULL
S1301E,Washington,Schooner,West Indies,10/24/1810,1810-10-24,133,"4350, 4351",NULL
S1302E,William & Charles,Brig,Havana,01/13/1810,1810-01-13,161,"4352, 4353, 4354, 4355, 4356",NULL
S1303E,William & Charles,Brig,St. Petersburg,06/26/1810,1810-06-26,161,"4357, 4358, 4359, 4360, 4361",NULL
S1304E,Witch,Brig,Martinico [From Savannah],06/16/1810,1810-06-16,NULL,"4362, 4363",NULL
S1305E,Adaline,Ship,"St. Petersburg [From Charleston, SC]",03/14/1811,1811-03-14,NULL,"4365, 4366, 4367",NULL
S1306E,Alexander Hodgdon,Ship,Lisbon and a Market [From Boston],??/??/1811,0000-00-00,377,"4368, 4369",from Boston
S1307E,Alfred,Ship,Russia,05/10/1811,1811-05-10,260,"4370, 4371, 4372, 4373, 4374",NULL
S1308E,Adaline,Ship,Antwerp,02/08/1811,1811-02-08,NULL,"4375, 4376",NULL
S1309E,Astrea,Brig,Gibraltar [From New York],09/28/1811,1811-09-28,NULL,"4377, 4378",NULL
S1311E,Astrea,Brig,Gibraltar [From Savannah],03/30/1811,1811-03-30,NULL,"4383, 4384",NULL
S1312E,Augustus,Ship,NULL,04/13/1811,1811-04-13,246,"4385, 4386, 4387, 4388",NULL
S1313E,Augusta,Brig,Havana,12/24/1811,1811-12-24,127,"4389, 4390, 4398, 4399",NULL
S1314E,Augusta,Brig,Havana,09/12/1811,1811-09-12,127,"4391, 4392, 4393, 4394, 4395",NULL
S1315E,Argus,Brig,West Indies,07/22/1811,1811-07-22,127,"4396, 4397",NULL
S1316E,Augusta,Brig,Havana,03/29/1811,1811-03-29,127,"4400, 4401",NULL
S1317E,Argo,Ship,Salem [from London],04/06/1811,1811-04-06,NULL,"4402, 4403",NULL
S1318E,Argus,Brig,Havana,04/01/1811,1811-04-01,125,"4404, 4405",NULL
S1319E,Ann,Schooner,West Indies,07/26/1811,1811-07-26,92,"4406, 4407, 4408, 4409, 4410",NULL
S1320E,America,Ship,"St. Petersburg, Russia [From New York]",07/03/1811,1811-07-03,NULL,"4411, 4412",NULL
S1321E,Angler,Schooner,Archangel,05/02/1811,1811-05-02,96 44/95,"4379, 4380, 4381, 4382, 4413, 4414",NULL
S1322E,Alonzo,Brig,Gibraltar,10/26/1811,1811-10-26,100,"4415, 4416",NULL
S1323E,Alonzo,Brig,South America,03/20/1811,1811-03-20,130,"4417, 4418, 4419",NULL
S1324E,Augusta,Brig,West Indies,06/06/1811,1811-06-06,NULL,"4420, 4421",NULL
S1325E,Belleisle,Brig,Havana,10/09/1811,1811-10-09,119,"4422, 4423, 4424, 4425, 4426",NULL
S1326E,Belleisle,Brig,Pillau & St. Petersburg,02/23/1810,1810-02-23,119,"4427, 4428",NULL
S1327E,Belleisle,Brig,Havana,03/22/1811,1811-03-22,119,"4429, 4430, 4431, 4432, 4433",NULL
S1328E,Betsy,Brig,Cuba,12/30/1811,1811-12-30,122,"4434, 4435, 4436, 4437, 4438",NULL
S1329E,Betsey,Schooner,Tangiers & a Market,06/28/1811,1811-06-28,100,"4439, 4440, 4441, 4442, 4443",NULL
S1330E,Betsey,Schooner,Sicily,05/25/1811,1811-05-25,82,"4444, 4445, 4446, 4447, 4448",NULL
S1331E,Betsey,Brig,Matanzas,06/01/1811,1811-06-01,107,"4449, 4450",NULL
S1332E,Betsey,Brig,Tangiers,05/20/1811,1811-05-20,122,"4451, 4452, 4453, 4454",NULL
S1333E,Betsey,Brig,Havana,01/23/1811,1811-01-23,107 & 58/95,"4455, 4456",NULL
S1334E,Boston Packet,Bark,Lisbon and a Market,06/13/1811,1811-06-13,184,"4457, 4458, 4459, 4460, 4461",NULL
S1335E,Boston Packet,Bark,West Indies & a Market,12/19/1811,1811-12-19,184,"4462, 4463",NULL
S1336E,Catharine,Brig,Cadiz,08/26/1811,1811-08-26,158,"4464, 4465, 4466, 4467, 4468",NULL
S1337E,Clarissa,Brig,Brazil,02/18/1811,1811-02-18,135,"4469, 4470, 4471, 4472, 4473",NULL
S1338E,Clarissa,Brig,Europe,09/30/1811,1811-09-30,135,"4474, 4475",NULL
S1339E,Columbia,Schooner,Tangiers & a Market,04/20/1811,1811-04-20,109 67/95,"4476, 4477, 4478, 4479, 4480",NULL
S1340E,Columbia,Schooner,Tangiers & a Market,11/06/1811,1811-11-06,109,"4481, 4482, 4483, 4484, 4485",NULL
S1341E,Criterion,Schooner,"Barbados [From Wilmington, NC]",12/05/1810,1810-12-05,NULL,"4486, 4487",NULL
S1342E,Cora,Brig,South America,04/09/1811,1811-04-09,153,"4488, 4489, 4490",NULL
S1343E,Coromandel,Brig,Isle of France,12/14/1811,1811-12-14,315,"4491, 4492, 4493",NULL
S1344E,Criterion,Schooner,St. Bartholomews,09/25/1811,1811-09-25,87,"4494, 4495, 4496, 4497, 4498",NULL
S1345E,Criterion,Schooner,Cuba,04/15/1811,1811-04-15,87,"4499, 4500, 4501, 4502",NULL
S1346E,Cynthia,Brig,West Indies,12/27/1811,1811-12-27,128,"4503, 4504, 4505, 4506, 4507",NULL
S1347E,Cynthia,Brig,Sicily,04/17/1811,1811-04-17,128,"4508, 4509",NULL
S1348E,Diomede,Brig,Archangel,05/06/1811,1811-05-06,223,"4510, 4511, 4512, 4513, 4514",NULL
S1349E,Doris,Ship,"Madeira and a Market [From Charleston, SC]",03/15/1811,1811-03-15,NULL,"4515, 4516, 4517, 4518",NULL
S1350E,Dove,Schooner,Civita Vecchia,07/27/1811,1811-07-27,67,"4519, 4520",NULL
S1351E,Dryade,Brig,Archangel,05/23/1811,1811-05-23,262,"4521, 4522",NULL
S1352E,Eliza,Schooner,Gibraltar,06/19/1811,1811-06-19,55,"4523, 4524",NULL
S1353E,Eliza,Schooner,West Indies,01/02/1811,1811-01-02,55,"4525, 4526",NULL
S1354E,Endeavour,Ship,Archangel,05/07/1811,1811-05-07,234,"4529, 4530",NULL
S1355E,Endeavour,Ship,Havana,02/19/1811,1811-02-19,234,"4527, 4528",NULL
S1356E,Eros,Schooner,Bordeaux,06/11/1811,1811-06-11,126,"4531, 4532",NULL
S1357E,Exeter,Ship,Isle of France,04/19/1811,1811-04-19,291,"4533, 4534, 4535, 4536, 4537",NULL
S1358E,Export,Schooner,Europe,04/02/1811,1811-04-02,112,"4538, 4539, 4540, 4543, 4544",NULL
S1359E,Factor,Brig,Gottenburg,01/22/1811,1811-01-22,122,"4541, 4542, 4545, 4546, 4547",NULL
S1360E,Fame,Ship,Sumatra,03/26/1811,1811-03-26,350,"4548, 4549, 4550, 4551, 4552, 4553",NULL
S1361E,Fame,Schooner,Matanzas,03/02/1811,1811-03-02,95,"4554, 4555, 4556, 4557, 4558",NULL
S1362E,Fame,Schooner,Matanzas,07/25/1811,1811-07-25,95,"4559, 4560, 4561, 4562, 4563",NULL
S1363E,Fame,Schooner,West Indies,11/02/1811,1811-11-02,95,"4564, 4565, 4566, 4567, 4568",NULL
S1364E,Favorite,Schooner,Smyrna [Turkey?],04/24/1811,1811-04-24,87,"4569, 4570, 4571, 4572, 4573",NULL
S1365E,Favorite,Schooner,South of Europe,10/10/1811,1811-10-10,87,"4574, 4575, 4576, 4577, 4578",NULL
S1366E,Fishhawk,Schooner,Havana [From Baltimore],10/23/1811,1811-10-23,NULL,"4579, 4580",NULL
S1367E,Four Sisters,Schooner,Tangier & a Market,01/10/1811,1811-01-10,127,"4581, 4582, 4583",NULL
S1368E,Four Sisters,Schooner,Brazil,02/01/1811,1811-02-01,79,"4584, 4585, 4586, 4587, 4588",NULL
S1369E,Four Sisters,Schooner,Vigo [Spain?],10/15/1811,1811-10-15,79,"4589, 4590, 4591, 4592, 4593",NULL
S1370E,Friendship,Ship,Archangel,04/18/1811,1811-04-18,342,"4594, 4595, 4596, 4597, 4598",NULL
S1371E,Friendship,Schooner,Europe,02/23/1811,1811-02-23,93,"4599, 4600",NULL
S1372E,Friendship,Schooner,Europe,04/06/1811,1811-04-06,93,"4601, 4602, 4603, 4604, 4605",NULL
S1373E,Friendship,Schooner,Lisbon,12/14/1810,1810-12-14,80,"4606, 4607, 4608",NULL
S1374E,George,Brig,Smyrna,01/04/1811,1811-01-04,211,"4609, 4610, 4611",NULL
S1375E,George Little,Brig,Archangel,04/24/1811,1811-04-24,229,"4612, 4613",NULL
S1376E,George,Brig,Palermo,10/07/1811,1811-10-07,211,"4614, 4615",NULL
S1377E,George & Susan,Brig,West Indies,05/07/1811,1811-05-07,118,"4616, 4617, 4618, 4619, 4620",NULL
S1378E,Harriot,Brig,Tangiers & a Market,01/23/1811,1811-01-23,166,"4621, 4622, 4623, 4624, 4625",NULL
S1379E,Harriot,Brig,Cayenne,07/29/1811,1811-07-29,117,"4626, 4627",NULL
S1380E,Helen,Schooner,Algeciras & a market,01/10/1811,1811-01-10,74,"4628, 4629, 4230, 4231, 4632",NULL
S1381E,Helen,Schooner,Cayenne,10/30/1811,1811-10-30,74,"4633, 4634, 4638, 4639, 4640",NULL
S1382E,Hind,Bark,Gibraltar & a market,10/30/1811,1811-10-30,157,"4635, 4636, 4637, 4641, 4642",NULL
S1383E,Hiram,Schooner,Lisbon [From Baltimore],05/09/1811,1811-05-09,NULL,"4643, 4644",NULL
S1384E,Hope,Schooner,Europe,02/25/1811,1811-02-25,77,"4645, 4646, 4647, 4648, 4649",NULL
S1385E,Hope,Ship,Sumatra,03/26/1811,1811-03-26,282,"4650, 4651",NULL
S1386E,Hope,Schooner,Cadiz,08/05/1811,1811-08-05,76,"4652, 4653, 4656, 4657, 4658",NULL
S1387E,Hope,Brig,Cayenne,09/07/1811,1811-09-07,185,"4654, 4655",NULL
S1388E,Industry,Brig,Christian...[?],07/16/1811,1811-07-16,136,"4659, 4660, 4661",NULL
S1389E,Janus,Ship,Europe [From Baltimore],04/13/1811,1811-04-13,NULL,"4662, 4663",NULL
S1390E,Jason,Brig,Europe,03/12/1811,1811-03-12,130,"4664, 4665, 4666, 4667, 4668, 4669",NULL
S1391E,Jeremiah,Schooner,Havana,05/08/1811,1811-05-08,131,"4670, 4671, 4672, 4675, 4676",NULL
S1392E,Jeremiah,Schooner,NULL,07/26/1811,1811-07-26,131,"4673, 4674",NULL
S1393E,Joanna,Brig,Bordeaux,12/30/1811,1811-12-30,98 & 12/95,"4677, 4678",NULL
S1394E,Joanna,Schooner,West Indies,09/13/1811,1811-09-13,98,"4679, 4680, 4681, 4682, 4683, 4684",NULL
S1395E,Joanna,Schooner,Matanzas,04/22/1811,1811-04-22,98,"4685, 4686, 4687, 4688, 4689",NULL
S1396E,John,Ship,Archangel,05/25/1811,1811-05-25,258,"4690, 4691, 4692, 4693",NULL
S1397E,Juno,Brig,Havana,02/09/1811,1811-02-09,164,"4694, 4695, 4696",NULL
S1398E,Juno,Brig,St. Petersburg,05/10/1811,1811-05-10,164,"4697, 4698, 4699, 4702, 4703",NULL
S1399E,Little James,Brig,Rio de Laplata,01/21/1811,1811-01-21,127,"4700, 4701, 4704, 4705, 4706",NULL
S1400E,Louisa,Brig,St. Petersburg,05/28/1811,1811-05-28,156,"4707, 4708, 4709, 4710, 4711, 4712",NULL
S1401E,Lucy,Brig,St. Bartholomew's,05/18/1811,1811-05-18,129,"4713, 4714, 4715, 4716, 4717",NULL
S1402E,Lucy,Brig,Bordeaux,12/23/1811,1811-12-23,129,"4718, 4719",NULL
S1403E,Lydia,Schooner,St. Iago de Cuba,01/26/1811,1811-01-26,51,"4720, 4721",NULL
S1404E,Martha,Brig,Turks Island,??/??/1811,0000-00-00,116,"4722, 4723",NULL
S1405E,Marquis de Somerulas,Ship,Civita Vecchia,08/20/1811,1811-08-20,359,"4724, 4725",NULL
S1406E,Mary,Brig,Havana,01/19/1811,1811-01-19,113,"4726, 4727, 4728, 4729, 4730",NULL
S1407E,Mary,Brig,Tangiers,05/14/1811,1811-05-14,113,"4731, 4732, 4733, 4734, 4735, 4736",NULL
S1408E,Mary,Brig,Havana,10/17/1811,1811-10-17,113,"4737, 4738",NULL
S1409E,Mary Ann,Ship,Russia,05/06/1811,1811-05-06,240 & 20/95,"4739, 4740",NULL
S1410E,Mary & Eliza,Ship,Tunis & a market,09/04/1810,1810-09-04,233,"4099, 4100, 4741, 4742, 4743",NULL
S1411E,Mentor,Ship,"[…ersburg], Russia [From Savannah, Georgia]",03/18/1811,1811-03-18,NULL,"4744, 4745, 4746",NULL
S1412E,Molly,Schooner,West Indies,06/18/1811,1811-06-18,65,"4747, 4748, 4749, 4750, 4751",NULL
S1413E,Monk,Ship,Gibraltar,11/23/1811,1811-11-23,253,"4752, 4753",NULL
S1414E,Moses,Bark,Gottenburg,05/14/1811,1811-05-14,203,"4754, 4755",NULL
S1415E,Montgomery,Ship,West Indies,01/21/1811,1811-01-21,274,"4756, 4757",NULL
S1416E,Mount Vernon,Ship,Archangel,04/16/1811,1811-04-16,254,"4758, 4759, 4760, 4761, 4762",NULL
S1417E,Neptune,Brig,Sicily,01/05/1811,1811-01-05,134,"4763, 4764, 4765, 4766, 4767",NULL
S1418E,Neutrality,Schooner,West Indies,05/02/1811,1811-05-02,123,"4768, 4769, 4772, 4773, 4774",NULL
S1419E,Orestes,Ship,St. Petersburg,03/08/1811,1811-03-08,274,"4770, 4771",NULL
S1420E,Patriot,Bark,Archangel,05/09/1811,1811-05-09,265,"4775, 4776, 4777, 4778, 4779",NULL
S1421E,Perseverance,Ship,Liverpool [From New Orleans],03/30/1811,1811-03-30,241,"4780, 4781",NULL
S1422E,Perseverance,Ship,East Indies,12/26/1811,1811-12-26,241,"4782, 4783",NULL
S1423E,Plato,Ship,Gottenburg,10/25/1811,1811-10-25,240,"4784, 4785, 4786, 4787, 4788",NULL
S1424E,Rachel,Schooner,Havana,??/??/1811,0000-00-00,70,"4789, 4790",NULL
S1425E,Rachel,Schooner,St. Michael's,02/18/1811,1811-02-18,72,"4791, 4792",NULL
S1426E,Rambler,Ship,Isle of France,12/19/1811,1811-12-19,285,"4793, 4794",NULL
S1427E,Rebecca,Brig,St. Petersburg,05/13/1811,1811-05-13,178,"4795, 4796, 4797, 4798, 4799",NULL
S1428E,Recovery,Ship,Europe,08/08/1811,1811-08-08,284,"4800, 4801",NULL
S1429E,Resolution,Brig,Smyrna,07/26/1811,1811-07-26,135,"4802, 4803, 4804, 4808, 4809",NULL
S1430E,Resolution,Schooner,Para,03/26/1811,1811-03-26,110,"4805, 4806, 4807",NULL
S1431E,Restitution,Ship,Liverpool,08/12/1811,1811-08-12,247,"4810, 4811, 4812, 4813, 4814",NULL
S1432E,Return,Brig,Cayenne,04/24/1811,1811-04-24,133,"4815, 4816",NULL
S1433E,Return,Brig,West Indies,09/30/1811,1811-09-30,133,"4817, 4818",NULL
S1434E,Rising States,Schooner,Pernambuco,07/27/1811,1811-07-27,128,"4819, 4820, 4821, 4822, 4823",NULL
S1435E,Rotund,Brig,Havana [From Bath],03/06/1811,1811-03-06,146,"4824, 4825",NULL
S1436E,Rising States,Schooner,Barbados [From Savannah],04/09/1811,1811-04-09,NULL,"4826, 4827",NULL
S1437E,Sally,Schooner,St. Petersburg,04/17/1811,1811-04-17,73,"4828, 4829",NULL
S1438E,Sally,Schooner,Corunna,12/05/1811,1811-12-05,73,"4830, 4831",NULL
S1439E,Spring Bird,Schooner,Porto Rico,05/03/1811,1811-05-03,127,"4832, 4833, 4834, 4835, 4836",NULL
S1440E,Spring Bird,Schooner,Martinico,12/13/1810,1810-12-13,126,"4246, 4247, 4837, 4838, 4839",NULL
S1441E,Saucy Jack,Brig,Havana,04/29/1811,1811-04-29,129[?],"4840, 4841",NULL
S1442E,Sukey,Brig,St. Petersburg,04/18/1811,1811-04-18,145,"4842, 4843, 4844, 4845, 4846, 4847",NULL
S1443E,Sukey,Brig,Havana,11/14/1811,1811-11-14,145,"4848, 4849, 4850, 4851, 4852",NULL
S1444E,Thomas,Schooner,Christiana & a Market,03/15/1811,1811-03-15,103,"4853, 4854, 4855",NULL
S1445E,Thomas,Schooner,Bergen,10/26/1811,1811-10-26,103,"4856, 4857, 4858, 4859, 4860",NULL
S1446E,Thomas,Schooner,Bordeaux,12/30/1811,1811-12-30,68,"4861, 4862",NULL
S1447E,Three Friends,Brig,Pernambuco,10/07/1811,1811-10-07,135,"4863, 4864",NULL
S1448E,Three Friends,Brig,Havana [From New York],01/18/1811,1811-01-18,NULL,"4865, 4866",NULL
S1449E,Traveller,Ship,Copenhagen & India,??/??/1811,0000-00-00,NULL,"4867, 4868",NULL
S1450E,Union,Schooner,West Indies,01/30/1811,1811-01-30,99,"4869, 4870, 4871, 4872, 4873, 4874",NULL
S1451E,Union,Schooner,Smyrna,01/31/1811,1811-01-31,84,"4875, 4876",NULL
S1452E,Union,Schooner,West Indies,11/01/1811,1811-11-01,85,"4877, 4878, 4879, 4880, 4881",NULL
S1453E,Vandyck,Schooner,West Indies,06/08/1811,1811-06-08,69,"4882, 4883",NULL
S1454E,Washington,Brig,St. Petersburg,04/18/1811,1811-04-18,178,"4884, 4885",NULL
S1455E,William,Schooner,Oronoco [From Wiscasset],12/28/1811,1811-12-28,NULL,"4886, 4887",Vessel of Wiscasset
S1456E,William & Charles,Brig,Havana[?],02/15/1811,1811-02-15,161,"4888, 4889, 4890, 4891, 4892",NULL
S1457E,William & Charles,Brig,Gottenburg and St. Petersburg,07/16/1811,1811-07-16,161,"4893, 4894, 4895, 4896, 4897",NULL
S1458E,William and David,Schooner,Cayenne & a market,04/16/1811,1811-04-16,87,"4898, 4899",NULL
S1459E,Active,Brig,Lisbon,08/28/1812,1812-08-28,206,"4902, 4903",NULL
S1460E,Adaline,Ship,Gibraltar [From Baltimore],03/27/1812,1812-03-27,NULL,"4906, 4907",NULL
S1461E,Active,Schooner,Civita Vecchia,02/06/1812,1812-02-06,112,"4908, 4909",NULL
S1462E,Alligator,Schooner,South America & East Indies,12/01/1812,1812-12-01,73,"4910, 4911",NULL
S1463E,Angler,Schooner,Europe,01/06/1812,1812-01-06,96,"4912, 4913, 4914, 4915, 4916",NULL
S1464E,Argus,Brig,West Indies,01/21/1812,1812-01-21,127,"4917, 4918, 4919, 4920, 4921",NULL
S1465E,Augusta,Brig,West Indies,04/04/1812,1812-04-04,127,"4922, 4923, 4924, 4925, 4926",NULL
S1466E,Augusta,Brig,Lisbon [From Baltimore],10/23/1812,1812-10-23,NULL,"4927, 4928",NULL
S1467E,Belleisle,Brig,West Indies,04/01/1812,1812-04-01,119,"4929, 4930",NULL
S1468E,Betsey,Brig,Matanzas,01/08/1812,1812-01-08,149,"4931, 4932, 4933, 4934, 4935",NULL
S1469E,Betsey,Brig,Pernambuco & a Market.,04/01/1812,1812-04-01,92,"4936, 4937, 4938, 4939, 4940",NULL
S1470E,Betsey,Brig,St. Petersburg,04/10/1812,1812-04-10,120,"4941, 4942, 4943, 4944, 4945",NULL
S1471E,Bird,Schooner,France,01/11/1812,1812-01-11,80,"4946, 4947, 4948, 4949, 4950",NULL
S1472E,Caravan,Brig,Calcutta,02/15/1812,1812-02-15,267,"4951, 4952, 4953, 4954, 4955",NULL
S1473E,Catharine,Brig,Lisbon [From Savannah],12/03/1812,1812-12-03,NULL,"4956, 4957",NULL
S1474E,Cora,Brig,South America,02/25/1812,1812-02-25,153,"4958, 4959, 4960, 4961, 4962, 4963, 4964",NULL
S1475E,Criterion,Schooner,West Indies,02/21/1812,1812-02-21,87,"4965, 4966, 4967, 4968, 4969",NULL
S1476E,Diligent,Schooner,France,11/07/1812,1812-11-07,68,"4970, 4971",NULL
S1477E,Diomede,Brig,Madras,01/31/1812,1812-01-31,220,"4972, 4973",NULL
S1478E,Dryade,Brig,St. Petersburg,03/07/1812,1812-03-07,262,"4974, 4975",NULL
S1479E,Enterprise,Brig,NULL,10/21/1809,1809-10-21,182,"5005, 5006",NULL
S1480E,Equality,Schooner,Laguira [La Guaira?],06/02/1809,1809-06-02,101,"5007, 5008, 5009, 5010",NULL
S1481E,Eros,Schooner,St. Bartholomew,05/09/1809,1809-05-09,126,"5011, 5012, 5013, 5018, 5019",NULL
S1482E,Exchange,Brig,Gottenburg,03/20/1809,1809-03-20,185,"5014, 5015",NULL
S1483E,Export,Ship,Cadiz & Alicante,09/18/1809,1809-09-18,253,"5016, 5017",NULL
S1484E,Export,Schooner,Havana,12/09/1809,1809-12-09,112,"5020, 5021",NULL
S1485E,Eliza,Schooner,Algiers and a Market,08/04/1809,1809-08-04,80,"5022, 5023",NULL
S1486E,Eliza,Ship,Gottenburg,04/17/1809,1809-04-17,241,"5024, 5025, 5026",NULL
S1487E,Francis,Ship,Sumatra,03/18/1809,1809-03-18,280,"5027, 5028",NULL
S1488E,Friendship,Brig,Cuba,03/29/1809,1809-03-29,156,"5029, 5030",NULL
S1489E,Fame,Schooner,West Indies,08/02/1809,1809-08-02,95,"5031, 5032, 5033, 5034, 5035",NULL
S1490E,Fame,Schooner,Cuba,04/05/1809,1809-04-05,95,"5036, 5037, 5038, 5039, 5040",NULL
S1491E,Fame,Ship,Cadiz & market,10/06/1809,1809-10-06,363,"5041, 5042, 5043",NULL
S1492E,Fishhawk,Schooner,La Guaira,05/18/1809,1809-05-18,101,"5044, 5045",NULL
S1493E,Fishhawk,Schooner,St. Iago de Cuba,11/07/1809,1809-11-07,101,"5046, 5047",NULL
S1494E,Fly,Schooner,St. Bartholomew,04/11/1809,1809-04-11,58,"5048, 5049, 5050",NULL
S1495E,Four Brothers,Schooner,Europe,09/26/1809,1809-09-26,107,"5051, 5052, 5053, 5054, 5055",NULL
S1496E,Four Sisters,Schooner,Cuba,04/28/1809,1809-04-28,80,"5056, 5057, 5058",NULL
S1497E,Fox,Brig,Havana,06/17/1809,1809-06-17,116,"5059, 5060, 5061, 5062, 5063, 5064, 5065",NULL
S1498E,Ganges,Brig,Canton,09/02/1809,1809-09-02,265,"5066, 5067",NULL
S1499E,George & Susan,Schooner,West Indies,06/03/1809,1809-06-03,118,"5068, 5069, 5070, 5051, 5072",NULL
S1500E,George & Susan,Schooner,West Indies,12/14/1809,1809-12-14,118,"5073, 5074, 5075, 5076, 5077",NULL
S1501E,Golden Age,Ship,Sumatra,06/19/1809,1809-06-19,219,"5078, 5079, 5080",NULL
S1502E,Grey Hound,Schooner,Cayenne,05/19/1809,1809-05-19,60,"5081, 5082, 5083, 5084, 5085, 5086",NULL
S1503E,Halcyon,Schooner,Tonningen or a market,05/23/1809,1809-05-23,76,"5087, 5088, 5089, 5090, 5091, 5092",NULL
S1504E,Harriot,Brig,Tangiers,04/11/1809,1809-04-11,166,"5093, 5094, 5109, 5110, 5111",NULL
S1505E,Hazard,Schooner,Cayenne,06/08/1809,1809-06-08,83,"5095, 5096",NULL
S1506E,Henry,Brigantine,Stockholm,04/27/1809,1809-04-27,115,"5097, 5098, 5099",NULL
S1507E,Hannah,Schooner,The Brazils,12/02/1809,1809-12-02,105,"5100, 5101",NULL
S1508E,Harmony,Schooner,St. Bartholomew's,12/08/1809,1809-12-08,112,"5102, 5103, 5104, 5105",NULL
S1509E,Harper,Bark,St. Bartholomew's,05/09/1809,1809-05-09,161,"5106, 5107, 5108",NULL
S1510E,Harriot,Brigantine,West Indies,06/06/1809,1809-06-06,NULL,"5112, 5113",NULL
S1511E,Harriot,Brig,Mantanzas,12/20/1809,1809-12-20,107,"5114, 5115",NULL
S1512E,Helen,Schooner,Porto Bello [From Ipswich],04/29/1809,1809-04-29,74 & 30/95,"5116, 5117",NULL
S1513E,Henry,Brig,Stockholm,04/27/1809,1809-04-27,157,"5118, 5119",NULL
S1514E,Henry,Ship,Lisbon [From Waldoborough],04/03/1809,1809-04-03,NULL,"5120, 5121",NULL
S1515E,Hercules,Ship,Europe,07/23/1809,1809-07-23,NULL,"5122, 5123, 5124",NULL
S1516E,Hero,Schooner,West Indies & Spanish Main,06/26/1809,1809-06-26,92,"5125, 5126",NULL
S1517E,Hette,Schooner,St. Bartholomew,05/27/1809,1809-05-27,76,"5127, 5128, 5129, 5130, 5131",NULL
S1518E,Hette,Schooner,St. Sebastian's,10/27/1809,1809-10-27,75,"5132, 5133",NULL
S1519E,Hind,Bark,Toningen,07/12/1809,1809-07-12,157,"5134, 5135, 5136, 5137, 5138",NULL
S1520E,Hope,Brig,Tonningen,12/01/1809,1809-12-01,165,"5139, 5140, 5141, 5142",NULL
S1521E,Hope,Ship,Sumatra,03/20/1809,1809-03-20,282,"5143, 5144, 5145",NULL
S1522E,Hope,Schooner,West Indies,07/18/1809,1809-07-18,100,"5146, 5147",NULL
S1523E,Hope,Ship,Cagliari & a Market,06/05/1809,1809-06-05,185,"5148, 5149",NULL
S1524E,Hope,Ship,St. Petersburg [From Savannah],05/13/1809,1809-05-13,NULL,"5150, 5151",NULL
S1525E,Pilgrim,Brig,Canton,03/24/1809,1809-03-24,269,"5152, 5153",NULL
S1526E,Recovery,Ship,"Rio Janario, India",06/19/1809,1809-06-19,284 28/95,"5154, 5155, 5156",NULL
S1527E,Liberty,Schooner,Martinico,08/14/1809,1809-08-14,99,"5157, 5158, 5222, 5223, 5224, 5225",NULL
S1528E,Independence,Brig,Sardinia,06/17/1809,1809-06-17,223,"5159, 5160",NULL
S1529E,Industry,Brig,Stockholm,05/06/1809,1809-05-06,136,"5161, 5162, 5163, 5169, 5170",NULL
S1530E,Industry,Schooner,St. Bartholomew's,05/12/1809,1809-05-12,62,"5164, 5165, 5166, 5167, 5168",NULL
S1531E,Iris,Schooner,West Indies,05/01/1809,1809-05-01,80,"5171, 5172, 5173, 5174, 5175",NULL
S1532E,Iris,Schooner,Spain,12/09/1809,1809-12-09,80,"5176, 5177",NULL
S1534E,Jane,Schooner,West Indies,03/21/1809,1809-03-21,60 & 8/95,"5178, 5179, 5180, 5181, 5182",NULL
S1535E,Jason,Brig,Malaya,07/06/1809,1809-07-06,130,"5183, 5184, 5185, 5186",NULL
S1536E,Jeremiah,Schooner,Gottenburg,05/11/1809,1809-05-11,131,"5187, 5188, 5189, 5218, 5219",NULL
S1537E,Latona,Brig,Naples & Civitavecchia [Italy],12/05/1809,1809-12-05,178,"5190, 5191",NULL
S1538E,Latona,Brig,Havana,07/19/1809,1809-07-19,178,"5192, 5193",NULL
S1539E,Lark,Schooner,The Western Islands[?],04/14/1809,1809-04-14,NULL,"5194, 5195, 5196, 5197, 5198",NULL
S1540E,Juno,Brig,Sardinia,04/12/1809,1809-04-12,164,"5199, 5200, 5201, 5202, 5203",NULL
S1541E,John,Ship,Palermo,??/??/1809,0000-00-00,258,"5204, 5205",NULL
S1542E,John,Schooner,Porto Rico & a Market,10/07/1809,1809-10-07,85,"5206, 5207, 5208, 5209, 5210",NULL
S1543E,John,Schooner,West Indies,06/21/1809,1809-06-21,60,"5211, 5212",NULL
S1544E,Joanna,Schooner,Tangiers,07/06/1809,1809-07-06,71,"5213, 5214, 5215, 5216, 5217",NULL
S1545E,Liberty,Schooner,Tonningen,06/26/1809,1809-06-26,86,"5220, 5221",NULL
S1546E,Little James,Brig,Gottenburg,06/02/1809,1809-06-02,126,"5226, 5227, 5228, 5229",NULL
S1547E,Louisa,Brig,Tangiers & a Market,05/01/1809,1809-05-01,156,"5230, 5231, 5232, 5233, 5234",NULL
S1548E,Madockawando,Schooner,West Indies,07/01/1809,1809-07-01,115,"5235, 5236, 5237",NULL
S1549E,Lydia,Schooner,St. Bartholomew's,12/30/1809,1809-12-30,51,"5238, 5239, 5240, 5241",NULL
S1550E,Madockawando,Schooner,West Indies,07/01/1809,1809-07-01,115,"5242, 5243",NULL
S1551E,Marquis de Somerulas,Ship,Rio Janario,03/25/1809,1809-03-25,359 & 9/95,"5244, 5245, 5246",NULL
S1552E,Martha,Brig,West Indies,05/02/1809,1809-05-02,110,"5247, 5248",NULL
S1553E,Mary,Brig,West Indies,10/28/1809,1809-10-28,113,"5249, 5250, 5251, 5252, 5253, 5254",NULL
S1554E,Mary,Schooner,Gottenburgh,03/19/1809,1809-03-19,80,"5255, 5256",NULL
S1555E,Mary,Schooner,St. Bartholomew's,05/24/1809,1809-05-24,113,"5257, 5258, 5259, 5260, 5261",NULL
S1556E,Mary Ann,Ship,Sumatra,05/12/1809,1809-05-12,240,"5262, 5263, 5264",NULL
S1557E,Mary Caroline,Brig,St. Bartholomew's,06/03/1809,1809-06-03,158,"5265, 5266, 5267, 5268, 5269",NULL
S1558E,Mary,Bark,Calcutta,06/27/1809,1809-06-27,202,"5270, 5271",NULL
S1559E,Mary & Eliza,Ship,Sumatra,05/??/1809,0000-00-00,233,"5272, 5273, 5274",NULL
S1560E,Massafuero,Brig,Havana,09/30/1809,1809-09-30,87,"5275, 5276",NULL
S1561E,Mentor,Ship,"Sumatra, or China or both",03/22/1809,1809-03-22,212,"5277, 5278, 5279",NULL
S1562E,Mercury,Schooner,Laguira,04/05/1809,1809-04-05,102,"5280, 5281, 5284, 5285, 5286",NULL
S1563E,Mercury,Schooner,Brazil,10/30/1809,1809-10-30,102,"5282, 5283, 5287, 5288, 5289, 5290",NULL
S1564E,Minerva,Brig,Havana,03/27/1809,1809-03-27,134,"5291, 5292, 5293, 5294, 5295",NULL
S1565E,Minerva,Brig,Cayenne,07/06/1809,1809-07-06,134,"5296, 5297, 5298, 5299, 5300",NULL
S1566E,Monk,Ship,Costa Vecchia,06/16/1809,1809-06-16,253,"5301, 5302, 5303",NULL
S1567E,Montpelier,Brig,St. Bartholomew's,03/21/1809,1809-03-21,111,"5304, 5305, 5306, 5307, 5308",NULL
S1568E,Montpelier,Brig,Martinico,06/23/1809,1809-06-23,110,"5309, 5310",NULL
S1569E,Moses,Bark,Cayenne,04/29/1809,1809-04-29,203,"5311, 5312",NULL
S1570E,Mount Vernon,Ship,Havana,07/18/1809,1809-07-18,254,"5313, 5314, 5315",NULL
S1571E,Mabby,Brig,Surinam,06/14/1809,1809-06-14,154,"5316, 5317, 5318, 5319, 5320",NULL
S1572E,Nancy,Brig,Tonningen,07/22/1809,1809-07-22,143,"5321, 5322",NULL
S1573E,Nancy,Schooner,Cayenne,05/20/1809,1809-05-20,70,"5323, 5324, 5325, 5329, 5330",NULL
S1574E,Nancy,Schooner,St. Bartholomews,12/09/1809,1809-12-09,70,"5326, 5327, 5328, 5331, 5332",NULL
S1576E,Nancy,Schooner,Europe,12/21/1809,1809-12-21,94,"5333, 5334",NULL
S1577E,Nancy,Sloop,Halifax,08/05/1809,1809-08-05,28,"5335, 5336, 5337, 5338, 5339",NULL
S1578E,Nat & John,Schooner,Cuba St. Iago,05/03/1809,1809-05-03,104,"5340, 5341",NULL
S1579E,Nautilus,Schooner,Cayenne,05/24/1809,1809-05-24,64,"5342, 5343, 5344, 5345, 5346",NULL
S1580E,Neptune,Schooner,Havana,03/20/1809,1809-03-20,127,"5347, 5348, 5349, 5350, 5351",NULL
S1581E,Neptune,Schooner,North of Europe,06/20/1809,1809-06-20,127,"5352, 5353, 5354, 5355, 5356",NULL
S1582E,Neptune,Brig,Christiana,12/23/1809,1809-12-23,127,"5357, 5358, 5359, 5360, 5361",NULL
S1583E,Neptune,Schooner,Martinico,06/29/1809,1809-06-29,101,"5362, 5363, 5364, 5365, 5366, 5367",NULL
S1584E,Neutrality,Schooner,Martinico,06/20/1809,1809-06-20,123,"5368, 5369, 5370, 5371",NULL
S1585E,Pacific,Bark,Gottenburg,04/29/1809,1809-04-29,188,"5372, 5373",NULL
S1586E,Packet,Ship,Algiers,05/05/1809,1809-05-05,229,"5374, 5375, 5376, 5377",NULL
S1587E,Parrot,Schooner,St. Bartholomew's,06/02/1809,1809-06-02,70,"5378, 5379",NULL
S1588E,Perseverance,Schooner,St. Sebastians,11/13/1809,1809-11-13,71,"5380, 5381",NULL
S1589E,Pilgrim,Brig,Canton,03/24/1809,1809-03-24,269,"5384, 5385, 5386, 5387, 5388, 5389",NULL
S1590E,Plato,Ship,Europe and India,10/16/1809,1809-10-16,245,"5390, 5391",NULL
S1591E,Powder Point,Schooner,West Indies,07/28/1809,1809-07-28,82,"5392, 5393, 5394, 5395, 5396",NULL
S1592E,Rachel,Schooner,St. Bartholomews,03/30/1809,1809-03-30,71 & 66/95,"5397, 5398",NULL
S1593E,Rachel,Schooner,Cadiz,11/16/1809,1809-11-16,71,"5400, 5401",NULL
S1594E,Rachel,Ship,[Tonning? Gothenburg?],04/05/1809,1809-04-05,NULL,"5402, 5403, 5404",NULL
S1595E,Rebecca,Ship,Havana,07/20/1809,1809-07-20,211,"5405, 5406, 5407",NULL
S1596E,Rebecca,Brig,Gottenburgh,03/31/1809,1809-03-31,180,"5408, 5409, 5410, 5411, 5412",NULL
S1597E,Rebecca,Ship,St. Bartholomew's & Cuba,03/16/1809,1809-03-16,211,"5413, 5414, 5415",NULL
S1598E,Reindeer,Schooner,West Indies,03/22/1809,1809-03-22,NULL,"5416, 5417, 5418, 5419, 5420",NULL
S1599E,Reindeer,Schooner,St. Bartholomew's,06/08/1809,1809-06-08,82,"5421, 5422, 5423, 5424, 5425",NULL
S1600E,Republican,Brig,Havana,03/29/1809,1809-03-29,160,"5426, 5427, 5428, 5429, 5430",NULL
S1601E,Restitution,Ship,Gottenburg,05/09/1809,1809-05-09,247,"5431, 5432, 5433",NULL
S1602E,Return,Brig,Porto Rico/West Indies,06/20/1809,1809-06-20,133,"5434, 5435, 5436, 5437, 5438",NULL
S1603E,Reward,Brig,Samos,05/06/1809,1809-05-06,182,"5439, 5440, 5441, 5442, 5443, 5444",NULL
S1604E,Rising States,Schooner,Havana,12/09/1809,1809-12-09,NULL,"5445, 5446",NULL
S1605E,Roboreus,Bark,Tonningen,08/23/1809,1809-08-23,157,"5447, 5448, 5449",NULL
S1606E,Romp,Brig,Naples,10/16/1809,1809-10-16,232,"5450, 5451",NULL
S1607E,Salem,Schooner,Europe,06/17/1809,1809-06-17,NULL,"5452, 5453",NULL
S1608E,Sally,Schooner,Cayenne & St. Bartholomew's,05/10/1809,1809-05-10,73,"5454, 5455, 5456, 5457, 5458, 5459",NULL
S1609E,Sally,Schooner,St. Bartholomew's,11/13/1809,1809-11-13,34,"5460, 5461",NULL
S1610E,Saucy Jack,Schooner,Gottenburgh,03/20/1809,1809-03-20,129,"5462, 5463, 5464, 5465, 5466",NULL
S1611E,Saucy Jack,Schooner,Cadiz,10/20/1809,1809-10-20,129,"5467, 5468, 5469, 5470",NULL
S1612E,Spring Bird,Schooner,St. Bartholomew's,05/25/1809,1809-05-25,126,"5471, 5472, 5473, 5476, 5477",NULL
S1613E,Somers,Brig,Havana [From Kennebunk],08/19/1809,1809-08-19,138 66/95,"5474, 5475",NULL
S1614E,St. Peter,Schooner,Cayenne,05/25/1809,1809-05-25,67,"5478, 5479",NULL
S1615E,Star,Brig,Tonningen,07/06/1809,1809-07-06,156,"5480, 5481, 5482, 5483, 5484",NULL
S1616E,Success,Brig,Cuba,03/21/1809,1809-03-21,105,"5485, 5486, 5487, 5488, 5489",NULL
S1617E,Success,Brig,Cuba,08/21/1809,1809-08-21,105,"5490, 5491, 5492, 5493, 5494",NULL
S1618E,Success,Brig,Mantanzes,12/20/1809,1809-12-20,105,"5495, 5496, 5497, 5498",NULL
S1619E,Success,Schooner,Tangiers,04/04/1809,1809-04-04,92,"5499, 5500, 5501, 5502",NULL
S1620E,Sukey & Betsy,Brig,St. Bartholomews,04/22/1809,1809-04-22,120,"5503, 5504, 5505, 5506, 5507",NULL
S1621E,Sukey & Betsey,Brig,Gallipoli,10/11/1809,1809-10-11,120,"5508, 5509, 5510, 5511",NULL
S1622E,Sukey,Brig,Sumatra,04/03/1809,1809-04-03,145,"5512, 5513, 5514, 5515",NULL
S1623E,Susan,Brig,NULL,03/16/1809,1809-03-16,207,"5516, 5517",NULL
S1624E,Suwarrow,Brig,Gottenburgh,03/16/1809,1809-03-16,198,"5518, 5519",NULL
S1625E,Swift,Schooner,Tunis[?],03/18/1809,1809-03-18,70,"5520, 5521",NULL
S1626E,Telemachus,Brig,Tunis,06/13/1809,1809-06-13,132,"5522, 5523, 5524, 5525, 5526",NULL
S1628E,Thomas,Schooner,St. Bartholomews,05/26/1809,1809-05-26,103,"5527, 5528, 5529, 5530, 5531, 5532, 5533",NULL
S1629E,Thomas,Schooner,Havana,09/01/1809,1809-09-01,103,"5534, 5535, 5536, 5537, 5538",NULL
S1630E,Three Brothers,Schooner,Cayenne,04/18/1809,1809-04-18,63,"5539, 5540",NULL
S1631E,Three Friends,Brig,West Indies,04/08/1809,1809-04-08,136,"5541, 5542, 5543, 5544, 5545",NULL
S1632E,Three Friends,Brig,Havana,12/20/1809,1809-12-20,132,"5546, 5547, 5548, 5549, 5550",NULL
S1633E,Trial,Brig,Havana,07/28/1809,1809-07-28,147,"5551, 5552, 5553, 5554, 5555",NULL
S1634E,Trial,Brig,Cayenne,04/13/1809,1809-04-13,147,"5556, 5557, 5558, 5559, 5560",NULL
S1635E,Two Betseys,Brig,"Algiers, or Tunis and a Market.",09/07/1809,1809-09-07,141,"5561, 5562",NULL
S1636E,Two Brothers,Schooner,St. Bartholomews,03/18/1809,1809-03-18,98,"5563, 5564, 5565, 5566, 5567",NULL
S1637E,Two Brothers,Schooner,Lisbon,04/01/1809,1809-04-01,74,"5568, 5569",NULL
S1638E,Union,Schooner,"Bremen, Hamburg, or Tonningen",12/09/1809,1809-12-09,85,"5570, 5571, 5572, 5573, 5581, 5582",NULL
S1639E,Two Sisters,Schooner,Embden,05/13/1809,1809-05-13,68,"5574, 5575, 5576, 5577, 5578",NULL
S1640E,Two Friends,Schooner,Cadiz,11/10/1809,1809-11-10,74,"5579, 5580",NULL
S1641E,Union,Schooner,Sardinia,03/30/1809,1809-03-30,86,"5583, 5584, 5585, 5586, 5587",NULL
S1642E,Union,Schooner,Baracoa,11/25/1809,1809-11-25,99,"5588, 5589, 5590, 5591",NULL
S1643E,Union,Schooner,Cayenne,04/05/1809,1809-04-05,99,"5592, 5593, 5594, 5595, 5596",NULL
S1644E,Venus,Brig,Gottenburg,05/26/1809,1809-05-26,184,"5597, 5598, 5599, 5600, 5601",NULL
S1645E,Venus,Brig,Brazil,12/26/1809,1809-12-26,184,"5602, 5603, 5604, 5605, 5606",NULL
S1646E,Victory,Brig,Naples,10/11/1809,1809-10-11,176,"5607, 5608",NULL
S1647E,Washington,Brig,Gottenburg,05/27/1809,1809-05-27,178,"5609, 5610",NULL
S1648E,Washington,Brig,Cuba,07/18/1809,1809-07-18,108,"5611, 5612",NULL
S1649E,Washington,Schooner,St. Bartholomew's,05/30/1809,1809-05-30,133,"5613, 5614, 5615, 5616, 5617",NULL
S1650E,Welcome Return,Brig,The Brazils,04/22/1809,1809-04-22,225,"5618, 5619, 5620, 5621, 5622",NULL
S1651E,Welcome Return,Brig,India,10/21/1809,1809-10-21,223  5/19,"5623, 5624",NULL
S1652E,William,Brig,"Bergen, Norway",06/16/1809,1809-06-16,178,"5625, 5626",NULL
S1653E,William,Ship,Canton,03/25/1809,1809-03-25,304,"5627, 5628, 5629, 5630",NULL
S1654E,William,Schooner,Cayenne,05/09/1809,1809-05-09,97,"5631, 5632, 5633, 5634, 5635",NULL
S1655E,William,Schooner,Puerto Rico,07/03/1809,1809-07-03,52,"5636, 5637, 5638, 5639, 5640",NULL
S1656E,William,Schooner,Tonningen,11/15/1809,1809-11-15,79,"5641, 5642, 5643, 5644, 5645",NULL
S1657E,William & Charles,Brig,Gottenburg,05/10/1809,1809-05-10,161,"5646, 5647, 5648, 5649, 5650",NULL
S1658E,Augusta,Brig,Havana,10/08/1810,1810-10-08,127,"5652, 5653, 5658, 5659, 5660, 5661",NULL
S1659E,Augustus,Ship,Tonningen,05/22/1810,1810-05-22,246,"5654, 5655",NULL
S1660E,Augusta,Schooner,Archangel,04/28/1810,1810-04-28,125,"5656, 5657",NULL
S1662E,Augusta,Brig,Tonningen,04/10/1810,1810-04-10,127,"5662, 5663, 5664, 5665, 5666",NULL
S1663E,Astrea,Brig,Gottenburg,04/06/1810,1810-04-06,115,"5667, 5668",NULL
S1664E,Asia,Ship,Riga & St. Petersburg,02/26/1810,1810-02-26,274,"5669, 5670",NULL
S1665E,Argus,Brigantine,West Indies,07/31/1810,1810-07-31,126,"5671, 5672, 5673",NULL
S1666E,Ann,Schooner,West Indies,11/07/1810,1810-11-07,92,"5674, 5675, 5678, 5679, 5680",NULL
S1667E,Ann,Schooner,West Indies,07/30/1810,1810-07-30,92 47/95,"5676, 5677",NULL
S1668E,Alfred,Ship,Buenos Ayres,11/03/1810,1810-11-03,260,"5681, 5682, 5683, 5684, 5685",NULL
S1669E,Active,Brig,Manilla,05/31/1810,1810-05-31,206,"4904, 4905, 5688, 5689, 5690, 5698, 5699",NULL
S1670E,Abigail,Schooner,West Indies,07/13/1810,1810-07-13,74,"5691, 5692, 5693, 5694, 5695",NULL
S1671E,Abigail,Schooner,West Indies,11/24/1810,1810-11-24,74,"5696, 5697",NULL
S1672E,Augustus,Ship,Havana,12/19/1810,1810-12-19,246,"5700, 5701, 5702, 5703, 5704",NULL
S1673E,Becca,Schooner,Porto Rico,01/26/1810,1810-01-26,52,"5705, 5706",NULL
S1674E,Betsey,Schooner,Havana,12/29/1810,1810-12-29,82,"5707, 5708, 5709, 5710, 5711",NULL
S1675E,Betsy,Brig,Antigua,07/20/1810,1810-07-20,92,"5712, 5713, 5723, 5724, 5725",Also spelled Betsey
S1676E,Betsy,Schooner,Para,05/25/1810,1810-05-25,120,"5714, 5715",Also spelled Betsey
S1677E,Betsey,Schooner,Gottenburg & a market,06/11/1810,1810-06-11,82,"5716, 5717",NULL
S1678E,Betsey,Schooner,Porto Rico,12/08/1810,1810-12-08,100,"5718, 5719",NULL
S1679E,Betsy,Brig,Tonningen,04/03/1810,1810-04-03,107,"5720, 5721, 5722",Also spelled Betsey
S1680E,Bird,Schooner,Bordeaux,11/06/1810,1810-11-06,80,"5726, 5727, 5731, 5732, 5733",NULL
S1681E,Catherine,Brig,Europe,02/07/1810,1810-02-07,158,"5728, 5729, 5730",Also spelled Catharine
S1682E,Catherine,Brig,Kiel,09/19/1810,1810-09-19,158,"5734, 5735, 5736, 5737, 5738",Also spelled Catharine
S1683E,Columbia,Schooner,Havana,10/06/1810,1810-10-06,84,"5739, 5740",NULL
S1684E,Columbia,Schooner,Martinico,06/30/1810,1810-06-30,84,"5741, 5742, 5743, 5744, 5745",NULL
S1685E,Columbia,Schooner,North of Europe,12/22/1810,1810-12-22,90,"5746, 5747",NULL
S1686E,Columbia,Schooner,Cayenne,10/12/1810,1810-10-12,84,"5748, 5749, 5750",One document mistakenly calls vessel Columbus
S1687E,Coromandel,Brig,Mediterranean,12/17/1810,1810-12-17,315,"5751, 5752",NULL
S1688E,Cynthia,Brig,Tonningen,03/29/1810,1810-03-29,128,"5753, 5754, 5755, 5756, 5757",NULL
S1689E,Cynthia,Brig,Havana,10/13/1810,1810-10-13,128,"5758, 5759",NULL
S1690E,Dove,Schooner,Martinico,12/27/1810,1810-12-27,68,"5760, 5761, 5769, 5770, 5771",NULL
S1691E,Dove,Schooner,Trinidad,05/14/1810,1810-05-14,68,"5762, 5763",NULL
S1692E,Dido,Brig,Archangel,04/14/1810,1810-04-14,128,"5764, 5765, 5766, 5767, 5768",NULL
S1693E,Dryade,Brig,Archangel,04/20/1810,1810-04-20,262,"5772, 5773",NULL
S1694E,Dryade,Brig,St. Salvador and a market,11/08/1810,1810-11-08,262,"5774, 5775, 5776, 5777, 5778",NULL
S1695E,Driver,Schooner,Havana,12/25/1810,1810-12-25,102,"5779, 5780, 5781, 5782, 5783",NULL
S1696E,Edwin,Brig,Naples and the north of Europe.,01/04/1810,1810-01-04,162,"5784, 5785",NULL
S1697E,Edwin,Brig,Tangiers & a market,12/07/1810,1810-12-07,162,"5786, 5787",NULL
S1698E,Eliza & Mary,Brig,Sylt and a market,09/27/1810,1810-09-27,132,"5788, 5789, 5790, 5791, 5792",NULL
S1699E,Eliza & Mary,Brig,Tonningen [From Charleston],02/19/1810,1810-02-19,NULL,"5793, 5794",NULL
S1700E,Elizabeth,Schooner,Algiers and a Market,08/16/1810,1810-08-16,80 & 53/95,"5795, 5796, 5797, 5798, 5799",NULL
S1701E,Eros,Schooner,Gottenburg,04/20/1810,1810-04-20,126,"5800, 5801",NULL
S1702E,Eros,Schooner,West Indies,12/25/1810,1810-12-25,126,"5802, 5803, 5804, 5805, 5806",NULL
S1703E,Export,Schooner,West Indies,09/07/1810,1810-09-07,112,"5807, 5808, 5809, 5810",NULL
S1704E,Factor,Brig,Gottenburg & a Market,07/07/1810,1810-07-07,122 86/95,"5811, 5812",NULL
S1705E,Fame,Schooner,Mantanzas,01/10/1810,1810-01-10,95,"5813, 5814, 5815, 5816, 5817",NULL
S1706E,Fame,Schooner,Mantanzas,05/22/1810,1810-05-22,95,"5818, 5819, 5820, 5821",NULL
S1707E,Fame,Schooner,West Indies,08/15/1810,1810-08-15,78,"5822, 5823, 5824, 5825, 5826",NULL
S1708E,Fame,Schooner,Mantanzas,08/24/1810,1810-08-24,95,"5827, 5828, 5729, 5830, 5831",NULL
S1709E,Fishhawk,Schooner,Havana,05/03/1810,1810-05-03,101,"5832, 5833, 5834, 5835",NULL
S1710E,Fishhawk,Schooner,Havana,07/16/1810,1810-07-16,101,"5836, 5837, 5838, 5839, 5840",NULL
S1711E,Five Sisters,Schooner,Civita Vecchia,02/15/1810,1810-02-15,80,"5841, 5842",NULL
S1712E,Five Sisters,Schooner,Smirne [Smyrna],11/30/1810,1810-11-30,80,"5843, 5844, 5845, 5846, 5847",NULL
S1713E,Four Brothers,Schooner,Archangel,04/12/1810,1810-04-12,107,"5848, 5849",NULL
S1714E,Four Sisters,Schooner,Archangel,04/20/1810,1810-04-20,79 & 5/95,"5850, 5851",NULL
S1715E,Four Sisters,Schooner,Havana,01/01/1810,1810-01-01,79,"5852, 5853",NULL
S1716E,Franklin,Ship,Sumatra,11/21/1810,1810-11-21,296,"5854, 5855",NULL
S1717E,Francis,Ship,Calcutta,10/22/1810,1810-10-22,297,"5856, 5857",NULL
S1718E,Freedom,Ship,St. Petersburg,02/02/1810,1810-02-02,213,"5858, 5859",NULL
S1719E,Freedom,Ship,Palermo and Leghorn,08/01/1810,1810-08-01,213,"5860, 5861",NULL
S1720E,Friendship,Ship,NULL,03/01/1810,1810-03-01,342,"5862, 5863, 5864, 5865, 5866",NULL
S1721E,Friendship,Ship,Archangel,04/24/1810,1810-04-24,342,"5867, 5868",NULL
S1722E,Friendship,Schooner,Kiel,01/09/1810,1810-01-09,93,"5869, 5870, 5871, 5875, 5876",Handwritten note in German seems to indicate that 2-3 men either joined or deserted the ship at some point.
S1723E,Friendship,Schooner,Algiers and a Market,08/15/1810,1810-08-15,93,"5872, 5873, 5874",NULL
S1724E,Friendship,Schooner,Havana [From Kennebunk],08/30/1810,1810-08-30,67 10/19,"5877, 5878",NULL
S1725E,Friendship,Schooner,Lisbon,12/14/1810,1810-12-14,80,"5879, 5880",NULL
S1726E,Galatea,Ship,Gottenburg and a Market,07/05/1810,1810-07-05,310,"5881, 5882",NULL
S1727E,George Washington,Schooner,Cadiz and a Market,12/27/1810,1810-12-27,75,"5883, 5884, 5885, 5886, 5887",NULL
S1728E,George & Susan,Brig,Isle of St. Lucia,05/21/1810,1810-05-21,119,"5888, 5889, 5890, 5891",NULL
S1729E,George & Susan,Brig,West Indies,09/17/1810,1810-09-17,118,"5892, 5893",NULL
S1730E,Golden Age,Brig,Tunis and a Market,10/05/1810,1810-10-05,219,"5894, 5895",NULL
S1731E,Halcyon,Schooner,Havana,10/27/1810,1810-10-27,76,"5896, 5897",NULL
S1732E,Harmony,Schooner,West Indies,12/03/1810,1810-12-03,112,"5898, 5899, 5900, 5901, 5902",NULL
S1733E,Harriot,Brig,Algeciras[?] and others [From Cadiz],04/24/1810,1810-04-24,NULL,"5903, 5904",NULL
S1734E,Harriot,Brig,West Indies,07/06/1810,1810-07-06,117,"5905, 5906",NULL
S1735E,Harriot,Brig,Surinam,10/29/1810,1810-10-29,117,"5907, 5908, 5909, 5910, 5911",NULL
S1736E,Helen,Schooner,West Indies,07/21/1810,1810-07-21,74,"5912, 5913, 5914, 5915, 5916",NULL
S1737E,Herald,Ship,Sumatra,02/01/1810,1810-02-01,274,"5917, 5918, 5919",NULL
S1738E,Hind,Bark,Tonningen and a market,02/20/1810,1810-02-20,157,"5920, 5921",NULL
S1739E,Hiram,Schooner,Gottenburg & a Market,07/11/1810,1810-07-11,97,"5922, 5923, 5924, 5925, 5926, 5927",NULL
S1740E,Hope,Schooner,NULL,02/26/1810,1810-02-26,NULL,"5928, 5929, 5930",NULL
S1741E,Hope,Ship,Sumatra,02/06/1810,1810-02-06,283,"5931, 5932, 5933, 5934, 5935",NULL
S1742E,Hope,Brig,Buenos Ayres,09/11/1810,1810-09-11,185,"5936, 5937, 5938, 5939, 5940",NULL
S1743E,Hope,Schooner,West Indies,07/19/1810,1810-07-19,100,"5941, 5942, 5943",NULL
S1744E,Hope,Schooner,Cadiz and a Market,08/22/1810,1810-08-22,76,"5944, 5955, 5946",NULL
S1745E,Rover,Schooner,West Indies,11/20/1816,1816-11-20,NULL,"7006, 7007, 7008",NULL
S1746E,Sally,Ship,Isle of France,09/23/1816,1816-09-23,NULL,"7009, 7010, 7011",NULL
S1747E,Salus,Ship,Havana [From Newburyport],06/19/1816,1816-06-19,NULL,"7012, 7013, 7014",NULL
S1748E,Salus,Ship,Batavia,09/26/1816,1816-09-26,NULL,"7015, 7016, 7017",NULL
S1749E,Saucy Jack,Brig,West Indies,03/25/1816,1816-03-25,NULL,"7018, 7019, 7020",NULL
S1750E,Saucy Jack,Brig,South America,09/25/1816,1816-09-25,NULL,"7021, 7022, 7023, 7039, 7040, 7041","All members of the crew were discharged at Pernambuco, 7 Dec. 1816"
S1751E,Sophia,Ship,St. Petersburg,05/21/1816,1816-05-21,NULL,"7024, 7025, 7026, 7042, 7043, 7044",NULL
S1752E,Success,Schooner,West Indies,02/08/1816,1816-02-08,93,"7027, 7028",NULL
S1753E,Superb,Brig,Barcelona,10/26/1816,1816-10-26,144,"7029, 7030, 7045, 7046, 7047",NULL
S1754E,Trader,Brig,Gibraltar and a Market,04/29/1816,1816-04-29,NULL,"7031, 7032, 7033, 7051, 7052, 7506",NULL
S1755E,Triton,Brig,North of Europe,10/19/1816,1816-10-19,NULL,"7034, 7035, 7036, 7053, 7054, 7055",NULL
S1756E,Union,Ship,Europe,03/18/1816,1816-03-18,250,"7037, 7038, 7056, 7057, 7058",NULL
S1757E,Superior,Brig,"Martinique [From Wilmington, N. Carolina]",01/04/1816,1816-01-04,NULL,"7048, 7049, 7050",NULL
S1758E,Warrington,Ship,Brazil and a Market,12/10/1816,1816-12-10,NULL,"7059, 7060, 7061, 7062, 7063, 7064",NULL
S1759E,Washington,Brig,West Indies,11/02/1816,1816-11-02,NULL,"7065, 7066, 7067, 7070, 7071, 7072",NULL
S1760E,Washington,Bark,Bilboa,07/19/1816,1816-07-19,NULL,"7068, 7069",NULL
S1761E,William,Schooner,West Indies,12/19/1816,1816-12-19,NULL,"7073, 7074, 7075, 7076, 7077",NULL
S1762E,William & Charles,Brig,Europe,04/24/1816,1816-04-24,NULL,"7078, 7079",NULL
S1763E,William & Charles,Brig,Surinam,09/13/1816,1816-09-13,NULL,"7080, 7081, 7082, 7083, 7084, 7538",NULL
S1764E,Union,Schooner,West Indies,09/05/1816,1816-09-05,NULL,"7085, 7086, 7087, 7088, 7089",NULL
S1765E,Augusta,Brig,Surinam,12/27/1817,1817-12-27,127,"7090, 7091, 7092, 7093, 7094",NULL
S1766E,Bengal,Ship,East Indies/India,10/08/1817,1817-10-08,304,"7095, 7096, 7097, 7103, 7104",NULL
S1767E,Betsey,Brig,Matanzas,02/25/1817,1817-02-25,NULL,"7098, 7099, 7100, 7105, 7106, 7107, 7108",NULL
S1768E,Augustus,Ship,Havana,04/25/1817,1817-04-25,246,"7101, 7102",NULL
S1769E,Betsey,Brig,Matanzas,06/16/1817,1817-06-16,NULL,"7109, 7110, 7111, 7112, 7113",NULL
S1770E,Betsey,Brig,Matanzas,10/14/1817,1817-10-14,NULL,"7114, 7115, 7116, 7117, 7118",NULL
S1771E,Betsey,Brig,Cuba,11/08/1817,1817-11-08,NULL,"7119, 7120",NULL
S1772E,Betsey,Schooner,West Indies,??/??/1817,0000-00-00,68,"7121, 7122",NULL
S1773E,Britannia,Schooner,West Indies,12/24/1817,1817-12-24,NULL,"7123, 7124",NULL
S1774E,Canton,Brig,Northwest coast of America and Canton.,05/29/1817,1817-05-29,335,"7125, 7126",NULL
S1775E,Caravan,Brig,Havre de Grace,09/13/1817,1817-09-13,NULL,"7127, 7128",Vessel of Plymouth
S1776E,Ceres,Brig,India,10/18/1817,1817-10-18,NULL,"7129, 7130, 7131, 7132",NULL
S1777E,China,Ship,Canton,05/23/1817,1817-05-23,370,"7133, 7134, 7135, 7136",NULL
S1778E,Christie,Schooner,West Indies,12/23/1817,1817-12-23,NULL,"7137, 7138",NULL
S1779E,Cleopatra's Barge,Brig,West Indies and the Mediterranean,03/24/1817,1817-03-24,NULL,"7139, 7140",3 passengers (unnamed)
S1780E,Coromandel,Brig,East Indies,06/25/1817,1817-06-25,NULL,"7141, 7142, 7143, 7144, 7145",NULL
S1781E,Cynthia,Brig,Havana [From New Orleans?],04/16/1817,1817-04-16,NULL,"7146, 7147, 7148",Names of roughly nine crew members written very light; most illegible.
S1782E,Cynthia,Brig,Cayenne,11/04/1817,1817-11-04,NULL,"7149, 7150",NULL
S1783E,Adaline,Ship,Rio de Janeiro,05/02/1817,1817-05-02,NULL,"7152, 7153, 7154, 7155, 7156, 7157",Crew lists mostly illegible.
S1784E,Adriana,Brig,Antwerp,07/25/1817,1817-07-25,NULL,"7158, 7159",NULL
S1785E,Adventure,Schooner,West Indies,12/20/1817,1817-12-20,NULL,"7160, 7161, 7162, 7163, 7164",NULL
S1786E,Adventure,Schooner,West Indies,07/03/1817,1817-07-03,NULL,"7165, 7166, 7167",NULL
S1787E,Alba,Brig,Brazil,03/22/1817,1817-03-22,NULL,"7168, 7169, 7170, 7171",NULL
S1788E,Albatross,Brig,NULL,06/14/1817,1817-06-14,NULL,"7172, 7173",NULL
S1789E,Alexander,Brig,Havre de Grace,10/03/1817,1817-10-03,NULL,"7174, 7175",NULL
S1790E,Alexander,Schooner,West Indies,12/15/1817,1817-12-15,NULL,"7176, 7177",NULL
S1791E,Alice,Brig,West Indies,08/27/1817,1817-08-27,NULL,"7178, 7179, 7180",NULL
S1792E,Alonzo,Brig,South America,10/31/1817.,1817-10-31,NULL,"7181, 7182, 7183",NULL
S1793E,Ann,Brig,St. Domingo,12/03/1817,1817-12-03,NULL,"7184, 7185, 7186",NULL
S1794E,Ann,Schooner,Martinico and a market,10/11/1817,1817-10-11,NULL,"7187, 7188",NULL
S1795E,Argonaut,Ship,East Indies,11/05/1817,1817-11-05,NULL,"7189, 7190, 7191, 7192, 7193",NULL
S1796E,Argus,Brig,West Indies,04/15/1817,1817-04-15,NULL,"7194, 7195, 7196, 7197, 7198",NULL
S1797E,Cyrus,Schooner,Brazil,05/15/1817,1817-05-15,NULL,"7199, 7200",NULL
S1798E,Dawn,Brig,North of Europe,03/03/1817,1817-03-03,NULL,"7201, 7202, 7203",NULL
S1799E,Diomede,Ship,Isle of France,05/14/1817,1817-05-14,NULL,"7204, 7205, 7206, 7210, 7211",NULL
S1800E,Edward,Brig,South America,04/05/1817,1817-04-05,NULL,"7207, 7208, 7209",NULL
S1801E,Edward,Brig,India,10/18/1817,1817-10-18,NULL,"7212, 7213, 7214, 7215, 7216",NULL
S1802E,Eliza,Ship,NULL,10/20/1817,1817-10-20,NULL,"7217, 7218, 7219, 7220, 7221",NULL
S1803E,Eliza & Mary,Brig,Europe,04/12/1817,1817-04-12,NULL,"7222, 7223, 7224, 7225, 7226",NULL
S1804E,Eliza & Mary,Brig,Marseilles,12/24/1817,1817-12-24,NULL,"7227, 7228, 7229, 7230, 7231",NULL
S1805E,Elizabeth,Brig,India,11/19/1817,1817-11-19,NULL,"7232, 7233",NULL
S1806E,Endeavour,Ship,East Indies,11/20/1817,1817-11-20,NULL,"7234, 7235, 7236",Extremely light crew list; names listed here are the legible ones.
S1807E,Erin,Ship,East Indies,11/20/1817,1817-11-20,NULL,"7237, 7238, 7239, 7240, 7241",NULL
S1808E,Essex,Schooner,Cayenne,06/10/1817,1817-06-10,NULL,"7242, 7243",NULL
S1809E,Eunice,Brig,West Indies,02/24/1817,1817-02-24,NULL,"7244, 7245, 7246, 7247, 7248",NULL
S1810E,Eunice,Brig,India,08/27/1817,1817-08-27,NULL,"7249, 7250, 7251, 7252",NULL
S1811E,Exeter,Ship,East Indies,10/21/1817,1817-10-21,NULL,"7253, 7254, 7255, 7256",NULL
S1812E,Fame,Schooner,Matanzas,10/31/1817,1817-10-31,NULL,"7262, 7263",NULL
S1813E,Fame,Schooner,Matanzas,04/24/1817,1817-04-24,NULL,"7257, 7258, 7259, 7260, 7261",NULL
S1814E,Fanny,Schooner,NULL,04/15/1817,1817-04-15,NULL,"7264, 7265, 7266, 7267, 7268",NULL
S1815E,Fanny,Schooner,West Indies,11/24/1817,1817-11-24,NULL,"7269, 7270",NULL
S1816E,Francis,Ship,Leghorn and India,07/15/1817,1817-07-15,297,"7271, 7272, 7273, 7274",NULL
S1817E,Franklin,Brig,India,10/22/1817,1817-10-22,NULL,"7275, 7276, 7277, 7278, 7279, 7280",NULL
S1818E,Friendship,Ship,Batavia,06/30/1817,1817-06-30,NULL,"7281, 7282, 7283, 7284, 7285, 7286",NULL
S1819E,Gentoo,Ship,East Indies,06/28/1817,1817-06-28,NULL,"7287, 7288, 7289, 7290, 7291",Crew lists very difficult to read.
S1820E,George Beckworth,Schooner,Havana,03/07/1817,1817-03-07,NULL,"7292, 7293",Vessel of Boston
S1821E,George Little,Brig,Copenhagen and a market,03/26/1817,1817-03-26,NULL,"7294, 7295, 7296, 7297, 7298",NULL
S1822E,George,Ship,Leghorn,??/??/1817,0000-00-00,328,"7299, 7300",NULL
S1823E,Glide,Ship,Calcutta,03/31/1817,1817-03-31,NULL,"7303, 7304, 7305",NULL
S1824E,Happy Couple,Schooner,India,03/22/1817,1817-03-22,NULL,"7306, 7307, 7308, 7309, 7310",NULL
S1825E,Hazard,Schooner,St. Andrews,07/10/1817,1817-07-10,NULL,"7311, 7312",Vessel of Vinalhaven
S1826E,Hercules,Ship,East Indies,06/23/1817,1817-06-23,NULL,"7313, 7314, 7315, 7316",NULL
S1827E,Hope,Ship,India,10/20/1817,1817-10-20,NULL,"7317, 7318, 7319",NULL
S1828E,Hope,Brig,Havana,11/04/1817,1817-11-04,NULL,"7320, 7321",NULL
S1829E,Horus,Schooner,St. Andrews,10/02/1817,1817-10-02,NULL,"7322, 7323, 7324",NULL
S1830E,Hunter,Brig,"Bristol, England",08/20/1817,1817-08-20,NULL,"7325, 7326",Vessel of Kennebunk
S1831E,Hunter,Brig,Bristol,11/12/1817,1817-11-12,NULL,"7327, 7328",Vessel of Kennebunk
S1832E,Hunter,Schooner,Havana,12/22/1817,1817-12-22,NULL,"7329, 7330, 7331, 7332, 7333",NULL
S1833E,Indus,Ship,The Marquesas and Canton,11/04/1817,1817-11-04,NULL,"7334, 7335, 7336, 7337, 7338",NULL
S1834E,Janus,Ship,India,11/04/1817,1817-11-04,277,"7339, 7340, 7341, 7342",NULL
S1835E,Janus,Ship,Havana,1817[?],0000-00-00,277,"7343, 7344",NULL
S1836E,Juno,Sloop,Martinico,08/02/1817,1817-08-02,NULL,"7345, 7346",NULL
S1837E,Levant,Brig,Martinico,04/28/1817,1817-04-28,NULL,"7347, 7348, 7349, 7350, 7351",NULL
S1838E,Levant,Brig,Gibraltar,11/12/1817,1817-11-12,NULL,"7352, 7353, 7354, 7355, 7356",NULL
S1839E,Lion,Brig,West Indies,01/02/1817,1817-01-02,NULL,"7357, 7358",NULL
S1840E,Malabar,Ship,Europe and East Indies,07/03/1817,1817-07-03,NULL,"7359, 7360, 7361, 7362, 7363",NULL
S1841E,Mary,Brig,NULL,10/18/1817,1817-10-18,NULL,"7364, 7365",NULL
S1842E,Mary & Eliza,Brig,Alicante,05/22/1817,1817-05-22,NULL,"7366, 7367",NULL
S1843E,Mary & Eliza,Brig,India,08/05/1817,1817-08-05,NULL,"7368, 7369, 7370, 7371, 7372",NULL
S1844E,Mercator,Brig,Brazil,03/28/1817,1817-03-28,NULL,"7373, 7374, 7375, 7376, 7377",NULL
S1845E,Mercator,Brig,Brazil Coast,10/25/1817,1817-10-25,NULL,"7378, 7379, 7380, 7381",NULL
S1846E,Mercy,Schooner,Saint Andrews,11/17/1817,1817-11-17,NULL,"7382, 7383, 7384",NULL
S1847E,Messenger,Ship,Europe and India,08/26/1817,1817-08-26,NULL,"7385, 7386",NULL
S1848E,Midas,Ship,Leghorn and India,04/25/1817,1817-04-25,NULL,"7387, 7388, 7389",NULL
S1849E,Milo,Schooner,South America,06/25/1817,1817-06-25,NULL,"7390, 7391",NULL
S1850E,Nancy Ann,Brig,India,10/16/1817,1817-10-16,NULL,"7392, 7393, 7394, 7395",NULL
S1851E,Nautilus,Brig,Antwerp,07/25/1817,1817-07-25,NULL,"7396, 7397, 7398, 7399",NULL
S1852E,Neutrality,Schooner,West Indies,05/31/1817,1817-05-31,NULL,"7400, 7401, 7402, 7403",NULL
S1853E,Neutrality,Schooner,West Indies,12/19/1817,1817-12-19,NULL,"7404, 7405, 7406, 7407",NULL
S1854E,Neva,Brig,NULL,03/26/1817,1817-03-26,NULL,"7408, 7409, 7410, 7411",NULL
S1855E,New Hazard,Brig,Europe and India,03/14/1817,1817-03-14,NULL,"7412, 7413, 7414, 7415",NULL
S1856E,Niagara,Brig,Hamburg,03/13/1817,1817-03-13,NULL,"7416, 7417, 7418",NULL
S1857E,Olive Branch,Schooner,St. Iago de Cuba,10/24/1817,1817-10-24,NULL,"7419, 7420, 7421, 7422, 7423",NULL
S1858E,Packet,Sloop,Martinico,07/14/1817,1817-07-14,NULL,"7424, 7425",NULL
S1859E,Patriot,Bark,St. Petersburg,05/07/1817,1817-05-07,NULL,"7426, 7427, 7428, 7429",NULL
S1860E,Patriot,Bark,The Mediterranean,12/09/1817,1817-12-09,NULL,"7430, 7431, 7432, 7433",NULL
S1861E,President,Brig,West Indies,08/29/1817,1817-08-29,NULL,"7434, 7435, 7436, 7437, 7438",NULL
S1862E,Rapid,Brig,West Indies,11/29/1817,1817-11-29,NULL,"7439, 7440, 7441, 7442",NULL
S1863E,Rebecca,Brig,NULL,04/15/1817,1817-04-15,NULL,"7443, 7444",NULL
S1864E,Rebecca,Brig,Havana,12/03/1817,1817-12-03,NULL,"7445, 7446, 7447",NULL
S1865E,Reindeer,Schooner,Cayenne,09/23/1817,1817-09-23,NULL,"7448, 7449",NULL
S1866E,Restitution,Ship,East Indies,10/13/1817,1817-10-13,NULL,"7450, 7451, 7452, 7453",NULL
S1867E,Rogue,Schooner,Rio Grande,09/05/1817,1817-09-05,157,"7454, 7455, 7456, 7457, 7458",NULL
S1868E,Roscius,Brig,South America,04/08/1817,1817-04-08,NULL,"7459, 7460, 7461, 7462",NULL
S1869E,Rotund,Brig,Surinam,01/03/1818,1818-01-03,NULL,"7463, 7464",NULL
S1870E,Rotund,Brig,Surinam,05/06/1817,1817-05-06,NULL,"7465, 7466",NULL
S1871E,Rover,Schooner,West Indies,06/02/1817,1817-06-02,NULL,"7467, 7468, 7469, 7470, 7471",NULL
S1872E,Rover,Schooner,Martinico,12/06/1817,1817-12-06,NULL,"7472, 7473, 7474, 7475",NULL
S1873E,Sally,Schooner,West Indies,01/04/1817,1817-01-04,NULL,"7476, 7477, 7478, 7479",NULL
S1874E,Sally,Brig,"West Indies [From Wilmington, NC]",04/26/1817,1817-04-26,NULL,"7480, 7481",Vessel of Wilmington
S1875E,Sophia,Ship,East Indies,04/28/1817,1817-04-28,NULL,"7482, 7483",NULL
S1876E,Superior,Schooner,"West Indies [From Wilmington, NC]",03/15/1817,1817-03-15,NULL,"7484, 7485",NULL
S1877E,Superior,Schooner,Martinico,07/07/1817,1817-07-07,NULL,"7486, 7487",NULL
S1878E,Superior,Schooner,West Indies,12/23/1817,1817-12-23,NULL,"7488, 7489, 7490, 7491",NULL
S1879E,Superb,Brig,Marseilles,06/06/1817,1817-06-06,144,"7492, 7493, 7498, 7499",NULL
S1880E,Superb,Brig,West Indies,11/28/1817,1817-11-28,144,"7494, 7495",NULL
S1881E,Tiger,Schooner,Angostura,03/12/1817,1817-03-12,167,"7496, 7497, 7500, 7501",NULL
S1882E,Trader,Brig,Marseilles,09/08/1817,1817-09-08,NULL,"7502, 7503, 7504, 7505",NULL
S1883E,Triton,Brig,North of Europe,07/31/1817,1817-07-31,NULL,"7507, 7508",NULL
S1884E,Two Brothers,Ship,India,01/27/1817,1817-01-27,NULL,"7509, 7510, 7511, 7512",NULL
S1885E,Union,Schooner,West Indies,07/17/1817,1817-07-17,NULL,"7513, 7514, 7515, 7520, 7521",NULL
S1886E,Union,Schooner,Cayenne,12/09/1817,1817-12-09,NULL,"7516, 7517, 7518, 7519",NULL
S1887E,Wallace,Ship,India,11/06/1817,1817-11-06,NULL,"7522, 7523, 7524, 7525",NULL
S1888E,Warrington,Ship,Brazil,11/18/1817,1817-11-18,NULL,"7526, 7527, 7528, 7529",NULL
S1889E,Washington,Brig,Matanzas,05/03/1817,1817-05-03,NULL,"7530, 7531, 7532, 7533",NULL
S1890E,Washington,Brig,West Indies,12/03/1817,1817-12-03,NULL,"7534, 7535",NULL
S1891E,William,Schooner,Hamburg,04/05/1817,1817-04-05,NULL,"7536, 7537, 7539, 7540",Vessel of Marblehead
S1892E,William & Charles,Brig,West Indies,04/19/1817,1817-04-19,NULL,"7541, 7542, 7543, 7544",NULL
S1893E,Adaline,Ship,Europe,03/24/1818,1818-03-24,NULL,"7546, 7547, 7548, 7549, 7550",NULL
S1894E,Adaline,Ship,India,11/02/1818,1818-11-02,NULL,"7551, 7552",NULL
S1895E,Adventure,Schooner,West Indies,05/15/1818,1818-05-15,NULL,"7553, 7554, 7555, 7556, 7557, 7558",NULL
S1896E,Adventure,Schooner,West Indies,09/11/1818,1818-09-11,NULL,"7559, 7560",NULL
S1897E,Alba,Brig,South America,01/03/1818,1818-01-03,NULL,"7561, 7562, 7563, 7585, 7586, 7587",NULL
S1898E,Alba,Brig,Brazil,10/10/1818,1818-10-10,NULL,"7564, 7565, 7588, 7589, 7590",NULL
S1899E,Alert,Schooner,"St. Johns [From District of Passamaquody, MA]",09/14/1818,1818-09-14,NULL,"7566, 7567, 7568, 7569",Vessel of Boothbay
S1900E,Alexander,Schooner,West Indies,06/10/1818,1818-06-10,NULL,"7570, 7571",NULL
S1901E,Alonzo,Brig,Isle of France,09/30/1818,1818-09-30,NULL,"7572, 7573, 7594, 7595, 7596",NULL
S1902E,Anson,Brig,Brazil,12/05/1818,1818-12-05,NULL,"7574, 7575, 7597, 7598, 7599",NULL
S1903E,Argonaut,Ship,East Indies,11/04/1818,1818-11-04,NULL,"7576, 7577",NULL
S1904E,Augusta,Brig,Surinam,07/03/1818,1818-07-03,127,"7578, 7579, 7609, 7610, 7611",NULL
S1905E,Augustus,Ship,Havana,05/04/1818,1818-05-04,246,"7580, 7581, 7582, 7583, 7584",NULL
S1906E,Andrew Jackson,Ship,Liverpool,05/02/1818,1818-05-02,NULL,"7591, 7592, 7593",NULL
S1907E,Anson,Brig,Brazil,01/16/1818,1818-01-16,NULL,"7600, 7601, 7602, 7603, 7604, 7605",NULL
S1908E,Argus,Brig,West Indies,12/16/1818,1818-12-16,NULL,"7606, 7607",Vessel of Portsmouth
S1909E,Argus,Brig,South America,05/16/1818,1818-05-16,NULL,"7612, 7613, 7614",NULL
S1910E,Argo,Schooner,Halifax,12/15/1818,1818-12-15,NULL,"7615, 7616, 7617",NULL
S1911E,Becket,Brig,Marseilles,12/14/1818,1818-12-14,NULL,"7618, 7619, 7620, 7621",NULL
S1912E,Bengal,Ship,India,12/01/1818,1818-12-01,NULL,"7622, 7623, 7624, 7627, 7628",Crew list for the next voyage of Bengal to India (2/7/1820) from Antwerp appended to list on image 7623
S1913E,Bengal,Ship,India [From Antwerp],02/07/1820,1820-02-07,NULL,7623,Crew list for this voyage was part of the paperwork for the previous voyage (11/30/1818). Thomas Moriarty commanded both voyages; many of the sailors from the first voyage joined this one.
S1914E,Betsey,Brig,Matanzas,04/15/1818,1818-04-15,NULL,"7625, 7626, 7629, 7630",NULL
S1916E,Betsey,Brig,Island of Cuba,05/05/1818,1818-05-05,NULL,"7631, 7632",NULL
S1917E,Betsey,Brig,Matanzas,10/07/1818,1818-10-07,NULL,"7633, 7634, 7635, 7636, 7637",NULL
S1918E,Betsey,Brig,Bourdeaux,12/19/1818,1818-12-19,NULL,"7638, 7639",NULL
S1919E,Blakely,Brig,West Indies,03/20/1818,1818-03-20,NULL,"7640, 7641, 7642, 7643, 7644",NULL
S1920E,Britannia,Brig,South Seas,12/05/1818,1818-12-05,NULL,"7645, 7646, 7647, 7648, 7649",NULL
S1921E,Buffalo,Schooner,St. John [From Portland],08/19/1818,1818-08-19,NULL,"7650, 7651, 7652",NULL
S1922E,Cambrian,Brig,Havana,11/05/1818,1818-11-05,NULL,"7653, 7654, 7655, 7656, 7657",NULL
S1923E,Catharine,Ship,India,10/09/1818,1818-10-09,NULL,"7658, 7659, 7660",NULL
S1924E,Caroline,Ship,Batavia,01/26/1818,1818-01-26,NULL,"7661, 7662",NULL
S1925E,China,Ship,Europe and India,04/28/1818,1818-04-28,NULL,"7663, 7664, 7665, 7666",NULL
S1926E,Cleopatra's Barge,Brig,South America,09/28/1818,1818-09-28,NULL,"7667, 7668",NULL
S1927E,Fame,Schooner,Matanzas,03/24/1818,1818-03-24,NULL,"7669, 7670",NULL
S1928E,Fame,Schooner,West Indies,06/04/1818,1818-06-04,NULL,"7671, 7672, 7673, 7674, 7675",NULL
S1929E,Fame,Schooner,Matanzas,06/08/1818,1818-06-08,NULL,"7676, 7677",NULL
S1930E,Fame,Schooner,Matanzas,10/29/1818,1818-10-29,NULL,"7678, 7679",NULL
S1931E,Fanny,Schooner,West Indies,05/09/1818,1818-05-09,NULL,"7680, 7681, 7682, 7683",NULL
S1932E,Fanny,Schooner,West Indies,08/04/1818,1818-08-04,NULL,"7684, 7685, 7686, 7687",NULL
S1933E,Favorite,Schooner,West Indies/Cuba,02/28/1818,1818-02-28,NULL,"7688, 7689, 7690, 7691",NULL
S1934E,Favorite,Schooner,West Indies,07/16/1818,1818-07-16,NULL,"7692, 7693, 7694, 7695, 7696",NULL
S1935E,Favorite,Schooner,Cape Henry,11/21/1818,1818-11-21,NULL,"7697, 7698, 7699, 7700",NULL
S1936E,Cynthia,Brig,Surinam,12/05/1818,1818-12-05,128,"7701, 7702, 7703, 7704",NULL
S1937E,Cynthia,Brig,Cayenne and a market,09/02/1818,1818-09-02,128,"7705, 7706",NULL
S1938E,Cyrus,Schooner,Brazil,12/12/1818,1818-12-12,NULL,"7707, 7708, 7711, 7712",NULL
S1939E,Cyrus,Schooner,NULL,04/28/1818,1818-04-28,NULL,"7709, 7710",NULL
S1940E,Dawn,Brig,Havana,03/20/1818,1818-03-20,NULL,"7713, 7714, 7715, 7716, 7717",NULL
S1941E,Dawn,Brig,Marseilles,12/30/1818,1818-12-30,NULL,"7718, 7719, 7720",NULL
S1942E,Delphos,Ship,East Indies,07/01/1818,1818-07-01,NULL,"7721, 7722",NULL
S1943E,Dido,Brig,Havre,12/08/1818,1818-12-08,NULL,"7723, 7724",NULL
S1944E,Diomede,Ship,Brazil,05/09/1818,1818-05-09,NULL,"7725, 7726, 7727, 7728, 7729, 7730",NULL
S1945E,Diomede,Ship,South America,11/30/1818,1818-11-30,NULL,"7731, 7732",NULL
S1946E,Dove,Schooner,West Indies,01/12/1818,1818-01-12,NULL,"7733, 7734, 7735, 7736, 7737",NULL
S1947E,Eliza,Brig,Isle of France,04/21/1818,1818-04-21,NULL,"7738, 7739, 7740, 7741, 7742, 7743",NULL
S1948E,Eliza,Brig,South America,10/12/1818,1818-10-12,NULL,"7744, 7745",NULL
S1949E,Eliza & Mary,Brig,East Indies,10/14/1818,1818-10-14,NULL,"7746, 7747",NULL
S1950E,Ellen Douglas,Brig,NULL,06/30/1818,1818-06-30,NULL,"7748, 7749",NULL
S1951E,Endeavour,Ship,Europe and India,12/17/1818,1818-12-17,NULL,"7750, 7751, 7752, 7753, 7754",NULL
S1952E,Erin,Ship,India,11/30/1818,1818-11-30,NULL,"7755, 7756, 7757, 7758, 7759, 7760",NULL
S1953E,Essex,Brig,Holland,06/06/1818,1818-06-06,NULL,"7761, 7762",NULL
S1954E,Essex,Schooner,Africa,05/29/1818,1818-05-29,NULL,"7763, 7764",NULL
S1955E,Eunice,Brig,Marseilles/Gibraltar,12/11/1818,1818-12-11,NULL,"7765, 7766, 7769, 7770, 7771",NULL
S1956E,Exeter,Ship,Havre de Grace,09/24/1818,1818-09-24,NULL,"7767, 7768",NULL
S1957E,Halcyon,Schooner,Marseilles,12/11/1818,1818-12-11,NULL,"7772, 7773, 7774, 7775, 7776",NULL
S1958E,Happy Couple,Brig,East Indies,05/12/1818,1818-05-12,NULL,"7777, 7778",NULL
S1959E,Helen,Brig,West Indies,09/03/1818,1818-09-03,NULL,"7779, 7780",NULL
S1960E,Herald,Ship,India,12/17/1818,1818-12-17,NULL,"7781, 7782, 7783, 7784, 7785",NULL
S1961E,Hero,Schooner,St. Andrew's,07/24/1818,1818-07-24,NULL,"7786, 7787, 7788, 7789, 7790",NULL
S1962E,Hero,Schooner,St. Andrew's,06/12/1818,1818-06-12,NULL,"7791, 7792, 7793, 7794",NULL
S1963E,Hero,Schooner,St. John's,08/24/1818,1818-08-24,NULL,"7795, 7796",NULL
S1964E,Hesper,Brig,Havre de Grace,09/23/1818,1818-09-23,NULL,"7797, 7798",NULL
S1965E,Hope,Ship,India,11/16/1818,1818-11-16,NULL,"7799, 7800, 7801, 7802, 7803",NULL
S1966E,Hope,Brig,Matanzas,04/01/1818,1818-04-01,NULL,"7804, 7805, 7806",NULL
S1967E,Hope,Brig,South America,07/09/1818,1818-07-09,NULL,"7807, 7808",NULL
S1968E,Hope,Brig,South America,12/19/1818,1818-12-19,NULL,"7809, 7810, 7811, 7812, 7813",NULL
S1969E,Horace,Brig,Antwerp,12/02/1818,1818-12-02,NULL,"7814, 7815",NULL
S1970E,Hunter,Schooner,St. Andrew's,08/07/1818,1818-08-07,NULL,"7816, 7817, 7818, 7819, 7820",NULL
S1971E,Juliann,Schooner,St. Andrew's,06/27/1818,1818-06-27,NULL,"7821, 7822",Vessel of Mount Desert
S1972E,Juno,Brig,West Indies,06/12/1818,1818-06-12,NULL,"7823, 7824, 7825",NULL
S1973E,Levant,Brig,Isle of France,07/17/1818,1818-07-17,NULL,"7826, 7827, 7828, 7829, 7830","The following names are listed separately, with dates under ""Time of Entry."" Their role in the voyage is not clear:
Thomas Lowell, 12/29/??
Wm. McCormack
Joseph Gomes, 12/30/??
Edward Glover, 02/03/1819."
S1974E,Lion,Brig,West Indies,07/01/1818,1818-07-01,NULL,"7831, 7832, 7833, 7834, 7835",NULL
S1975E,Malabar,Ship,Gibraltar and India,09/05/1818,1818-09-05,NULL,"7836, 7837, 7840, 7841, 7842",NULL
S1976E,Lion,Brig,West Indies,11/30/1818,1818-11-30,NULL,"7838, 7839",NULL
S1977E,Malay,Brig,East Indies,08/24/1818,1818-08-24,NULL,"7843, 7844",NULL
S1978E,Mary,Brig,Havana,11/30/1818,1818-11-30,NULL,"7845, 7846",NULL
S1979E,Mary Ann,Ship,India,05/01/1818,1818-05-01,NULL,"7847, 7848",NULL
S1980E,Mary & Eliza,Brig,India,10/13/1818,1818-10-13,NULL,"7849, 7850, 7851, 7852, 7853",NULL
S1981E,Malay,Brig,East Indies,08/24/1818,1818-08-24,NULL,"7854, 7855, 7856",NULL
S1982E,Mercator,Brig,South America/Brazil,11/30/1818,1818-11-30,NULL,"7857, 7858, 7859, 7860, 7861",NULL
S1983E,Mercator,Brig,Brazil,05/21/1818,1818-05-21,NULL,"7862, 7863, 7864, 7865, 7866",NULL
S1984E,Mexico,Brig,Antwerp,10/07/1818,1818-10-07,NULL,"7867, 7868",NULL
S1985E,Milo,Schooner,Surinam,01/17/1818,1818-01-17,NULL,"7869, 7870",NULL
S1986E,Midas,Ship,Canton,09/10/1818,1818-09-10,355,"7871, 7872, 7873",NULL
S1987E,Francis,Ship,Leghorn,09/12/1818,1818-09-12,NULL,"7874, 7875, 7876, 7877, 7878",NULL
S1988E,General Knox,Ship,South Seas,08/17/1818,1818-08-17,NULL,"7881, 7882, 7883, 7884, 7885, 7886",NULL
S1989E,General Stark,Brig,East Indies,12/07/1818,1818-12-07,NULL,"7887, 7888",NULL
S1990E,George Washington,Brig,West Indies,04/17/1818,1818-04-17,NULL,"7889, 7890, 7891, 7892, 7893, 7894",NULL
S1991E,George Washington,Brig,West Indies,09/29/1818,1818-09-29,NULL,"7895, 7896",NULL
S1992E,Gleaner,Brig,East Indies,10/30/1818,1818-10-30,NULL,"7897, 7898, 7899",NULL
S1993E,Glide,Ship,India,04/14/1818,1818-04-14,306,"7900, 7901",NULL
S1994E,Governor Brooks,Schooner,South Seas,07/14/1818,1818-07-14,NULL,"7902, 7903, 7904, 7905, 7906",NULL
S1995E,Abby,Brig,Surinam,01/21/1820,1820-01-21,135 & 59/95,"9006, 9007, 9008, 9009",NULL
S1996E,Abby,Brig,"Gibraltar, Madeira, and South America",06/19/1820,1820-06-19,NULL,"9010, 9011, 9012, 9013",NULL
S1997E,Acorn,Brig,East Indies,12/12/1820,1820-12-12,NULL,"9014, 9015, 9016, 9017",NULL
S1998E,Adaline,Ship,Europe,04/04/1820,1820-04-04,NULL,"9018, 9019",NULL
S1999E,Agawam,Schooner,Bermuda and a market,05/16/1820,1820-05-16,NULL,"9020, 9021",NULL
S2000E,Agawam,Schooner,St. Andrew's,10/19/1820,1820-10-19,NULL,"9022, 9023",NULL
S2001E,Alexander,Schooner,West Indies,09/30/1820,1820-09-30,NULL,"9024, 9025, 9026, 9027",NULL
S2002E,Alonzo,Brig,North coast of Brazil,04/26/1820,1820-04-26,NULL,"9028, 9029, 9030, 9031",NULL
S2003E,Alonzo,Brig,South America,11/17/1820,1820-11-17,NULL,"9032, 9033, 9034, 9035, 9036",NULL
S2004E,Ann,Schooner,West Indies,12/22/1820,1820-12-22,NULL,"9037, 9038, 9039, 9040",NULL
S2005E,Anson,Brig,Brazil and a market,04/13/1820,1820-04-13,NULL,"9041, 9042, 9043, 9044, 9045",NULL
S2006E,Anson,Brig,Brazil,12/02/1820,1820-12-02,NULL,"9046, 9047, 9048, 9049, 9050",NULL
S2007E,Aristides,Ship,Falmouth and a Market,09/30/1820,1820-09-30,NULL,"9051, 9052",NULL
S2008E,Argo,Schooner,Matanzas,11/28/1820,1820-11-28,NULL,"9053, 9054",NULL
S2009E,Argo,Schooner,St. Michael's and a market,07/30/1820,1820-07-30,NULL,"9055, 9056, 9057",NULL
S2010E,Augusta,Brig,Leghorn,06/07/1820,1820-06-07,127,"9058, 9059, 9060, 9061",NULL
S2011E,Augusta,Brig,St. Thomas and a market,12/20/1820,1820-12-20,NULL,"9062, 9063, 9064, 9065, 9066",NULL
S2012E,Augustus,Ship,St. Petersburgh,05/24/1820,1820-05-24,246,"9067, 9068",NULL
S2013E,Augustus,Ship,Hamburg,??/??/1820,0000-00-00,246,"9069, 9070",NULL
S2014E,Aurora,Ship,Antwerp,07/28/1820,1820-07-28,NULL,"9071, 9072, 9073, 9074",NULL
S2015E,Aurora,Brig,Smyrna,04/24/1820,1820-04-24,NULL,"9075, 9076",NULL
S2016E,Banian,Brig,Flushing,01/29/1820,1820-01-29,NULL,"9077, 9078",NULL
S2017E,Cambrian,Brig,Leghorn,07/24/1820,1820-07-24,NULL,"9079, 9080, 9081, 9084, 9085",NULL
S2018E,Betsey,Brig,Matanzas,08/23/1820,1820-08-23,NULL,"9082, 9083",NULL
S2019E,Caroline,Ship,India,01/01/1820,1820-01-01,NULL,"9086, 9087, 9088, 9089",NULL
S2020E,Catherine,Ship,Liverpool [From New Orleans],03/22/1820,1820-03-22,NULL,"9090, 9091, 9092, 9093",NULL
S2021E,China,Ship,Antwerp,06/09/1820,1820-06-09,NULL,"9094, 9095, 9096, 9097",NULL
S2022E,China,Ship,India,12/12/1820,1820-12-12,370,"9098, 9099, 9100, 9101",NULL
S2023E,Commerce,Ship,Liverpool,05/10/1820,1820-05-10,NULL,"9102, 9103",NULL
S2024E,Coromandel,Brig,Antwerp,12/30/1820,1820-12-30,NULL,"9104, 9105",Note says 1 man shipped 10/25/1821; 5 shipped 03/05/1822. No names or other details given.
S2025E,Cynthia,Brig,Surinam,10/19/1820,1820-10-19,NULL,"9106, 9107, 9110, 9111",NULL
S2026E,Cynthia,Brig,Cayenne,03/25/1820,1820-03-25,NULL,"9108, 9109, 9112, 9113",NULL
S2027E,Cyrus,Schooner,Brazil and a market,04/12/1820,1820-04-12,NULL,"9114, 9115, 9121, 9122",NULL
S2028E,Cyrus,Schooner,Para & Cayenne,11/01/1820,1820-11-01,NULL,"9116, 9117, 9118, 9119, 9120",NULL
S2029E,Dawn,Brig,Marseilles,02/11/1820,1820-02-11,NULL,"9123, 9124",NULL
S2030E,Dispatch Packet,Schooner,West Indies,09/04/1820,1820-09-04,NULL,"9125, 9126",NULL
S2031E,Dispatch Packet,Schooner,Bermuda,06/05/1820,1820-06-05,NULL,"9127, 9128",NULL
S2032E,Edward,Brig,"Copenhagen, St. Petersburg",04/28/1820,1820-04-28,NULL,"9129, 9130, 9131, 9132",NULL
S2033E,Edward,Brig,Brazil and a market,11/08/1820,1820-11-08,NULL,"9133, 9134, 9135, 9136, 9137",NULL
S2035E,Eliza,Brig,West Indies,01/26/1820,1820-01-26,NULL,"9141, 9142, 9143",NULL
S2036E,Eliza,Brig,Mediterranean,07/26/1820,1820-07-26,NULL,"9138, 9139, 9140, 9144, 9145",NULL
S2037E,Eliza,Schooner,West Indies,02/01/1820,1820-02-01,NULL,"9146, 9147, 9148",NULL
S2038E,Eliza,Schooner,West Indies,05/17/1820,1820-05-17,NULL,"9149, 9150, 9151, 9152",NULL
S2039E,Eliza,Schooner,West Indies,09/11/1820,1820-09-11,NULL,"9153, 9154, 9155, 9156, 9157",NULL
S2040E,Ellen Douglas,Brig,Java[?],06/09/1820,1820-06-09,NULL,"9158, 9159",NULL
S2041E,Enterprise,Schooner,Martinique and a market,12/23/1820,1820-12-23,NULL,"9160, 9161, 9162",NULL
S2042E,Essex,Brig,Europe and India,07/07/1820,1820-07-07,NULL,"9163, 9164, 9171, 9172",NULL
S2043E,Essex,Schooner,Cayenne,04/15/1820,1820-04-15,NULL,"9165, 9166",NULL
S2044E,Essex,Schooner,Cayenne,08/21/1820,1820-08-21,NULL,"9167, 9168, 9169, 9170","Captain's name is spelled ""Shatchwell"" here, but I believe it is same captain as previous record--William Shatswell."
S2046E,Eunice,Brig,Sumatra,11/03/1820,1820-11-03,NULL,"9173, 9174",NULL
S2047E,Fame,Schooner,Matanzas,05/03/1820,1820-05-03,NULL,"9175, 9176",NULL
S2048E,Fame,Schooner,[?],10/20/1820,1820-10-20,NULL,"9177, 9178",NULL
S2049E,Favorite,Schooner,West Indies,04/14/1820,1820-04-14,NULL,"9179, 9180",NULL
S2050E,Favorite,Schooner,Cape Haytien,11/30/1820,1820-11-30,NULL,"9181, 9182",NULL
S2051E,Five Brothers,Schooner,Mount Desert,04/06/1820,1820-04-06,NULL,"9183, 9184",NULL
S2052E,Francis,Ship,Leghorn,03/03/1820,1820-03-03,297,"9185, 9186, 9191, 9192",NULL
S2053E,Francis,Ship,India,10/17/1820,1820-10-17,297,"9187, 9188, 9189, 9190",NULL
S2054E,Franklin,Brig,India/Sumatra,11/20/1820,1820-11-20,NULL,"9193, 9194, 9195, 9196",NULL
S2055E,Friendship,Ship,Europe,03/14/1820,1820-03-14,NULL,"9197, 9198",NULL
S2056E,George,Ship,Calcutta,06/30/1820,1820-06-30,328,"9199, 9200, 9201, 9202",NULL
S2057E,Glide,Ship,Leghorn,04/21/1820,1820-04-21,306,"9203, 9204, 9205, 9206, 9207",NULL
S2058E,Greyhound,Ship,Marseilles,03/16/1820,1820-03-16,NULL,"9208, 9209, 9210, 9211, 9212, 9213",NULL
S2059E,Hercules,Ship,India,11/27/1820,1820-11-27,NULL,"9214, 9215, 9218, 9219",NULL
S2060E,Hercules,Ship,St. Petersburg,04/10/1820,1820-04-10,NULL,"9216, 9217",NULL
S2061E,Hope,Brig,Leghorn,06/06/1820,1820-06-06,NULL,"9220, 9221, 9222",NULL
S2062E,Hope,Brig,Brazil and a market,07/26/1820,1820-07-26,NULL,"9223, 9224, 9225, 9226, 9227",NULL
S2063E,Hope,Ship,Europe,03/06/1820,1820-03-06,NULL,"9228, 9229, 9230, 9231",NULL
S2064E,Hunter,Schooner,"St. John's, NB",10/30/1820,1820-10-30,NULL,"9232, 9233",NULL
S2066E,Indus,Brig,Calcutta,06/07/1820,1820-06-07,262,"9236, 9237",NULL
S2067E,Indus,Ship,Sumatra,12/08/1820,1820-12-08,NULL,"9234, 9235, 9238, 9239",NULL
S2068E,Jane,Brig,Antwerp,02/01/1820,1820-02-01,NULL,"9240, 9241, 9242, 9243, 9244, 9245","The word ""Passengers"" is written near the bottom of crew list. It is clear which of these names--if any--were passengers."
S2069E,Jane,Brig,East Indies,08/12/1820,1820-08-12,NULL,"9246, 9247, 9248, 9249",NULL
S2070E,Janus,Ship,Havana,03/25/1820,1820-03-25,NULL,"9250, 9251, 9252, 9253",NULL
S2071E,Janus,Ship,Havana[?],12/06/1820,1820-12-06,NULL,"9254, 9255",NULL
S2072E,Java,Brig,Batavia,12/15/1820,1820-12-15,NULL,"9256, 9257",NULL
S2073E,Jewell,Sloop,St. Andrew's,09/05/1820,1820-09-05,NULL,"9258, 9259",NULL
S2074E,Julia Ann,Schooner,West Indies,03/31/1820,1820-03-31,NULL,"9260, 9261, 9262, 9263, 9264",NULL
S2075E,Julia Ann,Schooner,West Indies,12/20/1820,1820-12-20,NULL,"9265, 9266, 9267, 9268, 9269",NULL
S2076E,Juno,Schooner,West Indies,08/15/1820,1820-08-15,NULL,"9270, 9271",NULL
S2077E,Laura,Brig,Rio de Janeiro and a market,08/25/1820,1820-08-25,NULL,"9272, 9273, 9274, 9275",NULL
S2078E,Laura,Brig,Gibraltar,06/10/1820,1820-06-10,NULL,"9276, 9277",NULL
S2079E,Levant,Brig,Bremen,05/10/1820,1820-05-10,233,"9278, 9279, 9280, 9281",NULL
S2080E,Lion,Brig,Brazil/Pernambuco and a market,11/08/1820,1820-11-08,NULL,"9282, 9283, 9284, 9285, 9286, 9287",NULL
S2081E,Malabar,Ship,East Indies,02/18/1820,1820-02-18,NULL,"9288, 9289, 9290, 9291, 9292",NULL
S2082E,Malay,Brig,Leghorn,06/21/1820,1820-06-21,NULL,"9293, 9294, 9295, 9296",NULL
S2083E,Mary,Schooner,West Indies,12/12/1820,1820-12-12,NULL,"9297, 9298",NULL
S2084E,Mary,Schooner,Martinico and a market,02/22/1820,1820-02-22,NULL,"9299, 9300",NULL
S2085E,Mary Ann,Ship,Antwerp,11/11/1820,1820-11-11,NULL,"9301, 9302",NULL
S2086E,Mary Jane,Schooner,West Indies,05/02/1820,1820-05-02,119,"9303, 9304, 9307, 9308, 9309",NULL
S2087E,Mary Jane,Schooner,West Indies,12/08/1820,1820-12-08,119 & 35/95,"9305, 9306",NULL
S2088E,Mary & Eliza,Brig,India,04/19/1820,1820-04-19,NULL,"9310, 9311",NULL
S2089E,Mechanic,Schooner,St. Petersburg,03/30/1820,1820-03-30,NULL,"9312, 9313",also spelled Mechanick
S2090E,Mercator,Brig,Brazil and a market,07/21/1820,1820-07-21,NULL,"9314, 9315, 9316, 9317","The name of a second man listed as discharged on january 27, 1821, is not clear. It appears to be ""John Auzton [Austin?],"" with ""Cooper"" possibly a last name."
S2091E,Messenger,Brig,Hamburg,07/26/1820,1820-07-26,NULL,"9318, 9319",NULL
S2092E,Madeira Packet,Schooner,Brazil and a market,09/08/1820,1820-09-08,NULL,"9320, 9321",NULL
S2093E,Messenger,Ship,Cowes and a market,04/05/1820,1820-04-05,NULL,"9322, 9323, 9324, 9325, 9326",NULL
S2094E,Nancy,Brig,Isle of May & Falkland Islands,08/11/1820,1820-08-11,NULL,"9327, 9328, 9329, 9330, 9331, 9332",NULL
S2095E,Nancy,Schooner,West Indies,08/24/1820,1820-08-24,NULL,"9333, 9334",NULL
S2096E,Nautilus,Brig,Antwerp,06/16/1820,1820-06-16,NULL,"9335, 9336, 9337, 9338, 9339",NULL
S2097E,Neutrality,Brig,Martinico,07/17/1820,1820-07-17,NULL,"9340, 9341",NULL
S2098E,Nereus,Brig,Holland,05/22/1820,1820-05-22,NULL,"9342, 9343",NULL
S2099E,Nereus,Brig,East Indies,09/30/1820,1820-09-30,NULL,"9344, 9345, 9346, 9347",Captain Neal left three months pay ($33) for said seaman in hands of Bernard Henry at US consulate in Gibraltar.
S2100E,Neva,Brig,Antwerp,05/10/1820,1820-05-10,NULL,"9348, 9349, 9350, 9351, 9354",NULL
S2101E,Neva,Brig,Brazil and a market,12/08/1820,1820-12-08,NULL,"9352, 9353, 9455, 9356, 9357, 9358",NULL
S2102E,Nine Sisters,Schooner,West Indies,08/22/1820,1820-08-22,NULL,"9359, 9360, 9361, 9362, 9363",NULL
S2103E,Nymph,Sloop,West Indies,11/22/1820,1820-11-22,NULL,"9364, 9365",NULL
S2104E,Olive Branch,Schooner,West Indies,03/20/1820,1820-03-20,NULL,"9366, 9367",NULL
S2105E,Olive Branch,Schooner,West Indies,08/26/1820,1820-08-26,NULL,"9368, 9369, 9370, 9371",NULL
S2106E,Ontario,Brig,NULL,05/20/1820,1820-05-20,NULL,"9372, 9373, 9374",Names/information very difficult to read.
S2107E,Ontario,Brig,Europe,03/29/1820,1820-03-29,NULL,"9375, 9376, 9377",NULL
S2108E,Palladium,Schooner,St. Michael's and a market,12/12/1820,1820-12-12,NULL,"9378, 9379",NULL
S2109E,Peacock,Schooner,Martinique,??/??/1820,0000-00-00,64,"9380, 9381",NULL
S2110E,Perseverance,Ship,Antwerp,05/23/1820,1820-05-23,NULL,"9382, 9383, 9384, 9385",NULL
S2111E,Polly,Sloop,West Indies,07/05/1820,1820-07-05,NULL,"9386, 9387",NULL
S2112E,President,Brig,West Indies,03/25/1820,1820-03-25,NULL,"9388, 9389",NULL
S2113E,Rajah,Brig,Mediterranean/India,09/05/1820,1820-09-05,NULL,"9390, 9391, 9392, 9393",NULL
S2114E,Rambler,Brig,Para,05/04/1820,1820-05-04,NULL,"9394, 9395",NULL
S2115E,Reaper,Brig,India,06/29/1820,1820-06-29,NULL,"9396, 9397, 9398, 9399",NULL
S2116E,Rebecca,Brig,NULL,03/08/1820,1820-03-08,NULL,"9400, 9401",NULL
S2117E,Regulus,Brig,[?],12/22/1820,1820-12-22,NULL,"9402, 9403",NULL
S2118E,Rising States,Schooner,St. John/N.B.,09/27/1820,1820-09-27,NULL,"9404, 9405",NULL
S2119E,Rising States,Schooner,St. Andrew,11/09/1820,1820-11-09,NULL,"9406, 9407",NULL
S2120E,Romp,Brig,St. Iago de Cuba and a market,05/13/1820,1820-05-13,NULL,"9408, 9409",Very difficult to read lists.
S2121E,Roscius,Brig,Brazil and a market,08/26/1820,1820-08-26,NULL,"9410, 9411, 9412, 9413",NULL
S2122E,Rotund,Brig,St. Iago de Cuba,06/12/1820,1820-06-12,146,"9414, 9415, 9416, 9417",NULL
S2123E,Sally,Schooner,St. Andrew's,05/01/1820,1820-05-01,NULL,"9418, 9419",NULL
S2124E,Sally,Schooner,Havana Via Salem,03/17/1820,1820-03-17,NULL,"9420, 9421",NULL
S2125E,Superior,Schooner,West Indies,05/17/1820,1820-05-17,NULL,"9422, 9423, 9424",NULL
S2126E,Superior,Schooner,Europe,09/23/1820,1820-09-23,NULL,"9425, 9426, 9427, 9428",NULL
S2127E,Texel,Brig,East Indies,11/25/1820,1820-11-25,NULL,"9429, 9430, 9431, 9432, 9433",NULL
S2128E,Thetis,Brig,India,12/27/1820,1820-12-27,NULL,"9434, 9435, 9436, 9437",NULL
S2129E,Trader,Brig,Brazil and a market,11/18/1820,1820-11-18,NULL,"9438, 9439, 9440, 9443, 9444",NULL
S2130E,Trader,Brig,Europe,04/14/1820,1820-04-14,NULL,"9441, 9442",NULL
S2131E,Triton,Brig,Havana,08/31/1820,1820-08-31,NULL,"9445, 9446, 9447, 9448",NULL
S2132E,Two Sisters,Schooner,St. Thomas and a market,12/26/1820,1820-12-26,NULL,"9449, 9450, 9451, 9452",NULL
S2133E,Union,Brig,Brazil and a market,04/08/1820,1820-04-08,NULL,"9453, 9454, 9455, 9456",NULL
S2134E,Union,Brig,Pernambuco and a market,11/30/1820,1820-11-30,128,"9457, 9458, 9459, 9460, 9461, 9462, 9463",NULL
S2135E,Virginia,Schooner,Cayenne,12/16/1820,1820-12-16,NULL,"9464, 9465, 9466, 9467",NULL
S2136E,Volant,Schooner,St. Andrew,07/20/1820,1820-07-20,NULL,"9468, 9469",NULL
S2137E,Washington,Brig,West Indies,06/09/1820,1820-06-09,NULL,"9470, 9471, 9472, 9473",NULL
S2138E,Washington,Brig,Matanzas,12/28/1820,1820-12-28,NULL,"9474, 9475, 9476, 9477",NULL
S2139E,Wild Goose,Brig,Antwerp,10/24/1820,1820-10-24,NULL,"9478, 9479, 9480, 9481",NULL
S2140E,William,Brig,Bremen,06/09/1820,1820-06-09,NULL,"9482, 9483, 9484",NULL
S2141E,William,Brig,St. Petersburg,06/24/1820,1820-06-24,NULL,"9485, 9486, 9487, 9488",NULL
S2142E,William,Schooner,St. Salvador and a market,06/10/1820,1820-06-10,NULL,"9489, 9490, 9491, 9492, 9493",NULL
S2143E,Abby,Brig,Brazil/South America,02/21/1821,1821-02-21,NULL,"9495, 9496, 9497","Writing very light; difficult to align names with details, etc."
S2144E,Abby,Brig,The Brazils,12/07/1821[?],1821-12-07,135 & 59/95,"9498, 9499",NULL
S2145E,Acasta,Ship,Calcutta,05/25/1821,1821-05-25,NULL,"9500, 9501, 9502, 9503, 9504, 9505",NULL
S2146E,Adaline,Ship,"Charleston, Europe and India",05/15/1821,1821-05-15,NULL,"9506, 9507",NULL
S2147E,Alexander,Schooner,Brazil and a market,04/02/1821,1821-04-02,NULL,"9508, 9509, 9512, 9513, 9514",NULL
S2148E,Alexander,Schooner,Brazil and a market,11/23/1821,1821-11-23,NULL,"9510, 9511, 9515, 9516",NULL
S2149E,Alonzo,Brig,South America,12/05/1821,1821-12-05,NULL,"9517, 9518, 9519, 9525, 9526",NULL
S2150E,Alonzo,Brig,Brazil and a market,05/24/1821,1821-05-24,NULL,"9520, 9521, 9522, 9523, 9524",NULL
S2151E,America,Brig,Malta,10/11/1821,1821-10-11,NULL,"9527, 9528, 9529, 9530",NULL
S2152E,America,Brig,Copenhagen,04/06/1821,1821-04-06,NULL,"9531, 9532, 9533, 9534, 9535, 9536",NULL
S2153E,Ann,Brig,India/East Indies,07/21/1821,1821-07-21,NULL,"9537, 9538, 9539, 9540",NULL
S2154E,Anson,Brig,West Indies and a market,06/23/1821,1821-06-23,NULL,"9541, 9542, 9543, 9544",NULL
S2155E,Argo,Schooner,"Matanzas [From Wilmington, NC]",02/16/1821,1821-02-16,NULL,"9545, 9546, 9547",NULL
S2156E,Argo,Schooner,West Indies via Bath,10/20/1821,1821-10-20,NULL,"9548, 9549",NULL
S2157E,Argo,Schooner,West Indies,05/28/1821,1821-05-28,NULL,"9550, 9551, 9552, 9553, 9554",NULL
S2158E,Argus,Brig,West Indies,??/??/1821,0000-00-00,126,"9555, 9556",NULL
S2159E,Atlas,Sloop,St. Andrew's,07/26/1821,1821-07-26,NULL,"9557, 9558",NULL
S2160E,Augustus,Ship,The South of Europe,01/03/1821,1821-01-03,NULL,"9559, 9560, 9561",NULL
S2161E,Augusta,Brig,West Indies,10/23/1821,1821-10-23,NULL,"9562, 9563",NULL
S2162E,Aurora,Ship,East Indies,09/19/1821,1821-09-19,NULL,"9564, 9565, 9566, 9567, 9568",NULL
S2163E,Bengal,Ship,India,03/02/1821,1821-03-02,NULL,"9569, 9570, 9571, 9572, 9573",It is unclear whether Ropes or Gale was First Officer.
S2164E,Betsey,Schooner,West Indies,10/24/1821,1821-10-24,NULL,"9574, 9575, 9576, 9589, 9590",NULL
S2165E,Betsy,Brig,West Indies/St. Bartholomew's,12/22/1821,1821-12-22,NULL,"9577, 9578, 9587, 9588",NULL
S2166E,Betsey,Brig,West Indies,01/12/1821,1821-01-12,NULL,"9579, 9580, 9581, 9582",NULL
S2167E,Betsey,Brig,West Indies,07/26/1821,1821-07-26,NULL,"9583, 9584, 9591, 9592, 9593",NULL
S2168E,Betsey,Brig,Brazil,04/27/1821,1821-04-27,NULL,"9585, 9586, 9594, 9595, 9596, 9597",NULL
S2169E,Bird,Schooner,Brazil and a market,11/02/1821,1821-11-02,NULL,"9598, 9599, 9600, 9601",NULL
S2170E,Cambrian,Brig,Havana,03/07/1821,1821-03-07,196,"9602, 9603, 9604, 9605",NULL
S2171E,Caroline,Ship,East Indies,11/14/1821,1821-11-14,NULL,"9606, 9607, 9608, 9609, 9610","According to notes, one man on voyage was ""drounded"" and another discharged, with two others shipped in their place. No names are given."
S2172E,Catharine,Ship,Europe,03/05/1821,1821-03-05,NULL,"9611, 9612, 9613, 9614, 9615",NULL
S2173E,Catharine,Schooner,West Indies,08/16/1821,1821-08-16,NULL,"9616, 9617",NULL
S2174E,Ceres,Brig,Brazil and a market,05/08/1821,1821-05-08,NULL,"9618, 9619",NULL
S2175E,Chase,Brig,South America/Brazil and a market via Baltimore,06/02/1821,1821-06-02,NULL,"9620, 9621, 9622, 9623, 9624, 9625",NULL
S2176E,Climax,Brig,East Indies,02/23/1821,1821-02-23,NULL,"9626, 9627",NULL
S2177E,Commerce,Ship,Liverpool,07/10/1821,1821-07-10,NULL,"9628, 9629, 9630",NULL
S2178E,Cynthia,Brig,Cayenne,08/29/1821,1821-08-29,NULL,"9631, 9632, 9633, 9638, 9639",NULL
S2179E,Cynthia,Brig,Cayenne,04/04/1821,1821-04-04,128,"9634, 9635, 9636, 9637",NULL
S2180E,Cyrus,Schooner,Maranham and Para [Brazil],08/16/1821,1821-08-16,NULL,"9640, 9641",NULL
S2181E,Dawn,Brig,Leghorn,01/01/1821,1821-01-01,163,"9642, 9643, 9646, 9647",NULL
S2182E,Dawn,Brig,Europe,07/16/1821,1821-07-16,163,"9644, 9645, 9648, 9649",NULL
S2183E,Edward,Brig,Brazil and a market and India,07/10/1821,1821-07-10,NULL,"9650, 9651, 9654, 9655, 9656",NULL
S2184E,Edward,Sloop,The Western Islands,06/05/1821,1821-06-05,NULL,"9652, 9653, 9657, 9658, 9659",NULL
S2185E,Eliza,Schooner,Martinico,02/27/1821,1821-02-27,NULL,"9660, 9661, 9662, 9668, 9669",NULL
S2186E,Eliza,Ship,India,04/04/1821,1821-04-04,NULL,"9663, 9664, 9665, 9666, 9667",NULL
S2187E,Eliza,Schooner,St. Domingo,10/02/1821,1821-10-02,NULL,"9670, 9671",NULL
S2188E,Eliza & Mary,Brig,South America,01/03/1821,1821-01-03,NULL,"9672, 9673",NULL
S2189E,Eliza,Schooner,Jevenie[?],06/02/1821,1821-06-02,NULL,"9674, 9675, 9676",NULL
S2190E,Elizabeth,Brig,Europe,02/28/1821,1821-02-28,NULL,"9677, 9678",NULL
S2191E,Elizabeth,Brig,East Indies,09/22/1821,1821-09-22,NULL,"9679, 9680",NULL
S2192E,Endeavour,Ship,India,04/10/1821,1821-04-10,NULL,"9681, 9682, 9683, 9684, 9685",NULL
S2193E,Essex,Schooner,Curracoa [Curacao?] and a market,11/03/1821,1821-11-03,NULL,"9686, 9687, 9690, 9691, 9692",NULL
S2194E,Essex,Brig,Salem (From Leghorn),11/05/1821,1821-11-05,NULL,"9688, 9689",No crew information supplied.
S2195E,Essex,Schooner,Cayenne and Europe,07/27/1821,1821-07-27,NULL,"9693, 9694",NULL
S2196E,Fame,Schooner,West Indies,04/07/1821,1821-04-07,NULL,"9695, 9696, 9697, 9710, 9711",NULL
S2197E,Fame,Schooner,Brazil and a market,04/07/1821,1821-04-07,NULL,"9698, 9699, 9700, 9708, 9709",NULL
S2198E,Fame,Schooner,South America,10/05/1821,1821-10-05,NULL,"9701, 9702, 9703, 9704, 9705",NULL
S2199E,Fame,Schooner,West Indies,10/08/1821,1821-10-08,NULL,"9706, 9707",NULL
S2200E,Fanny,Schooner,Saint Bartholomew's,05/10/1821,1821-05-10,NULL,"9712, 9713",NULL
S2201E,Fanny,Schooner,Martinico,10/23/1821,1821-10-23,NULL,"9714, 9715, 9716, 9717, 9718",NULL
S2202E,Favorite,Schooner,West Indies,12/05/1821,1821-12-05,NULL,"9719, 9720, 9721",NULL
S2203E,Favorite,Schooner,West Indies,08/17/1821,1821-08-17,NULL,"9722, 9723",NULL
S2204E,Fawn,Brig,Isle of Bourbon and a market,12/21/1821,1821-12-21,NULL,"9724, 9725",NULL
S2205E,General Brooks,Schooner,Havana,04/20/1821,1821-04-20,NULL,"9726, 9727",NULL
S2206E,General Jackson,Schooner,Teneriffe,06/21/1821,1821-06-21,NULL,"9728, 9729",NULL
S2207E,General Stark,Brig,Sumatra,11/07/1821,1821-11-07,NULL,"9730, 9731, 9732, 9733, 9734",NULL
S2208E,George,Ship,Calcutta,05/26/1821,1821-05-26,328,"9735, 9736, 9737, 9738",NULL
S2209E,Greyhound,Schooner,??,??/??/1821,0000-00-00,NULL,9739,"Returned Sept.10, 1821"
S2210E,Greyhound,Schooner,Martinico and a market,12/22/1821,1821-12-22,NULL,"9740, 9741, 9742, 9743",NULL
S2211E,Halcyon,Schooner,Antwerp,02/20/1821,1821-02-20,NULL,"9744, 9745",NULL
S2212E,Hazard,Ship,St. Andrew's,09/06/1821,1821-09-06,NULL,"9746, 9747",NULL
S2213E,Hope,Brig,Brazil and a market,05/19/1821,1821-05-19,NULL,"9748, 9749, 9750, 9754, 9755",NULL
S2214E,Hope,Brig,Europe,11/19/1821,1821-11-19,NULL,"9751, 9752, 9753, 9756, 9757",NULL
S2215E,Independence,Brig,Copenhagen and St. Petersburg [From Boston],03/01/1821,1821-03-01,NULL,"9758, 9759",NULL
S2216E,Indus,Brig,East Indies,06/08/1821,1821-06-08,263,"9760, 9761, 9762, 9763, 9764",NULL
S2217E,Mercator,Brig,Brazil and a market,12/22/1821,1821-12-22,NULL,"9765, 9766, 9769, 9770",NULL
S2218E,Mercator,Brig,Brazil and a market,05/09/1821,1821-05-09,NULL,"9767, 9768",NULL
S2220E,Nancy Ann,Brig,India,02/21/1821,1821-02-21,NULL,"9771, 9772, 9773, 9867, 9868",NULL
S2221E,Mary,Schooner,[?],04/06/1821,1821-04-06,NULL,"9774, 9775, 9776, 9777, 9778",NULL
S2222E,Mary,Schooner,Martinico and a market,02/22/1821,1821-02-22,NULL,"9779, 9780",NULL
S2223E,Marseilles,Schooner,Port Hate [Haiti?] St. Domingo,10/24/1821,1821-10-24,114 & 34/95,"9781, 9782",NULL
S2224E,Leander,Brig,Europe,08/28/1821,1821-08-28,223,"9783, 9784, 9785, 9786, 9787",NULL
S2225E,Laura Townes,Brig,Nice via Petersburg,11/08/1821,1821-11-08,NULL,"9788, 9789","According to ""Salem Ship Registers: 1789-1900,"" The Laura Townes left Genoa for Nice in March 1822 and was never heard from again."
S2226E,Laura,Brig,Mediterranean,07/12/1821,1821-07-12,NULL,"9790, 9791",NULL
S2227E,Laurel,Brig,Havana,04/14/1821,1821-04-14,NULL,"9792, 9793, 9794, 9795",NULL
S2228E,Juno,Schooner,West Indies,12/27/1821,1821-12-27,NULL,"9796, 9797",NULL
S2229E,Juno,Schooner,Aux Cayes,05/03/1821,1821-05-03,NULL,"9798, 9799, 9800, 9801, 9802",NULL
S2230E,Julia Ann,Schooner,West Indies,12/05/1821,1821-12-05,NULL,"9803, 9804, 9805, 9806, 9807",NULL
S2231E,Julia Ann,Schooner,Curracoa [Curacao?]and a market,06/01/1821,1821-06-01,NULL,"9808, 9809, 9810, 9811, 9812",NULL
S2232E,Joseph,Schooner,Curacao,02/16/1821,1821-02-16,76,"9813, 9814, 9822, 9823, 9824",NULL
S2233E,Joseph,Schooner,West Indies,04/25/1821,1821-04-25,NULL,"9815, 9816, 9819, 9820, 9821","Only 3 names listed in crew, including captain. List also notes one hand discharged and one shipped, without giving names."
S2234E,Joseph,Schooner,Pernambuco & a market,10/26/1821,1821-10-26,NULL,"9817, 9818, 9825, 9826, 9827, 9828, 9829",NULL
S2235E,Jeremiah,Brig,St. Petersburg,07/07/1821,1821-07-07,NULL,"9830, 9831",NULL
S2236E,Jeremiah,Brig,Havana,03/27/1821,1821-03-27,NULL,"9832, 9833, 9834, 9835",NULL
S2237E,Jason,Brig,South America,08/14/1821,1821-08-14,100,"9836, 9837, 9838, 9839, 9840",NULL
S2238E,Janus,Ship,Falmouth [From New Orleans],02/27/1821,1821-02-27,NULL,"9841, 9842","Note of February 1822 by Inspector Joseph James at Salem seems to state that five crew members were dead and five seaman shipped in their place. The ""dead"" seaman are not named."
S2239E,Jane,Brig,Salem[?] From Leghorn,10/06/1821,1821-10-06,NULL,9843,"The deletion of one name from this list [probably Nathaniel Vincent, who was discharged at Leghorn (see next voyage, which actually preceded this one.)] seems to have caused a mixup in the listed age of some of these seamen. Vincent's name was omitted, but his age and description seem to have stayed on, messing up the rest of the list. William Ranson is listed here as 17 and 5' 3""; elsewhere he is 34 and 6' 5"", and black. I have left the original information here, but believe it to be faulty.
EE (3/7/2005)"
S2240E,Jane,Brig,Leghorn,07/17/1821,1821-07-17,NULL,"9844, 9845, 9846, 9847, 9848","See Voyage Notes from previous voyage, which actually followed this one."
S2241E,Mechanic,Schooner,Martinico,01/24/1821,1821-01-24,NULL,"9849, 9850, 9851, 9852",NULL
S2242E,Merrimack Packet,Sloop,Havana,05/01/1821,1821-05-01,NULL,"9853, 9854, 9855, 9861, 9862",NULL
S2243E,Merrimack Packet,Sloop,Havana,02/15/1821,1821-02-15,NULL,"9856, 9857, 9858, 9859, 9860",NULL
S2244E,Messenger,Brig,Nice,03/10/1821,1821-03-10,NULL,"9863, 9864",NULL
S2245E,Naiad,Brig,India,03/05/1821,1821-03-05,NULL,"9865, 9866, 9873, 9874, 9875",NULL
S2246E,Nancy Thorndike,Schooner,Cape Haytian,07/12/1821,1821-07-12,NULL,"9869, 9870",NULL
S2247E,Nancy Thorndike,Schooner,West Indies,02/19/1821,1821-02-19,NULL,"9871, 9872",NULL
S2248E,Neutrality,Brig,West Indies,05/04/1821,1821-05-04,NULL,"9876, 9877, 9878, 9879, 9880",One cabin passenger and baggage shipped--unclear if this is Blisset or a second passenger.
S2249E,Neutrality,Brig,West Indies,12/21/1821,1821-12-21,NULL,"9881, 9882",NULL
S2250E,Niagara,Brig,Havana,04/03/1821,1821-04-03,NULL,"9883, 9884, 9885, 9886, 9890, 9891",NULL
S2251E,Niagara,Brig,Matanzas,12/26/1821,1821-12-26,NULL,"9887, 9888, 9889, 9892, 9893",NULL
S2252E,Olive Branch,Schooner,St. Iago de Cuba,10/05/1821,1821-10-05,NULL,"9894, 9895, 9900, 9901, 9902",NULL
S2253E,Olive Branch,Schooner,West Indies,04/13/1821,1821-04-13,NULL,"9896, 9897, 9899, 9899, 9903, 9904",NULL
S2254E,Ostrich,Schooner,West Indies,05/11/1821,1821-05-11,NULL,"9906, 9907, 9908, 9909, 9910",NULL
S2255E,Cepheus,Schooner,Pernambuco,01/28/1827,1827-01-28,NULL,"12006, 12007",NULL
S2256E,Ceres,Brig,Sumatra,12/17/1827,1827-12-17,NULL,"12008, 12009, 12014, 12015",NULL
S2257E,Ceres,Brig,East Indies,01/09/1827,1827-01-09,NULL,"12010, 12011, 12012, 12013",NULL
S2258E,Clay,Ship,Pacific Ocean,04/04/1827,1827-04-04,300,"12016, 12017, 12018, 12019",NULL
S2259E,Combine,Brig,Patagonia,02/17/1827,1827-02-17,NULL,"12020, 12021, 12024, 12025","Note: ""Four passengers in steerage! Americans."" Two other names [Joseph Preeble and John Gill] are listed; a note in Spanish appears to say they are Americans returning home."
S2260E,Combine,Brig,Matanzas,08/15/1827,1827-08-15,NULL,"12022, 12023",NULL
S2261E,Cynthia,Brig,Baltimore and South America,04/25/1827,1827-04-25,NULL,"12026, 12027",NULL
S2262E,Cynthia,Brig,Brazil and a market,05/25/1827,1827-05-25,NULL,"12028, 12029, 12030",NULL
S2263E,Cynthia,Brig,South America and a market,12/26/1827,1827-12-26,NULL,"12031, 12032, 12033, 12034",NULL
S2264E,Dawn,Brig,Marseilles,07/12/1827,1827-07-12,NULL,"12035, 12036, 12037, 12038",NULL
S2265E,Derby,Bark,Antwerp,04/07/1827,1827-04-07,NULL,"12039, 12040, 12041, 12042",NULL
S2266E,De Witt Clinton,Brig,Sumatra,11/17/1827,1827-11-17,NULL,"12043, 12044",NULL
S2267E,Dollar,Schooner,Cayenne,02/24/1827,1827-02-24,NULL,"12045, 12046, 12047, 12048",NULL
S2268E,Dollar,Schooner,Cayenne,06/08/1827,1827-06-08,NULL,"12049, 12050, 12051, 12052",NULL
S2269E,Dollar,Schooner,Cayenne,11/22/1827,1827-11-22,NULL,"12053, 12054",NULL
S2270E,Echo,Brig,Brazil and a market,02/23/1827,1827-02-23,NULL,"12055, 12056, 12057, 12058, 12059",NULL
S2271E,Echo,Brig,Para,06/28/1827,1827-06-28,NULL,"12060, 12061, 12062, 12063, 12064",NULL
S2272E,Echo,Brig,Maranham and a market,10/09/1827,1827-10-09,NULL,"12065, 12066",NULL
S2273E,Economy,Schooner,St. Iago and a market,08/15/1827,1827-08-15,NULL,"12067, 12068, 12075, 12076",NULL
S2274E,Economy,Schooner,St. Iago de Cuba and a market,11/08/1827,1827-11-08,NULL,"12069, 12070, 12071, 12072",NULL
S2275E,Elizabeth,Schooner,Gibraltar and a market,04/04/1827,1827-04-04,NULL,"12073, 12074",NULL
S2276E,Elizabeth,Schooner,Cape de Verdi and a market,10/31/1827,1827-10-31,NULL,"12077, 12078",NULL
S2277E,Edward,Brig,So. America[?] and a market,03/29/1827,1827-03-29,NULL,"12079, 12080, 12081",NULL
S2278E,Emerald,Ship,Calcutta,02[09?]/03/1827,0000-00-00,NULL,"12082, 12083",NULL
S2279E,Enterprize,Brig,Montevideo,07/07/1827,1827-07-07,NULL,"12084, 12085, 12086, 12087, 12088, 12089",NULL
S2280E,Export,Brig,Liverpool,09/15/1827,1827-09-15,NULL,"12090, 12091, 12092, 12093","Original crew of brig apparently ""left her in Liverpool and Havana."""
S2281E,Fame,Brig,Antwerp,01/13/1827,1827-01-13,NULL,"12094, 12095",NULL
S2282E,Fenelon,Brig,St. Iago,01/30/1827,1827-01-30,NULL,"12096, 12097",NULL
S2283E,Fanny,Schooner,West Indies,02/24/1827,1827-02-24,NULL,"12098, 12099, 12100, 12101",NULL
S2284E,Fenelon,Brig,West Indies,05/31/1827,1827-05-31,NULL,"12102, 12103",NULL
S2285E,Fenelon,Brig,St. Iago de Cuba,09/06/1827,1827-09-06,NULL,"12104, 12105",NULL
S2286E,Fenelon,Brig,Martinique/St. Iago,12/26/1827,1827-12-26,NULL,"12106, 12107, 12108, 12109",NULL
S2287E,Frances,Schooner,South America,08/24/1827,1827-08-24,NULL,"12110, 12111",NULL
S2288E,Franklin,Brig,Guam[?],06/09/1827,1827-06-09,NULL,"12112, 12113",NULL
S2289E,Friendship,Ship,East Indies,08/22/1827,1827-08-22,NULL,"12114, 12115, 12116, 12117, 12118",NULL
S2290E,Gazelle,Schooner,Maranham [Maranhao],11/??/1827,0000-00-00,NULL,"12119, 12120",NULL
S2291E,General Brooks,Schooner,St. Iago de Cuba,04/12/1827,1827-04-12,NULL,"12121, 12122",NULL
S2292E,General Brooks,Schooner,West Indies,08/02/1827,1827-08-02,NULL,"12123, 12124, 12125, 12126",NULL
S2293E,General Brooks,Schooner,St. Iago,12/25/1827,1827-12-25,NULL,"12127, 12128, 12129, 12130",NULL
S2294E,General Jackson,Brig,Cayenne,06/09/1827,1827-06-09,NULL,"12131, 12132, 12133, 12134",NULL
S2295E,General Jackson,Brig,Cayenne,10/20/1827,1827-10-20,NULL,"12135, 12136",NULL
S2296E,General Warren,Brig,West Indies,11/19/1827,1827-11-19,NULL,"12137, 12138",NULL
S2297E,George,Ship,Calcutta,07/02/1827,1827-07-02,NULL,"12139, 12140, 12141, 12142",NULL
S2298E,Governor Winslow,Brig,West Indies,05/17/1827,1827-05-17,NULL,"12143, 12144, 12145, 12146",NULL
S2299E,Governor Winslow,Brig,West Indies,11/17/1827,1827-11-17,NULL,"12147, 12148, 12149, 12150",NULL
S2300E,Hercules,Ship,St. Andrew's,03/23/1827,1827-03-23,NULL,"12151, 12152, 12158, 12159",NULL
S2301E,Halsey,Brig,Brazil and a market,06/07/1827,1827-06-07,NULL,"12153, 12154, 12155","Crew discharged with three months extra pay at St. Salvador, 09/18/1827."
S2302E,Hercules,Ship,St. Thomas,11/23/1827,1827-11-23,NULL,"12156, 12157",NULL
S2303E,Hope,Schooner,S. America and a market,10/20/1827,1827-10-20,NULL,"12160, 12161, 12162",NULL
S2304E,Henry,Brig,Brazil and a market,01/29/1827,1827-01-29,NULL,"12163, 12164, 12165, 12166, 12167",NULL
S2305E,Henry,Brig,Rio Grande and a market,11/02/1827,1827-11-02,NULL,"12168, 12169",NULL
S2306E,Janus,Ship,Antwerp,08/29/1827,1827-08-29,NULL,"12170, 12171","One note [Salem, August, 1828] Says four men shipped abroad. No names given."
S2307E,Janus,Ship,Antwerp via Charleston,07/31/1827,1827-07-31,NULL,"12172, 12173",NULL
S2308E,Jason,Brig,Leghorn,06/01/1827,1827-06-01,NULL,"12174, 12175, 12176, 12177",NULL
S2309E,Jeremiah,Brig,South America via Richmond,08/08/1827,1827-08-08,NULL,"12178, 12179, 12180, 12181, 12182",J. Johnson may have shipped as a replacement for the lost J. Obear.
S2310E,Jones,Brig,Madagascar,03/07/1827,1827-03-07,NULL,"12183, 12184",NULL
S2311E,Jones,Brig,Havana,11/02/1827,1827-11-02,NULL,"12185, 12186",NULL
S2312E,Lama,Brig,West Indies,04/21/1827,1827-04-21,NULL,"12187, 12188",NULL
S2313E,Lama,Brig,Leghorn and a market,07/12/1827,1827-07-12,NULL,"12189, 12190",NULL
S2314E,Laurel,Brig,Havana,10/10/1827,1827-10-10,NULL,"12191, 12192",NULL
S2315E,Leader,Schooner,Maranham/Brazil and a market,03/15/1827,1827-03-15,NULL,"12193, 12194, 12195, 12196",NULL
S2316E,Leader,Schooner,Maranham,07/31/1827,1827-07-31,NULL,"12197, 12198, 12199, 12200, 12201",NULL
S2317E,Leander,Brig,Smyrna,08/10/1827,1827-08-10,NULL,"12202, 12203, 12204, 12205",NULL
S2318E,Mary,Brig,Matanzas,09/01/1827,1827-09-01,NULL,"12206, 12207, 12208, 12209",NULL
S2319E,Mary,Brig,Maranham and a market,11/24/1827,1827-11-24,NULL,"12210, 12211",NULL
S2320E,Mercator,Brig,Bremer [From New Orleans],05/05/1827,1827-05-05,NULL,"12212, 12213",NULL
S2321E,Mermaid,Brig,Hamburgh,04/12/1827,1827-04-12,NULL,"12214, 12215",NULL
S2322E,Merrimack Packet,Schooner,West Indies,03/??/1827,0000-00-00,NULL,"12216, 12217",NULL
S2323E,Merrimack Packet,Schooner,West Indies,09/03/1827,1827-09-03,NULL,"12218, 12219",NULL
S2324E,Monroe,Brig,Africa,02/17/1827,1827-02-17,NULL,"12220, 12221",NULL
S2325E,Neptune,Brig,Liverpool,06/19/1827,1827-06-19,NULL,"12222, 12223, 12224",NULL
S2326E,Nereus,Brig,Matanzas,03/19/1827,1827-03-19,183,"12225, 12226, 12227, 12228",NULL
S2327E,Nereus,Brig,Genoa,07/07/1827,1827-07-07,182,"12229, 12230",NULL
S2328E,New Priscilla,Brig,West Indies,10/16/1827,1827-10-16,NULL,"12231, 12232",NULL
S2329E,Niagara,Brig,St. Thomas,12/27/1827,1827-12-27,NULL,"12233, 12234, 12235, 12236",NULL
S2330E,Nile,Ship,East Indies,05/23/1827,1827-05-23,NULL,"12237, 12238, 12239, 12240, 12241",3 foreign seamen shipped at Antwerp 22 Mar. 1828; 14 foreign seamen shipped at Antwerp 5 Sept. 1828
S2331E,Packet,Ship,East Indies,02/20/1827,1827-02-20,339,"12242, 12243",NULL
S2332E,Pactolus,Brig,Cuba,03/23/1827,1827-03-23,NULL,"12244, 12245, 12246, 12247",NULL
S2333E,Pactolus,Brig,South America and a market,11/26/1827,1827-11-26,NULL,"12248, 12249",NULL
S2334E,Peru,Bark,East Indies,07/12/1827,1827-07-12,NULL,"12250, 12251",NULL
S2335E,Phoebe,Brig,The Brazils,03/07/1827,1827-03-07,104,"12252, 12253",NULL
S2336E,Reaper,Brig,East Indies,05/16/1827,1827-05-16,NULL,"12254, 12255, 12256, 12257",NULL
S2337E,Richard,Bark,America and a market,03/28/1827,1827-03-28,NULL,"12258, 12259, 12260, 12261",NULL
S2338E,Rogue,Brig,Marseilles,01/18/1827,1827-01-18,NULL,"12262, 12263",NULL
S2339E,Rogue,Brig,Marseilles,07/23/1827,1827-07-23,NULL,"12264, 12265, 12266, 12267",NULL
S2340E,Roscoe,Brig,South America and a market,10/26/1827,1827-10-26,NULL,"12268, 12269, 12270, 12271",NULL
S2341E,Rotund,Brig,Cayenne,04/14/1827,1827-04-14,NULL,"12272, 12273, 12274, 12275",NULL
S2342E,Rotund,Brig,Cayenne,08/29/1827,1827-08-29,NULL,"12276, 12277, 12278, 12279",NULL
S2343E,Sally,Brig,Cape Hayties [Haiti?],06/07/1827,1827-06-07,NULL,"12280, 12281",NULL
S2344E,Scion,Brig,West Indies,04/19/1827,1827-04-19,NULL,"12282, 12283",NULL
S2345E,Siren,Brig,Africa,02/10/1827,1827-02-10,NULL,"12284, 12285",NULL
S2346E,Siren,Brig,Africa,08/01/1827,1827-08-01,NULL,"12286, 12287",NULL
S2347E,Spy,Schooner,India,09/08/1827,1827-09-08,92,"12288, 12289, 12290, 12291",NULL
S2348E,St. Michael,Brig,South America,10/01/1827,1827-10-01,NULL,"12292, 12293, 12294, 12295",NULL
S2349E,Suffolk,Ship,East Indies,03/03/1827,1827-03-03,314,"12296, 12297",NULL
S2350E,Sumatra,Ship,India,11/09/1827,1827-11-09,NULL,"12298, 12299",NULL
S2351E,Talent,Brig,NULL,12/28/1827,1827-12-28,NULL,"12300, 12301",NULL
S2352E,Texel,Brig,Cowes [From New Orleans],08/01/1827,1827-08-01,NULL,"12302, 12303",NULL
S2353E,Tryon,Schooner,"Halifax, N.S.",02/17/1827,1827-02-17,NULL,"12304, 12305",NULL
S2354E,Velocity,Brig,Valparaiso,07/30/1827,1827-07-30,NULL,"12306, 12307, 12308, 12309",NULL
S2355E,Washington,Brig,Tampico,03/17/1827,1827-03-17,NULL,"12310, 12311",NULL
S2356E,Washington,Brig,Havana,04/07/1827,1827-04-07,236,"12312, 12313, 12314, 12315, 12316, 12317, 12318",NULL
S2357E,Washington,Brig,Martinico,04/10/1827,1827-04-10,NULL,"12319, 12320, 12321, 12322",NULL
S2358E,Washington,Brig,Martinico,08/06/1827,1827-08-06,NULL,"12323, 12324",NULL
S2359E,Zephyr,Ship,East Indies,04/23/1827,1827-04-23,NULL,"12325, 12326, 12327, 12328, 12329, 12330",Eight unnamed men shipped from Antwerp.
S2360E,Abby M.,Brig,Cape de Verde and a market,04/11/1828,1828-04-11,NULL,"12332, 12333, 12334, 12335",NULL
S2361E,Acasta,Ship,Rio Janeiro and a market,04/01/1828,1828-04-01,NULL,"12336, 12337, 12338",NULL
S2362E,Acorn,Brig,Matanzas,04/01/1828,1828-04-01,NULL,"12339, 12340, 12341, 12342",NULL
S2363E,Acorn,Brig,South America and a market,07/12/1828,1828-07-12,NULL,"12343, 12344, 12345",NULL
S2364E,Amazon,Brig,Havana,03/12/1828,1828-03-12,NULL,"12346, 12347, 12350, 12351",NULL
S2365E,Amazon,Brig,Havana,11/21/1828,1828-11-21,NULL,"12348, 12349, 12352, 12353",NULL
S2366E,Amethyst,Brig,Maranham and a market,04/04/1828,1828-04-04,NULL,"12354, 12355, 12360, 12361",NULL
S2367E,Amethyst,Brig,Para and a market,08/06/1828,1828-08-06,NULL,"12356, 12357, 12358, 12359",NULL
S2368E,Amethyst,Brig,Para and a market,12/12/1828,1828-12-12,NULL,"12362, 12363",NULL
S2369E,Arcade,Schooner,Cayenne,06/25/1828,1828-06-25,NULL,"12364, 12365, 12366, 12367",NULL
S2370E,Arcade,Schooner,Martinique,10/29/1828,1828-10-29,NULL,"12368, 12369",NULL
S2371E,Augustus,Ship,St. Petersburg,06/10/1828,1828-06-10,NULL,"12370, 12371, 12372, 12373",NULL
S2372E,Augustus,Ship,The South of Europe,11/28/1828,1828-11-28,NULL,"12374, 12375",William Giddings and Charles M. Lane do not appear to have completed voyage. Joshua Warren's role in voyage is unclear.
S2373E,Black Warrior,Ship,Havana,04/07/1828,1828-04-07,232,"12376, 12377, 12378, 12379",NULL
S2374E,Calliope,Brig,Para and a market,07/23/1828,1828-07-23,NULL,"12380, 12381, 12382, 12383, 12384, 12799",NULL
S2375E,Cambrian,Brig,Marseilles,07/11/1828,1828-07-11,NULL,"12385, 12386, 12387, 12388","""Chief mate discharged; second mate shipped in his stead. One hand discharged, one shipped in his stead."""
S2376E,Cambridge,Brig,Antwerp,10/07/1828,1828-10-07,NULL,"12390, 12391",NULL
S2377E,Cambrine,Schooner,St. Andrew's,09/06/1828,1828-09-06,NULL,"12392, 12393, 12394, 12395",NULL
S2378E,Camel,Brig,Pernambuco,08/09/1828,1828-08-09,NULL,"12396, 12397, 12398, 12399, 12400",NULL
S2379E,Caroline,Ship,Rio Grande,10/14/1828,1828-10-14,NULL,"12401, 12402, 12403, 12404",NULL
S2380E,Ceres,Brig,Sumatra,12/24/1828,1828-12-24,NULL,"12405, 12406, 12407, 12408",NULL
S2381E,Cipher,Brig,Cayenne and Surinam,09/01/1828,1828-09-01,NULL,"12409, 12410, 12411, 12412",NULL
S2382E,Cipher,Brig,Cayenne,03/22/1828,1828-03-22,NULL,"12413, 12414, 12415, 12416",NULL
S2383E,Commerce,Brig,South America,01/02/1828,1828-01-02,NULL,"12417, 12418",NULL
S2384E,Crusoe,Ship,Brazil,12/24/1828,1828-12-24,294,"12419, 12420, 12909, 12910",NULL
S2385E,Dawn,Brig,Matanzas,12/18/1828,1828-12-18,NULL,"12421, 12422, 12423, 12424",NULL
S2386E,Dispatch Packet,Brig,Brazil,03/18/1828,1828-03-18,135,"12425, 12426",NULL
S2387E,Dollar,Schooner,West Indies,10/18/1828,1828-10-18,NULL,"12427, 12428, 12431, 12432",NULL
S2388E,Dollar,Schooner,Cayenne,04/10/1828,1828-04-10,NULL,"12429, 12430, 12435, 12436",NULL
S2389E,Echo,Brig,Maranham and a market,06/18/1828,1828-06-18,NULL,"12437, 12438, 12439, 12440, 12441, 12433,12434",NULL
S2390E,Echo,Brig,Maranham and a market,02/09/1828,1828-02-09,NULL,"12442, 12443, 12444, 12447, 12448",NULL
S2391E,Echo,Brig,Maranham and a market,09/26/1828,1828-09-26,NULL,"12445, 12446",NULL
S2392E,Economy,Schooner,St. Iago de Cuba and a market,04/02/1828,1828-04-02,NULL,"12449, 12450, 12451, 12452, 12453, 12454, 12455",One seaman apparently died; another ran away. No names given.
S2393E,Economy,Schooner,St. Iago de Cuba and a market,07/02/1828,1828-07-02,NULL,"12456, 12457",NULL
S2394E,Essex,Schooner,Cayenne,10/14/1828,1828-10-14,NULL,"12458, 12459, 12460, 12461",NULL
S2395E,Exchange,Schooner,Pernambuco and a market,11/14/1828,1828-11-14,NULL,"12462, 12463, 12464","According to the U.S. Consul at St. Salvador, John W. Kenzie was really a Swedish man named Peter Matzen. Jefferson Conant was actually Charles Guest--a Danish subject. Each bought ""a protection"" for one dollar and signed on as Americans under false names. Upon discharge, neither were issued the three months' extra pay given the others."
S2396E,Fair American,Brig,Maranham and Para,10/09/1828,1828-10-09,NULL,"12465, 12466, 12467, 12468",NULL
S2397E,Talent,Brig,Havana,12/04/1828,1828-12-04,NULL,"12469, 12470, 12471, 12472, 12473",NULL
S2398E,Fawn,Brig,East Indies,05/07/1828,1828-05-07,NULL,"12474, 12475, 12476, 12477",NULL
S2399E,Fenelon,Brig,West Indies,08/05/1828,1828-08-05,NULL,"12478, 12479, 12480, 12481",NULL
S2400E,Fenelon,Brig,West Indies,05/01/1828,1828-05-01,NULL,"12482, 12483",NULL
S2401E,Fenelon,Brig,St. Iago,11/29/1828,1828-11-29,NULL,"12484, 12485, 12911, 12912",NULL
S2402E,Fides,Brig,St. Iago,08/28/1828,1828-08-28,NULL,"12486, 12487",NULL
S2403E,Fides,Brig,West Indies,12/18/1828,1828-12-18,NULL,"12488, 12489, 12490, 12491",NULL
S2404E,Fides,Brig,St. Iago,06/06/1828,1828-06-06,NULL,"12492, 12493, 12494, 12495",NULL
S2405E,Fides,Brig,St. Iago,02/26/1828,1828-02-26,NULL,"12496, 12497, 12498",NULL
S2406E,Forrester,Brig,Hamburg,06/03/1828,1828-06-03,NULL,"12499, 12500",NULL
S2407E,Francis,Ship,East Indies,10/06/1828,1828-10-06,NULL,"12501, 12502, 12503, 12504",NULL
S2408E,Fredonia,Schooner,Cape de Veras and a market,10/10/1828,1828-10-10,NULL,"12505, 12506",NULL
S2409E,Garnet,Brig,Antwerp,06/25/1828,1828-06-25,NULL,"12507, 12508",NULL
S2410E,General Brooks,Schooner,West Indies,04/17/1828,1828-04-17,NULL,"12509, 12510, 12511, 12512, 12513, 12514, 12515, 12516, 12517","It appears that Abraham Pickering may have replaced Samuel Dowst as master some time during the voyage. While initial forms give Dowst as master, Pickering is referred to as master in several other documents well into the voyage."
S2411E,General Brooks,Schooner,West Indies,10/25/1828,1828-10-25,NULL,"12518, 12519",NULL
S2412E,General Brooks,Schooner,St. Iago,07/28/1828,1828-07-28,NULL,"12520, 12521",NULL
S2413E,General Jackson,Brig,West Indies,12/29/1828,1828-12-29,NULL,"12522, 12523, 12528, 12529",NULL
S2414E,General Jackson,Brig,Martinico,10/06/1828,1828-10-06,NULL,"12524, 12525, 12526, 12527",NULL
S2415E,General Warren,Brig,West Indies,03/21/1828,1828-03-21,NULL,"12530, 12531",NULL
S2416E,General Warren,Brig,St. Barts [St. Bartholomew] and a market,08/01/1828,1828-08-01,NULL,"12532, 12533, 12534, 12537, 12538",NULL
S2417E,General Warren,Brig,St. Bartholomew's,10/28/1828,1828-10-28,NULL,"12535, 12536",NULL
S2418E,George,Ship,Calcutta,08/07/1828,1828-08-07,NULL,"12543, 12544, 12545, 12546",NULL
S2419E,Governor Winslow,Brig,West Indies,09/10/1828,1828-09-10,NULL,"12547, 12548",NULL
S2420E,Governor Winslow,Brig,West Indies,05/03/1828,1828-05-03,NULL,"12549, 12550",NULL
S2421E,Glide,Ship,Marseilles,02/05/1828,1828-02-05,NULL,"12551, 12552, 12553","Difficult to read crew lists, etc."
S2422E,Henry,Brig,South America,06/28/1828,1828-06-28,NULL,"12556, 12557",NULL
S2423E,Henry,Brig,Haiti,03/13/1828,1828-03-13,NULL,"12558, 12559, 12560, 12561",NULL
S2424E,Hercules,Ship,East Indies via Richmond,09/09/1828,1828-09-09,NULL,"12562, 12563, 12564, 12565",NULL
S2425E,Janus,Ship,Pernambuco and a market,11/17/1828,1828-11-17,NULL,"12566, 12567, 12568, 12569, 12570",NULL
S2426E,Java,Brig,Pima [Lima?],01/17/1828,1828-01-17,NULL,"12571, 12572",NULL
S2427E,John Q. Adams,Schooner,Cayenne,11/17/1828,1828-11-17,NULL,"12573, 12574, 12575, 12576",NULL
S2428E,Jones,Brig,Matanzas,03/05/1828,1828-03-05,NULL,"12577, 12580, 12581",NULL
S2429E,Jones,Brig,Havana,11/02/1828,1828-11-02,NULL,"12582, 12583",NULL
S2430E,Lady Sarah,Schooner,Mauratine? & a market,12/20/1828,1828-12-20,NULL,"12584, 12585",Crew list hard to read
S2431E,Lama,Brig,Gibralter & Maderia?,2/16/1828,1828-02-16,NULL,"12586, 12587",NULL
S2432E,Lama,Brig,West Indies,9/30/1828,1828-09-30,NULL,"12588, 12589, 12578, 12579",return certified on 02/16/1829 (2 images)
S2433E,Laurel,Brig,Isle of Mayo(?),12/16/1828,1828-12-16,NULL,"12590, 12591",NULL
S2434E,Leander,Brig,India,06/27/1828,1828-06-27,NULL,"12592, 12593, 12594, 12595",Includes both outgoing and incoming crew lists.
S2436E,Lion,Brig,South America,07/14/1828,1828-07-14,NULL,"12597, 12598, 12596",NULL
S2437E,Mandarin,Ship,Valparaiso to market,08/05/1828,1828-08-05,NULL,"12599, 12600",NULL
S2438E,Mermaid,Brig,Bayonne &?,06/20/1828,1828-06-20,NULL,"12601, 12602, 12607, 12608","Second crew list created for voyage to Bayonne,"
S2439E,Malay,Brig,East Indies,12/17/1828,1828-12-17,NULL,"12603, 12604",NULL
S2440E,Lotos[?],[Ship],Batavia,12/18/1828,1828-12-18,220,"12605, 12606",Vessel name torn off crew list
S2443E,Mermaid,Brig,West Indies,02/01/1828,1828-02-01,NULL,"12609, 12610",NULL
S2444E,Mermaid,Brig,Cayanne,11/20/1828,1828-11-20,NULL,"12611, 12612",confusing crew entries
S2445E,Nereus,Brig,South America via Nantucket?,04/15/1828,1828-04-15,NULL,"12614, 12615, 12613",NULL
S2446E,Monticello,Brig,St. Thomas,10/20/1828,1828-10-20,NULL,"12616, 12617",NULL
S2447E,Mexican,Brig,Matanzas,05/21/1828,1828-05-21,NULL,"12618, 12619",NULL
S2448E,Merrimack Packet,Schooner,Brazil,01/15/1828,1828-01-15,NULL,"12620, 12621, 12622","Vessel condemned, deemed unseaworthy, discharged and forwarded from Maranham (Brazil) to Boston by Leonardo Corning, 04/18/1828"
S2449E,Mermaid,Brig,Bayonne,02/16/1828,1828-02-16,NULL,"12623, 12624",NULL
S2450E,Nereus,Brig,South America bw market,04/15/1828,1828-04-15,182,"12625, 12626",NULL
S2451E,New Priscilla,Brig,The West Indies,05/05/1828,1828-05-05,NULL,"12627, 12628, 12629","Three desertions noted in Havana on 06/13/1828 by Vincent Gray, U.S. Vice Cousular Agent."
S2452E,New Priscilla,Brig,West Indies,09/24/1828,1828-09-24,NULL,"12630, 12631","Salem Ship Registers 1789-1900 note:
[ Sailed Oct.2, 1828 for the West Indies and never arrived. A deserted brig with ""New Priscilla"" on her stern was sighted, her stern-boat tackles hanging in the water. It was supposed that she had been taken by pirates and the crew murdered. The body of a boy was found spiked to the deck. See E.I Hist. Coll. XXXIV, 42.]"
S2453E,Nile,Ship,NULL,07/31/1828,1828-07-31,NULL,"12632, 12633",bound from Cowes
S2454E,Olinda,Brig,Brazil,03/27/1828,1828-03-27,NULL,"12634, 12635, 12636",All crew returned certified 09/08/1828
S2455E,Olinda,Brig,Pernambuco,04/19/1828?,1828-04-19,NULL,"12637, 12638, 12639, 12640, 12641",certified return of all crew 09/30/1828
S2456E,Orient,Brig,Antwerp,05/23/1828,1828-05-23,NULL,"12342, 12643, 12644, 12645",Consulate verified appearance in Antwerp and cleared customs 07/19/1828
S2457E,Ospray,Brig,India,07/10/1828,1828-07-10,NULL,"12646, 12647",certified returned with all crew on 11/23/1828
S2458E,Pactolus,Brig,Brazil,06/06/1828,1828-06-06,NULL,"12648, 12649, 12650",Return with all crew certified 11/09/1828
S2459E,Osprey,Brig,Indies,07/10/1828,1828-07-10,NULL,"12651, 12652",NULL
S2460E,Pactolus,Brig,Brazil & a Market,06/06/1828,1828-06-06,NULL,"12653, 12654",NULL
S2461E,Persia,Brig,Havana,05/13/1828,1828-05-13,NULL,"12655, 12656",NULL
S2462E,Persia,Brig,Havana,04/11/1828,1828-04-11,NULL,"12657, 12658",NULL
S2463E,Phoenix,Brig,Europe,10/09/1828,1828-10-09,NULL,"12659, 12660",NULL
S2464E,Phoenix,Brig,Matanza,06/05/1828,1828-06-05,NULL,"12661, 12662, 12663",Certified returned 09/29/1828 with modifications to crew.
S2465E,Phoenix,Brig,South America and a market,05/16/1828,1828-05-16,NULL,"12664, 12665, 12665, 12667",Certified consular stamps from Havana and Brazil
S2466E,Phoenix,Brig,Cuba,06/04/1828,1828-06-04,NULL,"12668, 12669",NULL
S2467E,Phoenix,Brig,Europe,10/09/1828,1828-10-09,NULL,"12670, 12671, 12672",NULL
S2468E,Pioneer,Brig,Marseilles,10/24/1828,1828-10-24,NULL,"12673, 12674",NULL
S2469E,Pioneer,Brig,Leghorn,04/28/1828,1828-04-28,NULL,"12675, 12676",Verified crew list in Leghone 07/19/1828 and all crew returned 09/17/1828
S2470E,Pioneer,Brig,Marseilles,10/24/1828,1828-10-24,NULL,"12677, 12678",Crew List verified by U.S. Consul in Marseilles 12/08/1828
S2471E,Pioneer,Brig,Leghorn,04/28/1828,1828-04-28,NULL,"12679, 12680",NULL
S2472E,Quill,Brig,East Indies,10/04/1828,1828-10-04,190,"12681, 12682",NULL
S2473E,Rajah,Brig,One or more ports in the North,03/04/1828,1828-03-04,NULL,"12683, 12684",Return verified 09/02/1828
S2474E,Rambler,Brig,Cayenne,11/26/1828,1828-11-26,NULL,"12685, 12686",Certified in Cayenne 11/20/1828
S2475E,Reaper,Brig,East Indies,08/04/1828,1828-08-04,NULL,"12687, 12688",NULL
S2476E,Rebecca,Schooner,West Indies,02/14/1828,1828-02-14,NULL,"12689, 12690",Return certified May 1828
S2477E,Rebecca,Brig,South America,12/19/1828,1828-12-19,NULL,"12691, 12692, 12693, 12694","Certified in Rio de Janero, Brazil 06/16/1829 ""...that John P. Adams has discharged at this consulate agreeably to Sen. Thomas Verrll? Paying three months wages over and above what was then due him."""
S2478E,Rebecca,Brig,South America,03/24/1828,1828-03-24,NULL,"12695, 12696",Certified return 08/28/1828
S2479E,Rebecca,Schooner,West Indies,02/14/1828,1828-02-14,NULL,"12696, 12697",Departed 02/16/1828
S2480E,Richard,Bark,Europe,05/14/1828,1828-05-14,NULL,"12699, 12700, 12701, 12702","District of Boston certified that all returned except: see below
Certified by the Collector of CustomsDistrict of Salem"
S2481E,Rising Sun,Schooner,Maranham & Market,06/12/1828,1828-06-12,NULL,"12703, 12704",NULL
S2482E,Rogue,Brig,Marseilles,04/18/1828,1828-04-18,NULL,"12705, 12706, 12707",Certified in Marseilles with notes and certified all returned
S2483E,Rolla,Schooner,West Indies,09/13/1828,1828-09-13,NULL,"12708, 12809",NULL
S2484E,Romp,Brig,Maranham and Para of the West Indies,01/02/1828,1828-01-02,NULL,"12710, 12711, 12712","Certified in Maranham 02/24/1828, certified returned 05/24/1828"
S2485E,Romp,Brig,Brazil and Market,06/11/1828,1828-06-11,NULL,"12713, 12714",NULL
S2486E,Romp,Brig,Maranham and Para,06/12/1828,1828-06-12,NULL,"12715, 12716",NULL
S2487E,Rover,Brig,St. Thomas,01/02/1828,1828-01-02,NULL,"12717, 12718",NULL
S2488E,Sally Barker,Brig,Curry,0112/1828,0000-00-00,NULL,"12719, 12720",NULL
S2489E,Sally Ann,Brig,West Indies,10/13/1828,1828-10-13,NULL,"12721, 12722,12723, 12724, 12725",certified returned with all aboard 03/04/1829
S2490E,Scion,Brig,West Indies,05/05/1828,1828-05-05,NULL,"12726, 12727",Certified returned June 1828
S2491E,Siren,Brig,Africa,05/09/1828,1828-05-09,NULL,"12728, 12729","(Sold on the coast of Africa 1828, per Salem Ship Registers 1789-1900)"
S2492E,Star,Schooner,South America,10/25/1828,1828-10-25,NULL,"12730, 12731, 12732, 12733",Certified in Buenos Aires 04/08/1829
S2493E,Stork,Brig,a port in the West Indies,06/02/1828,1828-06-02,NULL,"12734, 12735",certified returned 09/07/1828
S2494E,Susan,Brig,Brazil and a market,01/05/1828,1828-01-05,NULL,"12736, 12737, 12738, 12739",NULL
S2495E,Triton,Brig,Europe,08/27/1828,1828-08-27,NULL,"12740, 12741, 12742",noted returned 10/08/1828
S2496E,Triton,Brig,Matanzas,01/08/1828,1828-01-08,NULL,"12743, 12744",NULL
S2497E,Tryon,Schooner,St. Andrews,07/25/1828,1828-07-25,NULL,"12745, 12746",NULL
S2498E,Two Brothers,Ship,Calcutta,07/02/1828,1828-07-02,NULL,"12747, 12748, 13254",NULL
S2499E,Velocity,Brig,South America,07/24/1828,1828-07-24,NULL,"12749, 12750",NULL
S2500E,Vine,Brig,Papagonia,0619/1828,0000-00-00,NULL,"12751, 12752, 12752, 12753","Certified all returned except George Brooks, 07/55/1828"
S2501E,Virginia,Brig,India,03/13/1828?,1828-03-13,137,"12755, 12756",NULL
S2502E,Virginia,Brig,East Indies,03/13/1828,1828-03-13,NULL,"12757, 12758",note returned July 1828
S2503E,Zephyr,Ship,East Indies,11/07/1828,1828-11-07,NULL,"12759, 12760",NULL
S2504E,Abbey M.,Brig,South America,12/21/1829,1829-12-21,NULL,"12762, 12763, 12764, 12765, 12766",note:returned October 29
S2505E,Adams,Brig,Copenhagen,12/21/1829,1829-12-21,NULL,"12767, 12768, 12769, 12770",note returned June 6
S2506E,Albert,Brig,West Indies,03/31/1829,1829-03-31,NULL,"12771, 12772",note returned June 11
S2507E,Amazon,Brig,Marseilles,08/19/1829,1829-08-19,NULL,"12773, 12774",NULL
S2508E,Amethyst,Brig,Para & a market,04/27/1829,1829-04-27,NULL,"12775, 12776",NULL
S2509E,Amethyst,Brig,Para & a market,08/26/1829,1829-08-26,110,"12777, 12778",NULL
S2510E,Amethyst,Brig,Para & a market,12/15/1829,1829-12-15,110,"12779, 12780",NULL
S2511E,Arcade,Schooner,St.Pierre,08/14/1829,1829-08-14,NULL,"12781, 12782",NULL
S2512E,Arcade,Schooner,Martinique,12/25/1829,1829-12-25,NULL,"12783, 12784",NULL
S2513E,Arcade,Schooner,?,08/??/1829,0000-00-00,NULL,"12785, 12786",returned Nov. 24th
S2514E,Arcade,Schooner,St. Pierre,04/22/1829,1829-04-22,NULL,"12787, 12788, 12789",certified return 07/14/1829
S2515E,Augustus,Ship,Europe,11/25/1829,1829-11-25,NULL,"12790, 12791",NULL
S2516E,Augustus,Ship,Marseilles,12/12/1829,1829-12-12,NULL,"12792, 12793",returned 04/16/1830
S2517E,Betsy & Eliza,Schooner,"West Indies, Cayenne",04/08/1829,1829-04-08,NULL,"12794, 12795, 12796, 12797, 12798",returned Aug.24
S2519E,Cambrian,Brig,marseilles,10/03/1829,1829-10-03,NULL,"12800, 12801",returned June 2
S2520E,Cambrian,Brig,Marseilles,09/03/1829,1829-09-03,NULL,"12802, 12803",NULL
S2521E,Cambrine,Schooner,St. Barts,10/09/1829,1829-10-09,NULL,"12804, 12805, 12806",NULL
S2522E,Camel,Brig,West Indies,11/11/1829,1829-11-11,NULL,"12807, 12808",returned Jan.24 1830
S2523E,Cambridge,Brig,St Thomas & a market,04/11/1829,1829-04-11,NULL,"12809, 12810",NULL
S2524E,Cambridge,Brig,St Iago di Cuba (Jamaica?),03/25/1829,1829-03-25,NULL,"12811, 12812",NULL
S2525E,Cambridge,Brig,St. Thomas,04/11/1829,1829-04-11,NULL,"12813, 12814, 12815","note by the U.S. consulate, Port of Antwerp ( see notes below)
note returned Oct. 10"
S2526E,Catharine,Ship,South America,12/26/1829,1829-12-26,NULL,"12816, 12817",Valparaiso consulate verified crew 11/09/1830
S2527E,Catherine,Ship,South America,12/20/1829,1829-12-20,NULL,"12818, 12819",NULL
S2528E,Catherine,Ship,Antwerp,06/04/1829,1829-06-04,NULL,"12820, 12821","All on board verified at U.S. consulate, Port of Antwerp 07/29/1829"
S2529E,Centurion,Brig,North of Europe,06/18/1829,1829-06-18,NULL,"12822, 12823, 12824, 12825, 12826",NULL
S2530E,Centurion,Brig,West Indies,02/19/1829,1829-02-19,NULL,"12827, 12828, 12829",note returned June1829
S2531E,China,Ship,Havana,04/27/1829,1829-04-27,NULL,"12830, 12831",returned Aug.27
S2532E,Cipher,Brig,Cayenne,02/06/1829,1829-02-06,NULL,"12832, 12833",NULL
S2533E,Cipher,Brig,Cayenne,09/15/1829,1829-09-15,NULL,"12834, 12835",NULL
S2534E,Cipher,Brig,Cayenne,02/06/1829,1829-02-06,NULL,"12836, 12837, 12838",NULL
S2535E,Cipher,Brig,Cayenne,09/15/1829,1829-09-15,NULL,"1,283,912,840",returned Dec. 28
S2536E,Clay,Ship,Pacific Ocean,08/26/1829,1829-08-26,300,"12841, 12842, 12843, 12844",NULL
S2537E,Combine,Brig,Buenos Ayres,05/13/1829,1829-05-13,NULL,"12845, 12846",NULL
S2538E,Combine,Brig,Buenos Ayres,05/13/1829,1829-05-13,NULL,"12847, 12848",NULL
S2539E,Commerce,Brig,South America,01/02/1829,1829-01-02,NULL,"12849, 12850, 12851",NULL
S2540E,Cynthia,Brig,Cayenne,05/14/1829,1829-05-14,NULL,"12852, 12853",NULL
S2541E,Cynthia,Brig,Surinam,10/05/1829,1829-10-05,NULL,"12853, 12854",note all returned 01/21/1830
S2542E,Cynthia,Brig,Surinam,10/05/1829,1829-10-05,NULL,"12855, 12856",duplicate or return list?
S2543E,Cynthia,Brig,Cayenne,05/17/1829,1829-05-17,NULL,"12857, 12858",NULL
S2544E,Dawn,Brig,Leghorn,07/13/1829,1829-07-13,NULL,"12859, 12860, 12863, 12864","certified in Leghorn Spet 1829, certified returned 12/21/1829"
S2545E,Dawn,Brig,Matanzas,04/29/1829,1829-04-29,NULL,"12861, 12862",NULL
S2546E,Delphos,Ship,East Indies,05/14/1829,1829-05-14,NULL,"12865, 12866, 12867, 12868",All crew certified in Antwerp 06/11/1829 and all discharged with one months pay except the top two officers and subsequently a replacement crew was signed on in Antwep 06/11/1830.(see image 12866)
S2547E,Dollar,Schooner,Cayene,06/20/1829,1829-06-20,NULL,"12869, 12870, 12880, 12881","note from Salem customs agent noting crew returned except Thomas Holmes, Master left at Cayenne."
S2548E,De Witt Clinton,Brig,NULL,03/07/1829,1829-03-07,NULL,"12871, 12872","crew list not included, note from Customs agent in Banrstable 03/07/1829 (see Image 12871)"
S2549E,Dollar,Schooner,West Indies,11/14/1829,1829-11-14,NULL,"12873, 12874",NULL
S2550E,Dollar,Schooner,West Indies,01/22/1829,1829-01-22,NULL,"12875, 12876, 12877, 12878, 12879",NULL
S2551E,Edward,Brig,Rio Grande,04/21/1829,1829-04-21,NULL,"12882, 12883",NULL
S2552E,Edward,Brig,Rio Grande,05/25/1829,1829-05-25,NULL,"12884, 12885",NULL
S2553E,Eliza,Bark,South of Europe,01/22/1829,1829-01-22,NULL,"12886, 12887, 12888",Signed off in Charleston SC and Trieste
S2554E,Exchange,Schooner,Guadaloupe,03/28/1829,1829-03-28,NULL,"12889, 12890, 12891",NULL
S2555E,Fair American,Brig,Maranham and a market,02/13/1829,1829-02-13,NULL,"12892, 12893",NULL
S2556E,Fair American,Brig,Para and the West Indies,06/02/1829,1829-06-02,NULL,"12894, 12895",NULL
S2557E,Fair American,Brig,Para and a market,10/29/1829,1829-10-29,NULL,"12896, 12897",NULL
S2558E,Fair American,Brig,Para and the West Indies,06/02/1829,1829-06-02,NULL,"12898, 12899",certified in Para (Schooner crossed out)
S2559E,Francis,Ship,India,11/04/1829,1829-11-04,NULL,"12900, 12901",NULL
S2560E,Fairplay,Brig,St. Andrews,11/14/1829,1829-11-14,NULL,"12902, 12903, 12904, 12905",NULL
S2561E,Fawn,Brig,South America,12/05/1829,1829-12-05,NULL,"12906, 12907","note from ""Ship Registers of the Dist. of Salem and Beverly 1789-1900"": [Lost in the Feejees, Aug. 1830…see The Wreck of the Glide.""Boston, 1846 p.73]"
S2564E,Fenelon,Brig,Havana,04/13/1829,1829-04-13,NULL,"12913, 12914, 12919, 12920",04/25/1829 Certification of ship crew all returned
S2565E,Fenelon,Brig,West Indies and a market,07/13/1829,1829-07-13,NULL,"12908, 12915, 12916",NULL
S2566E,Fenelon,Brig,West Indies,12/25/1829,1829-12-25,NULL,"12917, 12918",NULL
S2567E,Fides,Brig,St. Iago de Cuba,06/26/1829,1829-06-26,NULL,"12921, 12922",NULL
S2568E,Francis,Ship,India,11/04/1829,1829-11-04,NULL,"12923, 12924",NULL
S2569E,Fredonia,Schooner,Cape de Verde,10/14/1829,1829-10-14,NULL,"12925, 12926",NULL
S2570E,Garnet,Brig,?,04/12/1829,1829-04-12,NULL,"12927, 12928",certification of vessel returned with all aboard
S2571E,Gazelle,Schooner,Ceara (Brazil),06/10/1829,1829-06-10,NULL,"12929, 12930",NULL
S2572E,Gazelle,Schooner,?,02/14/1829,1829-02-14,NULL,"12931, 12932, 12933",NULL
S2574E,Gazelle,Schooner,Ceara and a market,06/01/1829,1829-06-01,NULL,"12935, 12936",NULL
S2575E,General Brooks,Schooner,S. Iago de Cuba,02/04/1829,1829-02-04,NULL,"12937, 12938, 12941, 12942",NULL
S2576E,General Brooks,Schooner,West Indies (St. Iago),09/12/1829,1829-09-12,NULL,"12939, 12940",NULL
S2577E,General Brooks,Schooner,West Indies,05/30/1829,1829-05-30,NULL,"12943, 12944",NULL
S2580E,Arthur[?],[Schooner],NULL,1804[?],0000-00-00,NULL,"1291, 1292",NULL
S2581E,Betsey,Schooner,Havanna,1804,0000-00-00,88,"1314, 1315, 1316",NULL
S2582E,Margaret,Ship,East Indies,03/22/1805,1805-03-22,295,"2006, 2007, 2008",NULL
S2583E,Martha,Brig,Havana,03/14/1805,1805-03-14,110,"2009, 2010, 2011, 2012, 2013",NULL
S2584E,Martha,Brig,Havana,07/08/1805,1805-07-08,110,"2014, 2016, 2016, 2017, 2018",NULL
S2586E,Mary Ann,Ship,East Indies,04/15/1805,1805-04-15,240,"2023, 2024, 2025, 2026, 2027",NULL
S2587E,Massafuero,Brig,Cuba,06/06/1805,1805-06-06,NULL,"2019, 2020, 2028",NULL
S2588E,Merchant,Ship,Rotterdam,11/13/1805,1805-11-13,243,"2029, 2030, 2031, 2032",of Boston
S2589E,Mercury,Schooner,West Indies [?],03/09/1805,1805-03-09,102,"2033, 2034, 2035",NULL
S2590E,Moses,Brig,Island of Cuba,07/06/1805,1805-07-06,150,"2036, 2037, 2038, 2039",NULL
S2591E,Moses,Brig,Havana,03/14/1805,1805-03-14,150,"2040, 2041, 2042, 2043, 2044",NULL
S2592E,Mount Vernon,Ship,Copenhagen,05/06/1805,1805-05-06,254,"2045, 2046, 2047, 2052, 2053",NULL
S2593E,Mount Vernon,Ship,Leghorn,12/09/1805,1805-12-09,254,"2048, 2049",NULL
S2594E,Mount Vernon,Ship,Calcutta,??/??/1805,0000-00-00,254,"2050, 2051",NULL
S2595E,Nancy,Brig,Marseilles,08/01/1805,1805-08-01,153,"2058, 2059",NULL
S2596E,Nancy,Brig,West Indies,1805?,0000-00-00,159,"2054, 2055",NULL
S2597E,Nancy,Brig,Marseilles,??/??/1805,0000-00-00,NULL,"2056, 2057",NULL
S2598E,Neptune,Schooner,Salem (from Nantes),??/??/1805,0000-00-00,101,"2060, 2061, 2062",NULL
S2599E,Pacific,Brig,Surinam,10/18/1805,1805-10-18,146,"2063, 2064, 2065, 2066, 2067",NULL
S2600E,Pembroke,Ship,Mocha,05/03/1805,1805-05-03,193,"2068, 2069, 2070",NULL
S2601E,Phenix,Brig,Europe,06/01/1805,1805-06-01,150,"2071, 2072",NULL
S2602E,Plymouth,Brigantine,Havana,04/05/1805,1805-04-05,146,"2073, 2074, 2075",NULL
S2603E,Powder Point,Schooner,Lisbon,01/29/1805,1805-01-29,82,"2076, 2077, 2078",NULL
S2604E,Prince,Schooner,"Leghorn, West Indies",12/17/1805,1805-12-17,98,"2081, 2082, 2083",NULL
S2605E,Rachel,Schooner,West Indies,06/19/1805,1805-06-19,71,"2084, 2085, 2086",NULL
S2606E,Rachel,Schooner,West Indies,10/19/1805,1805-10-19,71,"2087, 2088, 2089",NULL
S2607E,Rachel,Schooner,West Indies,02/09/1805,1805-02-09,71,"2090, 2091, 2092",NULL
S2608E,Rajah,Brig,West Indies,01/02/1805,1805-01-02,122,"2093, 2094",NULL
S2609E,Rebecca,Brig,Amsterdam,09/02/1805,1805-09-02,178,"2095, 2096, 2097",NULL
S2610E,Recovery,Ship,Cape Good Hope,??/??/1805,0000-00-00,289,"2101, 2102",NULL
S2611E,Robert,Schooner,West Indies,01/17/1805,1805-01-17,87,"2098, 2099, 2100",NULL
S2612E,Roboreus,Brig,West Indies,04/13/1805,1805-04-13,129,"2103, 2104, 2105",NULL
S2613E,Rover,Brig,Europe,07/18/1805,1805-07-18,204,"2106, 2107, 2108",NULL
S2614E,St. Peter,Schooner,Boston [from Bordeaux],05/09/1805,1805-05-09,NULL,"2109, 2110",NULL
S2620E,Providence,Schooner,Surinam?,1809?,0000-00-00,67,5399,"Vessel of Halifax. List from ""Short List of Men"" submitted at Surinam, 15 Aug. 1809"
S2621E,Adaline,Ship,Europe,1810,0000-00-00,NULL,"5686, 5687",Names of all crew members missing (list mutilated)
S2623E,Anna,Schooner,NULL,05/13/1805,1805-05-13,NULL,"1673, 1674",returned 5/22/1806
S2624E,George & Susan,Brig,Gibraltar & a market,06/12/1817,1817-06-12,NULL,"7301, 7302",Remainder of crew list illegible
S3131E,Fair American,Brig,Para & a market,2/2/1835,1835-02-02,NULL,"17005, 17006, 17007, 17008, 17015, 17016",NULL
S3132E,Fair American,Brig,Para & a market,5/6/1835,1835-05-06,NULL,"17009, 17010, 17011, 17017, 17018",NULL
S3133E,Fair American,Brig,Para & a market,9/18/1835,1835-09-18,NULL,"17012, 17013, 17014, 17019, 17020",NULL
S3134E,Fides,Brig,St. Jago de Cuba,6/20/1835,1835-06-20,NULL,"17021, 17022, 17023, 17024",NULL
S3135E,Fides,Brig,West Indies,9/30/1835,1835-09-30,NULL,"17025, 17026, 17027, 17028",NULL
S3136E,Gazelle,Brig,"St. Pierre, Martinico",4/11/1835,1835-04-11,NULL,"17029, 17030, 17031, 17032, 17033",NULL
S3137E,General Brooks,Brig,St. Jago du Cuba,2/2/1835,1835-02-02,NULL,"17038, 17039, 17040, 17041",NULL
S3138E,General Brooks,Brig,St. Jago du Cuba,5/18/1835,1835-05-18,NULL,"17042, 17043, 17049, 17050",NULL
S3139E,General Brooks,Brig,St. Jago du Cuba,9/23/1835,1835-09-23,NULL,"17044, 17045, 17046, 17047, 17048",NULL
S3140E,General Brooks,Brig,St. Jago du Cuba,1/1/1835,1835-01-01,NULL,"17051, 17052",NULL
S3141E,Generous,Schooner,St. Helena & India,8/29/1835,1835-08-29,NULL,"17053, 17054, 17060, 17061",NULL
S3142E,Generous,Schooner,Para & a market,4/11/1835,1835-04-11,NULL,"17055, 17056, 17057, 17058, 17059",NULL
S3143E,Gentleman,Brig,Para & a market,4/8/1835,1835-04-08,NULL,"17062, 17063, 17064, 17065, 17066",NULL
S3144E,George,Schooner,Para,3/10/1835,1835-03-10,NULL,"17072, 17073",NULL
S3145E,George,Ship,East Indies,6/15/1835,1835-06-15,NULL,"17074, 17075, 17076, 17077, 17078",NULL
S3146E,Gleamer,Brig,Africa,9/23/1835,1835-09-23,NULL,"17079, 17080, 17081, 17082",NULL
S3147E,Heber,Brig,Malaga,7/20/1835,1835-07-20,NULL,"17083, 17084",NULL
S3148E,Hope,Brig,Cayenne,7/25/1835,1835-07-25,NULL,"17085, 17086, 17087, 17088",NULL
S3149E,Josette,Ship,"South Atlantic and elsewhere, on a whaling voyage",5/29/1835,1835-05-29,NULL,"17089, 17090",NULL
S3150E,Leander,Brig,Padang,9/3/1835,1835-09-03,NULL,"17096, 17097, 17098, 17099",NULL
S3151E,Lydia,Ship,"South Atlantic, India & Pacific Oceans",9/21/1835,1835-09-21,NULL,"17100, 17101, 17102, 17103, 17104, 17105",NULL
S3152E,Mac,Schooner,Sydney N S,10/16/1835,1835-10-16,NULL,"17106, 17107, 17108, 17109",NULL
S3153E,Malaga,Brig,Cayenne,1/20/1835,1835-01-20,NULL,"17110, 17111, 17112",NULL
S3154E,Malaga,Brig,St Pierre Martinico,5/26/1835,1835-05-26,NULL,"17113, 17114, 17115, 17116",NULL
S3155E,Malaga,Brig,Cayenne,11/21/1835,1835-11-21,NULL,"17117, 17118, 17119, 17120",NULL
S3156E,Mayflower,Schooner,West Indies,1/0/1835,1835-01-00,NULL,"17121, 17122",NULL
S3157E,Mechanic,Schooner,Pictou (N. S.),9/9/1835,1835-09-09,NULL,"17123, 17124",NULL
S3158E,Mexican,Brig,Matanzas,5/21/1835,1835-05-21,NULL,"17125, 17126",NULL
S3159E,Neptune,Brig,East Indias,5/4/1835,1835-05-04,NULL,"17127, 17128, 17129, 17130",NULL
S3160E,Ocallo,Brig,Puerto Rico,1/1/1835,1835-01-01,120,"17131, 17132",NULL
S3161E,Oscar,Schooner,Martinique,3/12/1835,1835-03-12,NULL,"17133, 17134",NULL
S3162E,Pactolus,Brig,Cayenne,6/29/1835,1835-06-29,NULL,"17135, 17136, 17142, 17143",NULL
S3163E,Pactolus,Brig,Cayenne & a market,12/9/1835,1835-12-09,NULL,"17137, 17138, 17140, 17141",NULL
S3164E,Palestine,Bark,Atlantic & Pacific Oceans on a whaling voyage,11/7/1835,1835-11-07,NULL,"17144, 17145",NULL
S3165E,Palm,Brig,Bombay,1/10/1835,1835-01-10,NULL,"17146, 17147, 17148, 17149",NULL
S3166E,Pamelia,Brig,St. Johns P. R.,5/25/1835,1835-05-25,NULL,"17150, 17151, 17152, 17153",NULL
S3167E,Pamelia,Brig,St. Jago de Cuba,8/24/1835,1835-08-24,NULL,"17155, 17156",NULL
S3168E,Patriot,Brig,Para & a market,4/8/1835,1835-04-08,NULL,"17157, 17158, 17159, 17160, 17161, 17162",NULL
S3169E,Patriot,Brig,Maranham & a market,10/9/1835,1835-10-09,NULL,"17163, 17164",NULL
S3170E,Quill,Brig,East Indies,8/13/1835,1835-08-13,189,"17165, 17166, 17167, 17168, 17169, 17170",NULL
S3171E,Reaper,Bark,South Atlantic & Indian Ocean on a whaling voyage,8/5/1835,1835-08-05,NULL,"17171, 17172, 17173, 17174",NULL
S3172E,Richard,Bark,South Atlantic,10/13/1835,1835-10-13,NULL,"17177, 17178, 17179, 17180",NULL
S3173E,Rising Sun,Brig,Martinque,3/3/1835,1835-03-03,NULL,"17181, 17182",NULL
S3174E,Romp,Brig,St. Pierres,5/11/1835,1835-05-11,NULL,"17183, 17184, 17185, 17186, 17187, 17188",NULL
S3175E,Romp,Brig,St. Thomas,10/8/1835,1835-10-08,NULL,"17189, 17190, 17191, 17192",NULL
S3176E,Salem,Brig,Cayenne & Surinam,7/29/1835,1835-07-29,NULL,"17193, 17194",NULL
S3177E,Sciot,Brig,Africa,2/6/1835,1835-02-06,NULL,"17197, 17198, 17199, 17200",NULL
S3178E,Sciot,Brig,Africa,12/20/1835,1835-12-20,NULL,"17201, 17202, 17203, 17204",NULL
S3179E,Sea Mew,Ship,Africa,6/9/1835,1835-06-09,NULL,"17505, 17506, 17507, 17508",NULL
S3180E,Selina & Jane,Ship,Cape de Verd Island & west Coast of Africa,11/14/1835,1835-11-14,NULL,"17209, 17210, 17211, 17212",NULL
S3181E,Shawmut,Ship,Pernambuco & a market,4/16/1835,1835-04-16,NULL,"17213, 17214, 17215, 17216, 17217",NULL
S3182E,Shawmut,Ship,Africa,8/29/1835,1835-08-29,NULL,"17218, 17219, 17220, 17221, 17222",NULL
S3183E,Shawmut,Brig,St. Jago du Cuba & a market,9/9/1835,1835-09-09,NULL,"17223, 17224, 17725, 17726",NULL
S3184E,Shawmut,Brig,St. Jago du Cuba & a market,11/17/1835,1835-11-17,NULL,"17227, 17228",NULL
S3185E,Shepardess,Ship,East Indies,5/13/1835,1835-05-13,NULL,"17229, 17230",NULL
S3186E,Sumatra,Ship,Canton,9/18/1835,1835-09-18,NULL,"17231, 17232, 17233, 17234, 17235",NULL
S3187E,Susan,Ship,Cayenne,4/2/1835,1835-04-02,NULL,"17236, 17237, 17238, 17239",NULL
S3188E,Susan,Ship,Cayenne,10/13/1835,1835-10-13,NULL,"17240, 17241, 17242, 17243",NULL
S3189E,Tattler,Brig,Cayenne,812/1835,0000-00-00,NULL,"17244, 17245",NULL
S3190E,Thomas Perkins,Brig,India,2/28/1835,1835-02-28,NULL,"17246, 17247, 17248, 17249",NULL
S3191E,Trenton,Bark,Bahia & a market & East Indias,10/10/1835,1835-10-10,NULL,"17250, 17251",NULL
S3192E,Two Sisters,Brig,Para,6/20/1835,1835-06-20,NULL,"17252, 17253, 17254, 17255",NULL
S3193E,Tybee,Ship,East Indies,2/18/1835,1835-02-18,298,"17256, 17257, 17258, 17259",NULL
S3194E,Virginia,Brig,Cayenne,1/17/1835,1835-01-17,NULL,"17260, 17261, 17271, 17272",NULL
S3195E,Virginia,Brig,Cayenne,12/1/1835,1835-12-01,NULL,"17262, 17263, 17267, 17268",NULL
S3196E,Virginia,Brig,Cayenne,5/19/1835,1835-05-19,NULL,"17264, 17265, 17266, 17269, 17270",NULL
S3197E,Waverly,Brig,Mocha,6/19/1835,1835-06-19,NULL,"17273, 17274",NULL
S3198E,William Penn,Schooner,Gibralter,4/13/1835,1835-04-13,NULL,"17280, 17281, 17283",NULL
S3199E,William Penn,Schooner,Para & a market,6/6/1835,1835-06-06,NULL,"17284, 17285, 17286, 17287, 17288",NULL
S3200E,William J. Henry,Ship,East Indies,11/21/1835,1835-11-21,NULL,"17289, 17290",NULL
S3201E,Abby M,Brig,Cape de Verds & Buenos Ayres,10/6/1836,1836-10-06,NULL,"17292, 17293, 17294, 17295, 17296, 17297",NULL
S3202E,Active,Bark,Africa,12/10/1836,1836-12-10,NULL,"17298, 17299, 17300, 17301",NULL
S3203E,Active,Bark,Sydney (N. S.),8/15/1836,1836-08-15,NULL,"17302, 17303, 17304, 17305",NULL
S3204E,Amethyst,Brig,Maranham,6/28/1836,1836-06-28,NULL,"17306, 17307, 17308, 17311, 17312",NULL
S3205E,Amethyst,Brig,Permanbuco & a market,3/11/1836,1836-03-11,NULL,"17309, 17310, 17317, 17318, 17319",NULL
S3206E,Amethyst,Brig,Maranham & a market,10/25/1836,1836-10-25,NULL,"17313, 17314",NULL
S3207E,Brookline,Ship,India,4/24/1836,1836-04-24,NULL,"17315, 17316",NULL
S3208E,Chalcedony,Bark,Para & a market,9/3/1836,1836-09-03,NULL,"17320, 17321, 17322, 17323, 17324",NULL
S3209E,Cherokee,Brig,East Indies,4/24/1836,1836-04-24,NULL,"17325, 17326",NULL
S3210E,Deborah,Brig,Cayenne,3/7/1836,1836-03-07,NULL,"17336, 17337, 17342, 17343, 17344",NULL
S3211E,Deborah,Brig,Cayenne,9/27/1836,1836-09-27,NULL,"17338, 17339, 17340, 17341",NULL
S3212E,Dollar,Schooner,Africa,9/13/1836,1836-09-13,NULL,"17344, 17345, 17346, 17447",NULL
S3213E,Eagle,Schooner,The Brazils,4/11/1836,1836-04-11,NULL,"17348, 17349, 17350, 17355, 17356",NULL
S3214E,Eagle,Brig,Para & a market,9/3/1836,1836-09-03,NULL,"17351, 17352, 17353, 17354",NULL
S3215E,Eclipse,Ship,India,12/7/1836,1836-12-07,NULL,"17357, 17358, 17359, 17360",NULL
S3216E,Eliza,Bark,India,3/16/1836,1836-03-16,NULL,"17361, 17362, 17363, 17364",NULL
S3217E,Elizabeth,Ship,Pacific Ocean on a whaling voyage,11/2/1836,1836-11-02,NULL,"17365, 17366, 17370, 17371",NULL
S3218E,Elizabeth,Brig,Africa,5/10/1836,1836-05-10,NULL,"17367, 17368, 17369, 17376, 17377",NULL
S3219E,Elizabeth,Schooner,"Pictou, N. S.",7/16/1836,1836-07-16,NULL,"17372, 17373, 17374, 17375",NULL
S3220E,Emeline,Brig,Whaling voyage,3/26/1836,1836-03-26,NULL,"17378, 17379, 17380, 17381",NULL
S3221E,Emerald,Bark,"Atlantic, Indian Pacific Ocean",7/9/1836,1836-07-09,NULL,"17382, 17383, 17384, 17385",NULL
S3222E,Fair American,Brig,Buenos Ayres & a market,9/3/1836,1836-09-03,NULL,"17386, 17387, 17391, 17392",NULL
S3223E,Fair American,Brig,Pernambuco & a market,3/25/1836,1836-03-25,NULL,"17388, 17389, 17390, 17393, 17394",NULL
S3224E,Fides,Brig,St. Jago de Cuba,6/14/1836,1836-06-14,NULL,"17395, 17396, 17399, 173400",NULL
S3225E,Francis,Ship,Sumatra,1/5/1836,1836-01-05,NULL,"17401, 17402, 17403, 17404",NULL
S3226E,Franklin,Schooner,Whaling voyage,4/6/18326,1832-04-06,NULL,"17405, 17406, 17407, 17408",NULL
S3227E,Ganges,Schooner,Sydney N S,7/23/1836,1836-07-23,NULL,"17409, 17410",NULL
S3228E,Gentleman,Bark,Maranham & a market,9/9/1836,1836-09-09,NULL,"17441, 17442, 17445, 17446, 17447",NULL
S3229E,Gentleman,Bark,Antwerp,3/15/1836,1836-03-15,NULL,"17443, 17444, 17448, 17449",NULL
S3230E,George,Ship,Calcutta,8/4/1836,1836-08-04,NULL,"17450, 17451, 17452, 17453, 17454",NULL
S3231E,Gleamer,Brig,Africa,12/23/1836,1836-12-23,NULL,"17455, 17456",NULL
S3232E,Governor Endicott,Bark,Valparaiso,4/19/1836,1836-04-19,NULL,"17458, 17459, 17460, 17461, 17462",NULL
S3233E,Governor Endicott,Bark,Sumatra,12/19/1836,1836-12-19,NULL,"17457, 17463, 17464",NULL
S3234E,Hope,Brig,Cayenne,3/25/1836,1836-03-25,NULL,"17469, 17470, 17471, 17472, 17473",NULL
S3235E,Leander,Brig,Antwerp,5/19/1836,1836-05-19,NULL,"17476, 17477, 17478, 17483, 17484",NULL
S3236E,Leander,Brig,India,9/9/1836,1836-09-09,NULL,"17479, 17480, 17481, 17482",NULL
S3237E,Lotus,Ship,Leghorn,6/3/1836,1836-06-03,NULL,"17485, 17486, 17487, 17488",NULL
S3238E,Mac,Schooner,Atlantic & adjacent Seas on a Whaling Voyage,4/21/1836,1836-04-21,NULL,"17489, 17490",NULL
S3239E,Malaga,Brig,Maranham & a market,6/30/1836,1836-06-30,NULL,"17491, 17492, 17493, 17494, 17495",NULL
S3240E,Mary Ann,Schooner,Jamaica,12/12/1836,1836-12-12,NULL,"17496, 17497",NULL
S3241E,Mary Dacre,Brig,West Coast of Africa,8/25/1836,1836-08-25,NULL,"17498, 17499, 17500, 17501",NULL
S3242E,Mechanic,Schooner,Sydney N B,8/26/1836,1836-08-26,NULL,"174502, 174503",NULL
S3243E,Mercator,Brig,Maranham & a market,4/11/1836,1836-04-11,NULL,"17504, 17405, 17511, 17512, 17513",NULL
S3244E,Mermaid,Brig,Pacific Ocean,9/30/1836,1836-09-30,NULL,"17514, 17515, 17516, 17517",NULL
S3245E,Mexican,Brig,Copenhagen & St. Petersburg,3/7/1836,1836-03-07,NULL,"17522, 17523",NULL
S3246E,Mexico,Schooner,Sydney,10/7/1836,1836-10-07,81 44/95,"17524, 17525, 17526, 17527",NULL
S3247E,Mount Wollaston,Ship,Atlantic & Indian Oceans,6/28/1836,1836-06-28,NULL,"17528, 17529, 17530, 17531",NULL
S3248E,Neptune,Bark,East Indies,8/22/1836,1836-08-22,NULL,"17532, 17533, 17534, 17535",NULL
S3249E,Neptune,Bark,Cowes,4/22/1836,1836-04-22,NULL,"17536, 17537",NULL
S3250E,Nereus,Brig,East Indies,6/21/1836,1836-06-21,182,"17538, 17539, 17540, 17541",NULL
S3251E,Olinda,Brig,Pernambuco & a market,4/5/1836,1836-04-05,NULL,"17542, 17543",NULL
S3252E,Olinda,Brig,St. Johns,11/14/1836,1836-11-14,NULL,"17544, 17545, 17546, 17547",NULL
S3253E,Pactolus,Brig,Cayenne,11/15/1836,1836-11-15,NULL,"17548, 17549, 17552, 17553",NULL
S3254E,Pactolus,Brig,Cayenne,4/29/1836,1836-04-29,NULL,"17550, 17551, 17554, 17555",NULL
S3255E,Pamelia,Brig,St. Jago de Cuba & a market,6/3/1836,1836-06-03,NULL,"17556, 17557, 17563, 17564",NULL
S3256E,Pamelia,Brig,St. Jago,10/28/1836,1836-10-28,NULL,"17558, 17559",NULL
S3257E,Patriot,Brig,Maranham & a market,3/18/1836,1836-03-18,NULL,"17560, 17561, 17562, 17567, 17568",NULL
S3258E,Patriot,Brig,Para & a market,8/6/1836,1836-08-06,NULL,"17565, 17566",NULL
S3259E,Richmond,Brig,Madagascar & a market,5/11/1836,1836-05-11,NULL,"17574, 17575, 17576, 17577",NULL
S3260E,Romp,Brig,Porto Rico,1/16/1836,1836-01-16,NULL,"17578, 17579",NULL
S3261E,Gazelle,Brig,Martinique,2/15/1836,1836-02-15,NULL,"17411, 17412",NULL
S3262E,Gem,Schooner,St. Michael & a market,8/25/1836,1836-08-25,NULL,"17417, 17418, 17419, 17420, 17421, 17422",NULL
S3263E,Generous,Brig,East Indies,10/27/1836,1836-10-27,NULL,"17423, 17424, 17439, 17440",NULL
S3264E,General Brooks,Brig,St. Jago de Cuba,7/18/1836,1836-07-18,NULL,"17425, 17426, 17431, 17432, 17433, 17435",NULL
S3265E,General Brooks,Brig,St. Jago de Cuba,4/11/1836,1836-04-11,NULL,"17427, 17428, 17434",NULL
S3266E,General Brooks,Brig,St. Jago de Cuba,12/3/1836,1836-12-03,NULL,"17429, 17430",NULL
S3267E,General Brooks,Brig,St. Jago de Cuba,1/1/1836,1836-01-01,NULL,"17436, 17437, 17438",NULL
S3268E,Salem,Brig,Cayenne,6/16/1836,1836-06-16,NULL,"17580, 17581, 17582, 17583",NULL
S3269E,Sam Wright,Ship,Atlantic & Pacific Oceans,11/24/1836,1836-11-24,NULL,"17584, 17585",NULL
S3270E,Sciot,Brig,Africa,12/9/1836,1836-12-09,NULL,"17592, 17593, 17594, 17595",NULL
S3271E,Selina & Jane,Brig,Permanbuco & a market,12/2/1836,1836-12-02,NULL,"17600, 17601, 17602, 17603, 17604",NULL
S3272E,Shawmut,Brig,Trieste and a market,7/16/1836,1836-07-16,NULL,"17605, 17606, 17616, 17617",NULL
S3273E,Shawmut,Brig,Africa,5/23/1836,1836-05-23,NULL,"17607, 17608, 17614, 17615",NULL
S3274E,Shawmut,Brig,Paraiba & a market in Brazils,3/19/1836,1836-03-19,NULL,"17609, 17610, 17611, 17612, 17613",NULL
S3275E,Statesman,Bark,Pacific Ocean on a whaling voyage,12/20/1836,1836-12-20,NULL,"17618, 17619, 17620, 17621",NULL
S3276E,Susan,Brig,Cayenne & Surinam,5/4/1836,1836-05-04,NULL,"17622, 17623, 17626, 17627",NULL
S3277E,Susan,Brig,Cayenne,11/19/1836,1836-11-19,NULL,"17624, 17625",NULL
S3278E,Tattler,Brig,Cayenne,1/27/1836,1836-01-27,NULL,"17628, 17629, 17630, 17631",NULL
S3279E,Thomas Perkins,Brig,India,6/13/1836,1836-06-13,NULL,"17632, 17633",NULL
S3280E,Tybee,Ship,East Indies,5/4/1836,1836-05-04,300,"17634, 17635",NULL
S3281E,William & Henry,Ship,Surinam,12/24/1836,1836-12-24,NULL,"17641, 17642, 17643, 17644",NULL
S3282E,William Penn,Brig,Maranham & a market,2/25/1836,1836-02-25,NULL,"17651, 17652, 17653, 17654, 17655",NULL
S3283E,Abby M,Brig,St. Johns & Brazil,10/23/1836,1836-10-23,NULL,"17661, 17662, 17663, 17664",NULL
S3284E,Amethyst,Brig,Maranham & a market,8/2/1837,1837-08-02,NULL,"17667, 17668, 17674, 17675",NULL
S3285E,Amethyst,Brig,Para & a market,2/25/1837,1837-02-25,NULL,"17669, 17670, 17671, 17672, 17673",NULL
S3286E,Amethyst,Brig,Maranham & a market,12/15/1837,1837-12-15,NULL,"17676, 17677",NULL
S3287E,Augustus,Ship,Copenhagen & a market,5/19/1837,1837-05-19,247,"17678, 17679, 17680, 17681",NULL
S3288E,Brenda,Ship,Bahia & a market,11/1/1837,1837-11-01,NULL,"17694, 17695, 17696",NULL
S3289E,Brookline,Ship,Valparaiso & a market,6/26/1837,1837-06-26,NULL,"17697, 17698",NULL
S3290E,Carthage,Ship,Havana,5/17/1837,1837-05-17,NULL,"17699, 17700, 17701, 17702, 17703, 17704",NULL
S3291E,Carthage,Ship,St. Petersburg,8/10/1837,1837-08-10,NULL,"17705, 17706",NULL
S3292E,Cavalier,Bark,Atlantic & Indian Ocean,7/71837,0000-00-00,NULL,"17707, 17708, 17709, 17710",NULL
S3293E,Ceres,Brig,Pictou,5/13/1837,1837-05-13,NULL,"17713, 17714, 17715, 17716",NULL
S3294E,Ceres,Brig,Pictou,9/28/1837,1837-09-28,NULL,"17717, 17718",NULL
S3295E,Chalecdony,Bark,Buenos Ayres & a market,3/7/1837,1837-03-07,NULL,"17719, 17720",NULL
S3296E,Chalecdony,Bark,Cape de Verds & Buenos Ayres,9/20/1837,1837-09-20,NULL,"17721, 17722, 17723, 17724",NULL
S3297E,Cherokee,Brig,Majunga in Madagascar,3/6/1837,1837-03-06,NULL,"17725, 17726, 17727, 17728",NULL
S3298E,Cipher,Brig,Cape de Verdi Islands,7/29/1837,1837-07-29,NULL,"17729, 17730, 17731, 17732, 17733",NULL
S3299E,Criterion,Brig,Para & a market,8/30/1837,1837-08-30,NULL,"17734, 17735",NULL
S3300E,Curlew,Brig,Island of Cuba,12/9/1837,1837-12-09,NULL,"17736, 17737",NULL
S3301E,Deborah,Brig,Cayenne,9/18/1837,1837-09-18,NULL,"17738, 17739, 17740, 17741",NULL
S3302E,Derby,Bark,Indian Ocean,7/12/1837,1837-07-12,NULL,"17742, 17743",NULL
S3303E,Duxbury,Ship,Antwerp,5/10/1837,1837-05-10,NULL,"17744, 17745, 17746",NULL
S3304E,Eclipse,Ship,Batavia,7/1/1837,1837-07-01,NULL,"17751, 17752",NULL
S3305E,Eliza,Bark,Cayenne,9/26/1837,1837-09-26,NULL,"17753, 17754, 17755, 17756",NULL
S3306E,Elizabeth,Brig,Africa,4/19/1837,1837-04-19,NULL,"17757, 17758, 17759, 17760",NULL
S3307E,Emeline,Brig,Atlantic Ocean,9/4/1837,1837-09-04,NULL,"17761, 17762, 17763, 17764",NULL
S3308E,Emerald,Brig,Sydney,5/17/1837,1837-05-17,NULL,"17765, 17766",NULL
S3309E,Fair American,Brig,Rio de Janiero and a market,12/16/1837,1837-12-16,NULL,"17767, 17768, 17769, 17770",NULL
S3310E,Fair American,Brig,Monte Video & a market,3/30/1837,1837-03-30,NULL,"17771, 17772, 17773, 17774, 17775",NULL
S3311E,Fides,Brig,St Jago de Cuba,3/9/1837,1837-03-09,NULL,"17776, 17777",NULL
S3312E,Fides,Brig,St Jago de Cuba,6/12/1837,1837-06-12,NULL,"17778, 17779, 17780, 17781",NULL
S3313E,Fides,Brig,St Jago de Cuba,9/23/1837,1837-09-23,NULL,"17782, 17783",NULL
S3314E,Franklin,Schooner,Atlantic Ocean,5/25/1837,1837-05-25,NULL,"17784, 17785, 17786, 17787",NULL
S3315E,Gazelle,Brig,Guadaloupe,4/8/1837,1837-04-08,NULL,"17790, 17791, 17792, 17793",NULL
S3316E,Gazelle,Brig,"St. Pierre, Quad?, Martinico?",9/28/1837,1837-09-28,NULL,"17794, 17795, 17796, 17797",NULL
S3317E,General Brooks,Brig,St. Jago de Cuba,12/3/1837,1837-12-03,NULL,"17798, 17799",NULL
S3318E,General Brooks,Brig,St. Jago de Cuba,8/28/1837,1837-08-28,NULL,"17802, 17803, 17806, 17807",NULL
S3319E,Gentlemen,Bark,Sydney,7/7/1837,1837-07-07,NULL,"17808, 17809, 17810, 17811",NULL
S3320E,George,Ship,Pernambuco & a market,9/21/1837,1837-09-21,NULL,"17812, 17813",NULL
S3321E,Henry,Bark,Cape de Verds & So. America,11/13/1837,1837-11-13,NULL,"17814, 17815, 17816, 17817",NULL
S3322E,Herald,Brig,Africa,12/20/1837,1837-12-20,NULL,"17818, 17819, 17820, 17821",NULL
S3323E,Hope,Brig,Cayenne,3/4/1837,1837-03-04,NULL,"17822, 17823, 17826, 17827",NULL
S3324E,Hope,Brig,Cayenne & a market,8/18/1836,1836-08-18,NULL,"17824, 17825",NULL
S3325E,Hope,Brig,Cayenne,8/11/1837,1837-08-11,NULL,"17828, 17829, 17830, 17831",NULL
S3326E,Jozette,Ship,Atlantic India & Pacific Ocean ….. For whaling,10/14/1837,1837-10-14,NULL,"17832, 17833",NULL
S3327E,James Maury,Ship,"Atlantic, Indian and Pacific Oceans",7/5/1837,1837-07-05,NULL,"17834, 17835",NULL
S3328E,Joseph Peabody,Brig,Africa,9/16/1837,1837-09-16,NULL,"17836, 17837, 17838, 17839",NULL
S3329E,Lydia,Ship,"Atlantic, India & Pacific Oceans for …… whaling",12/19/1837,1837-12-19,NULL,"17840, 17841, 17847, 17848",NULL
S3330E,Leander,Brig,Matanzas,9/2/1837,1837-09-02,NULL,"17842, 17843, 17844, 17845, 17846",NULL
S3331E,Mac,Schooner,Atlantic on a whaling voyage and back to Salem,5/23/1837,1837-05-23,NULL,"17849, 17850",NULL
S3332E,Malay,Bark,Indian Ocean on a whaling voyage,5/19/1837,1837-05-19,NULL,"17853, 17854",NULL
S3333E,Malaga,Brig,Africa,6/12/1837,1837-06-12,NULL,"17855, 17856, 17857, 17858",NULL
S3334E,Mary Dacre,Brig,West Coast of Africa,8/29/1837,1837-08-29,NULL,"17859, 17860",NULL
S3335E,Mercator,Brig,St. Jago de Cuba,7/20/1837,1837-07-20,NULL,"17861, 17861, 117861, 17862, 17863, 17864",NULL
S3336E,Mercator,Brig,Para & a market in Brazil,10/21/1837,1837-10-21,NULL,"17865, 17866, 17867, 17868",NULL
S3337E,Mexican,Brig,Copenhagen,4/11/1837,1837-04-11,NULL,"17869, 17870, 17875, 17876",NULL
S3338E,Mexican,Brig,Matanzas,8/11/1837,1837-08-11,NULL,"17871, 17872, 17873, 17874",NULL
S3339E,Maples,Ship,Batavia,4/6/1837,1837-04-06,NULL,"17877, 17878",NULL
S3340E,Nereus,Brig,Pernambuco & a market,6/19/1837,1837-06-19,181,"17879, 17880, 17881, 17882",NULL
S3341E,Olinda,Brig,Antwerp,6/19/1837,1837-06-19,NULL,"17885, 17886, 18409, 18410",NULL
S3342E,Pactolus,Brig,Cuba,4/19/1837,1837-04-19,NULL,"17887, 17888",NULL
S3343E,Pactolus,Brig,Cayenne,7/18/1837,1837-07-18,NULL,"17889, 17890, 17893, 17894",NULL
S3344E,Pactolus,Brig,Cayenne,12/6/1837,1837-12-06,NULL,"17891, 17892, 17895, 17896",NULL
S3345E,Mary Helen,Brig,St. Jago de Cuba,7/13/1842,1842-07-13,NULL,"35008, 35009, 35010, 35011",NULL
S3346E,Mary Helen,Brig,St. Jago de Cuba,4/19/1842,1842-04-19,NULL,"35012, 35013, 35014, 35015",NULL
S3347E,Mary Helen,Brig,St. Jago de Cuba,1/22/1842,1842-01-22,NULL,"35016, 35017, 35018, 35019",NULL
S3348E,Mary Helen,Brig,Cayenne,11/1/1842,1842-11-01,NULL,"35020, 35021, 35022, 35023",NULL
S3349E,Mermaid,Brig,St Helena & Africa,11/1/1842,1842-11-01,NULL,"35026, 35027, 35028, 25029",NULL
S3350E,Naumkeag,Schooner,Africa,3/26/1842,1842-03-26,NULL,"35033, 35034, 35035, 35036",NULL
S3351E,New Jersey,Ship,Calcutta,1/23/1842,1842-01-23,NULL,"35041, 35042, 35043, 35044",NULL
S3352E,Northumberland,Brig,Rio Grande & a market,7/20/1842,1842-07-20,NULL,"35050, 35051, 35052, 35053, 35054",NULL
S3353E,Olinda,Brig,St Johns,7/15/1842,1842-07-15,NULL,"35055, 35056, 35057, 35058",NULL
S3354E,Oregon,Brig,Africa,3/23/1842,1842-03-23,NULL,"35059, 35060",NULL
S3355E,Oriental,Brig,Cape Verd Islands & a market,8/6/1842,1842-08-06,NULL,"35061, 35062, 35063, 35064, 35065",NULL
S3356E,Pactolus,Brig,Cayenne,5/21/1842,1842-05-21,NULL,"35066, 35067, 35068, 35069",NULL
S3357E,Pamelia,Brig,Buenos Ayres & a Market,12/19/1842,1842-12-19,NULL,"35076, 35077",NULL
S3358E,Reaper,Bark,Africa,12/13/1842,1842-12-13,NULL,"35084, 35085, 35086, 35087",NULL
S3359E,Richmond,Brig,India,2/23/1842,1842-02-23,NULL,"35088, 35089, 35090, 35091",NULL
S3360E,Roanoke,Schooner,St. George N B,8/27/1842,1842-08-27,NULL,"35092, 35093",NULL
S3361E,Roanoke,Schooner,St. George N B,9/17/1842,1842-09-17,NULL,"35094, 35095, 35096, 35097",NULL
S3362E,Rolla,Brig,India,6/11/1842,1842-06-11,NULL,"35098, 35099, 35100, 35101",NULL
S3363E,Rome,Ship,East Indies,1/8/1842,1842-01-08,NULL,"35102, 35103",NULL
S3364E,Romp,Brig,Cayenne to port of discharge in U. States,3/11/1842,1842-03-11,NULL,"35104, 35105",NULL
S3365E,Romp,Brig,Cayenne So. America,5/21/1842,1842-05-21,NULL,"35106, 35107",NULL
S3366E,Romp,Brig,Cayenne,10/4/1842,1842-10-04,NULL,"35108, 35109, 35110, 35111",NULL
S3367E,Roxanna,Brig,Para & a market,3/18/1842,1842-03-18,NULL,"35112, 35113, 35114, 35115",NULL
S3368E,Roxanna,Brig,Para & a market,8/12/1842,1842-08-12,NULL,"35116, 35117, 35118, 35119, 35120",NULL
S3369E,Roxanna,Brig,Para & a market,12/23/1842,1842-12-23,NULL,"35121, 35122, 35123, 35124, 35125",NULL
S3370E,Salem,Brig,Cape de Verds & a market,9/7/1842,1842-09-07,NULL,"35126, 35127, 35128, 35129",NULL
S3371E,Sea Mew,Ship,Africa,10/26/1842,1842-10-26,NULL,"35145, 35146, 35147, 35148",NULL
S3372E,Star,Bark,Zanzebar,1/11/1842,1842-01-11,NULL,"35149, 35150, 35151, 35152",NULL
S3373E,Statesman,Bark,Pacific Ocean,4/16/1842,1842-04-16,NULL,"35153, 35154",NULL
S3374E,Sumatra,Ship,India,10/31/1842,1842-10-31,NULL,"35155, 35156, 35157, 35158",NULL
S3375E,Susan,Brig,Guadaloupe,10/4/1842,1842-10-04,NULL,"35159, 35160",NULL
S3376E,Susan,Brig,West Indies,2/22/11842,1184-02-22,NULL,"35161, 35162",NULL
S3377E,Three Brothers,Bark,South America,9/15/1842,1842-09-15,NULL,"35171, 35172, 35173, 35174, 35175",NULL
S3378E,Fremont,Schooner,Pictou N. S.,6/17/1842,1842-06-17,NULL,"35180, 35181, 35182, 35183",NULL
S3379E,Vintage,Brig,Montevideo & a market,11/4/1842,1842-11-04,NULL,"35191, 35192, 35193, 35194, 35195, 35196",NULL
S3380E,Active,Bark,Africa,3/4/1843,1843-03-04,NULL,"35198, 35199",NULL
S3381E,Ann Maria,Ship,India,8/5/1843,1843-08-05,NULL,"35202, 35203",NULL
S3382E,Atlantic,Schooner,St Johns Porto Rico,5/17/1843,1843-05-17,NULL,"35204, 35205",NULL
S3383E,Bevis,Bark,Rio Grande,7/3/1843,1843-07-03,NULL,"35206, 35207, 35208, 35209, 35210, 35211",NULL
S3384E,Boreno,Schooner,St Peters,8/12/1843,1843-08-12,NULL,"35212, 35213",NULL
S3385E,Boston,Schooner,West Indies Brazil & Coast of Africa,5/30/1843,1843-05-30,NULL,"35214, 35215",NULL
S3386E,Boxer,Brig,Maranham & a market,5/13/1843,1843-05-13,NULL,"35220, 35221, 35222, 35223, 35224",NULL
S3387E,Boxer,Brig,China,9/30/1843,1843-09-30,NULL,"35225, 35226",NULL
S3388E,Brenda,Bark,Zanzebar,1/31/1843,1843-01-31,NULL,"35227, 35228, 35231, 35232",NULL
S3389E,Brookline,Ship,Manila,5/22/1843,1843-05-22,NULL,"35229, 35230",NULL
S3390E,Caroline Augusta,Ship,India,1/4/1843,1843-01-04,NULL,"35233, 35234",NULL
S3391E,Cavalier,Bark,Zanzebar,10/10/1843,1843-10-10,NULL,"35235, 35236, 35237, 35238",NULL
S3392E,Ceylon,Brig,Africa,6/19/1843,1843-06-19,NULL,"35239, 35240, 35241, 35242",NULL
S3393E,Chalcedony,Bark,Buenos Ayres,11/3/1843,1843-11-03,NULL,"35243, 35244, 35252, 35253",NULL
S3394E,Chalcedony,Bark,Buenos Ayres & a market,4/1/1843,1843-04-01,NULL,"35245, 35246, 35247, 35248, 35249, 35250, 35251",NULL
S3395E,Cherokee,Brig,Zanzebar,10/27/1843,1843-10-27,NULL,"35254, 35255, 35260, 35261",NULL
S3396E,Cherokee,Brig,Buenos Ayres & a market,4/4/1843,1843-04-04,NULL,"35256, 35257, 35258, 35259",NULL
S3397E,Deposit,Brig,Para & a market,3/24/1843,1843-03-24,NULL,"35264, 35265, 35266, 35267, 35268",NULL
S3398E,Deposit,Brig,Maranham & a market,6/23/1843,1843-06-23,NULL,"35269, 35270, 35271, 35272, 35273",NULL
S3399E,Deposit,Brig,Para & a market,10/2/1843,1843-10-02,NULL,"35274, 35275, 35276, 35277, 35278",NULL
S3400E,Dromo,Bark,Surinam,9/12/1843,1843-09-12,NULL,"35279, 35280",NULL
S3401E,Eagle,Brig,Para & a market,9/12/1843,1843-09-12,NULL,"35281, 35282, 35283, 35284",NULL
S3402E,Eagle,Brig,Rio Grande & a market,7/27/1843,1843-07-27,NULL,"35285, 35286, 35287, 35288, 35289",NULL
S3403E,Eagle,Brig,Rio Grande,12/30/1843,1843-12-30,NULL,"35290, 35291, 35292, 35293, 35294, 35295",NULL
S3404E,Eclipse,Ship,Sumatra,10/31/1843,1843-10-31,NULL,"35296, 35297, 35303, 35304",NULL
S3405E,Eclipse,Ship,Havana,3/25/1843,1843-03-25,NULL,"35298, 35299, 35300, 35301, 35302",NULL
S3406E,Edward Burley,Schooner,Africa,12/14/1843,1843-12-14,NULL,"35305, 35306, 35307, 35308",NULL
S3407E,Eliza,Bark,India,5/12/1843,1843-05-12,NULL,"35309, 35310, 35311, 35212",NULL
S3408E,Elizabeth,Brig,Africa,7/22/1843,1843-07-22,NULL,"35313, 35314, 35315, 35316",NULL
S3409E,Ellen,Schooner,Africa,5/20/1843,1843-05-20,NULL,"35317, 35318",NULL
S3410E,Ganges,Brig,Rio Grande & a market,10/12/1843,1843-10-12,NULL,"35323, 35324",NULL
S3411E,Gazelle,Brig,Montevideo,5/18/1843,1843-05-18,NULL,"35325, 35326, 35327, 35328, 35329, 35330",NULL
S3412E,Gazelle,Brig,W. C.? Africa,11/8/1843,1843-11-08,198,"35331, 35332",NULL
S3413E,General Brooks,Brig,St. Jago de Cuba,1/26/1843,1843-01-26,NULL,"35333, 35334, 35335",NULL
S3414E,General Brooks,Brig,St. Jago de Cuba,8/8/1843,1843-08-08,NULL,"35338, 35339",NULL
S3415E,Granite,Brig,Cayenne,7/7/1843,1843-07-07,NULL,"35344, 35345, 35346, 35347",NULL
S3416E,Hamilton,Brig,Africa,4/12/1843,1843-04-12,NULL,"35348, 35349, 35742, 35743",NULL
S3417E,Herald,Brig,Africa,5/20/1843,1843-05-20,NULL,"35354, 35355, 35356, 35357",NULL
S3418E,Jozette,Bark,Montevideo,9/5/1843,1843-09-05,NULL,"35358, 35359",NULL
S3419E,King Phillip,Bark,Buenos Ayres & a market,4/20/1843,1843-04-20,NULL,"35360, 35361, 35362, 35363, 35364",NULL
S3420E,King Phillip,Bark,Montevideo,12/2/1843,1843-12-02,NULL,"35365, 35366, 35367, 35368, 35369",NULL
S3421E,Leander,Brig,Africa,7/7/1843,1843-07-07,NULL,"35370, 35371, 35372, 35373",NULL
S3422E,Lubec,Brig,West Indies,1/16/1843,1843-01-16,NULL,"35374, 35375",NULL
S3423E,Lubec,Brig,Gaudeloup and a market,10/26/1843,1843-10-26,NULL,"35384, 35385",NULL
S3424E,Malaga,Brig,Coast of Africa,5/10/1843,1843-05-10,NULL,"35386, 35387",NULL
S3425E,Malaga,Brig,Africa,10/28/1843,1843-10-28,NULL,"35388, 35389, 35390, 35391",NULL
S3426E,Marion,Brig,Maranham,2/10/1843,1843-02-10,NULL,"35392, 35393",NULL
S3427E,Mary Helen,Brig,St. Jago de Cuba,4/12/1843,1843-04-12,NULL,"35394, 35395, 35396, 35397",NULL
S3428E,Mary Helen,Brig,Cayenne,8/2/1843,1843-08-02,NULL,"35398, 35399, 35400, 35401",NULL
S3429E,Mary Paulina,Brig,Africa,12/1/1843,1843-12-01,192,"35402, 35403",NULL
S3430E,Mermaid,Brig,Rio Grande,8/23/1843,1843-08-23,NULL,"35404, 35405, 35406, 35407, 35408",NULL
S3431E,Naumkeag,Schooner,Aracaty & a Market,4/13/1843,1843-04-13,NULL,"35409, 35410, 35411, 35412, 35413",NULL
S3432E,Naumkeag,Schooner,Aracaty Brazil,9/20/1843,1843-09-20,NULL,"35414, 35415",NULL
S3433E,Nereus,Brig,Cayenne South America,11/9/1843,1843-11-09,NULL,"35416, 35417",NULL
S3434E,New Jersey,Ship,East Indies,1/19/1843,1843-01-19,NULL,"35418, 35419",NULL
S3435E,Northlumberland,Brig,Rio Grande & a market,2/1/1843,1843-02-01,NULL,"35420, 35421, 35422, 35423",NULL
S3436E,Northlumberland,Brig,Para & a market,5/31/1843,1843-05-31,NULL,"35424, 35425, 35426, 35427",NULL
S3437E,Olinda,Brig,Montevideo,4/17/1843,1843-04-17,NULL,"35432, 35433, 35434, 35435",NULL
S3438E,Olinda,Brig,Buenos Ayres,12/25/1843,1843-12-25,NULL,"35436, 35437, 35438, 35439",NULL
S3439E,Oregon,Brig,Africa,3/25/1843,1843-03-25,NULL,"35440, 35441, 35442, 35443",NULL
S3440E,Oregon,Brig,Africa,12/5/1843,1843-12-05,NULL,"35444, 35445, 35446, 35447",NULL
S3441E,Oriental,Brig,West Coast of Africa,7/22/1843,1843-07-22,NULL,"35448, 35449, 35450, 35451",NULL
S3442E,Ortho,Brig,Cape Verde & a market,8/18/1843,1843-08-18,132,"35452, 35453, 35454, 35455, 35456",NULL
S3443E,Pactolus,Brig,Cayenne,4/17/1843,1843-04-17,NULL,"35457, 35458, 35459, 35460",NULL
S3444E,Pactolus,Brig,Cayenne,9/13/1843,1843-09-13,NULL,"35461, 35462",NULL
S3445E,Palestine,Bark,St. Jago de Cuba,1/7/1843,1843-01-07,NULL,"35463, 35464, 35465, 35466",NULL
S3446E,Perseverance,Brig,Gaudeloup?,3/23/1843,1843-03-23,176,"35467, 35468, 35469, 35470",NULL
S3447E,Perseverance,Brig,Gaudeloup,10/31/1843,1843-10-31,176,"35471, 35472",NULL
S3448E,Rattler,Brig,Zanzebar,8/9/1843,1843-08-09,NULL,"35473, 35474, 35475, 35476",NULL
S3449E,Reaper,Bark,Africa,9/11/1843,1843-09-11,NULL,"35477, 35478, 35479, 35480",NULL
S3450E,Richmond,Brig,Ports and Parts in India,6/10/1843,1843-06-10,NULL,"35481, 35482, 35483, 35484",NULL
S3451E,Rolla,Brig,India,1/31/1843,1843-01-31,NULL,"35485, 35486, 35487, 35488",NULL
S3452E,Romp,Brig,Cayenne,2/22/1843,1843-02-22,NULL,"35489, 35490, 35491, 35492",NULL
S3453E,Romp,Brig,Cayenne,6/1/1843,1843-06-01,NULL,"35493, 35494, 35495, 35496",NULL
S3454E,Romp,Brig,Cayenne,10/31/1843,1843-10-31,NULL,"35497, 35498, 35499, 35500, 35501",NULL
S3455E,Rosabella,Bark,Buenos Ayres & a market,4/16/1843,1843-04-16,NULL,"35501, 35502",NULL
S3456E,Roxana,Brig,Para,4/29/1843,1843-04-29,NULL,"35503, 35504, 35505, 35506, 35507",NULL
S3457E,Roxana,Brig,Maranham?& a market,7/25/1843,1843-07-25,NULL,"35508, 35509, 35510, 33511, 33512",NULL
S3458E,Roxana,Brig,Para & a market,11/16/1943,11/16/1943,NULL,"35513, 35514",NULL
S3459E,St. Paul,Ship,Manila,1/26/1843,1843-01-26,NULL,"35515, 35516",NULL
S3460E,Salem,Brig,Surinam,7/27/1843,1843-07-27,NULL,"35517, 35518",NULL
S3461E,Star,Bark,East Indies,4/28/1843,1843-04-28,NULL,"35521, 35522, 35523, 35524",NULL
S3462E,Susan,Brig,Cape de Verds & a Market,9/30/1843,1843-09-30,NULL,"35525, 35526, 35527, 35528",NULL
S3463E,Teaser,Schooner,Trinidad (Cuba),12/22/1843,1843-12-22,NULL,"35529, 35530",NULL
S3464E,Three Brothers,Bark,South America,6/3/1843,1843-06-03,NULL,"35531, 35532, 35533, 35534, 35535",NULL
S3465E,Tigris,Brig,Africa,2/9/1843,1843-02-09,NULL,"35536, 35537",NULL
S3466E,Tigris,Brig,Africa,9/9/1843,1843-09-09,NULL,"35538, 35539",NULL
S3467E,Vintage,Brig,Africa,6/27/1843,1843-06-27,NULL,"35540, 35541, 35542, 35543",NULL
S3468E,Active,Bark,Africa,3/26/1844,1844-03-26,NULL,"35548, 33549, 33550, 33551",NULL
S3469E,H. H. Cole,Schooner,Africa,3/1/1844,1844-03-01,NULL,"35552, 35553",NULL
S3470E,Brenda,Bark,India,4/23/1844,1844-04-23,NULL,"35565, 35566, 35567",NULL
S3471E,Carolina,Ship,India,5/30/1844,1844-05-30,NULL,"35568, 35569, 35570",NULL
S3472E,Ceylon,Brig,West Coast of Africa,3/15/1844,1844-03-15,NULL,"35582, 35583, 35586, 35587",NULL
S3473E,Ceylon,Brig,West Coast of Africa,10/22/1844,1844-10-22,NULL,"35584, 35585, 35588, 35589, 35590",NULL
S3474E,Chalcedony,Bark,Buenos Ayres & a market,5/11/1844,1844-05-11,NULL,"35593, 35594, 35598, 35599",NULL
S3475E,Commissary,Brig,East India,2/24/1844,1844-02-24,NULL,"35600, 35601",NULL
S3476E,Cynthia,Bark,Cape of Good Hope,12/5/1844,1844-12-05,NULL,"35607, 35608",NULL
S3477E,Deposit,Brig,Para & a market,3/30/1844,1844-03-30,NULL,"35609, 35610, 35611, 35624, 35625",NULL
S3478E,Deposit,Brig,Para & a market,1/6/1844,1844-01-06,NULL,"35612, 35613, 35614, 35626, 35627",NULL
S3479E,Deposit,Brig,Para & a market,12/20/1844,1844-12-20,NULL,"35615, 35616, 35617, 35620, 35621",NULL
S3480E,Deposit,Brig,Para & a market,9/20/1844,1844-09-20,NULL,"35618, 35619, 35631, 35632, 35633",NULL
S3481E,Deposit,Brig,Para & a market,6/18/1844,1844-06-18,NULL,"35622, 35623, 35628, 35629, 35630",NULL
S3482E,Dromo,Bark,Surinam,2/5/1844,1844-02-05,NULL,"35634, 35635, 35636, 35641, 35642",NULL
S3483E,Dromo,Bark,"Cayenne, S. A.",8/29/1844,1844-08-29,NULL,"35637, 35638, 35639, 35640",NULL
S3484E,Eagle,Brig,Rio Grande,7/20/1844,1844-07-20,NULL,"35643, 35644, 35650, 35651, 35652",NULL
S3485E,Eagle,Brig,Rio Grande,12/27/1844,1844-12-27,NULL,"35645, 35646, 35647, 35648, 35649",NULL
S3486E,Edwin,Schooner,Guadeloupe,3/29/1844,1844-03-29,NULL,"35655, 35656, 35657, 35658",NULL
S3487E,Elisa,Bark,India,5/21/1844,1844-05-21,NULL,"35659, 35660, 35661, 35662",NULL
S3488E,Elizabeth,Brig,Port or Ports in the Pacific Ocean & India,9/9/1844,1844-09-09,NULL,"35663, 35664",NULL
S3489E,Emily Wilder,Bark,East Indies,8/29/1844,1844-08-29,NULL,"35685, 35686",NULL
S3490E,Enterprise,Brig,South America,12/31/1844,1844-12-31,NULL,"35687, 35688, 35689, 35690",NULL
S3491E,Gambia,Brig,Fegee Island,6/24/1844,1844-06-24,NULL,"35695, 35696, 35697, 35698",NULL
S3492E,Gazelle,Brig,St Peirres,6/5/1844,1844-06-05,NULL,"35701, 35702, 25709, 35710",NULL
S3493E,Gazelle,Brig,Martenico,2/26/1844,1844-02-26,NULL,"35703, 35704, 35705, 35706",NULL
S3494E,Gazelle,Brig,Cayenne,12/21/1844,1844-12-21,NULL,"35707, 35708, 35711, 35712",NULL
S3495E,General Brooks,Brig,St Jago de Cuba,9/6/1844,1844-09-06,NULL,"35713, 35714, 35719, 35720",NULL
S3496E,General Brooks,Brig,St Jago de Cuba,10/7/1844,1844-10-07,NULL,"35715, 35716",NULL
S3497E,General Brooks,Brig,St Jago de Cuba,1/19/1844,1844-01-19,NULL,"35717, 35718, 35723, 35724",NULL
S3498E,General Brooks,Brig,St Jago de Cuba,5/22/1844,1844-05-22,NULL,"35721, 35722, 35725, 35726",NULL
S3499E,Granite,Brig,Port or Ports in Brazil,6/14/1844,1844-06-14,NULL,"35727, 35728, 35734, 35735",NULL
S3500E,Granite,Brig,Maranham,10/28/1844,1844-10-28,NULL,"35729, 35730, 35731, 35736, 35737",NULL
S3501E,Granite,Brig,Cayenne,1/22/1844,1844-01-22,NULL,"35732, 35733, 35738, 35739",NULL
S3502E,Hamilton,Brig,West Coast of Alfrica,9/24/1844,1844-09-24,NULL,"35740, 35741, 35748, 35749",NULL
S3503E,Hamilton,Brig,Africa,3/6/1844,1844-03-06,NULL,"35744, 35745, 35746, 35747",NULL
S3504E,Henry,Brig,Africa,8/17/1844,1844-08-17,NULL,"35750, 35751, 35752",NULL
S3505E,Herald,Brig,Africa,3/19/1844,1844-03-19,NULL,"35753, 35754",NULL
S3506E,Izette,Bark,River la Plata and a market.,8/31/1844,1844-08-31,NULL,"35755, 35756",NULL
S3507E,Leander,Brig,Africa,3/26/1844,1844-03-26,NULL,"35763, 35764, 35765, 35766",NULL
S3508E,Lucilla,Brig,Sumatra,12/9/1844,1844-12-09,NULL,"35770, 35771",NULL
S3509E,Mary Helen,Brig,Cayenne,7/17/1844,1844-07-17,NULL,"35775, 35776, 35779, 35780",NULL
S3510E,Mary Helen,Brig,St. Jago de Cuba,4/20/1844,1844-04-20,NULL,"35777, 35778",NULL
S3511E,Mermaid,Brig,Rio Grande,5/18/1844,1844-05-18,NULL,"35781, 35782, 35783, 35784, 35785",NULL
S3512E,Mermaid,Brig,Rio Grande,11/23/1844,1844-11-23,NULL,"35786, 35787, 35688, 35789, 35790",NULL
S3513E,Mount Wollaston,Bark,Monte Video & a market,1/1/1844,1844-01-01,NULL,"35791, 35792, 35793, 35794",NULL
S3514E,Naumkeag,Schooner,Pemambuco,10/18/1844,1844-10-18,NULL,"35795, 35796, 35797, 35801, 35802",NULL
S3515E,Naumkeag,Schooner,Aracaty,3/6/1844,1844-03-06,NULL,"35803, 35804, 35807, 35808, 35809",NULL
S3516E,Naumkeag,Schooner,Aracaty,6/21/1844,1844-06-21,NULL,"35798, 35799, 35800, 35805, 35806",NULL
S3517E,Nereus,Brig,Cayenne,11/7/1844,1844-11-07,NULL,"35810, 35811",NULL
S3518E,Northumberland,Brig,West Coast of Africa,10/25/1844,1844-10-25,NULL,"35816, 35817, 35818, 35819",NULL
S3519E,Olinda,Brig,Buenos Ayres & a market,9/11/1844,1844-09-11,NULL,"35820, 35821, 35822, 35823",NULL
S3520E,Orb,Bark,East Indies,10/22/1844,1844-10-22,NULL,"35824, 35825, 35826, 35827",NULL
S3521E,Orb,Bark,Rio Grande,4/5/1844,1844-04-05,NULL,"35828, 35829, 35830",NULL
S3522E,Oregon,Brig,Africa,1/8/1844,1844-01-08,NULL,"35831, 35832, 35837, 35838",NULL
S3523E,Oregon,Brig,Africa,9/30/1844,1844-09-30,NULL,"35833, 35834, 35835, 35836",NULL
S3524E,Oriental,Brig,West Cost of Africa,10/9/1844,1844-10-09,NULL,"35839, 35940, 35841, 35842",NULL
S3525E,Otho,Brig,Cape de Verde & a market,1/31/1844,1844-01-31,NULL,"35847, 35848, 35851, 35852",NULL
S3526E,Otho,Brig,Cape de Verde & a market,1/31/1844,1844-01-31,NULL,"35849, 35850, 35853, 35854",NULL
S3527E,Pactolus,Brig,East Indies,5/11/1844,1844-05-11,NULL,"35855, 35856",NULL
S3528E,Rattler,Brig,East Indies,11/2/1844,1844-11-02,NULL,"35857, 35858, 35859, 35860",NULL
S3529E,Reaper,Bark,Africa,12/31/1844,1844-12-31,NULL,"35861, 35862, 35863, 35864",NULL
S3530E,Reaper,Bark,Africa,5/10/1844,1844-05-10,NULL,"35865, 35866, 35867, 35868",NULL
S3531E,Retreive,Brig,"Cape de Verds, Rio Grande",8/14/1844,1844-08-14,NULL,"35869, 35870, 35871, 35872, 35873",NULL
S3532E,Richmond,Schooner,Pictou N. Scotia,5/18/1844,1844-05-18,NULL,"35874, 35875",NULL
S3533E,Rolla,Brig,Africa,2/22/1844,1844-02-22,NULL,"35876, 35877, 35882, 35883",NULL
S3534E,Rolla,Brig,Africa,12/21/1844,1844-12-21,NULL,"35878, 35879, 35880, 35881",NULL
S3535E,Romp,Brig,Cayenne,3/16/1844,1844-03-16,NULL,"35884, 35885, 35890, 35891",NULL
S3536E,Romp,Brig,Cayenne,8/22/1844,1844-08-22,NULL,"35886, 35887, 35888, 35889",NULL
S3537E,Rosabella,Bark,Buenos Ayres and a market,2/15/1844,1844-02-15,NULL,"35897, 35898, 35899, 35900, 35901",NULL
S3538E,Russell,Brig,Rio Grande,10/17/1844,1844-10-17,NULL,"35904, 35905, 35906",NULL
S3539E,St. Paul,Ship,Manilla,4/19/1844,1844-04-19,NULL,"35912, 35913, 35914, 35915",NULL
S3540E,Sebago,Brig,West Indies,5/22/1844,1844-05-22,NULL,"35920, 35921",NULL
S3541E,Sophia,Schooner,Maranham,3/13/1844,1844-03-13,NULL,"35922, 35923, 35924, 35929, 35930",NULL
S3542E,Sophia,Schooner,Para & a market,12/16/1844,1844-12-16,NULL,"35925, 35926, 35933, 35934, 39535",NULL
S3543E,Sophia,Schooner,Para & a market,9/10/1844,1844-09-10,NULL,"35927, 35928, 35939, 35940",NULL
S3544E,Sophia,Schooner,Para & a market,6/15/1844,1844-06-15,NULL,"35931, 35932, 35936, 35937, 35938",NULL
S3545E,Star,Bark,Zanebar,5/14/1844,1844-05-14,NULL,"35941, 35942, 35943, 35944",NULL
S3546E,Susan,Brig,Bangor & Gaudeloupe,9/18/1844,1844-09-18,164,"35947, 35948",NULL
S3547E,Three Brothers,Bark,India,5/30/1844,1844-05-30,NULL,"35949, 35950, 35951, 35952",NULL
S3548E,Tigris,Brig,Africa,6/11/1844,1844-06-11,NULL,"35953, 35954, 35955, 35956, 35957",NULL
S3549E,Timothy Pickering,Brig,West coast of Africa,10/2/1844,1844-10-02,NULL,"35958, 35959, 35962, 35963",NULL
S3550E,Timothy Pickering,Brig,"Bathurst, Africa",1/31/1844,1844-01-31,NULL,"35960, 35961",NULL
S3551E,Vintage,Brig,Africa,10/18/1844,1844-10-18,NULL,"35968, 35969, 35970, 35971",NULL
S3552E,William Schroder,Bark,India,6/28/1844,1844-06-28,NULL,"35972, 35973, 35974, 35975",NULL
S3553E,Zaine,Brig,Brazil,2/3/1844,1844-02-03,NULL,"35976, 35977 35987, 35988, 35989",NULL
S3554E,Zaine,Brig,Para & a market,5/30/1844,1844-05-30,NULL,"35978, 35979, 35980, 35981",NULL
S3555E,Zaine,Brig,Para & a market,10/21/1844,1844-10-21,NULL,"35982, 35983, 35984, 35985, 35986",NULL
S3556E,Lotoff,Bark,Ports in the Pacific Ocean,7/19/1844,1844-07-19,NULL,"35990, 35991",NULL
S3557E,Naumkeag,Schooner,Africa,9/6/1842,1842-09-06,NULL,"35037, 35038, 35039, 35040",4 unnamed seaman shipped in place of those that did not return.
S3558E,William Penn,Brig,Maranham & a market,6/3/1836,1836-06-03,NULL,"17648, 17649, 17650, 17658",7 men all told. No guns. No passengers.
S3559E,Boxer,Brig,Maranham & a market,1/25/1843,1843-01-25,NULL,"35216, 35217, 35218, 35219",All returned except for one unnamed person.
S3560E,Henry,Bark,Havanna & Europe,4/12/1836,1836-04-12,NULL,"17465, 17466, 17467, 17468",Appears crew name between Barney and Henney not listed.
S3561E,Remittance,Brig,Pernambuco & a market,6/17/1835,1835-06-17,NULL,"17175, 17176",Brig sold in port of Haranham 15 Sep 1835 & crew legally discharged.
S3562E,Sea Mew,Bark,Africa,2/2/1844,1844-02-02,NULL,"35916, 35917, 35918, 35919","Captain's note. Four crew left at Ambrig & Brought 7 men including himself into port.
Vessel's note unclear."
S3563E,Rosabella,Bark,Buenos Ayres and a market,9/13/1844,1844-09-13,NULL,"35892, 35893, 35894, 35895, 35896",Conflicting sailing dates - 9/14/1844 also cited.
S3564E,Virginia,Brig,Pernambuco & a market,6/2/1836,1836-06-02,NULL,"17636, 17637, 17638, 17639, 17640","Consul certifies on 28 November 1836, vessel sold at Pernambuko, and crew paid according to law."
S3565E,Lotos,Ship,Genoa,11/27/1844,1844-11-27,NULL,"35767, 35768, 35769",Crew list is nearly illegible.
S3566E,Gazelle,Brig,St. Jago de Cuba,8/20/1836,1836-08-20,NULL,"17413, 17414, 17415, 17416",Crew list nearly illegible.
S3567E,Oriental,Brig,West Cost of Africa,5/14/1844,1844-05-14,NULL,"35843, 35844, 35845, 35846",Crew list notes include different ages for crew.
S3568E,America,Brig,West Indies & a Market,11/1/1843,1843-11-01,NULL,"35200, 35201",Crew nearly illegible.
S3569E,Caroline Augustus,Ship,Sumatra,6/10/1844,1844-06-10,NULL,"35571, 35572, 35573, 35574, 35575, 35576, 35577, 35578, 35579, 35580, 35581","David Pingee, Owner. Detailed Consul's note regarding crew."
S3570E,Augustus,Ship,Brazils & Sydney & New South Wales,11/3/1837,1837-11-03,242,"17682, 17683, 17684, 17685",Descrepenancy in crew list.
S3571E,Roxanna,Schooner,?,4/2/1844,1844-04-02,NULL,"35902, 35903",Destination illegible.
S3572E,Gazelle,Brig,?,10/17/1835,1835-10-17,NULL,"17034, 17035, 17036, 17037",Destination not given.
S3573E,Salem,Brig,?,12/30/1835,1835-12-30,NULL,"17195, 17196",Destination not given.
S3574E,Pactolus,Brig,?,NULL,0000-00-00,NULL,17139,Destination not given. Crew list missing.
S3575E,Saxon,Ship,?,6/4/1836,1836-06-04,NULL,"17590, 17591",Destination not given. No crew list.
S3576E,Granite,Brig,Cayenne,2/21/1843,1843-02-21,NULL,"35340, 35341, 35342, 35343","Differences in residences for Florena, Stevens, Morse, Shields.
Passengers -Napoleon Bynantha Jerome, Mrs. Jerome and three children, and ""Slave of Mrs. Jerome.""
Also, passenger Jospeh Waren Fabens."
S3577E,Pactolus,Brig,South America,9/3/1842,1842-09-03,NULL,"35070, 35071, 35072, 35073",Four passengers from Cayenne to Martinique.
S3578E,Lubec,Brig,Gaudaloup,4/15/1843,1843-04-15,NULL,"35376, 35377, 35378, 35379",Image #35374 & 35375 state master's name as John Campbell.
S3579E,Lubec,Brig,"Bangor, Maine & West Indies",7/7/1843,1843-07-07,NULL,"35380, 35381, 35382, 35382, 35383",Image #35382 master's name as John Campbell.
S3580E,Chalcedony,Bark,Buenos Ayres & a market,10/22/1844,1844-10-22,NULL,"35591, 35592, 35595, 35596, 35597",Image #35596. John E. A. Todd listed as master. D. S. Kenedy? Listed as master in error?
S3581E,Fides,Brig,St. Jago de Cuba,9/17/1836,1836-09-17,NULL,"17397, 17398",Image 17397 nearly illegible.
S3582E,Cuba,Bark,Africa,6/19/1844,1844-06-19,NULL,"35602, 35603, 35604, 35605, 35606",Image 35603. Consul's notes illegible.
S3583E,Lotos,Ship,Maranham & a market,6/13/1836,1836-06-13,NULL,17659,Image out of chronological order and crew list missing.
S3584E,Emerald,Bark,Whaling Voyage,9/2/1843,1843-09-02,NULL,"35319, 35320","In ""of what country, citizen or subjects"", crew's name of state was entered. Records adjusted accordingly."
S3585E,Eagle,Brig,South Atlantic,4/18/1837,1837-04-18,NULL,"17747, 17748, 17749, 17750","Names noted with "" * "" are listed as ""Bark's crew."" Vessel [bark] unnamed."
S3586E,Fairfield,Schooner,New York,12/14/1844,1844-12-14,100,"35693, 35694",No crew list.
S3587E,Cavalier,Bark,South Atlantic & Indian Ocean Whaling,NULL,0000-00-00,NULL,"17711, 17712",No date for departure.
S3588E,William Penn,Brig,Maranham & a market,10/30/1835,1835-10-30,NULL,"17275, 17276, 17277, 17278, 17279",No guns. No Passengers. Specie to be cleared.
S3589E,William Penn,Brig,Para & a market,10/8/1836,1836-10-08,NULL,"17645, 17646, 17647, 17656, 17657",No guns. No Passengers. 7 men all told.
S3590E,Helen Gray,Schooner,Sydney N S,8/7/1843,1843-08-07,NULL,"35350, 35351, 35352, 35353",of Addison. Image #34353 receipt for certification of papers and invoice.
S3591E,Zaine,Brig,Maranham & a market,9/16/1843,1843-09-16,NULL,"35544, 35545, 35546",of Baltimore.
S3592E,Gallio,Brig,Cape de Verds,8/6/1844,1844-08-06,NULL,"35699, 35700",of Belfast.
S3593E,Mechanic,Schooner,"St. George, NZ?",11/29/1842,1842-11-29,NULL,"35024, 35025",of Beverly
S3594E,Albert,Schooner,Marygalanto,1/18/1837,1837-01-18,NULL,"17665, 17666",of Beverly.
S3595E,Borneo,Schooner,St. Peters,6/26/1844,1844-06-26,NULL,"35559, 35560",of Beverly.
S3596E,Boston,Schooner,"W. Indies, Brazil",5/30/1844,1844-05-30,NULL,"35561, 35562, 35563, 35564",of Boston.
S3597E,Saratoga,Schooner,Maderia?,4/2/1842,1842-04-02,NULL,"35136, 35137, 35138",of Boston. Unclear if Alexander Smith or Reuben Buese is master of vessel.
S3598E,Factor,Brig,St. George N. B.,10/17/1844,1844-10-17,NULL,"35691, 35692",of Cranbery Isle.
S3599E,New York,Schooner,Meramechi,5/23/1837,1837-05-23,NULL,"17883, 17884",of Dennis?
S3600E,Sarah,Schooner,St Helena & a market,7/18/1842,1842-07-18,NULL,"35130, 35131, 35132, 35133, 35134, 35135",of Gloucester.
S3601E,Constitution,Schooner,Syndey Cape Breton,5/3/1843,1843-05-03,NULL,"35262, 35263",of Marblehead.
S3602E,Essex,Brig,Amsterdam,7/19/1843,1843-07-19,NULL,"35321, 35322",of Newburyport.
S3603E,Ark,Brig,Matanzas?,1/20/1844,1844-01-20,NULL,"35554, 35555, 35556",of Newburyport.
S3604E,Athens,Brig,Bremen,6/26/1844,1844-06-26,NULL,"35557, 35558",of Newburyport.
S3605E,Magnolia,Brig,Cuba,11/28/1837,1837-11-28,NULL,"17851, 17852",of Portland
S3606E,Sebago,Brig,?,5/3/1843,1843-05-03,NULL,"35519, 35520",of Portland. Destination not given.
S3607E,Ganges,Schooner,Sydney,6/14/1837,1837-06-14,NULL,"17788, 17789",of Woolwich.
S3608E,Gentleman,Brig,Para & a market,8/28/1835,1835-08-28,NULL,"17067, 17068, 17069, 17070, 17071","One gun, no passengers. Owned by Ed ?2? J Fallen."
S3609E,Timothy Pickering,Brig,Bissau & Rio N?,4/20/1844,1844-04-20,NULL,"35964, 35965, 35966, 35967",One unnamed crew did not return. Brought 2 passengers.
S3610E,Tigris,Brig,Africa,5/12/1842,1842-05-12,NULL,"35176, 35177, 35178, 35179",One unnamed Portuguese passenger.
S3611E,Quill,Brig,Bahia,10/24/1836,1836-10-24,NULL,"17569, 17570, 17571, 17572, 17573",One unnamed seaman passenger.
S3612E,Lotos,Ship,Not given.,NULL,0000-00-00,NULL,"35772, 35773, 35774",Original crew list from Salem missing. Destination and departure date not given.
S3613E,Syren,Brig,Montevideo,9/3/1842,1842-09-03,NULL,"35163, 35164, 35165, 35166, 35167, 35168, 35169, 35170","Owned by Caleb Smith. Condemmed at Montevideo in 1843 per ""Ship Registers of the District of Salem & Beverly, Massachusetts, 1789-1900."" Published The Essex Institute, 1906."
S3614E,Curlew,Brig,Maranham & a market,12/12/1836,1836-12-12,NULL,"17331, 17332, 17333, 17334, 17335","Owned by E? H? Allen.
No guns. One unidentified passenger."
S3615E,Cipher,Brig,Cape de Verds & a market,11/26/1836,1836-11-26,NULL,"17327, 17328, 17329, 17330","Passenger, name unknown."
S3616E,Hope,Brig,Cayenne & a Market,8/18/1836,1836-08-18,NULL,"17474, 17475",Possibly another crew member but illegible.
S3617E,Susan,Brig,"Cherifield (Cherryfield), Me., to West Indies",11/13/1844,1844-11-13,NULL,"35945, 35946",Sailing port in Maine unidentified.
S3618E,Bengal,Ship,Atlantic & Indian Oceans on a whaling voyage,11/4/1837,1837-11-04,NULL,"17686, 17687, 17681, 17682, 18922","Salem boarding officer states 5 crew did not return, and most likely have an ""x"" in front of the name."
S3619E,Sea Mew,Ship,South America & a Market,2/16/1842,1842-02-16,NULL,"35139, 35140, 35141, 35142, 35143, 35144",See image # 35143 for wages.
S3620E,Eclipse,Ship,Marseilles,10/26/1844,1844-10-26,NULL,"35653, 35654",Some crew country or subject entered as Salem. Corrected to read USA.
S3621E,Northumberland,Brig,Brazil,4/12/1842,1842-04-12,NULL,"35045, 35046, 35047, 35048, 35049",Three unnamed passengers.
S3622E,Northlumberland,Brig,West Coast of Africa,10/6/1843,1843-10-06,NULL,"35428, 35429, 35430, 35431",Three unnamed passengers.
S3623E,Nereus,Brig,Cayenne in South America,5/25/1844,1844-05-25,NULL,"35812, 35813, 35814, 35815",Two unnamed passengers.
S3624E,Rattler,Brig,Zanzebar,11/10/1842,1842-11-10,NULL,"35080, 35081, 35082, 35083",Two unnamed passengers. One gun.
S3625E,Sea Mew,Ship,Africa,6/6/1836,1836-06-06,NULL,"17596, 17597, 17598, 17599","U. S. Consul for Province of Paia, on 20th March 1837, certified that vessel, owned by D. Pingru, Esq was sold to above government."
S3626E,Sapphire,Ship,Pacific Ocean,6/1/7/1836,6/1/2007,NULL,"17586, 17587, 17688, 17589","Unable to identify Henry H. Smith, or which crew was transferred to Henry H. Smith"
S3627E,General Brooks,Brig,St. Jago de Cuba,5/15/1837,1837-05-15,NULL,"17800, 17801, 17804, 17805",Unclear if crew Robert Katrun & Jacob Malony were on voyage dated 5/15/1837 or 8/28/1837.
S3628E,Brazil,Bark,Cuba,3/7/1837,1837-03-07,NULL,"17690, 17691, 17692, 17693",Unnamed foreigners taken aboard to replaced discharged and deserted crew.
S3629E,Mexican,Brig,Matanzas,9/28/1836,1836-09-28,NULL,"17518, 17519, 17520, 17521",Unnamed Seaman Passenger put on board by American Consul at Leghorn.
S3630E,Pamelia,Brig,Africa,2/12/1842,1842-02-12,NULL,"35074, 35075, 35078, 35079",Unnamed seaman shipped in Cape Miossarado.
S3631E,King Phillip,Bark,Buenos Ayres & a market,6/18/1844,1844-06-18,NULL,"35758, 35759, 35760, 35761, 35762",Vessel condemmed & sold Buenos Ayres 12/18/1844. Crew paid off according to law.
S3634E,Vigilant,Schooner,Valparaiso and a Market,5/26/1842,1842-05-26,NULL,"35184, 35185, 35186, 35187, 35188, 35189, 35190","Vessel purchased U.S.Gov't, registered 5/26/1842 and sold in Montevideo in 1842 per ""Ship Registers of the District of Salem & Beverly, Massachusetts, 1789-1900."" Published byThe Essex Institute, 1906.
Richard Usher master for the term of six ? [Image"
S3635E,Lady Sarah,Brig,Maranham & a market,6/3/1835,1835-06-03,NULL,"17091, 17092 17093, 17094, 17095",Vessel sold in Maranham? & crew legally discharged.
S3636E,Nabob,Brig,?,4/26/1842,1842-04-26,NULL,"35030, 35031, 35032","Vessel wrecked on English Bank & abandoned. Crew, whose names are marked with astresik, were taken under Consul's protection at Montvideo."
S3637E,Russell,Brig,Rio Grande South America,3/14/1844,1844-03-14,NULL,"35907, 35908, 35909, 35910, 35911","William Green, 2d mat of Brig Orb, transferred to Brig Russell. Samuel Leech 2d mate of Brig Russell transferred to Brig Ord as 2d mate."
S3638E,Elizabeth,Ship,Pacific Ocean & elsewhere,12/16/1844,1844-12-16,NULL,"35666, 35667, 35668, 35669, 35670, 35671, 35672, 35673, 35674, 35675, 35676, 35677, 35678, 35679, 35680, 35681, 35682, 35683, 35684","Vessel departed 12/16/1844, most likely returned 5/16/1848."
S3639E,Sally,Schooner,West Indies,11/04/1805,1805-11-04,59,"2111, 2112, 2113, 2114, 2115",NULL
S3640E,Sally,Brig,India,10/04/1805,1805-10-04,160,"2116, 2117, 2118, 2121, 2122",NULL
S3641E,Sally,Sloop,Havana,06/11/1805,1805-06-11,181,"2119, 2120, 2128, 2129",NULL
S3642E,Sally,Schooner,West Indies,05/21/1805,1805-05-21,59,"2123, 2124, 2125",NULL
S3643E,Sally & Betsy,Brig,Shelburn?,02/22/1805,1805-02-22,100,"2126, 2127",NULL
S3644E,Saucy Jack,Schooner,Dominco,04/22/1805,1805-04-22,90,"2130, 2131, 2132",NULL
S3645E,Restitution,Ship,Lisbon,12/07/1805,1805-12-07,NULL,"2133, 2134",NULL
S3646E,Saucy Jack,Schooner,Bordeaux,08/07/1805,1805-08-07,90,"2135, 2136",NULL
S3647E,Success,Schooner,West Indies,10/12/1805,1805-10-12,105,"2137, 2138, 2139, 2140, 2141",NULL
S3648E,Success,Schooner,Europe,06/20/1805,1805-06-20,93,"2142, 2143, 2144",NULL
S3649E,Success,Schooner,West Indies,01/19/1805,1805-01-19,105,"2145, 2146, 2147",NULL
S3650E,Success,Schooner,West Indies,02/23/1805,1805-02-23,92,"2150, 2151, 2152",NULL
S3651E,Sukey,Brig,East India,09/10/1805,1805-09-10,145,"2153, 2154, 2155, 2156",NULL
S3652E,Sukey & Betsy,Brig,Corunna,04/19/1805,1805-04-19,120,"2157, 2158, 2159, 2160, 2161",NULL
S3653E,Susannah,Schooner,"Barbardos[from Wilmington, NC]",03/11/1805,1805-03-11,NULL,"2162, 2163",NULL
S3654E,Susanna,Schooner,Martinique,10/19/1805,1805-10-19,120,"2164, 2165, 2166",NULL
S3655E,Swan,Schooner,Europe,06/07/1805,1805-06-07,107 23/95,"2167, 2168, 2169",NULL
S3656E,Telemachus,Brig,East Indies,08/01/1805,1805-08-01,133,"2170, 2171, 2172",NULL
S3657E,Telemachus,Brig,Europe,01/26/1805,1805-01-26,NULL,"2173, 2174, 2175",NULL
S3658E,Thomas,Schooner,West Indies,07/31/1805,1805-07-31,65,"2176, 2177, 2178",NULL
S3659E,Three Brothers,Schooner,Bellisle & France & Europe,05/15/1805,1805-05-15,74,"2179, 2180, 2181",Vessel of Manchester
S3660E,Trent,Ship,Gibralter,07/20/1805,1805-07-20,131,"2184, 2183, 2185",NULL
S3661E,Trial,Brig,Martinique,08/13/1805,1805-08-13,NULL,"2186, 2187",NULL
S3662E,Trial,Brig,West Indies,04/20/1805,1805-04-20,147,"2189, 2188, 2190",NULL
S3663E,Two Friends,Schooner,Beverly [from Bordeaux],03/27/1805,1805-03-27,NULL,"2191, 2192",NULL
S3664E,Two Sisters,Schooner,Martinique,08/12/1805,1805-08-12,68,"2194, 2193",Of Beverly
S3665E,Two Sisters,Schooner,Havana,03/27/1805,1805-03-27,68,"2195, 2196, 2197, 2198",Of Beverly
S3666E,Two Sons,Ship,East Indies,04/25/1805,1805-04-25,210,"2200, 2199, 2201",NULL
S3667E,Union,Schooner,West Indies,12/16/1805,1805-12-16,100,"2202, 2203, 2204",NULL
S3668E,Union,Schooner,West Indies,05/01/1805,1805-05-01,109,"2256, 2206, 2207",NULL
S3669E,Union,Schooner,Trinidad,10/25/1805,1805-10-25,102,"2210, 2208, 2209, 2211",NULL
S3670E,Union,Schooner,St. Lucia,04/13/1805,1805-04-13,99,"2212, 2213, 2214",NULL
S3671E,Union,Schooner,Trindad,10/25/1805,1805-10-25,101,"2215, 2216",NULL
S3672E,Union,Schooner,West Indies,12/28/1805,1805-12-28,109,"2217, 2218, 2219, 2222, 2223",NULL
S3673E,Vengeance,Brig,Bilboa,03/07/1805,1805-03-07,NULL,"2224, 2225",NULL
S3674E,Union,Ship,Europe,04/16/1805,1805-04-16,250,"2226, 2227, 2228",NULL
S3675E,Victory,Schooner,West Indies,09/17/1805,1805-09-17,120,"2231, 2232, 2233",NULL
S3676E,Victory,Schooner,"St. Thomas [from Wilmington, N.C.]",05/16/1805,1805-05-16,NULL,"2234, 2235",NULL
S3677E,Washington,Schooner,St. Lucia,12/23/1805,1805-12-23,133,"2236, 2237, 2244, 2246",Of Salem
S3678E,Washington,Schooner,West Indies,07/24/1805,1805-07-24,143,"2239, 2238, 2240",Of Salem
S3679E,Washington,Brig,Europe,04/24/1805,1805-04-24,178,"2241, 2242, 2243",NULL
S3680E,Washington,Brig,East Indies,02/25/1804,1804-02-25,178,"2247, 2248, 2249",NULL
S3681E,William,Schooner,Bilboa,10/30/1805,1805-10-30,79,"2250, 2251",NULL
S3682E,William & Charles,Brig,Copenhagen,05/21/1805,1805-05-21,161,"2256, 2255, 2256, 2257",NULL
S3683E,William,Brig,Alicante,04/25/1805,1805-04-25,178,"2252, 2253, 2260, 2261, 2262",NULL
S3684E,Adventure,Ship,India,11/10/1804,1804-11-10,184,"2263, 2264, 2266, 2267",Master's name not given. Vessel returned to New York April 1806.
S3685E,Alexander Hodgdon,Ship,Sumatra,09/16/1806,1806-09-16,377,"2268, 2269",NULL
S3686E,Alert,Sloop,St. Bartholomews,12/06/1806,1806-12-06,59,"2270, 2271",NULL
S3687E,Alfred,Ship,Leghorn,07/03/1806,1806-07-03,260,"2272, 2273, 2274, 2275, 2276",NULL
S3688E,Alfred,Schooner,West Indies,10/09/1806,1806-10-09,75,"2277, 2278",NULL
S3689E,America,Ship,Leghorn,11/29/1806,1806-11-29,473,"2279, 2280, 2281, 2282",NULL
S3690E,Angler,Schooner,NULL,05/16/1806,1806-05-16,96,"2283, 2284, 2285",Remaining portion of original page missing.
S3691E,Angler,Schooner,Spain,12/09/1806,1806-12-09,99,"2284, 2285, 2286, 2287, 2288, 2289, 2290",NULL
S3692E,Anna,Brig,West Indies,02/07/1806,1806-02-07,123,"2291, 2294, 2295, 2296, 2297",NULL
S3693E,Ann,Brigantine,Europe,05/21/1806,1806-05-21,NULL,"2292, 2293",NULL
S3694E,Bellona,Brig,"St. Vincent (from Norfolk, Va.)",01/24/1806,1806-01-24,NULL,"2298, 2299",NULL
S3695E,Anna,Brigantine,Kingston,06/25/1806,1806-06-25,123,"2300, 2301",NULL
S3696E,Anson,Schooner,West Indies,09/22/1806,1806-09-22,106,"2303, 2302, 2304",NULL
S3697E,Anson,Schooner,Antwerp (from Boston),03/13/1806,1806-03-13,106,"2305, 2306, 2307",NULL
S3698E,Anson,Schooner,West Indies,09/22/1806,1806-09-22,106,"2308, 2309",NULL
S3699E,Aphia,Schooner,NULL,03/25/1806,1806-03-25,78,"2310, 2311, 2312",NULL
S3700E,Aphia,Schooner,Martinico,07/19/1806,1806-07-19,78,"2313, 2314",NULL
S3701E,Arab,Ship,Tenerife & India,03/20/1806,1806-03-20,287,"2315, 2316",NULL
S3702E,Argus,Brig,West Indies,05/23/1806,1806-05-23,126,"2317, 2318, 2319",NULL
S3703E,Argus,Brig,West Indies,09/01/1806,1806-09-01,125,"2320, 2321, 2322, 2323, 2324",NULL
S3704E,Arthur,Schooner,Surrinam,10/11/1806,1806-10-11,102,"2325, 2326, 2327",NULL
S3705E,Asia,Ship,Madiera & India,06/25/1806,1806-06-25,275,"2328, 2329, 2330, 2331, 2332",NULL
S3706E,Attempt,Schooner,West Indies,08/02/1806,1806-08-02,105,"2333, 2334",NULL
S3707E,Attempt,Schooner,West Indies,04/28/1806,1806-04-28,105,"2335, 2336, 2337, 2338, 2339",NULL
S3708E,Augusta,Brig,Copenhagen,04/28/1806,1806-04-28,NULL,"2340, 2341",NULL
S3709E,Augustus,Ship,Havana,05/12/1806,1806-05-12,246,"2342, 2343",NULL
S3710E,Belisarius,Ship,Leghorn & India,10/27/1806,1806-10-27,261,"2344, 2345",NULL
S3711E,Belleisle,Brig,Bordeaux,09/16/1806,1806-09-16,119,"2346, 2347, 2348, 2349",NULL
S3712E,Betsy,Brig,Havana,09/19/1806,1806-09-19,121,"2350, 2351, 2352",NULL
S3713E,Bellona,Brig,St. Vincents,01/24/1806,1806-01-24,NULL,"2353, 2354",NULL
S3714E,Betsey,Brig,Leghorn,01/11/1806,1806-01-11,122,"2355, 2356, 2357",NULL
S3715E,Betsey,Brig,?,01/11/1806,1806-01-11,Not given.,"2358, 2359, 2360",Half page missing
S3716E,Betsy,Brig,New Providence & Market?,08/29/1806,1806-08-29,92,"2361, 2362",NULL
S3717E,Betsy,Brig,Leghorn,11/11/1805,1805-11-11,122,"2364, 2365",NULL
S3718E,Bonetta,Ship,Cape of Good Hope [from New York],10/24/1806,1806-10-24,Not given.,"2366, 2367",NULL
S3719E,Betsy,Brig,Leghorn,11/26/1806,1806-11-26,154,"2368, 2369",NULL
S3720E,Catherine,Brig,Hamburg,02/27/1806,1806-02-27,158,"2370, 2371, 2372",NULL
S3721E,Concord,Ship,Rotterdam & India,05/05/1806,1806-05-05,171,"2378, 2379",NULL
S3722E,Columbia,Schooner,Corunna,12/10/1806,1806-12-10,89,"2375, 2376, 2377",NULL
S3723E,Cynthia,Brig,West India,05/02/1806,1806-05-02,128,"2380, 2381, 2382",NULL
S3724E,Cynthia,Brig,?,?/18/1806,0000-00-00,128,"2383, 2384",NULL
S3725E,Dolly,Schooner,Barbadoes,11/10/1806,1806-11-10,81,"2385, 2384",NULL
S3726E,Dolly,Schooner,West Indies,07/03/1806,1806-07-03,81,"2387, 2388, 2389",NULL
S3727E,Edwin,Brig,Martinico,07/28/1806,1806-07-28,129,"2390, 2391, 2392, 2393, 2394",NULL
S3728E,Eliza,Bark,Sumatra,10/16/1806,1806-10-16,187,"2395, 2396, 2397, 2398, 2399",NULL
S3729E,Eliza,Ship,Sumatra,06/04/1806,1806-06-04,512,"2400, 2401",NULL
S3730E,Enterprize,Brig,Amsterdam,06/28/1806,1806-06-28,185,"2402, 2403, 2404",NULL
S3731E,Enterprize,Brig,Europe,06/27/1806,1806-06-27,182,"2405, 2406",NULL
S3732E,Exchange,Brig,France,02/01/1806,1806-02-01,185,"2407, 2408, 2409, 2410, 2411",NULL
S3733E,Exter,Ship,Sumatra,10/18/1806,1806-10-18,291,"2412, 2413, 2414, 2415, 2416",NULL
S3734E,Factor,Ship,Rotterdam,06/23/1806,1806-06-23,253,"2417, 2418, 2419, 2420, 2421",NULL
S3735E,Fishhawk,Schooner,Martinico,06/10/1806,1806-06-10,101,"2422, 2423",NULL
S3736E,Fame,Ship,Europe & India,03/22/1806,1806-03-22,363,"2424, 2425, 2426, 2427, 2428,",NULL
S3737E,Fame,Schooner,West Indies,11/06/1806,1806-11-06,95,"2429, 2430",NULL
S3738E,Fame,Schooner,Martinique,06/05/1806,1806-06-05,97,"2431, 2432",NULL
S3739E,Fishhawk,Schooner,Martinico,06/10/1806,1806-06-10,101,"2433, 2434, 2435",NULL
S3740E,Five Sisters,Schooner,Europe [from Beverly],1806,0000-00-00,80,"2436, 2437",NULL
S3741E,Four Brothers,Schooner,Various ports in Mediterranean Sea,07/15/1806,1806-07-15,76,"2438, 2439, 2440, 2443, 2444",NULL
S3742E,Four Sons,Schooner,Bordeaux,07/05 /1806,1806-07-05,175,"2441, 2442",NULL
S3743E,Four Brothers,Schooner,Martinico [from New Bern],03/10/1806,1806-03-10,NULL,"2445, 2446",NULL
S3744E,Fox,Brig,Amsterdam [from Port of New York],03/27/1806,1806-03-27,NULL,"2447, 2448",NULL
S3745E,Freedom,Ship,Leghorn,09/29/1806,1806-09-29,213,"2449, 2450",NULL
S3746E,Friendship,Ship,Calcutta,03/06/1806,1806-03-06,345,"2451, 2452",NULL
S3747E,Friendship,Brig,Havana,07/13/1806,1806-07-13,157,"2456, 2457",NULL
S3748E,Friendship,Brig,Havana,12/26/1806,1806-12-26,157,"2453, 2454, 2455, 2458, 2459",NULL
S3749E,George Washington,Ship,Tonningen,8/28/1806,1806-08-28,217  3/95,"2460, 2461",NULL
S3750E,Georgetown,Bark,Rotterdam,1806,0000-00-00,162,"2462, 2463",NULL
S3751E,Georgetown,Bark,Leghorn,11/13/1806,1806-11-13,162,"2464, 2465",NULL
S3752E,Hector,Brig,Trinadad,06/19/1806,1806-06-19,109,"2466, 2467",NULL
S3753E,Georgetown,Bark,Rotterdam,06/14/1806,1806-06-14,162,"2468, 2469",NULL
S3754E,Henry,Brig,Europe,04/19/1806,1806-04-19,157,"2470, 2471, 2472, 2473",NULL
S3755E,Henry,Brig,Leghorn,11/13/1806,1806-11-13,157,"2474, 2475, 2476, 2477, 2478",NULL
S3756E,Herald,Brig,Europe,06/03/1806,1806-06-03,197,"2479, 2480, 2481",NULL
S3757E,Hercules,Ship,Canton,12/29/1806,1806-12-29,297,"2482, 2483",NULL
S3758E,Hero,Schooner,West Indies,12/23/1806,1806-12-23,92,"2484, 2485, 2486, 2487 2486",NULL
S3759E,Hope,Ship,Amsterdam,06/15/1806,1806-06-15,236,"2488, 2489, 2490, 2491, 2492, 2493",NULL
S3760E,Hope,Ship,Calcutta,08/25/1806,1806-08-25,186,"2494, 2495",NULL
S3761E,Hope,Brig,Amsterdam,01/03/1806,1806-01-03,165,"2496, 2497, 2498, 2499",NULL
S3762E,Hope,Brig,Triest [from Boston],03/26/1806,1806-03-26,165,"2500, 2501, 2502, 2503",NULL
S3763E,Hope,Schooner,Coast of Africa,01/29/1806,1806-01-29,101,"2504, 2505, 2506",NULL
S3764E,Hopewell,Brig,Europe,08/22/1806,1806-08-22,157,"2507, 2508, 2509",NULL
S3765E,Hypsia & Jane,Brig,West Indies [from Beverly],11/17/1806,1806-11-17,124,"2510, 2511, 2512, 2513",NULL
S3766E,Hypsia & Jane,Brig,West Indies,07/03/1806,1806-07-03,124,"2514, 2515",NULL
S3767E,Industry,Brig,Havana,04/10/1806,1806-04-10,136,"2516, 2517, 2518, 2519, 2520",NULL
S3768E,Industry,Brig,Havana,06/28/1806,1806-06-28,136,"2521, 2522, 2523, 2524",NULL
S3769E,Industry,Brig,Leghorn,12/08/1806,1806-12-08,136,"2525, 2526",NULL
S3770E,Iris,Ship,Lisbon & a Market (from Baltimore),12/09/1806,1806-12-09,NULL,"2527, 2528",NULL
S3771E,Ives,Schooner,Havana,09/23/1806,1806-09-23,80,"2529, 2530",NULL
S3772E,Jason,Brig,Marseilles,08/27/1806,1806-08-27,130,"2531, 2532, 2533, 2534, 2535, 2536",NULL
S3773E,Jason,Schooner,Europe,11/06/1805,1805-11-06,93,"2537, 2538, 2539",NULL
S3774E,Jeremiah,Schooner,Mediterranean [from Beverly],07/19/1806,1806-07-19,131,"2540, 2541",NULL
S3775E,Joanna,Schooner,Valencia [from Manchester],01/28/1806,1806-01-28,98,"2542, 2543, 2544",NULL
S3776E,Joanna,Schooner,Bilboa,11/20/1806,1806-11-20,98,"2545, 2546",NULL
S3777E,Joanna,Schooner,Martinique,06/11/1806,1806-06-11,98,"2547, 2548, 2549, 2550, 2551",NULL
S3778E,John,Ship,Cape of Good Hope & India,10/11/1806,1806-10-11,258,"2552, 2553, 2554, 2555, 2556",NULL
S3779E,Juno,Brig,NULL,2/19/1806,1806-02-19,NULL,2557,Crew List unavailable. Crew names taken from Collector's Certification list dated 2/19/1806.
S3780E,Sally,Brig,India,10/06/1805,1805-10-06,160,2121,NULL
S3781E,Sally,Ship,Havana,06/11/1805,1805-06-11,181,2128,NULL
S3782E,Catherine,Brig,Havana,12/10/1806,1806-12-10,158,"2373, 2374",NULL
S3783E,Juno,Brig,Europe,05/23/1806,1806-05-23,113,"2558, 2559, 2560, 2561",NULL
S3784E,Leopard,Brig,West Indies,05/27/1806,1806-05-27,156,"2562, 2563, 2564, 2565",Image 2562 apparently belongs to a previous voyage
S3785E,Little James,Brig,Hamburgh [from Boston],05/01/1806,1806-05-01,126,"2566, 2567",NULL
S3786E,Lucia,Ship,Europe,04/26/1806,1806-04-26,310,"2568, 2569, 2570, 2571",NULL
S3787E,Marquis de Somerulas,Ship,Gibraltar,01/14/1806,1806-01-14,[359 9/95],"2572, 2573, 2576, 2577",NULL
S3788E,Margaret,Ship,Europe & India,04/09/1806,1806-04-09,295,"2574, 2575",NULL
S3789E,Martha,Brig,St. Thomas,01/04/1806,1806-01-04,110,"2578, 2579, 2580",NULL
S3790E,Martha,Brig,Havana,08/13/1806,1806-08-13,111,"2581, 2582",NULL
S3791E,Martha,Brig,West Indies,02/11/1806,1806-02-11,110,"2583, 2584, 2585",NULL
S3792E,Martha,Brig,Havana,05/29/1806,1806-05-29,110,"2586, 2587, 2588",NULL
S3793E,Mary,Bark,Trieste,07/05/1806,1806-07-05,190,"2589, 2590",NULL
S3794E,Mary,Ship,A market,12/07/1806,1806-12-07,176,"2591, 2592, 2593",Crew list badly deteriorated at center of sheet. Residence & height illegible.
S3795E,Mary & Eliza,Ship,Europe & India,05/14/1806,1806-05-14,233,"2594, 2595, 2596, 2597",Crew changes from image 594.
S3796E,Massafuero,Brig,Martinque,02/12/1806,1806-02-12,158,"2598, 2599, 2600, 2601, 2602",NULL
S3797E,Massafuero,Brig,Europe,07/29/1806,1806-07-29,158,"2603, 2604, 2605, 2606",NULL
S3798E,Mercury,Schooner,West Indies,04/16/1806,1806-04-16,102,"2607, 2608, 2609, 2610",NULL
S3799E,Messenger,Ship,Hamburg,2/22/1806,1806-02-22,277,"2611, 2610, 2612, 2613, 2614",NULL
S3800E,Minerva,Brig,NULL,07/31/1807,1807-07-31,134,"2615, 2616",NULL
S3801E,Minerva,Brig,Coronia,12/08/1806,1806-12-08,134,"2617, 2618",NULL
S3802E,Minerva,Brig,Havana,08/18/1806,1806-08-18,134,"2619, 2620, 2621, 2622",NULL
S3803E,Minerva,Brig,West Indies,04/01/1806,1806-04-01,134,"2623, 2624, 2625",NULL
S3804E,Monk,Ship,Leghorn,08/11/1806,1806-08-11,253,"2626, 2627, 2628, 2629, 2630",NULL
S3805E,Moses,Bark,Surinam,1806,0000-00-00,203,"2631, 2632",NULL
S3806E,Moses,Bark,Copenhagen,04/05/1806,1806-04-05,203,"2633, 2634, 2635, 2636, 2637",One passenger not named.
S3807E,Moses,Bark,Suirnam,10/09/1806,1806-10-09,203,"2638, 2639, 2640, 2641",NULL
S3808E,Nancy,Brig,Barcelona,10/25/1806,1806-10-25,143,"2642, 2643",NULL
S3809E,Nancy,Schooner,Havana,06/3/1806,1806-06-03,70,"2644, 2645",NULL
S3810E,Nancy,Schooner,West Indies,12/09/1806,1806-12-09,70,"2646, 2647, 2648",NULL
S3811E,Nat & John,Schooner,West Indies,12/01/1806,1806-12-01,103,"2649, 2650, 2651, 2652, 2653",NULL
S3812E,Neptune,Schooner,West Indies,02/19/1806,1806-02-19,102,"2654, 2655, 2656, 2657, 2658",NULL
S3813E,Neptune,Schooner,West Indies,07/10/1806,1806-07-10,102,"2659, 2660, 2661, 2662, 2663",NULL
S3814E,Nymph,Brig,Guadaloupe,10/28/1806,1806-10-28,NULL,"2664, 2665",Vessel of Newburyport
S3815E,Pacific,Bark,Havana,12/24/1806,1806-12-24,188,"2666, 2667, 2668, 2669",Subject to country not given.
S3816E,Packet,Ship,Europe,08/16/1806,1806-08-16,129,"2670, 2671",NULL
S3817E,Pallas,Ship,Bombay [from Boston],09/13/1806,1806-09-13,331,"2672, 2673, 2674",NULL
S3818E,Peace & Plenty,Schooner,Gaudaloupe,12/29/1806,1806-12-29,94,"2675, 2676, 2679, 2680",NULL
S3819E,Pembroke,Ship,Havana,06/21/1806,1806-06-21,193,"2677, 2678",NULL
S3820E,Pompey,Bark,Bourbon,07/21/1806,1806-07-21,188,"2681, 2682",NULL
S3821E,Prince,Schooner,Madeira,06/19/1806,1806-06-19,98,"2683, 2684, 2685",NULL
S3822E,Rachel,Ship,Havana,01/31/1806,1806-01-31,198,"2686, 2687",NULL
S3823E,Rachel,Ship,Bordeaux,10/01/1806,1806-10-01,198,"2688, 2689, 2690, 2691",NULL
S3824E,Rachel,Schooner,France,12/16/1806,1806-12-16,71,"2692, 2693",NULL
S3825E,Rebecca,Brig,Hamburgh [from Boston],05/02/1806,1806-05-02,178,"2694, 2695, 2696",NULL
S3826E,Recovery,Ship,Bombay,01/04/1806 [?],1806-01-04,284,"2697, 2698",NULL
S3827E,Republican,Brig,Europe,07/18/1806,1806-07-18,198,"2700, 2701, 2702",NULL
S3828E,Restitution,Ship,Isle of France,07/18/1806,1806-07-18,247,"2703, 2704, 2705, 2706",NULL
S3829E,Reward,Brig,Europe,01/06/1806,1806-01-06,182,"2707, 2708",NULL
S3830E,Robereus,Bark,Calcutta (from Lisbon),1/28/1806,1806-01-28,NULL,"2709, 2710",NULL
S3831E,Sally,Schooner,"West Indies, Port Royal",12/27/1806,1806-12-27,58,"2711, 2712, 2713, 2714",NULL
S3832E,Sally,Schooner,West Indies,1806,0000-00-00,59,"2715, 2716, 2717",NULL
S3833E,Sally & Betsey,Brig,New Orleans [from Boston],9/25/1805,1805-09-25,NULL,"2718, 2719",Crew list as appeared in Lisbon.
S3834E,Saucy Jack,Schooner,Havana,02/14/1806,1806-02-14,90,"2720, 2721, 2722, 2723, 2724",NULL
S3835E,Saucy Jack,Schooner,West Indies,07/12/1806,1806-07-12,90,"2725, 2726, 2727, 2728",NULL
S3836E,Saucy Jack,Schooner,Havana,11/22/1806,1806-11-22,90,"2729, 2730, 2731",NULL
S3837E,Success,Schooner,West Indies,10/15/1806,1806-10-15,106,"2732, 2733",NULL
S3838E,Success,Schooner,West Indies,02/08/1806,1806-02-08,93,"2734, 2735",NULL
S3839E,Success,Schooner,West Indies,04/25/1806,1806-04-25,105,"2736, 2737, 2738",NULL
S3840E,Sukey,Brig,NULL,11/19/1806,1806-11-19,145,"2739, 2740, 2741, 2742, 2743",NULL
S3841E,Sukey & Betsy,Brig,Alicante,08/26/1806,1806-08-26,120,"2744, 2745, 2746, 2747",NULL
S3842E,Susan,Ship,Madeira,1806,0000-00-00,207,2749,No departure date.
S3843E,Success,Schooner,West Indies?,1806,0000-00-00,106,"2751, 2752","Departure date & country illegible. Returned to Boston March 6, 1807."
S3844E,Suwarro,Brigantine,East Indies,06/21/1806,1806-06-21,198,"2753, 2754",NULL
S3845E,Telemachus,Brig,Rotterdam & Calcutta,09/19/1806,1806-09-19,133,"2755, 2756, 2757, 2758, 2759",NULL
S3846E,Temperance,Schooner,Gibralter,07/10/1806,1806-07-10,100,"2760, 2761",NULL
S3847E,Temperance,Schooner,West Indies,03/18/1806,1806-03-18,101,"2762, 2763, 2764, 2765",NULL
S3848E,Thomas,Schooner,Bordeaux,07/18/1806,1806-07-18,103,"2766, 2767, 2768, 2769, 2770, 2771, 2772",NULL
S3849E,Three Friends,Brig,Hamburg,03/03/1806,1806-03-03,132,"2773, 2774, 2775, 2776",NULL
S3850E,Traveller,Ship,Europe & India,12/27/1806,1806-12-27,294,"2777, 2778, 2779, 2780, 2781",NULL
S3851E,Trent,Ship,West Indies,10/14/1806,1806-10-14,191,"2782, 2783, 2787, 2788, 2789",NULL
S3852E,Trent,Ship,Havana,06/02/1806,1806-06-02,191,"2784, 2785, 2786",NULL
S3853E,Trial,Brig,Martinico,01/06/1806,1806-01-06,148  2/95,"2790, 2791",NULL
S3854E,Triumphant,Ship,Cadiz [from New York],09/04/1806,1806-09-04,NULL,2792,No crew list available.
S3855E,Tryal [Trial],Brig,Martinico,1806,0000-00-00,147,"2793, 2794",NULL
S3856E,Two Brothers,Schooner,Amsterdam,03/26/1806,1806-03-26,99,"2795, 2796, 2797, 2798, 2799",of Marblehead
S3857E,Two Brothers,Ship,Madeira & E Indies,1/18/1806,1806-01-18,151,"2800, 2801",No master listed. 1/18/1806 possible voyage date.
S3858E,Two Brothers,Schooner,Magdalena,06/26/1806,1806-06-26,98,"2802, 2803, 2804, 2805, 2806",See also image 806. Image 803 tattered.
S3859E,Two Sisters,Schooner,West Indies,04/07/1806,1806-04-07,68,"2807, 2808, 2809, 2810",NULL
S3860E,Two Sons,Ship,Europe & India,04/21/1806,1806-04-21,210,"2811, 2812, 2813",NULL
S3861E,Union,Schooner,Surinam,09/13/1806,1806-09-13,99,"2814, 2815, 2816, 2817",NULL
S3862E,Union,Schooner,Surinam,05/07/1806,1806-05-07,99,"2818, 2819, 2820",NULL
S3863E,Union,Schooner,West Indies,07/05/1806,1806-07-05,109,"2821, 2822",NULL
S3864E,Union,Ship,Sumatra,01/04/1806,1806-01-04,250,"2824, 2825, 2826",NULL
S3865E,Vengeance,Brig,Europe,05/10/1806,1806-05-10,181,"2827, 2828, 2829, 2830",NULL
S3866E,Venus,Brig,Leghorn,03/12/1806,1806-03-12,184,"2831, 2832, 2833, 2834",NULL
S3867E,Victory,Schooner,"St. Thomas [from Wilmington, NC]",6/19/1806,1806-06-19,NULL,"2835, 2836",NULL
S3868E,Victory,Schooner,West Indies,10/11/1806,1806-10-11,120,"2837, 2838, 2839, 2840, 2841, 2842",NULL
S3869E,Washington,Brig,Copenhagen,03/04/1806,1806-03-04,178,"2843, 2844",NULL
S3870E,Washington,Schooner,West Indies,06/23/1806,1806-06-23,133,"2845, 2846, 2847, 2848, 2849",NULL
S3871E,Welcome Return,Brig,Surinam,11/24/1806,1806-11-24,174,"2850, 2851",NULL
S3872E,Washington,Brig,Salem [from Leghorn],12/02/1806,1806-12-02,NULL,"2852, 2853",NULL
S3873E,Welcome Return,Brig,Surinam,07/14/1806,1806-07-14,174,"2854, 2855, 2856",NULL
S3874E,William,Brig,Valencia,09/26/1806,1806-09-26,162,"2857, 2858, 2859, 2860, 2861, 2862",NULL
S3875E,William,Schooner,Europe,10/25/1806,1806-10-25,79,"2863, 2864, 2872, 2873",NULL
S3876E,William,Brig,Europe,07/09/1806,1806-07-09,178,"2865, 2866, 2867, 2868",NULL
S3877E,William,Schooner,Valencia,05/20/1806,1806-05-20,79,"2869, 2870, 2871",NULL
S3878E,William Gray,Bark,Europe,11/06/1806,1806-11-06,191,"2874, 2875, 2876, 2877",NULL
S3879E,William & Charles,Brig,St. Lucia,01/14/1806,1806-01-14,161,"2879, 2880, 2881",NULL
S3880E,William & Charles,Brig,West [Indies?],12/25/1806,1806-12-25,161,"2882, 2883",NULL
S3881E,William & Charles,Brig,Copenhagen,06/05/1806,1806-06-05,161,"2884, 2885, 2886",NULL
S3882E,Active,Bark,Marseilles,02/25/1807,1807-02-25,206,"2889, 2890, 2891, 2892, 2893",NULL
S3883E,Active,Bark,Havana,07/27/1807,1807-07-27,206,"2894, 2895, 2896, 2897, 2898, 2899,",NULL
S3884E,Alert,Sloop,West Indies,04/29/1807,1807-04-29,58,"2901, 2902, 2903, 2904, 2905",NULL
S3885E,Algol,Ship,Bordeaux,06/01/1807,1807-06-01,187,"2906, 2907, 2908, 2911, 2912",NULL
S3886E,Alfred,Ship,Massanet?,5/26/1807,1807-05-26,260,"2909, 2910",NULL
S3887E,Algol,Ship,Dantzig[?],01/22/1807,1807-01-22,NULL,"2913, 2914",NULL
S3888E,Alonzo,Brig,Leghorn,03/30/1807,1807-03-30,130,"2915, 2916, 2917, 2918",NULL
S3889E,Amazon,Brigantine,Alicante & a Market? [from Beverly],06/20/1807,1807-06-20,153,"2919, 2920",NULL
S3890E,Angler,Schooner,Trinidad [from Baltimore],10/16/1807,1807-10-16,Not given.,"2921, 2922",NULL
S3891E,Ann,Schooner,Spanish Main,06/06/1807,1807-06-06,92,"2924, 2925, 2926, 2927, 2928",NULL
S3892E,Anson,Schooner,West Indies [from Beverly],02/06/1807,1807-02-06,106,"2929, 2930, 2931, 2932",NULL
S3893E,Anson,Schooner,West Indies,03/03/1807,1807-03-03,106,"2933, 2934, 2935",NULL
S3894E,Anson,Schooner,West Indies [from Beverly],09/01/1807,1807-09-01,106,"2936, 2937, 2938, 2939, 2940",NULL
S3895E,Arab,Ship,Europe,04/05/1807,1807-04-05,286,"2941, 2942, 2943, 2944, 2945, 2946",NULL
S3896E,Arab,Ship,Tenerife & India,1807,0000-00-00,586,"2947, 2948",NULL
S3897E,Argo,Ship,Leghorn,04/27/1807,1807-04-27,320,"2949, 2950, 2951, 2952, 2953, 2954",NULL
S3898E,Argus,Brig,West Indies,1807,0000-00-00,NULL,"2955, 2956",NULL
S3899E,Argus,Brig,West Indies,03/14/1807,1807-03-14,125,"2957, 2958, 2959, 2960, 2961",NULL
S3900E,Argus,Brig,West Indies,06/04/1807,1807-06-04,125,"2962, 2963, 2964, 2969, 2970",NULL
S3901E,Astrea,Brig,West Indies,06/22/1807,1807-06-22,115,"2965, 2966",NULL
S3902E,Argus,Brig,West Indies,09/13/1807,1807-09-13,126,"2967, 2968",NULL
S3903E,Augusta,Brig,St. Andreros,10/20/1807,1807-10-20,127,"2971, 2972, 2973, 2974, 2975",NULL
S3904E,Augusta,Brig,Havana,01/20/1807,1807-01-20,127,"2977, 2978, 2979, 2980",NULL
S3905E,Union,Schooner,Salem (from Surinam),10/19/1805,1805-10-19,99,"2258, 2259",NULL
S3906E,Union,Schooner,NULL,3[?]/1806,0000-00-00,NULL,2823,"of Kennebunk - Document is a statement of wages paid upon return, June 1806"
S3907E,Active,Bark,Malaca,12/5/1807,1807-12-05,206 52/95,"2894, 2895",NULL
S3908E,Success,Schooner,West Indies,6/18/1805,1805-06-18,NULL,"2148, 2149",NULL
S3909E,Astrea,Brig,West Indies,3/21/1807,1807-03-21,115,"3005, 3006",NULL
S3910E,Astrea,Brig,West Indies,3/21/1807,1807-03-21,115,"3007, 3008, 3009",NULL
S3911E,Augusta,Brig,Havanna,6/5/1807,1807-06-05,137,"3010, 3011",NULL
S3912E,Augusta,Brig,NULL,10/1/1807,1807-10-01,100,"3012, 3013",NULL
S3913E,Augusta,Schooner,Bilbao,11/2/1807,1807-11-02,125,"3014, 3015, 3016, 3017, 3018",NULL
S3914E,Augustus,Ship,Leghorn,5/29/1807,1807-05-29,246,"3019, 3020, 3021",NULL
S3915E,Augustus,Ship,Havanna,1/10/1807,1807-01-10,246,"3022, 3023",NULL
S3916E,Augustus,Ship,NULL,1/10/1807,1807-01-10,NULL,"3024, 3025, 3026",NULL
S3917E,Augustus,Ship,Leghorn,11/30/1807,1807-11-30,246,"3027, 3028, 3029, 3030",NULL
S3918E,Augustus,Ship,Leghorn,11/30/1807,1807-11-30,246,"3031, 3032",NULL
S3919E,Belleisle,Brig,Bourdeaux,3/7/1807,1807-03-07,119,"3033, 3034",NULL
S3920E,Belleisle,Brig,Bordeaux,3/7/1807,1807-03-07,119,"3035, 3036, 3037",NULL
S3921E,Bellona,Brig,Tobago,6/20/1807,1807-06-20,122,"3038, 3039",NULL
S3922E,Betsy,Schooner,Havanna,6/20/1807,1807-06-20,107,"3040, 3041, 3042",NULL
S3923E,Betsy,Schooner,West Indies,1/12/1807,1807-01-12,NULL,"3043, 3044",NULL
S3924E,Betsy,Schooner,West Indies,1/12/1807,1807-01-12,NULL,"3045, 3046",NULL
S3925E,Besty,Brig,Martinique,12/17/1807,1807-12-17,NULL,"3047, 3048",NULL
S3926E,Betsy,Schooner,West Indies,10/17/1807,1807-10-17,68,"3049, 3050",NULL
S3927E,Betsy,Schooner,West Indies,6/12/1807,1807-06-12,107,"3051, 3052",NULL
S3928E,Betsy,Schooner,West Indies,4/15/1807,1807-04-15,107,"3053, 3054, 3055",NULL
S3929E,Betsy,Schooner,Havanna,1/10/1807,1807-01-10,NULL,"3056, 3057",NULL
S3930E,Betsy,Schooner,Havanna,1/10/1807,1807-01-10,NULL,"3058, 3059, 3060",NULL
S3931E,Belleisle,Brig,Leghorn,10/2/1807,1807-10-02,119,"3061, 3062, 3063",NULL
S3932E,Belleisle,Brig,Leghorn,10/2/1807,1807-10-02,119,"3064, 3065",NULL
S3933E,Betsy,Schooner,Havanna,6/15/1807,1807-06-15,107,"3066, 3067",NULL
S3934E,Betsy,Brig,Havanna,7/3/1807,1807-07-03,154,"3068, 3069",NULL
S3935E,Betsy,Brig,Havanna,7/3/1807,1807-07-03,154,"3071, 3072",NULL
S3936E,Betsy,Schooner,West Indies,12/7/1807,1807-12-07,108,"3073, 3074, 3075, 3076, 3077",NULL
S3937E,Betsy,Schooner,Barcelona,1/10/1807,1807-01-10,85,"3078, 3079",NULL
S3938E,Betsy,Schooner,Alicante,2/4/1807,1807-02-04,68,"3080, 3081, 3082",NULL
S3939E,Betsy,Schooner,Alicante,2/4/1807,1807-02-04,68,"3083, 3084",NULL
S3940E,Betsy,Brig,Martinico,7/7/1807,1807-07-07,92,"3085, 3086, 3087, 3088, 3089",NULL
S3941E,Betsy,Schooner,Smyrna & a market,3/26/1807,1807-03-26,82,"3090, 3091",NULL
S3942E,Betsy,Schooner,Martinico,7/7/1807,1807-07-07,107,"3092, 3093",NULL
S3943E,Betsy,Schooner,Martinico,7/7/1807,1807-07-07,107,"3094, 3095, 3096",NULL
S3944E,Betsy,Ship,Leghorn,8/28/1807,1807-08-28,NULL,"3097, 3098",NULL
S3945E,Boston Packet,Bark,Surinam,7/7/1807,1807-07-07,180,"3099, 3100",NULL
S3946E,Boston Packet,Bark,NULL,7/10/1807,1807-07-10,184,"3101, 3102, 3103",NULL
S3947E,Catherine,Brig,Havanna,3/19/1807,1807-03-19,158,"3104, 3105",NULL
S3948E,Catherine,Brig,Copenhagen,6/19/1807,1807-06-19,158,"3107, 3108",NULL
S3949E,Commerce,Ship,Barcelona,3/19/1807,1807-03-19,NULL,"3109, 3110",NULL
S3950E,Catharine,Brig,Havanna,3/19/1807,1807-03-19,158,"3112, 3113",NULL
S3951E,Catherine,Brig,Laguira,12/12/1807,1807-12-12,158,"3106, 3114, 3115, 3116, 3117",NULL
S3952E,Catharine,Schooner,West Indies,6/23/1807,1807-06-23,69,"3118, 3119",NULL
S3953E,Catharine,Schooner,West Indies,11/6/1807,1807-11-06,70,"3120, 3121",NULL
S3954E,Cincinnatus,Ship,Sumatra,1/10/1807,1807-01-10,226,"3122, 3123",NULL
S3955E,Cincinnatus,Ship,Sumatra,1/10/1807,1807-01-10,226,"3124, 3125, 3126",NULL
S3956E,Cushing,Schooner,St. Bartholomews,6/8/1807,1807-06-08,83,"3127, 3128",NULL
S3957E,Cynthia,Brig,Havanna,11/24/1807,1807-11-24,128,"3129, 3130, 3131, 3132",NULL
S3958E,Cynthia,Brigantine,Altona,3/13/1807,1807-03-13,128,"3134, 3135",NULL
S3959E,Dispatch,Brig,West Indies,6/24/1807,1807-06-24,119,"3136, 3137",NULL
S3960E,Dolphin,Schooner,Laguira,8/31/1807,1807-08-31,67,"3138, 3139",NULL
S3961E,Doris,Ship,Isle of Zante,7/22/1807,1807-07-22,NULL,"3140, 3141",Ship from Exeter; crew list is from port of Lisbon to Salem
S3962E,Edwin,Brig,Martinico,2/ 25/ 1807,1807-02-25,129,"3142, 3143",NULL
S3963E,Edwin,Brig,Marseilles,6/29/1807,1807-06-29,129,"3144, 3145",NULL
S3964E,Eliza,Schooner,Surinam,9/5/1807,1807-09-05,55,"3148, 3149",NULL
S3965E,Eliza,Ship,Sumatra,1/16/1807,1807-01-16,241,"3150, 3151",NULL
S3966E,Enterprize,Brig,Europe,1/23/1807,1807-01-23,182,"3152, 3153, 3154",NULL
S3967E,Enterprize,Brig,Europe,1/23/1807,1807-01-23,187,"3155, 3156",NULL
S3968E,Enterprize,Brig,Europe,9/11/1807,1807-09-11,185,"3157, 3158",NULL
S3969E,Enterprize,Brig,Naples,9/11/1807,1807-09-11,182,"3159, 3160",NULL
S3970E,Fame,Schooner,West Indies,4/25/1807,1807-04-25,95,"3161, 3162",NULL
S3971E,Fame,Schooner,West Indies,4/25/1807,1807-04-25,95,"3163, 3164",NULL
S3972E,Fishhawk,Schooner,Martinico,6/2/1807,1807-06-02,101,"3166, 3167",NULL
S3973E,Fishhawk,Schooner,Martinico,6/ 2/ 1807,1807-06-02,101,"3168, 3169",NULL
S3974E,Four Brothers,Schooner,Senegal,5/16/1807,1807-05-16,76,"3170, 3171",NULL
S3975E,Four Sisters,Schooner,West Indies,10/ 28/ 1807,1807-10-28,80,"3173, 3174, 3175, 3176",NULL
S3976E,Four Sisters,Schooner,Havanna,2/16/1807,1807-02-16,80,"3178, 3179",NULL
S3977E,Four Sisters,Schooner,Havanna,2/16/1807,1807-02-16,80,"3180, 3181",NULL
S3978E,Four Sisters,Schooner,Havanna,5/21/1807,1807-05-21,74,"3182, 3183, 3184",NULL
S3979E,Fox,Brig,Europe,8/31/1807,1807-08-31,116,"3186, 3187",NULL
S3980E,Fox,Brig,Europe,8/31/1807,1807-08-31,116,"3188, 3189",NULL
S3981E,Fox,Schooner,Dominique,7/2/1807,1807-07-02,41,"3190, 3191",NULL
S3982E,Franklin,Ship,Leghorn,1/12/1807,1807-01-12,296,"3192, 3193",NULL
S3983E,Franklin,Ship,Leghorn,1/12/1807,1807-01-12,296,"3194, 3195, 3196",NULL
S3984E,Freedom,Ship,Leghorn,8/5/1807,1807-08-05,213,"3198, 3199",NULL
S3985E,Friendship,Schooner,Bilboa,6/11/1807,1807-06-11,94,"3200, 3201",NULL
S3986E,Friendship,Ship,Calcutta,1807,0000-00-00,342,"3202, 3203, 3204",NULL
S3987E,Friendship,Ship,Smyrna,5/19/1807,1807-05-19,342,"3205, 3206",NULL
S3988E,Friendship,Ship,Smyrna,5/19/1807,1807-05-19,342,"3208, 3209",NULL
S3989E,Friendship,Brig,Gibraltar,4/29/1807,1807-04-29,157,"3210, 3211, 3212, 3213, 3214",NULL
S3990E,Greyhound,Schooner,West Indies,5/18/1807,1807-05-18,60,"3215, 3216",NULL
S3991E,Harper,Bark,India,NULL,0000-00-00,NULL,"3217, 3218",May be a surrendered crew list
S3992E,Harper,Bark,Genoa,4/30/1807,1807-04-30,145,"3219, 3220, 3221, 3222, 3223","Genoa crossed off, Leghorn written in"
S3993E,Harriet,Brig,Leghorn,11/ 29/ 1807,1807-11-29,NULL,"3224, 3225, 3226",NULL
S3994E,Harriet,Brigantine,Europe,5/ 22/ 1807,1807-05-22,118,"3227, 3228",NULL
S3995E,Harriet,Brig,Leghorn,7/23/1807,1807-07-23,NULL,"3229, 3230",NULL
S3996E,Harriet,Brigantine,Europe,5/22/1807,1807-05-22,118,"3231, 3232, 3233, 3234",NULL
S3997E,Hawk,Schooner,Laguna,5/28/1807,1807-05-28,69,"3235, 3236, 3237, 3238",NULL
S3998E,Hawk,Schooner,Havanna,10/15/1807,1807-10-15,69,"3239, 3240",NULL
S3999E,Hazard,Schooner,NULL,5/12/1807,1807-05-12,NULL,"3241, 3242",NULL
S4000E,Hawk,Schooner,La Guayna,NULL,0000-00-00,70,"3243, 3244","Vessel of Manchester, bound from Beverly"
S4001E,Hector,Brig,Marseilles,1/18/1807,1807-01-18,220,"3245, 3246",NULL
S4002E,Henry,Ship,Havanna,3/22/1807,1807-03-22,190,"3247, 3248, 3249",NULL
S4003E,Hero,Schooner,West Indies,3/16/1807,1807-03-16,92,"3250, 3251, 3252, 3253, 3254",NULL
S4004E,Hero,Schooner,West Indies,6/24/1807,1807-06-24,92,"3256, 3257",NULL
S4005E,Hind,Bark,Martinico,11/6/1807,1807-11-06,157,"3258, 3259",NULL
S4006E,Hind,Bark,Island of Martinico,11/6/1807,1807-11-06,157,"3255, 3260, 3261",NULL
S4007E,Hope,Ship,Calcutta,NULL,0000-00-00,285,"3262, 3263",NULL
S4008E,Hope,Ship,Leghorn,4/30/1807,1807-04-30,282,"3264, 3265",NULL
S4009E,Hope,Ship,Havanna,6/26/1807,1807-06-26,236,"3266, 3267, 3268, 3269, 3270",NULL
S4010E,Hopewell,Brig,Bourdeaux,12/1/1807,1807-12-01,156,"3271, 3272",NULL
S4011E,Hypsia & Jane,Brig,Saint Michaels and Saint Petersburg,2/13/1807,1807-02-13,124,"3273, 3274",NULL
S4012E,Industry,Brig,Havanna,10/31/1807,1807-10-31,136,"3275, 3276",NULL
S4013E,Hypsia & Jane,Brig,Bourdeaux,10/ 24/ 1807,1807-10-24,124,"3277, 3278",NULL
S4014E,Iris,Schooner,Havanna,5/1/1807,1807-05-01,80,"3279, 3280",NULL
S4015E,Java,Ship,India,6/17/1807,1807-06-17,224,"3281, 3282",NULL
S4016E,Jeremiah,Schooner,Malaga & a market,11/9/1807,1807-11-09,131,"3283, 3284, 3285, 3286, 3287",NULL
S4017E,Joanna,Schooner,Alicante,12/24/1807,1807-12-24,98,"3288, 3289, 3290",NULL
S4018E,John,Schooner,West Indies,7/14/1807,1807-07-14,85,"3291, 3292, 3293, 3294, 3295",NULL
S4019E,Juno,Brig,Europe,4/25/1807,1807-04-25,NULL,"3296, 3297",NULL
S4020E,Juno,Brig,Europe,4/25/1807,1807-04-25,164,"3298, 3299, 3300",NULL
S4021E,Juno,Brig,Matanzas,10/31/1807,1807-10-31,164,"3301, 3302, 3303, 3304, 3305",NULL
S4022E,Lark,Schooner,Laguna,4/30/1807,1807-04-30,80,"3306, 3307, 3308",NULL
S4023E,Lark,Schooner,Laguna,4/30/1807,1807-04-30,80,"3309, 3310",NULL
S4024E,Leopard,Bark,Leghorn,10/20/1807,1807-10-20,207,"3311, 3312, 3313, 3314",NULL
S4025E,Louisa,Ship,Sumatra,2/20/1807,1807-02-20,156,"3315, 3316",NULL
S4026E,Lively,Sloop,West Indies,2/17/1807,1807-02-17,84,"3317, 3318",NULL
S4027E,Little James,Brig,Leghorn,1/29/1807,1807-01-29,NULL,"3319, 3320",NULL
S4028E,Lydia,Schooner,Laguna,5/5/1807,1807-05-05,78,"3321, 3322, 3323, 3324, 3325",NULL
S4029E,Madockawando,Schooner,West Indies,1/26/1807,1807-01-26,NULL,"3326, 3327",NULL
S4030E,Madockawando,Schooner,West Indies,10/24/1807,1807-10-24,115,"3328, 3329",NULL
S4031E,Marquis de Somerulas,Ship,Tennington,4/14/1807,1807-04-14,359,"3330, 3331",NULL
S4032E,Madockawando,Schooner,West Indies,10/24/1807,1807-10-24,115,"3332, 3333, 3334",NULL
S4033E,Mark,Ship,Barcelona,12/14/1807,1807-12-14,256,"3335, 3336",NULL
S4034E,Marquis de Somerulas,Ship,Fennington,4/14/1807,1807-04-14,359,"3337, 3338, 3339, 3340",NULL
S4035E,Martha,Brig,West Indies,6/13/1807,1807-06-13,110,"3341, 3342, 3343, 3344",NULL
S4036E,Martha,Brig,Havanna,2/7/1807,1807-02-07,110,"3345, 3346, 3347, 3348, 3349",NULL
S4037E,Martha,Brig,Havanna,1807,0000-00-00,NULL,"3350, 3351",NULL
S4038E,Mary,Ship,Modager,3/27/1807,1807-03-27,176,"3352, 3353",NULL
S4039E,Mary & Allen,Brig,Saint Thomas,5/15/1807,1807-05-15,136,"3354, 3355",NULL
S4040E,Massafuero,Brig,"Bengal, India",5/15/1807,1807-05-15,158,"3356, 3357",NULL
S4041E,Merchant,Brig,Tobago,1/16/1807,1807-01-16,NULL,"3358, 3359",NULL
S4042E,Mercury,Schooner,Martinique,4/29/1807,1807-04-29,NULL,"3360, 3361",NULL
S4043E,Merchant,Ship,Rotterdam,1807,0000-00-00,263,"3362, 3363",NULL
S4044E,Mercury,Schooner,Guadaloupe,10/23/1807,1807-10-23,102,"3364, 3365",NULL
S4045E,Messenger,Ship,Copenhagen,4/24/1807,1807-04-24,277,"3366, 3367",NULL
S4046E,Montpelier,Brigantine,Surinam Market,11/24/1807,1807-11-24,110,"3368, 3369, 3370, 3371, 3372",NULL
S4047E,Moses,Bark,Surinam,10/24/1807,1807-10-24,203,"3373, 3374, 3375, 3376, 3377",NULL
S4048E,Nabby,Brigantine,Surinam,12/19/1807,1807-12-19,154,"3378, 3379",NULL
S4049E,Nancy,Brig,Copenhagen,2/4/1807,1807-02-04,NULL,"3380, 3381",NULL
S4050E,Nancy,Schooner,Martinico,9/4/1807,1807-09-04,70,"3384, 3385, 3386",NULL
S4051E,Nancy,Schooner,West Indies,4/24/1807,1807-04-24,70,"3387, 3388, 3389, 3390, 3391",NULL
S4052E,Nat & John,Schooner,Trinidad,3/20/1807,1807-03-20,NULL,"3392, 3393","Bound from Wilmington, NC, for Trinidad"
S4053E,Neptune,Schooner,Barbados,5/ 5/ 1807,1807-05-05,NULL,"3394, 3395","Bound from Wilmington, NC, to Barbados"
S4054E,Pacific,Bark,Surinam & a market,11/13/1807,1807-11-13,188,"3396, 3397, 3398, 3399, 3400",NULL
S4055E,Pacific,Bark,Surinam,4/22/1807,1807-04-22,188,"3401, 3402, 3404, 3405",NULL
S4056E,Packet,Ship,Europe,6/6/1807,1807-06-06,229,"3406, 3407, 3408, 3409",NULL
S4057E,Patty,Brigantine,Barcelona,5/19/1807,1807-05-19,165,"3411, 3412",NULL
S4058E,Peace & Plenty,Schooner,Palarmo [Palermo],5/27/1807,1807-05-27,94,"3413, 3414, 3415, 3418, 3419",NULL
S4059E,Peace & Plenty,Schooner,Marseilles & a Market,11/30/1807,1807-11-30,94,"3416, 3417",NULL
S4060E,Perseverance,Ship,Rotterdam & a Market,2/7/1807,1807-02-07,252,"3420, 3421",NULL
S4061E,Plymouth,Brig,Mogador,3/18/1807,1807-03-18,146,"3422, 3423",NULL
S4062E,Plymouth,Brig,Mogador,3/18/1807,1807-03-18,146,"3424, 3425",NULL
S4063E,Phoenix,Brig,Europe,12/1/1807,1807-12-01,150,"3426, 3427",NULL
S4064E,Polly,Schooner,Barbados,2/11/1807,1807-02-11,NULL,"3428, 3429",NULL
S4065E,Polly,Schooner,Havanna,6/30/1807,1807-06-30,112,"3430, 3431, 3432, 3433, 3434",NULL
S4066E,Polly,Schooner,Tobago,11/10/1807,1807-11-10,112,"3435, 3436",NULL
S4067E,Polly,Schooner,Tobago,11/10/1807,1807-11-10,112,"3437, 3438",NULL
S4068E,Rachel,Schooner,Barcelona,7/21/1807,1807-07-21,71,"3440, 3441",NULL
S4069E,Rachel,Ship,Hambu[rg] & Russia,3/21/1807,1807-03-21,198,"3442, 3443, 3444, 3445",NULL
S4070E,Raven,Schooner,"Point Peter, Guadaloupe",6/11/1807,1807-06-11,70,"3446, 3447, 3448",NULL
S4071E,Raven,Schooner,West Indies,12/21/1807,1807-12-21,70,"3449, 3450, 3451, 3452, 3453",NULL
S4072E,Recovery,Ship,Bombay,9/14/1807,1807-09-14,284,"3454, 3455",NULL
S4073E,Recovery,Ship,Rotterdam,3/5/1807,1807-03-05,284,"3456, 3457, 3458, 3459, 3465, 3466",NULL
S4074E,Republican,Brig,Havanna,4/11/1807,1807-04-11,198,"3460, 3461",NULL
S4075E,Republican,Brig,Havanna,4/11/1807,1807-04-11,198,"3462, 3463, 3464",NULL
S4076E,Republican,Brig,Havanna,7/8/1807,1807-07-08,198,"3467, 3468",NULL
S4077E,Republican,Brig,Havanna,12/13/1807,1807-12-13,198,"3469, 3470, 3471",NULL
S4078E,Roboreas,Bark,Hamburg,2/12/1807,1807-02-12,NULL,"3474, 3475",NULL
S4079E,St. Peter,Schooner,West Indies,7/1/1807,1807-07-01,67,"3476, 3477, 3478, 3479, 3480",NULL
S4080E,St. Peter,Schooner,West Indies,11/14/1807,1807-11-14,67,"3481, 3482, 3483, 3484, 3485",NULL
S4081E,Saucy Jack,Schooner,Lagura,3/7/1807,1807-03-07,90,"3486, 3487, 3488, 3489, 3490",NULL
S4082E,Saucy Jack,Schooner,NULL,6/11/1807,1807-06-11,90,"3491, 3492, 3493, 3494, 3495",NULL
S4083E,Success,Schooner,Chesbouro,3/5/1807,1807-03-05,93,"3496, 3497, 3498, 3499, 3500",NULL
S4084E,Success,Brig,West Indies,8/31/1807,1807-08-31,105,"3501, 3502",NULL
S4085E,Success,Schooner,West Indies,11/28/1807,1807-11-28,92,"3504, 3505",NULL
S4086E,Success,Brig,West Indies,4/24/1807,1807-04-24,105,"3506, 3507, 3508, 3509, 3510",NULL
S4087E,Sukey,Brig,NULL,12/26/1807,1807-12-26,145,"3503, 3511, 3512",NULL
S4088E,Sukey,Brig,NULL,12/26/1807,1807-12-26,145,"3513, 3514",NULL
S4089E,Sukey & Betsey,Brig,Malaga,7/31/1807,1807-07-31,120,"3515, 3516, 3517, 3518, 3519",NULL
S4090E,Sukey & Betsy,Brig,Corruna in Spain,1807,0000-00-00,120,"3520, 3521",NULL
S4091E,Sun Arrow,Brigantine,Leghorn,9/25/1807,1807-09-25,138,"3522, 3523",NULL
S4092E,Swan,Schooner,Bilbao,6/23/1807,1807-06-23,107,"3524, 3525",NULL
S4093E,Telemachus,Brig,East Indies,1/16/1807,1807-01-16,133,"3526, 3527",NULL
S4094E,Thomas,Schooner,West Indies,5/20/1807,1807-05-20,103,"3528, 3529, 3530",NULL
S4095E,Three Friends,Brig,Havanna,1/16/1807,1807-01-16,130,"3531, 3532",NULL
S4096E,Thomas,Schooner,Havanna,1/17/1807,1807-01-17,103,"3533, 3534, 3535, 3536, 3537",NULL
S4097E,Three Friends,Brig,Havanna,4/30/1807,1807-04-30,132,"3538, 3539",NULL
S4098E,Trent,Ship,Martinico,10/13/1807,1807-10-13,191,"3540, 3541",NULL
S4099E,Trent,Ship,Havanna,1807,0000-00-00,191,"3542, 3543",NULL
S4100E,Trent,Ship,West Indies,5/13/1807,1807-05-13,191,"3544, 3545, 3546, 3547",NULL
S4101E,Two Betseys,Brigantine,Laguna & a Market,5/6/1807,1807-05-06,141,"3548, 3549, 3550",NULL
S4102E,Two Brothers,Schooner,Europe,6/4/1807,1807-06-04,98,"3551, 3552",NULL
S4103E,Two Betseys,Brig,Leguayna,10/6/1807,1807-10-06,141,"3553, 3554, 3555, 3556, 3557",NULL
S4104E,Two Brothers,Schooner,Europe,1/19/1807,1807-01-19,98,"3558, 3559, 3560",NULL
S4105E,Two Brothers,Schooner,West Indies,5/18/1807,1807-05-18,74,"3561, 3562, 3563, 3564, 3565",NULL
S4106E,Two Brothers,Schooner,Martinique,1/24/1807,1807-01-24,74,"3566, 3567",NULL
S4107E,Two Brothers,Schooner,West Indies,10/13/1807,1807-10-13,74,"3568, 3569",NULL
S4108E,Union,Ship,Sumatra,1/5/1807,1807-01-05,NULL,"3570, 3571",NULL
S4109E,Union,Ship,Sumatra,1807,0000-00-00,258,"3572, 3573",NULL
S4110E,Union,Ship,Leghorn,12/21/1807,1807-12-21,250,"3574, 3575, 3576, 3577, 3578",NULL
S4111E,Union,Schooner,Surinam,4/4/1807,1807-04-04,99,"3579, 3580, 3581, 3582",NULL
S4112E,Union,Schooner,Surinam,8/25/1807,1807-08-25,99,"3583, 3584",NULL
S4113E,Vengeance,Brig,Lisbon,4/4/1807,1807-04-04,NULL,"3585, 3586",Crew list from port of Alexandria
S4114E,Venus,Brig,Isle of France,11/13/1807,1807-11-13,184,"3587, 3588, 3589, 3590",NULL
S4115E,Victory,Schooner,West Indies,2/28/1807,1807-02-28,170,"3591, 3592, 3593, 3594, 3595",NULL
S4116E,Victory,Schooner,West Indies,10/29/1807,1807-10-29,120,"3596, 3597",NULL
S4117E,Washington,Brig,Havanna,7/20/1807,1807-07-20,NULL,"3606, 3607",NULL
S4118E,Washington,Schooner,Europe,3/21/1807,1807-03-21,115,"3608, 3609, 3610, 3613, 3614",Returned 9/9/1807
S4119E,Welcome Return,Brig,West Indies,11/7/1807,1807-11-07,124,"3611, 3612",NULL
S4120E,Washington,Schooner,West Indies,10/26/1807,1807-10-26,115,"3615, 3616",NULL
S4121E,Welcome Return,Brig,Havanna,6/11/1807,1807-06-11,174,"3617, 3618",NULL
S4122E,Wells,Ship,Copenhagen,3/13/1807,1807-03-13,NULL,"3619, 3620, 3621",NULL
S4123E,Wells,Ship,Europe,12/3/1807,1807-12-03,205,"3622, 3623",NULL
S4124E,William,Brig,Valencia,2/23/1807,1807-02-23,178,"3624, 3625",NULL
S4125E,William,Brigantine,Alicante,9/8/1807,1807-09-08,178,"3626, 3627, 3628, 3629, 3630",NULL
S4126E,William,Schooner,Martinique,11/24/1807,1807-11-24,79,"3631, 3632, 3633, 3634, 3635",NULL
S4127E,William,Schooner,West Indies,6/16/1807,1807-06-16,79,"3636, 3637, 3638, 3639, 3640",NULL
S4128E,William,Ship,Calcutta,12/5/1807,1807-12-05,204,"3641, 3642, 3643",Returned 11/12/1808
S4129E,William & Charles,Brig,Leghorn,5/8/1807,1807-05-08,162,"3644, 3645, 3649, 3650",NULL
S4130E,William Gray,Bark,Leghorn from thence to U.S.A.,9/10/1807,1807-09-10,190,"3646, 3647, 3648, 3651, 3652",NULL
S4131E,Alexander Hodgdon,Ship,London then Sumatra,1808,0000-00-00,NULL,"3654, 3655",Crew list from consulate in London; returned 1809
S4132E,Argo,Ship,Havanna,7/28/1808,1808-07-28,325,"3658, 3659, 3660, 3661",NULL
S4133E,Argus,Brig,Matanzas,8/9/1808,1808-08-09,124,"3662, 3663, 3664",NULL
S4134E,Betsy,Brig,Havanna,1808,0000-00-00,154,"3665, 3666",NULL
S4135E,Betsy,Brig,Havanna,4/20/1808,1808-04-20,154,"3667, 3668, 3669, 3670, 3671",NULL
S4136E,Bonetta,Ship,Martinique,7/29/1808,1808-07-29,NULL,"3672, 3673",NULL
S4137E,Boston Packet,Bark,Surinam,5/11/1808,1808-05-11,184 48/95,"3674, 3575, 3576, 3577, 3578,",NULL
S4138E,Cincinnatus,Ship,Havanna,7/21/1808,1808-07-21,226,"3679, 3680, 3681, 3682",NULL
S4139E,Fishhawk,Schooner,Havanna,4/20/1808,1808-04-20,101,"3683, 3684, 3685, 3686, 3687",NULL
S4140E,Grey Hound,Schooner,Barbados,7/29/1808,1808-07-29,60,"3688, 3689, 3690, 3691, 3692",NULL
S4141E,Mary Eliza,Ship,Sumatra,6/1/1808,1808-06-01,233,"3695, 3696",NULL
S4142E,Minerva,Brig,Havanna,7/23/1808,1808-07-23,137,"3697, 3698, 3699, 3700, 3701",NULL
S4143E,Nobby,Brig,Havanna,7/23/1808,1808-07-23,154,"3702, 3703",NULL
S4144E,Rachel,Ship,Havanna,4/5/1808,1808-04-05,198,"3704, 3705, 3706, 3709, 3710",NULL
S4145E,Rachel,Ship,Havanna,7/19/1808,1808-07-19,198,"3707, 3708, 3711, 3712",NULL
S4146E,Sally,Brig,Surinam,6/24/1808,1808-06-24,143,"3713, 3714",NULL
S4147E,Success,Schooner,Martinico,7/28/1808,1808-07-28,NULL,"3715, 3716",NULL
S4148E,Thomas,Schooner,Martinico,7/29/1808,1808-07-29,103,"3717, 3718, 3719, 3720, 3721",NULL
S4149E,Two Betseys,Brig,Havanna,4/27/1808,1808-04-27,141,"3722, 3723",NULL
S4150E,Two Brothers,Schooner,Trinidad,7/18/1808,1808-07-18,74,"3724, 3725",NULL
S4151E,Two Sons,Ship,Europe and India,4/19/1808,1808-04-19,NULL,"3726, 3727",NULL
S4152E,Union,Schooner,Surinam,4/18/1808,1808-04-18,99,"3728, 3729, 3730, 3731",NULL
S4153E,Welcome Return,Brig,Havanna,4/6/1808,1808-04-06,174,"3732, 3733, 3734, 3735",NULL
S4154E,Active,Bark,Sumatra,4/1/1809,1809-04-01,206,"3737, 3738, 3739, 3740, 3741",NULL
S4155E,Adeline,Ship,Havanna,5/27/1809,1809-05-27,250,"3742, 3743, 3744",NULL
S4156E,Admittance,Brig,Cuba,8/12/1809,1809-08-12,170,"3745, 3746, 3747, 3748, 3749",NULL
S4157E,Agnes,Brig,St. Bartholomew,5/24/1809,1809-05-24,200,"3750, 3751",Crew list from Boston to St. Bartholomew
S4158E,Agnes,Brig,Matanzas,7/8/1809,1809-07-08,211,"3752, 3753, 3754, 3755, 3756",NULL
S4159E,Alert,Sloop,Saint Bartholomew,4/4/1809,1809-04-04,58,"3757, 3758, 3759, 3760, 3761",NULL
S4160E,Alfred,Ship,India,11      ,0000-00-00,258,"3762, 3763, 3764",NULL
S4161E,Alice,Brig,Sardina,3/25/1809,1809-03-25,164,"3765, 3766, 3767, 3768, 3769",NULL
S4162E,America,Ship,Calgo,7/12/1809,1809-07-12,673,"3770, 3771",NULL
S4163E,Angler,Schooner,Madeira,5/23/1809,1809-05-23,96,"3772, 3773",NULL
S4164E,Ann,Brig,NULL,9/30/1809,1809-09-30,234,"3774, 3775",NULL
S4165E,Ann,Brig,Gottenburg,3/16/1809,1809-03-16,234,"3776, 3777, 3778, 3779, 3780",Returned 8/21/1809
S4166E,Anna,Schooner,West Indies,6/12/1809,1809-06-12,103,"3781, 3782, 3783, 3784, 3785",NULL
S4167E,Anson,Schooner,Havanna,4/26/1809,1809-04-26,106,"3786, 3787, 3788, 3789, 3790",NULL
S4168E,Arab,Ship,NULL,6/7/1809,1809-06-07,287,"3791, 3792",NULL
S4169E,Argo,Ship,Civita Vecchia,6/21/1809,1809-06-21,325,"3793, 3794, 3795",NULL
S4170E,Argus,Brig,Porto Rico,4/8/1809,1809-04-08,125,"3796, 3797",NULL
S4171E,Asia,Ship,Sumatra,3/17/1809,1809-03-17,274,"3798, 3799, 3800",NULL
S4172E,Argus,Brig,West Indies,7/21/1809,1809-07-21,126,"3801, 3802",NULL
S4173E,Astrea,Brig,Havanna,4/15/1809,1809-04-15,NULL,"3803, 3804",NULL
S4174E,Augusta,Brig,Havanna,6/24/1809,1809-06-24,127,"3805, 3806, 3807, 3808, 3809",NULL
S4175E,Augusta,Schooner,Toningson & a market,9/16/1809,1809-09-16,120,"3810, 3811, 3812, 3813, 3814",NULL
S4176E,Augustus,Ship,Sardinia,4/12/1809,1809-04-12,146,"3815, 3816, 3817",NULL
S4177E,Belleisle,Brig,Havanna,5/27/1809,1809-05-27,119,"3818, 3819, 3820",NULL
S4178E,Betsey,Brig,Naples,10/31/1809,1809-10-31,122,"3821, 3821, 3823, 3824, 3825",NULL
S4179E,Betsey,Schooner,Laguna,4/18/1809,1809-04-18,83,"3826, 3827",NULL
S4180E,Betsey,Brig,Norfolk & Baltimore,2/6/1809,1809-02-06,NULL,"3828, 3829",NULL
S4181E,Betsey,Schooner,Gottenburg,5/23/1809,1809-05-23,82,"3830, 3831",NULL
S4182E,Betsey,Schooner,Cayenne,4/14/1809,1809-04-14,120,"3832, 3833",NULL
S4183E,Betsey,Schooner,Cadiz,6/14/1809,1809-06-14,100,"3834, 3835",NULL
S4184E,Betsey,Schooner,La Guayra,7/28/1809,1809-07-28,82,"3836, 3837",NULL
S4185E,Betsey,Schooner,Cadiz,9/19/1809,1809-09-19,68,"3838, 3839, 3940, 3941",NULL
S4186E,Betsey,Schooner,Saint Sebastians,11/16/1809,1809-11-16,72,"3842, 3843",NULL
S4187E,Betsey,Schooner,Stettin,12/25/1809,1809-12-25,83,"3844, 3845",NULL
S4188E,Betsy,Brig,St. Jago de Cuba,4/3/1809,1809-04-03,154,"3846, 3847",NULL
S4189E,Betsey,Brig,NULL,10/25/1809,1809-10-25,92,"3848, 3849",NULL
S4190E,Betsey,Schooner,Cadiz,6/14/1809,1809-06-14,100,"3850, 3851, 3852",NULL
S4191E,Besty,Schooner,Laguna,4/1/1809,1809-04-01,83,"3853, 3854, 3855",NULL
S4192E,Betsy,Schooner,St Bartholemew,5/11/1809,1809-05-11,72,"3856, 3857, 3858, 3859",NULL
S4193E,Betsy,Schooner,St. Jago de Cuba,12/11/1809,1809-12-11,100,"3861, 3862",NULL
S4194E,Britania,Schooner,Gion,11/16/1809,1809-11-16,69,"3863, 3864, 3865, 3866, 3867",NULL
S4195E,Boston Packet,Brig,NULL,3/31/1809,1809-03-31,184,"3868, 3869, 3870, 3871",NULL
S4196E,Catharine,Brig,Gottenburg,4/26/1809,1809-04-26,158,"3872, 3873",NULL
S4197E,Caesar,Schooner,Havana,6/17/1809,1809-06-17,91,"3874, 3875, 3876",NULL
S4198E,Catharine,Brig,Gottenburg & a market,4/26/1809,1809-04-26,158,"3877, 3878, 3879",NULL
S4199E,Catherine,Schooner,Saint Bartholomew,3/16/1809,1809-03-16,NULL,"3880, 3881",NULL
S4200E,Clarissa,Brig,Calcutta,8/1/1809,1809-08-01,135,"3882, 3883, 3884",from Boston; returned 12/21/1810
S4201E,Columbia,Schooner,Cayenne,4/14/1809,1809-04-14,84,"3885, 3886, 3887, 3888, 3889",NULL
S4202E,Columbus,Schooner,Cayenne,10/12/1809,1809-10-12,84,"3890, 3891",NULL
S4203E,Belleisle,Brigantine,Havanna,5/22/1809,1809-05-22,119,"3892, 3893",NULL
S4204E,Betsey,Brig,NULL,3/31/1809,1809-03-31,107,"3894, 3895",NULL
S4205E,Betsy,Brig,Havanna,4/7/1809,1809-04-07,172,"3896, 3897, 3898, 3899, 3900",NULL
S4206E,Betsey,Brig,West Indies,10/7/1809,1809-10-07,107,"3901, 3902, 3903, 3904, 3905",NULL
S4207E,Betsey,Schooner,Cayenne,4/27/1809,1809-04-27,120,"3906, 3907, 3908",NULL
S4208E,Betsy,Brig,Havanna,6/24/1809,1809-06-24,92,"3912, 3913, 3914, 3915, 3916",NULL
S4209E,Betsy,Brig,Naples,10/13/1809,1809-10-13,154,"3917, 3918",NULL
S4210E,Cynthia,Brig,Havanna,3/28/1809,1809-03-28,128,"3919, 3920, 3921, 3923",NULL
S4211E,Dash,Schooner,Cayenne[?],4/26/1809,1809-04-26,77,"3929, 3930",NULL
S4212E,Cynthia,Brig,Havanna,11/13/1809,1809-11-13,170,"3931, 3932, 3933, 3934, 3935",NULL
S4213E,Dove,Schooner,West Indies,5/11/1809,1809-05-11,67,"3936, 3937",NULL
S4214E,Dove,Schooner,Saint Bartholomew,5/ 11/ 1809,1809-05-11,67,"3938, 3939, 3940",NULL
S4215E,Dove,Schooner,Cayenne,5/18/1809,1809-05-18,68,"3941, 3942, 3943, 3944, 3945",NULL
S4216E,Dove,Schooner,Cadiz,9/19/1809,1809-09-19,68,"3946, 3947, 3948, 3949, 3950",NULL
S4217E,Dove,Schooner,Naples,11/18/1809,1809-11-18,67,"3951, 3952",NULL
S4218E,Edwin,Brig,Madeira,5/9/1809,1809-05-09,129,"3953, 3954, 3955, 3956, 3957",NULL
S4219E,Eliza,Brig,Laguira,7/6/1809,1809-07-06,133,"3958, 3959",NULL
S4220E,Eliza,Brig,Laguria,7/6/1809,1809-07-06,133,"3961, 3962",NULL
S4221E,Eliza,Schooner,Saint Bartholemew,3/20/1809,1809-03-20,55,"3963, 3964, 3965, 3966, 3967",NULL
S4222E,Eliza,Schooner,West Indies,6/16/1809,1809-06-16,55,"3968, 3969, 3970, 3971, 3972",NULL
S4223E,Eliza,Schooner,Algiers,8/5/1809,1809-08-05,NULL,"3973, 3974",NULL
S4224E,Elisa,Ship,NULL,4/12/1809,1809-04-12,512,"3975, 3976",from Penobscot
S4225E,Endeavour,Ship,Gottenburg,4/13/1809,1809-04-13,230,"3977, 3978, 3979",NULL
S4226E,Eliza & Mary,Brig,Gottenburg,"3/31/1809, 4/7/1809",1809-03-31,132,"3980, 3981, 3982, 3983, 3984",NULL
S4227E,Elizabeth,Schooner,"Western Island, Phyall [Fayal]",3/18/1809,1809-03-18,80,"3985, 3986, 3987, 3988, 3989, 3990",NULL
S4228E,Endeavour,Schooner,West Indies,6/27/1809,1809-06-27,57,"3991, 3992",NULL
S4229E,Eight Sisters,Brig,NULL,1807,0000-00-00,NULL,"3146, 3147",Brig of Boston; partial crew lists from the ports of Havana and Savannah
S4230E,Betsy,Schooner,NULL,1/12/1807,1807-01-12,NULL,3070,List of crew from captain's certification
S4231E,Nancy,Brig,Alicante,10/13/1807,1807-10-13,143,"3382, 3383",NULL
S4232E,Victory,Schooner,West Indies,5/15/1807,1807-05-15,120,"3598, 3599, 3600, 3601, 3602",NULL
S4233E,Victory,Schooner,West Indies,8/5/1807,1807-08-05,120,"3603, 3604, 3605",NULL
S4234E,Algol,Ship,NULL,11/22/1807,1807-11-22,NULL,"3656, 3657",Crew list from port of Philadelphia; list returned to Salem Nov. 1808
S4235E,Henry,Ship,NULL,12/19/1807,1807-12-19,NULL,"3693, 3694",Crew list from port of Philadelphia; list returned to Salem 4/4/1808
S4236E,Betsy,Brig,Cadiz & a market,10/25/1809,1809-10-25,92,"3909, 3910, 3911",NULL
S4237E,Cynthia,Brig,Tonningen,6/16/1809,1809-06-16,NULL,"3924, 3925, 3926, 3927, 3928",NULL
S4238E,Eliza Ann,Brig,Cronstadt,4/6/1812,1812-04-06,250,"6005, 6006",NULL
S4239E,Eliza & Mary,Brig,Cadiz [from New York],4/4/1812,1812-04-04,NULL,"6007, 6008, 6009",NULL
S4240E,Endeavour,Ship,Coast of Brazil,1/10/1812,1812-01-10,234,"6010, 6011, 6012, 6013, 6014",NULL
S4241E,Endeavour,Sloop,Bordeaux,11/13/1812,1812-11-13,91,"6015, 6016",NULL
S4242E,Enos,Brig,East Indias,1/12/1812,1812-01-12,126,"6017, 6018",NULL
S4243E,Factor,Brig,Buenos Ayres,2/8/1812,1812-02-08,122,"6021, 6022",NULL
S4244E,Fishhawk,Schooner,Martinique [from Baltimore],3/19/1812,1812-03-19,NULL,"6023, 6024",NULL
S4245E,Friendship,Ship,Archangel,4/7/1812,1812-04-07,342,"6025, 6026",NULL
S4246E,Glide,Ship,Havannah,3/21/1812,1812-03-21,307,"6027, 6028",NULL
S4247E,Helen,Schooner,West Indies,4/6/1812,1812-04-06,74,"6033, 6034, 6035",NULL
S4248E,Hercules,Ship,"Gibraltar & a Market [from Norfolk, Va.]",2/5/1812,1812-02-05,NULL,"6036, 6037",NULL
S4249E,Herald,Ship,Havana,2/15/1812,1812-02-15,274,"6038, 6039",NULL
S4250E,Levant,Brig,Lisbon,8/10/1812,1812-08-10,265,"6040, 6041, 6042",NULL
S4251E,Jason,Brig,West Indies & a Market,2/10/1812,1812-02-10,130,"6049, 6050, 6055, 6056, 6057",NULL
S4252E,Jeremiah,Schooner,Bay of St. Laurence & Eurpoe,NULL,0000-00-00,131,"6051, 6052",NULL
S4253E,Levant,Brig,Lisbon,10/8/1812,1812-10-08,265,"6053, 6054",NULL
S4254E,Mary,Brig,Havanna,2/26/1812,1812-02-26,113,"6058, 6059, 6060",NULL
S4255E,Mount Vernon,Ship,Europe,4/4/1812,1812-04-04,254,"6063, 6064",NULL
S4256E,Mentor,Ship,Riga?,3/19/1812,1812-03-19,213,"6065, 6066",NULL
S4257E,Neptune,Schooner,"Barbadoes [from Wilmington, N. C.]",1/28/1812,1812-01-28,NULL,"6067, 6068",NULL
S4258E,Neutrality,Schooner,West Indies,4/4/1812,1812-04-04,123,"6069, 6070, 6071, 6072, 6073",NULL
S4259E,Patriot,Bark,Havana,2/6/1812,1812-02-06,NULL,"6074, 6075",NULL
S4260E,Pilgrim,Brig,Brazil,1/11/1812,1812-01-11,269,"6076, 6077, 6078, 6079, 6080, 6081",NULL
S4261E,Polly,Schooner,Bordeaux,1/9/1812,1812-01-09,69,"6082, 6083",NULL
S4262E,Post Boy,Schooner,Citta Vecchia,1/27/1812,1812-01-27,154,"6084, 6085, 6086, 6087, 6088",NULL
S4263E,President,Schooner,West Indies,3/17/1812,1812-03-17,NULL,"6089, 6090",NULL
S4264E,Prudent,Brig,Europe,2/15/1812,1812-02-15,171,"6091, 6092",NULL
S4265E,Rachel,Brig,Cayene,3/12/1812,1812-03-12,116,"6093, 6094, 6095, 6096, 6097",NULL
S4266E,Rebecca,Brig,Gibralter,2/27/1812,1812-02-27,NULL,"6098, 6099",NULL
S4267E,Return,Ship,Porto Rica,11/13/1812,1812-11-13,133,"6102, 6103, 6104, 6105",NULL
S4268E,Reward,Brig,Lisbon,10/12/1812,1812-10-12,182,"6106, 6107",NULL
S4270E,Reward,Brig,Coruna,4/8/1812,1812-04-08,NULL,"6108, 6109",NULL
S4271E,Rotund,Brig,Havana,4/7/1812,1812-04-07,146,"6110, 6111, 6112, 6113, 6114",NULL
S4272E,Rotund,Brig,Havana,1/20/1812,1812-01-20,NULL,"6115, 6116",NULL
S4273E,Sally,Schooner,Messina,4/1/1812,1812-04-01,62,"6117, 6118",NULL
S4274E,Saucy Jack,Brig,Gibralter,1/1/1812,1812-01-01,125,"6119, 6120, 6121, 6122, 6123",NULL
S4275E,Sukey,Brig,St. Michael's & St. Petersburg,2/19/1812,1812-02-19,145,"6124, 6125",NULL
S4276E,Superiour,Schooner,West Indies,3/23/1812,1812-03-23,131,"6126, 6127, 6128, 6129, 6130",NULL
S4277E,Union,Schooner,West Indies,2/6/1812,1812-02-06,85,"6138, 6139, 6140, 6141, 6142",NULL
S4278E,Washington,Brig,"Liverpool, England",4/6/1812,1812-04-06,178,"6147, 6148, 6149, 6153, 6154",NULL
S4279E,Washington,Brig,Lisbon (from New York),1812,0000-00-00,NULL,"6150, 6151, 6152",NULL
S4280E,William & Charles,Brig,Havanna,4/7/1812,1812-04-07,162,"6155, 6156, 6157, 6158, 6159",NULL
S4281E,Cora,Brig,Europe,1/20/1813,1813-01-20,154,"6161, 6162",NULL
S4282E,Hare,Schooner,Hispaniola,12/17/1813,1813-12-17,36,"6163, 6164",NULL
S4283E,Hunter,Sloop,Havanna,12/22/1813,1813-12-22,43,"6165, 6166",NULL
S4284E,Levant,Brig,Havannah,12/18/1813,1813-12-18,265,"6167, 6168",NULL
S4285E,Phonix,Schooner,St. Bartholomews,10/22/1813,1813-10-22,54,"6169, 6170",NULL
S4286E,Rising States,Schooner,West Indies,1/9/1813,1813-01-09,128,"6173, 6174",NULL
S4287E,Speed,Brig,Cape Henry,10/23/1813,1813-10-23,110,"6175, 6176, 6177",NULL
S4288E,Starks,Schooner,Hispaniola,12/18/1813,1813-12-18,54,"6178, 6179",NULL
S4289E,Swift,Schooner,Hispaniola,12/13/1813,1813-12-13,64,"6180, 6181",NULL
S4290E,Three Brothers,Schooner,West Indies,12/18/1813,1813-12-18,52,"6182, 6183",NULL
S4291E,Venus,Ship,"St. Jago, Cuba",4/21/1813,1813-04-21,208,"6184, 6185",NULL
S4292E,Adaline,Ship,Europe,?/?/1815,0000-00-00,NULL,"6187, 6188, 6189",NULL
S4293E,Agawam,Schooner,Mediterranean,12/6/1815,1815-12-06,NULL,"6190, 6191, 6192, 6193, 6194",NULL
S4294E,Alba,Brig,Gibraltar & Market,9/7/1815,1815-09-07,NULL,"6195, 6196, 6197, 6198",NULL
S4295E,Alexander,Brig,Calcutta,8/8/1815,1815-08-08,NULL,"6201, 6202, 6203",NULL
S4296E,Alonzo,Brig,Mediterranean,8/17/1815,1815-08-17,NULL,"6204, 6205, 6206, 6207, 6208, 6209",NULL
S4297E,America,Schooner,Bourdeaux,8/21/1815,1815-08-21,NULL,"6210, 6211, 6212",NULL
S4298E,Anson,Brig,Not given.,6/19/1815,1815-06-19,NULL,"6213, 6214, 6215",NULL
S4299E,Argus,Brig,West Indies,5/30/1815,1815-05-30,NULL,"6216, 6217, 6218",NULL
S4300E,Argus,Brig,Matanzas,11/9/1815,1815-11-09,NULL,"6219, 6220, 6221, 6222, 6223, 6224",NULL
S4301E,Augusta,Brig,Matanzas,4/29/1815,1815-04-29,NULL,"6225, 6226, 6227",NULL
S4302E,Augusta,Brig,Havanna,11/9/1815,1815-11-09,127,"6228, 6229, 6230, 6231, 6232, 6233",NULL
S4303E,Augusta,Ship,Sumatra,4/8/1815,1815-04-08,NULL,"6234, 6235, 6236",NULL
S4304E,Betsey,Brig,West Indies,7/10/1815,1815-07-10,NULL,"6237, 6238, 6239, 6240, 6241, 6242",NULL
S4305E,Betsey,Brig,West Indies,9/12/1815,1815-09-12,NULL,"6243, 6244, 6245, 6246, 6247, 6248",NULL
S4306E,Betsey,Schooner,West Indies,11/25/1815,1815-11-25,NULL,"6251, 6252, 6253, 6254, 6255, 6256",NULL
S4307E,Camel,Bark,India,7/15/1815,1815-07-15,NULL,"6257, 6258, 6259, 6260",NULL
S4308E,Catherine,Brig,Cape Verd Islands,10/18/1815,1815-10-18,NULL,"6261, 6262, 6263, 6264, 6265, 6266, 6267",NULL
S4309E,Coromandel,Brig,Mediterranean,4/26/1815,1815-04-26,NULL,"6268, 6269, 6270",NULL
S4310E,Corinna,Schooner,Alicante Market [from Boston],10/23/1815,1815-10-23,NULL,"6271, 6272",NULL
S4311E,Coromandel,Brig,Europe,1/8/1815,1815-01-08,NULL,"6273, 6274",NULL
S4312E,Cuba,Brig,Havana,11/24/1815,1815-11-24,NULL,"6275, 6276, 6277",NULL
S4313E,Cynthia,Brig,Havana,7/1/1815,1815-07-01,NULL,"6278, 6279, 6280, 6281, 6282, 6283",NULL
S4314E,Cyrus,Schooner,Europe/Bordeaux,7/31/1815,1815-07-31,NULL,"6284, 6285, 6286, 6287, 6288, 6289",NULL
S4315E,Cyrus,Schooner,Gibralter,12/13/1815,1815-12-13,NULL,"6290, 6291, 6292",NULL
S4316E,Dawn,Brig,Archangel,11/22/1815,1815-11-22,NULL,"6293, 6294, 6295",NULL
S4317E,Diomede,Ship,Brazills[?],11/23/1815,1815-11-23,NULL,"6299, 6300, 6301, 6302, 6303, 6304",NULL
S4318E,Eliza,Brig,Lisbon,6/21/1815,1815-06-21,NULL,"6305, 6306",NULL
S4319E,Eliza,Brig,Martinico,9/1/1815,1815-09-01,NULL,"6307, 6308, 6309",NULL
S4320E,Eliza & Mary,Brig,Europe,11/23/1815,1815-11-23,NULL,"6310, 6311, 6312",NULL
S4321E,Eliza,Brig,Mediterranean,12///7/1815,0000-00-00,NULL,"6313, 6314, 6315",NULL
S4322E,Eliza & Mary,Brig,Rio Janiero,5/22/1815,1815-05-22,NULL,"6316, 6317, 6318",NULL
S4323E,Elizabeth,Schooner,Havana,7/26/1815,1815-07-26,NULL,"6319, 6320, 6321",NULL
S4324E,Endeavour,Ship,East Indies,4/14/1815,1815-04-14,NULL,"6322, 6323, 6324",NULL
S4325E,Equality,Schooner,Havana,7/3/1815,1815-07-03,NULL,"6325, 6326, 6327, 6328, 6329, 6330",NULL
S4326E,Essex,Schooner,Cayenne,11/20/1815,1815-11-20,NULL,"6331, 6332, 6333, 6334, 6335, 6336",NULL
S4327E,Exeter,Ship,Tenerife & India,7/9/1815,1815-07-09,NULL,"6337, 6338, 6339",NULL
S4328E,Falcon,Ship,West Indies,1/17/1815,1815-01-17,NULL,"6340, 6341, 6342",NULL
S4329E,Fame,Schooner,Matanzas,11/25/1815,1815-11-25,NULL,"6343, 6344, 6345",NULL
S4330E,Fanny,Schooner,Havana,5/27/1815,1815-05-27,NULL,"6346, 6347, 6348",NULL
S4331E,Fanny,Schooner,West Indies,9/1/1815,1815-09-01,NULL,"6349, 6350, 6351",NULL
S4332E,Favorite,Schooner,Martinico,7/1/1815,1815-07-01,NULL,"6352, 6353, 6354",NULL
S4333E,Francis,Ship,Havana,7/15/1815,1815-07-15,NULL,"6355, 6356, 6357, 6358, 6359",NULL
S4334E,Friendship,Schooner,West Indies,8/4/1815,1815-08-04,NULL,"6360, 6361, 6362",NULL
S4335E,Gentoo,Ship,Calcutta,12/30/1815,1815-12-30,NULL,"6363, 6364, 6365",NULL
S4336E,George,Ship,Pernambuco & Calcutta,5/22/1815,1815-05-22,NULL,"6366, 6367",NULL
S4337E,George,Brig,Martinico,8/11/1815,1815-08-11,NULL,"6368, 6369, 6370",NULL
S4338E,Glide,Ship,Calcutta,10/30/1815,1815-10-30,NULL,"6371, 6372, 6373, 6374, 6375",NULL
S4339E,Happy Couple,Schooner,Malta,8/5/1815,1815-08-05,NULL,"6376, 6377, 6378, 6379, 6380, 6381",NULL
S4340E,Happy Couple,Schooner,Mediterranean,10/14/1815,1815-10-14,NULL,"6382, 6383, 6384",NULL
S4341E,Hazard,Schooner,Havanna,3/14/1815,1815-03-14,NULL,"6385, 6386, 6387, 6388, 6389",NULL
S4342E,Hazard,Schooner,Not given.,5/26/1815,1815-05-26,NULL,"6390, 6391, 6392",NULL
S4343E,Hazard,Schooner,Liverpool,8/14/1815,1815-08-14,152,"6393, 9394, 9395, 6396, 6397",NULL
S4344E,Helen,Brig,South America,7/7/1815,1815-07-07,NULL,"6398, 6399, 6400, 6401, 6402, 6403",NULL
S4345E,Henry,Brig,Turks Island,8/3/1815,1815-08-03,NULL,"6404, 6405, 6406",NULL
S4346E,Henry,Brig,Gibraltar,10/21/1815,1815-10-21,NULL,"6407, 6408, 6409",NULL
S4347E,Herald,Ship,East Indies,10/23/1815,1815-10-23,NULL,"6410, 6411, 6412, 6413, 6414, 6415",NULL
S4348E,Hercules,Ship,Sumatra,3/18/1815,1815-03-18,NULL,"6416, 6417, 6418, 6419, 6420",NULL
S4349E,Hero,Schooner,St. Andrews,8/25/1815,1815-08-25,NULL,"6421, 6422, 6423",NULL
S4350E,Hope,Brig,Havana,4/22/1815,1815-04-22,NULL,"6424, 6425, 6426",NULL
S4351E,Hope,Brig,South America,10/3/1815,1815-10-03,NULL,"6430, 6431, 6432, 6436, 6437, 6438",NULL
S4352E,Hunter,Sloop,Havana,5/30/1815,1815-05-30,NULL,"6433, 6434, 6435",NULL
S4353E,Indus,Ship,South Seas & China,7/24/1815,1815-07-24,NULL,"6448, 6449, 6450",NULL
S4354E,Jachin,Schooner,Leghorn,1/21/1815,1815-01-21,NULL,"6451, 6452, 6453",NULL
S4355E,Leopard,Barque,Beauxdoux,7/10/1815,1815-07-10,NULL,"6454, 6455, 6456",NULL
S4356E,Mary,Brig,Canton,11/11/1815,1815-11-11,NULL,"6457, 6458, 6459",NULL
S4357E,Mary & Eliza,Schooner,Martinique,4/15/1815,1815-04-15,NULL,"6460, 6461, 6462",NULL
S4358E,Mercator,Brig,South America,12/21/1815,1815-12-21,NULL,"6463, 6464, 6465",NULL
S4359E,Meriam,Schooner,Martinique,3/28/1815,1815-03-28,NULL,"6466, 6467, 6468, 6469, 6470",NULL
S4360E,Meriam,Schooner,Guadaloupe,7/17/1815,1815-07-17,NULL,"6471, 6472, 6473, 6474, 6475",NULL
S4361E,Midas,Brig,India,9/25/1815,1815-09-25,NULL,"6476, 6477, 6478",NULL
S4362E,Nancy,Schooner,West Indies,12/9/1815,1815-12-09,70,"6479, 6480",NULL
S4363E,Nancy Ann,Brig,Mediterranean,4/12/1815,1815-04-12,NULL,"6481, 6482, 6483",NULL
S4364E,Nancy Ann,Brig,Baltic,5/30/1815,1815-05-30,NULL,"6484, 6485, 6486",NULL
S4365E,Nautilus,Brig,East Indies,10/20/1815,1815-10-20,NULL,"6487, 6488, 6489, 6490, 6491, 6492",NULL
S4366E,Neutrality,Schooner,West Indies,5/2/1815,1815-05-02,NULL,"6493, 6494",NULL
S4367E,Neva,Brig,St. Petersburgh,5/30/1815,1815-05-30,NULL,"6495, 6496",NULL
S4368E,Neutrality,Schooner,West Indies,9/25/1815,1815-09-25,NULL,"6497, 6498, 6499, 6500, 6501, 6502",NULL
S4369E,Patriot,Bark,India,12/12/1815,1815-12-12,NULL,"6503, 6504, 6505, 6506, 6507, 6508",NULL
S4370E,President,Schooner,West Indies,10/21/1815,1815-10-21,NULL,"6509, 6510, 6511",NULL
S4371E,Rapier,Schooner,Gibralter & a Market,6/20/1815,1815-06-20,NULL,"6512, 6513, 6514",NULL
S4372E,Romp,Brig,St. Petersburg,7/29/1815,1815-07-29,NULL,"6515, 6516, 6517",NULL
S4373E,Rotund,Brig,Surinam,4/15/1815,1815-04-15,NULL,"6518, 6519, 6520",NULL
S4374E,Rotund,Brig,Surinam,1/4/1815,1815-01-04,156,"6521, 6522",NULL
S4375E,Rotund,Brig,West Indies,8/9/1815,1815-08-09,156,"6523, 6524, 6525, 6526, 6527",NULL
S4376E,Saucy Jack,Brig,Archangel & India,5/16/1815,1815-05-16,NULL,"6534, 6535, 6536",NULL
S4377E,Sophia,Ship,Sumantra,4/26/1815,1815-04-26,NULL,"6537, 6538, 6539",NULL
S4378E,Speed,Brig,Havannah,1/14/1815,1815-01-14,110,"6540, 6541",NULL
S4379E,Stork,Sloop,West Indies,9/8/1815,1815-09-08,NULL,"6542, 6543, 6544, 6545, 6547, 6548",NULL
S4380E,Superb,Brig,Hamburgh,4/12/1815,1815-04-12,NULL,"6549, 6550, 6551",NULL
S4381E,Superb,Brig,Havannah,8/7/1815,1815-08-07,144,"6552, 6553, 6554, 6555, 6556",NULL
S4382E,Thomas,Schooner,St. Andrews,9/29/1815,1815-09-29,NULL,"6557, 6558, 6559",NULL
S4383E,Union,Ship,East Indies,4/20/1815,1815-04-20,NULL,"6563, 6564, 6565",NULL
S4384E,Warrington,Ship,West Indies,9/19/1815,1815-09-19,NULL,"6566, 6567, 6568, 6569, 6570, 6571",NULL
S4385E,Washington,Ship,West Indies,8/8/1815,1815-08-08,NULL,"6572, 6573, 6574",NULL
S4386E,Washington,Schooner,West Indies,7/17/1815,1815-07-17,NULL,"6575, 6576, 6577, 6578, 6579",NULL
S4387E,William,Brig,West Indies,10/24/1815,1815-10-24,NULL,"6580, 6581, 6582",NULL
S4388E,Active,Brig,Brazil & a Market,1/20/1816,1816-01-20,NULL,"6590, 6591, 6592",NULL
S4389E,Adaline,Ship,NULL,2/22/1816,1816-02-22,NULL,"6593, 6594, 6595, 6596, 6597, 6598",NULL
S4390E,Adventure,Schooner,Guadaloupe,12/4/1816,1816-12-04,NULL,"6599, 6600, 6601, 6602, 6603, 6604",NULL
S4391E,Alba,Brig,South America,4/30/1816,1816-04-30,NULL,"6605, 6606, 6607, 6608, 6609, 6610",NULL
S4392E,Alexander,Brig,East Indies,11/22/1816,1816-11-22,NULL,"6611, 6612, 6613, 6614, 6615, 6616",NULL
S4393E,Alice,Brig,West Indies,11/5/1816,1816-11-05,NULL,"6617, 6618, 6619, 6620, 6621,",NULL
S4394E,Anson,Brig,Maranham & a Market,4/8/1816,1816-04-08,NULL,"6622, 6623, 6624",NULL
S4395E,Argus,Brig,Martinico,3/18/1816,1816-03-18,NULL,"6625, 6626, 6627",NULL
S4396E,Anson,Brig,St. Salvador,10/5/1816,1816-10-05,NULL,"6628, 6629, 6630",NULL
S4397E,Argus,Brig,West Indies,8/8/1816,1816-08-08,NULL,"6631, 6632, 6633",NULL
S4398E,Augusta,Brig,West Indies,4/15/1816,1816-04-15,127,"6634, 6635",NULL
S4399E,Augusta,Brig,Angostura,10/28/1816,1816-10-28,127,"6636, 6637, 6638, 6639, 6640",NULL
S4400E,Augustus,Ship,Malta & a Market,3/16/1816,1816-03-16,NULL,"6641, 6642, 6643, 6644, 6645",NULL
S4401E,Bengal,Ship,Calcutta,10/19/1816,1816-10-19,304,"6646, 6647, 6648, 6649, 6650",NULL
S4402E,Betsy,Brig,Matanzas,4/25/1816,1816-04-25,NULL,"6651, 6652, 6653",NULL
S4403E,Betsy,Brig,West Indies,10/4/1816,1816-10-04,NULL,"6654, 6655, 6656, 6657, 6658",NULL
S4404E,Betsy,Schooner,West Indies,12/15/1816,1816-12-15,NULL,"6659, 6660, 6661",NULL
S4405E,Bramin,Brig,Calcutta,4/29/1816,1816-04-29,NULL,"6662, 6663, 6664",NULL
S4406E,Betsey,Schooner,West Indies,12/5/1815,1815-12-05,NULL,"6665, 6666, 6667",NULL
S4407E,Britannia,Schooner,Corunna,12/27/1816,1816-12-27,NULL,"6668, 666668, 6969, 6670, 6671, 6672, 6673",NULL
S4408E,Camel,Bark,Mediterranean,7/20/1816,1816-07-20,NULL,"6674, 6675, 6676",NULL
S4409E,Canton,Brig,India,5/8/1816,1816-05-08,335,"6677, 6678, 6679, 6680, 6681",NULL
S4410E,Catherine,Brig,St. Petersburg & Elsewhere[from Duxbury],4/15/1816,1816-04-15,NULL,"6682, 6683, 6684",NULL
S4411E,Charles Morris,Ship,Sumatra,1/13/1816,1816-01-13,NULL,"6685, 6686, 6687, 6688, 6689, 6690",NULL
S4412E,Cuba,Brig,Christiansand & Copeanhagen,4/23/1816,1816-04-23,NULL,"6691, 6692, 6693, 6697, 6698",NULL
S4413E,Cuba,Brig,Havana,11/24/1815,1815-11-24,NULL,"6694, 6695, 6696",NULL
S4414E,Cynthia,Brig,Hamburg & a Market,3/14/1816,1816-03-14,NULL,"6699, 6700, 6701",NULL
S4415E,Friendship,Ship,Calcutta,1/6/1816,1816-01-06,NULL,"6773, 6774, 6775",NULL
S4416E,George,Ship,Hamburgh,7/27/1816,1816-07-27,NULL,"6776, 6777, 6778, 6779, 6780",NULL
S4417E,George & Susan,Brig,Mediterranean,8/26/1816,1816-08-26,NULL,"6781, 6782, 6783",NULL
S4418E,Greyhound,Schooner,Martinico,8/16/1816,1816-08-16,NULL,"6784, 6785, 6786, 6787, 6788, 6789",NULL
S4419E,Happy Chance,Brig,West Indies,1/24/1816,1816-01-24,NULL,"6790, 6791, 6792, 6793, 6794, 6795",NULL
S4420E,Happy Chance,Brig,Guadaloupe,8/3/1815,1815-08-03,NULL,"6796, 6797, 6798, 6799, 6800, 6801",NULL
S4421E,Happy Couple,Schooner,Gibraltar,4/16/1816,1816-04-16,NULL,"6802, 6803, 6803",NULL
S4422E,Happy Couple,Schooner,Gibralter & market,9/17/1816,1816-09-17,NULL,"6805, 6806, 6807",NULL
S4423E,Hazard,Schooner,Angostura,4/25/1816,1816-04-25,152,"6808, 6809",NULL
S4424E,Helen,Brig,Europe,6/16/1816,1816-06-16,NULL,"6810, 6811, 6812, 6813, 6814, 6815",NULL
S4425E,Henry,Brig,Bengura (Africa),8/3/1816,1816-08-03,NULL,"6816, 6817, 6818, 6819, 6820, 6821",NULL
S4426E,Herald,Ship,Sumatra,11/5/1816,1816-11-05,NULL,"6822, 6823, 6824, 6825, 6826, 6827",NULL
S4427E,Hercules,Ship,Europe and India,3/16/1816,1816-03-16,NULL,"6828, 6829, 6830, 6831, 6832, 6833",NULL
S4428E,Hope,Ship,India,6/18/1816,1816-06-18,NULL,"6834, 6835, 6836, 6837, 6838, 6839",NULL
S4429E,Hope,Brig,South Sea,09/21/1816,1816-09-21,NULL,"6840, 6841, 6842",NULL
S4430E,Hope,Brig,Havanna,12/07/1816,1816-12-07,NULL,"6843, 6844, 6845, 6846, 6847, 6848",NULL
S4431E,Janus,Ship,Hamburg,05/28/1816,1816-05-28,277,"6849, 6859, 6851, 6852, 6853",NULL
S4432E,Jason,Brig,Bourbon,02/10/1816,1816-02-10,NULL,"6854, 6855, 6856",NULL
S4433E,Mary,Brig,West Indies,02/28/1816,1816-02-28,NULL,"6860, 6861, 6862, 6863, 6864, 6865",NULL
S4434E,Mary,Brig,Martinique,09/30/1816,1816-09-30,NULL,"6867, 6868, 6869, 6870, 6871",NULL
S4435E,Mary Ann,Ship,India,03/02/1816,1816-03-02,NULL,"6872, 6873, 6874, 6875, 6876, 6877",NULL
S4436E,Mary Ann,Ship,Janeiro,04/03/1816,1816-04-03,NULL,"6878, 6879",NULL
S4437E,Mary & Eliza,Brig,India,10/05/1816,1816-10-05,NULL,"6883, 6884, 6885, 6886, 6887, 6888",NULL
S4438E,Mercator,Brig,South America,08/30/1816,1816-08-30,NULL,"6889, 6890, 6891,6892, 6893, 6894",NULL
S4439E,Meriam,Schooner,Marseilles,02/10/1816,1816-02-10,NULL,"6895, 6896, 6897",NULL
S4440E,Messenger,Ship,Europe,05/31/1816,1816-05-31,NULL,"6898, 6899, 6900, 6901, 6902, 6903",NULL
S4441E,Nancy Ann,Brig,Europe,05/14/1816,1816-05-14,NULL,"6904, 6905, 6906, 6907, 6908, 6909",NULL
S4442E,New Hazard,Brig,East India,05/22/1816,1816-05-22,NULL,"6913, 6914, 6915, 6916, 6917, 6918",NULL
S4443E,Osprey,Ship,Cape de Verd,11/30/1816,1816-11-30,NULL,"6919, 6920, 6921",NULL
S4444E,Packet,Sloop,St. Michaels,04/29/1816,1816-04-29,NULL,"6922, 6923, 6924, 6925, 6926, 6927",NULL
S4445E,Palladium,Ship,Calcutta,12/28/1816,1816-12-28,NULL,"6928, 6929, 6930, 6931, 6932",NULL
S4446E,Perseverance,Ship,Gibraltar & a market,03/18/1816,1816-03-18,NULL,"6939, 6940, 6941, 6942",NULL
S4447E,Cynthia,Brig,Havanna,12/10/1816,1816-12-10,128,"6702, 6703, 6704, 6705, 6706",NULL
S4448E,Dawn,Brig,Havannah,12/6/1816,1816-12-06,163,"6707, 6708",NULL
S4449E,Edward,Brig,Surinam,9/21/1816,1816-09-21,NULL,"6712, 6713, 6714",NULL
S4450E,Eliza & Mary,Sloop,Europe,8/13/1816,1816-08-13,NULL,"6715, 6716, 6718, 6719, 6720",NULL
S4451E,Endeavour,Ship,Europe,5/17/1816,1816-05-17,NULL,"6721, 6722, 6723, 6724, 6725, 6726",NULL
S4452E,Essex,Brig,India,4/29/1816,1816-04-29,NULL,"6727, 6728, 6729, 6730, 6731, 6732, 6733",NULL
S4453E,Essex,Schooner,Cayenne,6/15/1816,1816-06-15,NULL,"6734, 6735, 6736",NULL
S4454E,Essex,Schooner,Cayenne,11/21/1816,1816-11-21,NULL,"6737, 6738, 6739, 6740, 6741, 6742",NULL
S4455E,Fame,Schooner,West Indies,8/5/1816,1816-08-05,NULL,"6746, 6747, 6748, 6749",NULL
S4456E,Fame,Schooner,Matanzes,12/23/1816,1816-12-23,NULL,"6752, 6753, 6754, 6755, 6756, 6757",NULL
S4457E,Fanny,Schooner,West Indies,5/14/1816,1816-05-14,NULL,"6758, 6759, 6760",NULL
S4458E,Fanny,Schooner,West Indies,11/27/1816,1816-11-27,NULL,"6761, 6762, 6763, 6764, 6765",NULL
S4459E,Francis,Ship,Leghorn,7/10/1816,1816-07-10,NULL,"6766, 6767, 6768, 6771, 6772",NULL
S4460E,Friendship,Ship,Batavia,1/6/1816,1816-01-06,NULL,"6769, 6770",NULL
S4461E,Rebecca,Brig,Havana,03/28/1816,1816-03-28,NULL,"6948, 6949, 6950, 6951, 6952, 6953",NULL
S4462E,Restitution,Ship,Calcutta,07/30/1816,1816-07-30,NULL,"6954, 6955, 6956",NULL
S4463E,Rogue,Schooner,Isle of May,10/23/1816,1816-10-23,147,"6957, 6958, 6959, 6960, 6961",NULL
S4464E,Rotund,Brig,Surinam,07/24/1816,1816-07-24,NULL,"6962, 6963, 6964",NULL
S4465E,Rotund,Brig,West Indies,05/21/1816,1816-05-21,166,"6965, 6966",NULL
S4466E,Rotund,Brig,West Indies,09/25/1816,1816-09-25,146,"6967, 6968, 6969, 6970, 6971",#6967 and 6968 are illegible
S4467E,Betsey,Schooner,Guadaloupe,5/1/1815,1815-05-01,NULL,"6249, 6250",.
S4468E,Venus,Brig,Gottenburg,4/6/1812,1812-04-06,184,"6143, 6144, 6145, 6146",15 May 1813. Crew discharged at Gothenberg.
S4469E,Helen,Schooner,Not given.,11/1/1811,1811-11-01,NULL,"6029, 6030, 3061, 3062,",Employment. 11/1/1811-3/21/1812
S4470E,Restitution,Ship,Not given,8/1811,0000-00-00,NULL,"6100, 6101",Employment. 8/12/1811-10/19/1812. Crew ranks not known.
S4471E,Janus,Ship,Not given.,NULL,0000-00-00,NULL,"6047, 6048",Employment. 1/4/1812-8/1/1812.
S4472E,Hope,Schooner,Not given.,7/24/1812[?],1812-07-24,NULL,"6043, 6044",Employment. 7/24/1812-1/3/1813.
S4473E,Industry,Brig,Not given.,NULL,0000-00-00,NULL,"6045, 6046",Employment. 7/4/1812-1/3/1813[?]
S4474E,Active,Ship,South America,11/30/1816,1816-11-30,NULL,"6584, 6585, 6586, 6586, 6587, 6588, 6589","Entire crew discharged at St. Salvador when vessel was sold, 12 June 1817."
S4475E,Diomede,Ship,South America,5/25/1816,1816-05-25,NULL,"6709, 6710, 6711","Five passengers, not named."
S4476E,Post Boy,Schooner,West Indies,5/18/1813,1813-05-18,154  3/5 ,"6171, 6172",Lower right portion of page missing.
S4477E,Alexander Hodgdon,Ship,Sumatra [from Boston],3/9/1815,1815-03-09,NULL,"6199, 6200",Notes at bottom: 4 guns; 2 more names missed by mistake
S4478E,Union,Schooner,Lisbon,3/10/1815,1815-03-10,NULL,"6560, 6561, 6562",of Beverly
S4479E,Mercator,Ship,"Ireland [from Charleston, South Carolina]",2/22/1812,1812-02-22,NULL,"6061, 6062",of Boston
S4480E,Fair American,Brig,"East Port (Eastport, ME?]",11/7/1861,1861-11-07,NULL,"6743, 6744, 6745",of Falmouth
S4481E,Rover,Brig,West Indies,10/24/1815,1815-10-24,NULL,"6528, 6529, 6530",of Kennebunk
S4482E,Evergreen,Ship,"Liverpool [from Charleston, SC]",3/12/1812,1812-03-12,NULL,"6019, 6020",of Wiscassett
S4483E,Neutrality,Schooner,West Indies,11/1816,0000-00-00,NULL,"6910, 6911, 6912",Remainder of crew list undecipherable
S4484E,Paragon,Schooner,West Indies,12/26/1816,1816-12-26,NULL,"6933, 6934, 6935, 6936, 6937, 6938",Schooner of Beverly
S4485E,President,Schooner,West Indies,08/24/1816,1816-08-24,NULL,"6942, 6943, 6944, 6945, 6946, 6947",Schooner of Beverly
S4486E,Mary Ann,Schooner,St. Andrews,10/22/1816,1816-10-22,NULL,"6880, 6881, 6882","Schooner of Warren, District of Passamaquody"
S4487E,Malabar,Ship,India,06/28/1816,1816-06-28,NULL,"6857, 6858, 6859",Ship is of Boston
S4488E,Talbot,Ship,Canton,3/11/1812,1812-03-11,318,"6131, 6132, 6133, 6134, 6135, 6136, 6137","Ship's captain and 1st officer declared some of the crew and officers were discharged and paid off at their own request at Pernambuco 12/4/1815. List of ship company given to George Gingerson, now master of Ship Talbot."
S4489E,Hope,Brig,Martinico,4/19/1815,1815-04-19,NULL,"6427, 6428, 6429",Vessel of Bath
S4490E,Salus,Ship,Hamburgh,7/27/1815,1815-07-27,NULL,"6531, 6532, 6533",Vessel of Newbury
S4491E,Delight,Schooner,West Indies,1/19/1815,1815-01-19,NULL,"6296, 6297, 6298",Vessel of Newburyport
S4492E,Hunter,Schooner,St. Andrews,7/24/1815,1815-07-24,NULL,"6439, 6440, 6441",Vessel of Newburyport
S4493E,Hunter,Schooner,St. Andrews,8/18/1815,1815-08-18,NULL,"6442, 6443, 6444, 6445, 6445, 6447",Vessel of Newburyport
S4494E,Naiad,Brig,Europe and India,07/18/1818,1818-07-18,NULL,"8006, 8007",NULL
S4495E,Nancy Ann,Brig,India,08/10/1818,1818-08-10,NULL,"8009, 8010, 8011, 8012, 8013",NULL
S4496E,Nautilus,Brig,East Indies,11/18/1818,1818-11-18,NULL,"8014, 8015, 8016, 8017, 8018","Note on image 8016 about deceased and deserted sailors June 2, 1820."
S4497E,Neutrality,Schooner,West Indies,06/02/1818,1818-06-02,NULL,"8019, 8020",NULL
S4498E,Neutrality,Schooner,West Indies,12/29/1818,1818-12-29,NULL,"8021, 8022, 8023, 8024, 8025",Returned March 9th 1819 [?]: see image 8023
S4499E,Neva,Brig,East Indies,01/17/1818,1818-01-17,NULL,"8026, 8027, 8028, 8029, 8030, 8031",NULL
S4500E,Niagara,Brig,Copenhagen and St. Petersburg,04/20/1818,1818-04-20,246,"8032, 8033, 8034, 8035",NULL
S4501E,Niagara,Brig,Brazil and a Market,11/27/1818,1818-11-27,NULL,"8036, 8037, 8038, 8039",NULL
S4502E,Olive Branch,Schooner,St. Jago De Cuba,12/10/1818,1818-12-10,NULL,"8040, 8041",NULL
S4503E,Ontario,Brig,East Indies,01/24/1818,1818-01-24,NULL,"8042, 8043, 8044, 8045, 8046",NULL
S4504E,Ontario,Brig,Europe and India,11/30/1818,1818-11-30,NULL,"8047, 8048",NULL
S4505E,Paramount,Schooner,Halifax,11/06/1818,1818-11-06,NULL,"8049, 8050",NULL
S4506E,Peace & Plenty,Schooner,West Indies,12/14/1818,1818-12-14,NULL,"8051, 8052, 8053",NULL
S4507E,Perseverance,Ship,East Indies,01/26/1818,1818-01-26,NULL,"8054, 8055, 8056",NULL
S4508E,President,Brig,West Indies,06/06/1818,1818-06-06,NULL,"8057, 8058",NULL
S4509E,Primrose,Schooner,Havre,10/21/1818,1818-10-21,NULL,"8059, 8060",NULL
S4510E,Rajah,Brig,India,08/11/1818,1818-08-11,NULL,"8061, 8062, 8063, 8064, 8065",NULL
S4511E,Rapid,Brig,Brazil,11/??/1818,0000-00-00,NULL,"8066, 8067",NULL
S4512E,Rebecca,Brig,St. Petersburg,06/03/1818,1818-06-03,NULL,"8068, 8069",NULL
S4513E,Rogue,Brig,Gibraltar and a Market,09/10/1819,1819-09-10,157,"8070, 8071",NULL
S4514E,Rogue,Brig,Havana,07/28/1818,1818-07-28,157,"8072, 8073",NULL
S4515E,Roscius,Brig,West Indies,01/03/1818,1818-01-03,NULL,"8074, 8075, 8076, 8077, 8078",NULL
S4516E,Roscius,Brig,Brazil,10/28/1818,1818-10-28,NULL,"8079, 8080, 8081, 8082, 8083",NULL
S4517E,Rotund,Brig,Surinam,01/03/1818,1818-01-03,146,"8084, 8085",NULL
S4518E,Rotund,Brig,Surinam,10/02/1818,1818-10-02,146,"8086, 8087, 8088, 8089, 8090",NULL
S4519E,St. Clair,Brig,St. Petersburg,06/11/1818,1818-06-11,NULL,"8091, 8092, 8093, 8094, 8095",NULL
S4520E,Salina & Jane,Schooner,Marseilles,09/01/1818,1818-09-01,NULL,"8096, 8097",NULL
S4521E,Sally,Schooner,Martinique and a Market,01/20/1818,1818-01-20,NULL,"8098, 8099, 8100",NULL
S4522E,Sally,Schooner,Brazil,06/18/1818,1818-06-18,NULL,"8101, 8102, 8103, 8104, 8105",NULL
S4523E,Spartan,Brig,Trieste,07/20/1818,1818-07-20,NULL,"8106, 8107, 8108",NULL
S4524E,Standard,Brig,Dublin,10/19/1818,1818-10-19,NULL,"8109, 8110, 8111",NULL
S4525E,Superior,Schooner,West Indies,06/17/1818,1818-06-17,NULL,"8112, 8113, 8114, 8115, 8116, 8117",NULL
S4526E,Trader,Brig,Marseilles,09/11/1818,1818-09-11,NULL,"8118, 8119, 8120, 8121, 8122",NULL
S4527E,Triton,Brig,West Indies,03/31/1818,1818-03-31,NULL,"8123, 8124, 8125, 8126, 8127",NULL
S4528E,Two Brothers,Ship,NULL,05/07/1818,1818-05-07,NULL,"8128, 8129, 8130, 8131, 8132, 8133, 8134","Note on 8131: Feb 6, 1819: I do hereby certify that Capt. Gilchrist has deposited in my hands eight pounds two shillings for 3 months wages for Thomas Taylor an American Seaman discharged out of the ship Two Brothers at this port. £8.2 being 3 months wages or $12 dolls p month 4/6 p dollar. Thomas Auldss[?] , Consul USA."
S4529E,Union,Brig,Cuba,01/12/1818[?],1818-01-12,129,"8135, 8136",NULL
S4530E,Union,Schooner,"West Indies (from Wilmington, NC)",02/18/1818,1818-02-18,NULL,"8137, 8138",NULL
S4531E,Union,Schooner,West Indies,07/13/1818,1818-07-13,NULL,"8139, 8140, 8141",NULL
S4532E,Union,Schooner,Martinique and St. Domingo,07/13/1818,1818-07-13,129,"8142, 8143",NULL
S4533E,Union,Schooner,West Indies,07/17/1818,1818-07-17,NULL,"8144, 8145, 8146, 8147, 8148, 8149",NULL
S4534E,Wallace,Ship,India,12/08/1818,1818-12-08,NULL,"8150, 8151",NULL
S4535E,Warrington,Ship,South Seas,07/14/1818,1818-07-14,NULL,"8152, 8153, 8154",NULL
S4536E,Washington,Brig,West Indies,05/26/1818,1818-05-26,NULL,"8155, 8156, 8157, 8158, 8159",NULL
S4537E,Wild Goose,Brig,Marseilles,06/06/1818,1818-06-06,NULL,"8160, 8161, 8162, 8163, 8164",NULL
S4538E,William,Brig,West Indies,11/26/1818,1818-11-26,NULL,"8165, 8166, 8167, 8168, 8169",NULL
S4539E,Agawam,Schooner,St. Andrews,07/27/1819,1819-07-27,NULL,"8171, 8172",NULL
S4540E,Alba,Brig,St. Andrews,06/23/1819,1819-06-23,NULL,"8173, 8174",NULL
S4541E,Alba,Brig,West Indies,11/12/1819,1819-11-12,NULL,"8175, 8176",NULL
S4542E,Alexander,Brig,Madura,03/29/1819,1819-03-29,NULL,"8177, 8178, 8179",NULL
S4543E,Alexander,Schooner,St. Andrews,06/12/1819; 06/26/1819,1819-06-12,NULL,"8180, 8181, 8182, 8183, 8184","8180, 8181: dated June 12, 1819
8182, 8183: dated June 26, 1819
8184: note dated July 1st, 1819, Wiscassett, certifying all persons except George Gregory were produced to him"
S4544E,Alonzo,Brig,Maranham and Para,10/22/1819,1819-10-22,NULL,"8185, 8186, 8193, 8194, 8195",NULL
S4545E,Alonzo,Brig,Maranham and Para,04/23/1819,1819-04-23,NULL,"8187, 8188, 8189, 8190, 8191, 8192",NULL
S4546E,Augusta,Brig,Leghorn,08/23/1819,1819-08-23,NULL,"8196, 8197",NULL
S4547E,Augustus,Ship,Havana,01/06/1819,1819-01-06,NULL,"8198, 8199, 8200, 8201",NULL
S4548E,Augusta,Brig,Havana,04/12/1819,1819-04-12,127,"8202, 8203",NULL
S4549E,Augustus,Brig,Leghorn,08/23/1819,1819-08-23,127,"8204, 8205",NULL
S4550E,Augustus,Ship,Havana,01/06/1819,1819-01-06,246,"8206, 8207",NULL
S4551E,Augusta,Brig,Leghorn,07/13/1819,1819-07-13,NULL,"8208, 8209, 8210",NULL
S4552E,Aurora,Ship,India,02/26/1819,1819-02-26,NULL,"8211, 8212, 8213, 8214, 8215, 8216","One man [unnamed] ran away and other shipped in his place, per notation dated 23 July 1820 at Salem"
S4553E,Barstow,Schooner,"Miquelon, St. Peter",01/25/1819,1819-01-25,NULL,"8217, 8218, 8219, 8220, 8221",NULL
S4554E,Eunice,Brig,East Indies,09/20/1819,1819-09-20,NULL,"8222, 8223",NULL
S4555E,Becket[?],Brig,East Indies,11/07/1819,1819-11-07,NULL,"8224, 8225",NULL
S4556E,Betsey,Brig,West Indies,08/20/1819,1819-08-20,NULL,"8226, 8227, 8228, 8234, 8235",NULL
S4557E,Betsy,Brig,West Indies,04/14/1819,1819-04-14,NULL,"8229, 8230, 8231, 8232, 8233",NULL
S4558E,Beverly,Schooner,West Indies,11/16/1819,1819-11-16,NULL,"8236, 8237, 8238, 8239, 8240",NULL
S4559E,Blackley,Brig,Isle of France,01/08/1819,1819-01-08,NULL,"8241, 8242, 8243, 8244, 8245",NULL
S4560E,Brittania,Brig,Europe,12/14/1819,1819-12-14,NULL,"8246, 8247, 8248",NULL
S4561E,Bulah,Brig,India,01/21/1819,1819-01-21,NULL,"8249, 8250, 8251, 8252",NULL
S4562E,Cambrian,Brig,Marseilles,10/21/1819,1819-10-21,196,"8253, 8254, 8255, 8256, 8257",NULL
S4563E,Catherine,Ship,West Indies,12/28/1819,1819-12-28,315,"8258, 8259",NULL
S4564E,Catherine,Ship,Hamburgh,07/17/1819,1819-07-17,315,"8260, 8263",NULL
S4565E,Catherine,Ship,India,10/10/1819,1819-10-10,315,"8261, 8262",NULL
S4566E,Ceres,Brig,Europe,10/15/1819,1819-10-15,NULL,"8264, 8265",NULL
S4567E,Charles Amberger,Brig,West Indies,01/06/1819,1819-01-06,NULL,"8266, 8267, 8268, 8269, 8270",NULL
S4568E,China,Ship,Leghorn and India,04/16/1819,1819-04-16,NULL,"8271, 8272, 8273",NULL
S4569E,Coromandel,Brig,Cowes and a Market,01/09/1819,1819-01-09,NULL,"8274, 8275, 8276, 8277",NULL
S4570E,Cynthia,Brig,Cayenne and a Market,09/02/1819,1819-09-02,NULL,"8278, 8279, 8280",NULL
S4571E,Cyrus,Schooner,Pernambuco,08/30/1819,1819-08-30,NULL,"8281, 8282, 8283, 8284, 8285","Note on 8283: Di[srti]ct of Boston and Charleston: All returned except Israel W. Grimes who Run and shipped another American in his place and in my oppinion [sic] the Captain and Officers and two thirds of the crew is Americans. Lewis Girdles[?] First Officers of the USR Cutter Search March 22, 1820."
S4572E,Diomede,Ship,South Minerva[?],12/17/1819,1819-12-17,NULL,"8286, 8287",NULL
S4573E,Dispatch Packet,Schooner,Guadeloupe,03/13/1819,1819-03-13,NULL,"8288, 8289, 8290",NULL
S4574E,Dispatch Packet,Schooner,St. Johns,07/08/1819,1819-07-08,NULL,"8291, 8292",NULL
S4575E,Edward,Brig,Bermuda,05/15/1819,1819-05-15,NULL,"8293, 8294, 8295",NULL
S4576E,Edward,Brig,Brazil and a market,10/27/1819,1819-10-27,NULL,"8296, 8297, 8298, 8299, 8300, 8301",NULL
S4577E,Eliza,Brig,South America,06/07/1819,1819-06-07,NULL,"8302, 8303, 8310, 8311, 8312",NULL
S4578E,Elizabeth,Brig,Amsterdam,09/10/1819,1819-09-10,NULL,"8304, 8305, 8313, 8314, 8315",NULL
S4579E,Eliza & Mary,Brig,Gibralter,10[?]/13/1819,0000-00-00,NULL,"8306, 8307",NULL
S4580E,Eliza,Schooner,West Indies,10/23/1819,1819-10-23,NULL,"8308, 8309",NULL
S4581E,Essex,Schooner,Port au Prince,07/01/1819,1819-07-01,NULL,"8316, 8317, 8322, 8323, 8324",NULL
S4582E,Essex,Schooner,West Indies,11/15/1819,1819-11-15,NULL,"8318, 8319",NULL
S4583E,Essex,Brig,(From Leghorn to) one or more ports in India,09/08/1819,1819-09-08,NULL,"8320, 8321",NULL
S4584E,Eunice,Brig,East Indies,09/20/1819,1819-09-20,NULL,"8325, 8326, 8327",NULL
S4585E,Fame,Schooner,Matanzas,10/28/1819,1819-10-28,NULL,"8328, 8329",NULL
S4586E,Fame,Schooner,Matanzas,02/26/1819,1819-02-26,NULL,"8330, 8331, 8332",NULL
S4587E,Fame,Schooner,Matanzas,06/08/1819,1819-06-08,NULL,"8333, 8334, 8335",NULL
S4588E,Fanny,Schooner,West Indies,06/04/1819,1819-06-04,NULL,"8336, 8337, 8338, 8341, 8342",NULL
S4589E,Fanny,Schooner,Cayenne and a market,12/14/1819,1819-12-14,NULL,"8339, 8340",NULL
S4590E,Favorite,Brig,Africa,09/11/1819,1819-09-11,NULL,"8343, 8344, 8345",NULL
S4591E,Favorite,Schooner,West Indies,11/17/1819,1819-11-17,NULL,"8346, 8347, 8348, 8349, 8350",NULL
S4592E,Favorite,Schooner,West Indies,05/21/1819,1819-05-21,NULL,"8351, 8352, 8353, 8354, 8355",NULL
S4593E,Fawn,Brig,South America,01/11/1819,1819-01-11,NULL,"8356, 8357, 8358",NULL
S4594E,Franklin,Brig,India,01/01/1819,1819-01-01,NULL,"8359, 8360, 8361, 8362, 8363","Note on 8361: Port of [?] 31 August 1820: Examined the within roll, found it correct except three men died and three shipped in their place[?] as affirmed by the captain. Christopher Babbige, Justice[?]"
S4595E,Frederick,Brig,Fayal,01/30/1819,1819-01-30,NULL,"8364, 8365, 8366, 8367",NULL
S4596E,Friendship,Ship,Europe and India,01/11/1819,1819-01-11,NULL,"8368, 8369, 8370, 8371",NULL
S4597E,General Stark,Brig,East Indies,12/07/1818,1818-12-07,NULL,"8372, 8373, 8374",NULL
S4598E,General Stark,Brig,Rotterdam,11/06/1819,1819-11-06,NULL,"8375, 8376",NULL
S4599E,George,Ship,Calcutta,06/08/1819,1819-06-08,328,"8377, 8378, 8379, 8380, 8381",NULL
S4600E,Gleaner,Brig,Antwerp,11/25/1819,1819-11-25,NULL,"8382, 8383",NULL
S4601E,Governor Endicott,Ship,Canton,5/11/1819[?],1819-05-11,298,"8384, 8385",NULL
S4602E,Hazard,Brig,West Indies,03/31/1819,1819-03-31,NULL,"8386, 8387",NULL
S4603E,Hercules,Ship,East Indies,07/07/1819,1819-07-07,NULL,"8388, 8389, 8390, 8391, 8392",NULL
S4604E,Homer,Brig,East Indies,07/07/1819,1819-07-07,NULL,"8393, 8394, 8395, 8396, 8397",NULL
S4605E,Hope,Brig,Brazil,04/29/1819,1819-04-29,NULL,"8398, 8399, 8402, 8403, 8404",NULL
S4606E,Hope,Brig,Pernambuco,12/15/1819,1819-12-15,NULL,"8400, 8401, 8405, 8406",NULL
S4607E,Hunter,Schooner,West Indies,04/10/1819,1819-04-10,NULL,"8407, 8408, 8409, 8410, 8411",NULL
S4608E,Jane,Schooner,NULL,07/21/1819,1819-07-21,NULL,"8412, 8413, 8414",8412: Too light to read
S4609E,Jane,Brig,a port East of Copenhagen[?],04/07/1819,1819-04-07,NULL,"8415, 8416, 8417",NULL
S4610E,Janus,Ship,Copenhagen and St. Petersburg,04/30/1819,1819-04-30,277,"8418, 8419, 8420, 8421, 8422",NULL
S4611E,Jeremiah,Schooner,Havana,04/20/1819,1819-04-20,NULL,"8423, 8424, 8425, 8426, 8427",NULL
S4612E,Julia Ann,Schooner,West Indies,12/09/1819,1819-12-09,NULL,"8428, 8429",NULL
S4613E,Laura,Brig,Europe and India,03/10/1819,1819-03-10,NULL,"8430, 8431, 8432, 8433, 8434",NULL
S4614E,Levant,Brig,West Indies,12/25/1819,1819-12-25,NULL,"8435, 8436, 8437, 8438, 8439",NULL
S4615E,Lion,Brig,West Indies,11/30/1819,1819-11-30,NULL,"8440, 8441, 8444, 8445",NULL
S4616E,Lion,Brig,West Indies,04/26/1819,1819-04-26,NULL,"8442, 8443, 8446, 8447, 8448",NULL
S4617E,Mary Eliza,Ship,Sumatra,04/07/1819,1819-04-07,233[?],"8449, 8450",NULL
S4618E,Mary Ann,Ship,Hamburg,08/03/1819,1819-08-03,NULL,"8451, 8452, 8453, 8454, 8455",NULL
S4619E,Mercator,Brig,Brazil,06/26/1819,1819-06-26,NULL,"8456, 8457, 8458, 8459, 8460",NULL
S4620E,Mercator,Brig,Brazil and a Market,12/31/1819,1819-12-31,NULL,"8461, 8462, 8463, 8464, 8465",NULL
S4621E,Messenger,Ship,India,03/19/1819,1819-03-19,NULL,"8466, 8467, 8468, 8469, 8470",NULL
S4622E,Midas,Ship,India,11/20/1819,1819-11-20,NULL,"8471, 8472",NULL
S4623E,Naiad,Brig,Europe and India,12/15/1819,1819-12-15,NULL,"8473, 8474, 8475, 8476, 8477",Spelled Niade on several documents
S4624E,Nancy Ann,Brig,Europe,10/04/1819,1819-10-04,NULL,"8478, 8479, 8480, 8481, 8482",NULL
S4625E,Nereus,Brig,East Indies,08/05/1819,1819-08-05,NULL,"8483, 8484, 8485, 8486, 8487",NULL
S4626E,Neutrality,Schooner,West Indies,06/09/1819,1819-06-09,NULL,"8488, 8489",NULL
S4627E,Niagara,Brig,Marseilles and a market,11/08/1819,1819-11-08,246,"8490, 8491, 8492, 8493, 8494",NULL
S4628E,Olive Branch,Schooner,St. Jago de Cuba,06/19/1819,1819-06-19,NULL,"8495, 8496",NULL
S4629E,Only Daughter,Schooner,St. Andrews,07/22/1819,1819-07-22,NULL,"8497, 8498, 8499",NULL
S4630E,Osprey,Ship,Sumatra,12/05/1819,1819-12-05,NULL,"8500, 8501, 8502, 8503, 9905",NULL
S4631E,Patriot,Bark,Marseilles,11/24/1819,1819-11-24,NULL,"8504, 8505, 8506, 8507",NULL
S4632E,President,Brig,West Indies,03/12/1819,1819-03-12,NULL,"8508, 8509",NULL
S4633E,President,Brig,West Indies,07/23/1819,1819-07-23,NULL,"8510, 8511",NULL
S4634E,Rambler,Brig,Cyane,05/27/1819,1819-05-27,NULL,"8512, 8513",NULL
S4635E,Rapid,Schooner,West Indies,12/28/1819,1819-12-28,NULL,"8514, 8515, 8516, 8517, 8518",NULL
S4636E,Rapid,Brig,Surinam,05/05/1819,1819-05-05,NULL,"8519, 8520",NULL
S4637E,Rapid,Brig,Surinam,10/25/1819,1819-10-25,NULL,"8521, 8522",NULL
S4638E,Rebecca,Brig,St. Petersburg,05/14/1819,1819-05-14,NULL,"8523, 8524, 8525, 8526, 8527",NULL
S4639E,Rebecca,Brig,Havanna (Cuba),01/15/1819,1819-01-15,NULL,"8528, 8529, 8530",NULL
S4640E,Restitution,Ship,Gibraltar,11/20/1819,1819-11-20,NULL,"8531, 8532",NULL
S4641E,Rogue,Brig,Gibraltar and a market,09/10/1819,1819-09-10,NULL,"8533, 8534, 8535, 8536",NULL
S4642E,Roscius,Brig,Brazil and a market,10/27/1819,1819-10-27,NULL,"8537, 8538, 8539, 8540, 8541",NULL
S4643E,Rotund,Brig,St. Jago de Cuba,12/22/1819,1819-12-22,146,"8542, 8543, 8546, 8547, 8548",NULL
S4644E,Rotund,Brig,Havana,08/03/1819,1819-08-03,146,"8544, 8545",NULL
S4645E,Stork,Brig,West Indies,01/29/1819,1819-01-29,NULL,"8549, 8550, 8553, 8554, 8555",NULL
S4646E,Stork,Brig,St. Andrews,06/18/1819,1819-06-18,NULL,"8551, 8552",NULL
S4647E,Superior,Schooner,St. Andrews,06/19/1819,1819-06-19,NULL,"8556, 8557",NULL
S4648E,Superior,Schooner,West Indies,01/13/1819,1819-01-13,NULL,"8558, 8559, 8560, 8561, 8562",NULL
S4649E,Swan,Schooner,West Indies,04/28/1819,1819-04-28,NULL,"8563, 8564, 8565, 8566, 8567",NULL
S4650E,Swan,Schooner,West Indies,08/16/1819,1819-08-16,NULL,"8568, 8569, 8570, 8571, 8572",NULL
S4651E,Time,Brig,Havana,NULL,0000-00-00,NULL,"8573, 8574",NULL
S4652E,Trend[?],Brig,Gibraltar and a market,08/14/1819,1819-08-14,NULL,"8575, 8576",NULL
S4653E,Triton,Brig,West Indies,03/15/1819,1819-03-15,NULL,"8577, 8578, 8579, 8585, 8586",NULL
S4654E,Triton,Brig,Copenhagen,07/08/1819,1819-07-08,NULL,"8580, 8581, 8582, 8583, 8584",NULL
S4655E,Two Brothers,Ship,India,08/21/1819,1819-08-21,NULL,"8587, 8588, 8589, 8590, 8591","Image 8589 mostly illegible. Many crew members died, ran away, etc., and others shipped on."
S4656E,Union,Brig,Havana,09/09/1819,1819-09-09,129,"8592, 8593",NULL
S4657E,Union,Schooner,West Indies,06/25/1819,1819-06-25,NULL,"8594, 8595, 8596, 8597, 8598",NULL
S4658E,Washington,Brig,Matanzas,03/15/1819,1819-03-15,NULL,"8599, 8600, 8601, 8607, 8608",NULL
S4659E,Washington,Brig,Matanzas,12/17/1819,1819-12-17,NULL,"8602, 8603, 8604, 8605, 8606",NULL
S4660E,Wild Goose,Brig,Gibraltar and a market,07/14/1819,1819-07-14,NULL,"8609, 8610, 8611, 8612, 8613",NULL
S4661E,William,Schooner,West Indies,11/25/1819,1819-11-25,NULL,"8614, 8615, 8622, 8623",NULL
S4662E,William,Brig,Russia,05/07/1819,1819-05-07,NULL,"8616, 8617, 8618",NULL
S4663E,William,Brig,St. Jago Cuba,12/06/1819,1819-12-06,NULL,"8619, 8620, 8621, 8624, 8625",NULL
S4664E,Otter,Brig,"Havana, Europe, and India",06/04/1821,1821-06-04,NULL,"1,000,610,007",NULL
S4665E,Padang,Brig,East Indies,09/22/1821,1821-09-22,NULL,"1,000,810,009,100,100,000,000,000",NULL
S4666E,Patriot,Bark,Nice,03/21/1821,1821-03-21,NULL,"10013, 10014, 10015, 10016, 10017",NULL
S4667E,Petrel,Schooner,"Bergin, Norway",03/26/1821,1821-03-26,NULL,"10018, 10019, 10020, 10021",NULL
S4668E,Petrel,Schooner,West Indies,12/03/1821,1821-12-03,NULL,"10022, 10023, 10024, 10025, 10026",NULL
S4669E,President,Brig,West Indies,02/20/1821,1821-02-20,NULL,"10027, 10028,10029,10030, 10031",NULL
S4670E,Rambler,Brig,Cayenne,12/22/1821,1821-12-22,NULL,"10032, 10033, 10034, 10035",Passengers [names illegible]
S4671E,Rambler,Brig,Cayenne,04/21/1821,1821-04-21,NULL,"10036, 10037, 10038, 10039, 10040",NULL
S4672E,Rambler,Brig,Cayenne,12/22/1821,1821-12-22,NULL,"10041, 10042",NULL
S4673E,Rebecca,Brig,Havana,03/31/1821,1821-03-31,NULL,"10043, 10044",NULL
S4674E,Regulus,Schooner,Nice,10/20/1821,1821-10-20,NULL,"10045, 10046",NULL
S4675E,Restitution,Ship,India,06/29(30)/1821,0000-00-00,NULL,"10047, 10048, 10051, 10052",NULL
S4676E,Roque,Brig,A market in the Mediterranian,11/09/1821,1821-11-09,NULL,"10049, 10050",NULL
S4677E,Roque,Brig,North Europe/ Copenhagen and St. Petersburg,06/12/1821,1821-06-12,206 13/19,"10053, 10054, 10057, 10058, 10059",NULL
S4678E,Roque,Brig,Havana,12/13/1821,1821-12-13,206,"10055, 10056",NULL
S4679E,Roscius,Brig,Brazil,07/11/1821,1821-07-11,NULL,"10061, 10062",NULL
S4680E,Roscoe,Brig,"Otaheite and a Market, Gibraltar",09/29/1821,1821-09-29,NULL,"10062, 10063, 10064, 10065, 10066",NULL
S4681E,Rotund,Brig,Gibraltar,07/12/1821,1821-07-12,NULL,"10067, 10068, 10069, 10070",NULL
S4682E,Sabat,Brig,West Indies,07/21/1821,1821-07-21,NULL,"10071, 10072",Vessel of Wells
S4683E,Sabat,Brig,Saint Michael's and a market,10/27/1821,1821-10-27,NULL,"10073, 10074",Vessel of Wells
S4684E,Sarah,Schooner,Saint Thomas & a market,12/29/1821,1821-12-29,NULL,"10075, 10076",Vessel of Ipswich
S4685E,Sea Serpent,Schooner,Saint Barthalomews,12/19/1821,1821-12-19,NULL,"10077, 10078",NULL
S4686E,Stork,Schooner,Saint Andrews,10/31/1821,1821-10-31,NULL,"10079, 10080",Vessel of Boston
S4687E,Stork,Brig,South America via Madeira,05/08/1821,1821-05-08,NULL,"10081, 10082",NULL
S4688E,Success,Schooner,Saint Domingo and a market,04/21/1821,1821-04-21,NULL,"10083, 10084, 10085, 10086","Note says James Mattenly deceased, but no James Mattenly on crew list; possibly James Hanson"
S4689E,Success,Schooner,Saint Domingo,12/14/1821,1821-12-14,NULL,"10087, 10088, 10089, 10090, 10091",NULL
S4690E,Suffolk,Ship,East Indies and elsewhere,10/26/1821,1821-10-26,NULL,"10092, 10093, 10094, 10095",NULL
S4691E,Teazer,Schooner,Nice and a market,03/19/1821,1821-03-19,NULL,"10096, 10097",Vessel of Marblehead
S4692E,Thetis,Brig,NULL,12/01/1821,1821-12-01,NULL,"10098, 10099",NULL
S4693E,Trader,Brigantine,South America,08/31/1821,1821-08-31,NULL,"10100, 10101, 10102, 10103, 10104",NULL
S4694E,Triton,Brig,North of Europe,02/01/1821,1821-02-01,NULL,"10105, 10106, 10107, 10108, 10109",NULL
S4695E,Triton,Brig,Copenhagen and Saint Petersburg,06/20/1821,1821-06-20,NULL,"10110, 10111, 10112, 10113,10114, 10115",NULL
S4696E,Two Brothers,Ship,East Indies,10/16/1821,1821-10-16,NULL,"10116, 10117, 10118, 10119, 10120",NULL
S4697E,Union,Brig,Hamburg,07/19/1821,1821-07-19,NULL,"10121, 10122, 10123, 10124, 10125, 10126",NULL
S4698E,Union,Brig,Surinam,12/31/1821,1821-12-31,NULL,"10127, 10128",NULL
S4699E,Washington,Brig,Matanzas,12/17/1821,1821-12-17,NULL,"10129, 10130, 10131, 10132, 10133",NULL
S4700E,Wild Goose,Brig,Gibraltar,04/21/1821,1821-04-21,NULL,"10134, 10135, 10136, 10137, 10138",Vessel sold to foreigners at Gibraltar; men discharged there were given 3 months extra pay
S4701E,William,Brig,Copenhagen and a Market,05/24/1821,1821-05-24,NULL,"10139, 10140,10144, 10145",NULL
S4702E,William,Brig,West Indies,12/31/1821,1821-12-31,NULL,"10141, 10142, 10143, 10146, 10147",NULL
S4703E,Acorn,Brig,India,12/21/1822,1822-12-21,NULL,"10149, 10150, 10151, 10152, 10153",NULL
S4704E,Active,Brig,East Indies,07/13/1822,1822-07-13,NULL,"10154, 10155, 10156, 10157, 10158, 10159",NULL
S4705E,Clarissa,Brig,Puerto Rico,08/03/1822,1822-08-03,NULL,"10284, 10285, 10286",Vessel of Kennebunk
S4706E,Africa,Brig,Brazil,08/08/1822,1822-08-08,NULL,"10160, 10161, 10162, 10163, 10164",NULL
S4707E,Alonzo,Brig,"Brazil and a market, South America",09/03/1822,1822-09-03,NULL,"10165, 10166, 10167, 10168, 10169",NULL
S4708E,America,Brig,Malta,07/10/1822,1822-07-10,NULL,"10170, 10171, 10172, 10173",NULL
S4709E,Amazon,Schooner,Limerick,12/26/1822,1822-12-26,NULL,"10174, 10175, 10176",NULL
S4710E,Ann,Schooner,West Indies,07/22/1822,1822-07-22,NULL,"10177, 10178, 10179, 10180",NULL
S4711E,Ann,Brig,East Indies,05/13/1822,1822-05-13,NULL,"10181, 10182, 10183, 10184, 10185",NULL
S4712E,Argo,Brig,Matanzas,02/23/1822,1822-02-23,NULL,"10186, 10187, 10188, 10189",NULL
S4713E,Argo,Schooner,Matanzas,11/01/1822,1822-11-01,NULL,"10190, 10191",NULL
S4714E,Augusta,Brig,Brazil,04/11/1822,1822-04-11,NULL,"10192, 10193, 10199, 10200, 10201",NULL
S4715E,Augusta,Brig,Brazilian Market,11/28/1822,1822-11-28,NULL,"10194, 10195, 10196, 10197, 10198",NULL
S4716E,Augustus,Ship,India,12/09/1822,1822-12-09,NULL,"10202, 10203, 10204, 10205, 10206",NULL
S4717E,Augustus,Ship,Hamburg,06/04/1822,1822-06-04,NULL,"10206, 10207, 10208, 10209",NULL
S4718E,Augustus,Ship,Havana,04/12/1822,1822-04-12,NULL,"10210, 10211, 10212, 10213, 10214, 10215",NULL
S4719E,Betsey,Brig,Cape Haytian,05/25/1822,1822-05-25,NULL,"10216, 10217, 10218, 10219",NULL
S4720E,Betsey,Brig,West Indies,02/27/1822,1822-02-27,NULL,"10220, 10221, 10222, 10223, 10224",NULL
S4721E,Betsey,Schooner,West Indies,10/13/1822,1822-10-13,NULL,"10225, 10226, 10232, 10233, 10234",NULL
S4722E,Betsey,Schooner,Curracoa [Curacao],06/12/1822,1822-06-12,NULL,"10227, 10228, 10229, 10230, 10231",NULL
S4723E,Cambrian,Brig,Europe,07/19/1822,1822-07-19,NULL,"10235, 10236, 10237, 10238, 10239",NULL
S4724E,Catharine,Ship,India,08/16/1822,1822-08-16,NULL,"10240, 10241, 10242, 10243, 10244, 10245",NULL
S4725E,Centurion,Brig,Copenhagen,06/29/1822,1822-06-29,NULL,"10246, 10247",NULL
S4726E,Ceres,Brig,Brazil,05/25/1822,1822-05-25,NULL,"10248, 10249, 10250, 10251, 10252, 10253",NULL
S4727E,Charles,Schooner,Pernambuco and a market,09/11/1822,1822-09-11,NULL,"10254, 10255, 10256, 10257, 10258",NULL
S4728E,Charles,Schooner,Maranham,02/23/1822,1822-02-23,NULL,"10259, 10260, 10261, 10262, 10263, 10264",NULL
S4729E,Chase,Brig,Brazil and a Market,11/25/1822,1822-11-25,NULL,"10265, 10266, 10267, 10268, 10269, 10270",NULL
S4730E,Cherub,Schooner,"Halifax, NS",02/07/1822,1822-02-07,NULL,"10271, 10272",NULL
S4731E,China,Ship,Havana,12/31/1822,1822-12-31,NULL,"10273, 10274, 10275, 10282, 10283",NULL
S4732E,China,Ship,"Antwerp, Europe",05/24/1822,1822-05-24,NULL,"10276, 10277, 10278, 10279, 10280, 10281",NULL
S4733E,Climax,Brig,India,04/25/1822,1822-04-25,NULL,"10287, 10288, 10289, 10290, 10291",NULL
S4734E,Commerce,Ship,Liverpool,03/02/1822,1822-03-02,NULL,"10292, 10293, 10294",NULL
S4735E,Cynthia,Brig,Cayenne and a market,10/04/1822,1822-10-04,NULL,"10295, 10296, 10300, 10301, 10302, 10303",NULL
S4736E,Cynthia,Brig,Surinam,04/01/1822,1822-04-01,NULL,"10297, 10298, 102994, 10304, 10305",NULL
S4737E,Cyrus,Schooner,Brazil and a Market,04/08/1822,1822-04-08,NULL,"10306, 10307, 10308, 10309, 10310",NULL
S4738E,Dawn,Brig,Matanzas,04/13/1822,1822-04-13,NULL,"10311, 10312, 10315, 10316",NULL
S4739E,Dawn,Brig,Leghorn,07/01/1822,1822-07-01,163,"10313, 10314, 10317, 10318",NULL
S4740E,Dispatch Packet,Schooner,Brazil and a market,06/15/1822,1822-06-15,NULL,"10319, 10320, 10323, 10324",NULL
S4741E,Dispatch Packet,Schooner,Brazil and a Market,12/9/1822,1822-12-09,NULL,"10321, 10322, 10325, 10326, 10327",NULL
S4742E,Dove,Schooner,West Indies,01/09/1822,1822-01-09,NULL,"10328, 10329, 10330, 10331, 10332",NULL
S4743E,Eliza,Brig,Brazil,01/24/1822,1822-01-24,NULL,"10333, 10334",NULL
S4744E,Eliza,Brig,Brazil and a Market,09/26/1822,1822-09-26,NULL,"10335, 10336",NULL
S4745E,Eliza & Mary,Brig,India,02/02/1822,1822-02-02,NULL,"10337, 10338, 10339, 10340",NULL
S4746E,Endeavour,Ship,East Indies,07/19/1822,1822-07-19,NULL,"10341, 10342, 10343, 10344",NULL
S4747E,Essex,Schooner,Cayenne,03/27/1822,1822-03-27,NULL,"10345, 10346",NULL
S4748E,Evergreen,Schooner,South America and a market,08/27/1822,1822-08-27,NULL,"10347, 10348",NULL
S4749E,Fame,Schooner,Saint Bartholomews,10/07/1822,1822-10-07,NULL,"10349, 10350",NULL
S4750E,Laurel,Brig,South America and a Market,11/14/1822,1822-11-14,NULL,"10509, 10510, 10511, 10512",NULL
S4751E,Fanny,Brig,Brazil,08/31/1822,1822-08-31,NULL,"10351, 10352",NULL
S4752E,Fanny,Schooner,West Indies,03/19/1822,1822-03-19,NULL,"10353, 10354, 10355, 10356",NULL
S4753E,Favorite,Schooner,Brazil,05/25/1822,1822-05-25,NULL,"10357, 10358, 10359, 10360",NULL
S4754E,Fenelon,Brig,Saint Iago de Cuba,11/20/1822,1822-11-20,NULL,"10361, 10362, 10365, 10366",NULL
S4755E,Francis,Ship,Leghorn,09/10/1822,1822-09-10,NULL,"10363, 10364, 10367, 10368, 10369",Ship went on to Sumatra from Leghorn
S4756E,Franklin,Brig,Saint Petersburg,07/21/1822,1822-07-21,NULL,"10370, 10371, 10372",NULL
S4757E,Friendship,Ship,South America,05/30/1822,1822-05-30,NULL,"10373, 10374, 10375, 10376",NULL
S4758E,General Brooks,Schooner,Augustina in South America,03/27/1822,1822-03-27,NULL,"10377, 10378",NULL
S4759E,General Brooks,Schooner,Western Islands,11/19/1822,1822-11-19,NULL,"10379, 10380",NULL
S4760E,General Warren,Schooner,West Indies,03/05/1822,1822-03-05,NULL,"10381, 10382",NULL
S4761E,George,Ship,"India, Calcutta",05/23/1822,1822-05-23,NULL,"10383, 10384, 10385, 10386, 10387",NULL
S4762E,Governor Endicott,Brig,Bremen,07/03/1822,1822-07-03,NULL,"10388, 10389",NULL
S4763E,Halcyon,Schooner,West Indies,01/05/1822,1822-01-05,NULL,"10390, 10391",NULL
S4764E,Herald,Brig,Calcutta,04/05/1822,1822-04-05,241,"10392, 10393",NULL
S4765E,Hercules,Ship,South American Market,12/24/1822,1822-12-24,NULL,"10394, 10395, 10396",NULL
S4766E,Homer,Brig,India,03/07/1822,1822-03-07,NULL,"10397, 10398",NULL
S4767E,Hope,Brig,St. Jago de Cuba,04/15/1822,1822-04-15,NULL,"10399, 10400, 10401, 10402, 10403",NULL
S4768E,Hope,Brig,South America,04/30/1822,1822-04-30,NULL,"10404, 10405, 10408, 10409, 10410",NULL
S4769E,Hope,Brig,South America and a Market,12/27/1822,1822-12-27,NULL,"10406, 10407, 10411, 10412, 10413, 10314",NULL
S4770E,Hope,Ship,India,08/24/1822,1822-08-24,NULL,"10415, 10416, 10417, 10418",NULL
S4771E,Persia,Brig,India,08/20/1822,1822-08-20,NULL,"10419, 10420, 10421, 10422, 10423",NULL
S4772E,Phebe,Brig,St. Iago de Cuba,09/09/1822,1822-09-09,NULL,"10424, 10425, 10426, 10427",NULL
S4773E,Phebe,Brig,St. Iago de Cuba,12/26/1822,1822-12-26,NULL,"10428, 10429, 10430, 10431, 10432, 10433",NULL
S4774E,Philaeni,Brig,East Indies,11/14/1822,1822-11-14,NULL,"10434, 10435, 10436",NULL
S4775E,Pioneer,Brig,East Indies,07/09/1822,1822-07-09,NULL,"10437, 10438, 10439, 10440, 10441",NULL
S4776E,Planet,Schooner,West Indies,11/29/1822,1822-11-29,NULL,"10442, 10443",NULL
S4777E,Plato,Schooner,St. Michael's and a market,03/02/1822,1822-03-02,NULL,"10444, 10445",NULL
S4778E,Plato,Schooner,Western Islands,11/01/1822,1822-11-01,NULL,"10446, 10447",NULL
S4779E,Rajah,Brig,India,09/16/1822,1822-09-16,NULL,"10448, 10449",NULL
S4780E,Rambler,Brig,Cayenne,09/24/1822,1822-09-24,NULL,"10450, 10451",NULL
S4781E,Reaper,Brig,Europe,08/31/1822,1822-08-31,NULL,"10452, 10453",NULL
S4782E,Rebecca,Brig,Havana,03/21/1822,1822-03-21,NULL,"10454, 10455",NULL
S4783E,Rebecca,Brig,Brazil and a Market,12/07/1822,1822-12-07,NULL,"10456, 10457, 10458, 10459, 10460",NULL
S4784E,Regulus,Schooner,"Brazil, South America and a market",08/09/1822,1822-08-09,NULL,"10461, 10462, 10463, 10464, 10465, 10466",NULL
S4785E,Roque,Brig,"Leghorn, Europe",05/04/1822,1822-05-04,NULL,"10467, 10468, 10469, 10470, 10471",NULL
S4786E,Roque,Brig,Mediterranean,11/09/1822,1822-11-09,NULL,"10472, 10473, 10474",NULL
S4787E,Roscius,Brig,Brazil and a Market,04/05/1822,1822-04-05,NULL,"10475, 10476, 10477, 10478, 10479, 10480",NULL
S4788E,Roscius,Brig,Brazil and a Market,11/12/1822,1822-11-12,NULL,"10481, 10482, 10483, 10484, 10485",NULL
S4789E,Jason,Brig,NULL,08/17/1822,1822-08-17,NULL,"10486, 10487",NULL
S4790E,Jane,Brig,Sumatra,11/11/1822,1822-11-11,NULL,"10488, 10489",NULL
S4791E,Janus,Ship,Copenhagen and a Market,05/28/1822,1822-05-28,NULL,"10490, 10491, 10492, 10493, 10494, 10495",NULL
S4792E,Jeremiah,Brig,Hamburg,06/20/1822,1822-06-20,NULL,"10496, 10497",NULL
S4793E,Jeremiah,Brig,Havana,04/13/1822,1822-04-13,NULL,"10498, 10499, 10500, 10501, 10502",NULL
S4794E,Laura,Brig,Havana,01/02/1822,1822-01-02,NULL,"10503, 10504, 10505",NULL
S4795E,Laura,Brig,South America and a Market,08/19/1822,1822-08-19,NULL,"10506, 10507, 10508",NULL
S4796E,Leader,Schooner,Saint Andrews,06/17/1822,1822-06-17,NULL,"10513, 10514, 10515, 10516",NULL
S4797E,Leander,Brig,India,06/22/1822,1822-06-22,NULL,"10517, 10518, 10519, 10520, 10521, 10522",NULL
S4798E,Lion,Brig,South America,05/26/[1822?],0000-00-00,NULL,"10523, 10524",NULL
S4799E,Lyon,Brig,Bremen,06/03/1822,1822-06-03,NULL,"10525, 10526",NULL
S4800E,Marcellus,Schooner,Aux Cayes,09/26/1822,1822-09-26,NULL,"10527, 10528",NULL
S4801E,Mary & Eliza,Schooner,Matanzas,11/07/1822,1822-11-07,NULL,"10529, 10530",NULL
S4802E,Merrimack Packet,Sloop,Cape Haytian and Gibarra,04/25/1822,1822-04-25,NULL,"10531, 10532",NULL
S4803E,Merimack Packet,Schooner,West Indies,12/02/1822,1822-12-02,NULL,"10533, 10534, 10535, 10536",NULL
S4804E,Messenger,Ship,South America,06/12/1822,1822-06-12,NULL,"10537, 10538, 10539, 10540",NULL
S4805E,Milo,Schooner,Saint Andrews,09/19/1822,1822-09-19,NULL,"10541, 10542",Vessel of Bristol
S4806E,Minerva,Schooner,Martinico,04/11/1822,1822-04-11,NULL,"10543, 10544, 10545, 10546",NULL
S4807E,Nautilus,Brig,South America,07/06/1822,1822-07-06,NULL,"10547, 10548",NULL
S4808E,Neutrality,Brig,Saint Pierres,11/29/1822,1822-11-29,NULL,"10549, 10550",NULL
S4809E,Neutrality,Brig,West Indies,05/23/1822,1822-05-23,NULL,"10551, 10552, 10553, 10554",NULL
S4810E,Nera,Brig,Bremen,07/29/1822,1822-07-29,NULL,"10555, 10556",NULL
S4811E,Niagara,Brig,North of Europe,04/24/1822,1822-04-24,NULL,"10557, 10558",NULL
S4812E,Olive,Schooner,Saint Andrews,05/10/1822,1822-05-10,NULL,"10563, 10564",Vessel of Portland
S4813E,Niagara,Brig,South America and a Market,10/08/1822,1822-10-08,NULL,"10559, 10560, 10561, 10562",NULL
S4814E,Only Son,Schooner,Saint Thomas and a Market,04/09/1822,1822-04-09,NULL,"10565, 10566, 10567",Vessel of Duxbury
S4815E,Ontario,Brig,"Salem, from Antwerp",11/02/1822,1822-11-02,NULL,"10568, 10569",NULL
S4816E,Orient,Brig,Liverpool,07/12/1822,1822-07-12,NULL,"10570, 10571, 10572","""Two hands [one unnamed] runaway two [unnamed] ship'd in their stead"""
S4817E,Osprey,Brig,South America and a Market,09/27/1822,1822-09-27,NULL,"10573, 10574",NULL
S4818E,Patriot,Bark,from Leghorn to Sumatra in India,11/04/1822,1822-11-04,NULL,"10575, 10576",NULL
S4819E,Perseverance,Ship,Sumatra,08/16/1822,1822-08-16,NULL,"10577, 10578, 10579, 10580",NULL
S4820E,Rotund,Brig,Brazil and a Market,11/22/1822,1822-11-22,NULL,"10581, 10582, 10583, 10584",NULL
S4821E,Sally Barker,Brig,Martinico,12/20/1822,1822-12-20,NULL,"10585, 10586, 10587, 10588",Note on image 10586 about crew members lost overboard does not seem to relate to this crew
S4822E,Seaman,Brig,India,01/03/1822,1822-01-03,NULL,"10589, 10590",Vessel of Danvers
S4823E,Spartan,Brig,Montevideo and a Market,10/17/1822,1822-10-17,NULL,"10591, 10592",NULL
S4824E,Standard,Brig,Bremen,04/25/1822,1822-04-25,NULL,"10593, 10594, 10595",NULL
S4825E,Stork,Brig,South America,03/21/1822,1822-03-21,NULL,"10596, 10597, 10598, 10599, 10600",NULL
S4826E,Stork,Schooner,Saint Andrews,09/09/1822,1822-09-09,NULL,"10601, 10602",Vessel of Boston
S4827E,Swan,Schooner,West indies,04/20/1822,1822-04-20,NULL,"10603, 10604, 10605, 10606",NULL
S4828E,Triton,Brig,North of Europe,02/15/1822,1822-02-15,NULL,"10607, 10608",NULL
S4829E,Triton,Brig,Brazil and a Market,11/13/1822,1822-11-13,NULL,"10609, 10610",NULL
S4830E,Two Sisters,Schooner,Saint Jago de Cuba,12/10/1822,1822-12-10,NULL,"10611, 10612, 10613, 10614",NULL
S4831E,Union,Brig,Surinam,11/22/1822,1822-11-22,NULL,"10615, 10616, 10617, 10618",NULL
S4832E,Union,Brig,Surinam,05/08/1822,1822-05-08,NULL,"10619, 10620",NULL
S4833E,Unicorn,Schooner,West Indies,10/14/1822,1822-10-14,NULL,"10621, 10622",NULL
S4834E,Unicorn,Schooner,Martinico,06/04/1822,1822-06-04,NULL,"10623, 10624",NULL
S4835E,Washington,Brig,Havana,12/24/1822,1822-12-24,NULL,"10625, 10626",NULL
S4836E,Washington,Brig,Havana,12/14/1822,1822-12-14,NULL,"10627, 10628",NULL
S4837E,William,Brig,Marseilles,11/13/1822,1822-11-13,NULL,"10629, 10630",NULL
S4838E,Abby,Brig,Marseilles,06/23/1823,1823-06-23,NULL,"10632, 10633",NULL
S4839E,Acorn,Brig,Leghorn,12/31/1823,1823-12-31,NULL,"10634, 10635, 10636, 10637",NULL
S4840E,Agawam,Schooner,Cuba,11/17/1823,1823-11-17,NULL,"10638, 10639, 10640, 10641",NULL
S4841E,Alexandria,Brig,Brazil,07/30/1823,1823-07-30,NULL,"10642, 10643",NULL
S4842E,Alfred,Brig,Brazil and a Market,01/03/1823,1823-01-03,NULL,"10644, 10645, 10646, 10647",NULL
S4843E,Alfred,Brig,Brazil and a Market,05/30/1823,1823-05-30,NULL,"10648, 10649, 10650, 10651, 10652",NULL
S4844E,Alfred,Brig,Brazil and a Market,11/16/1823,1823-11-16,NULL,"10653, 10654, 10655, 10656",NULL
S4845E,Alonzo,Brig,Mediterranean,05/06/1823,1823-05-06,NULL,"10657, 10658, 10659, 10660",NULL
S4846E,America,Brig,Hamburg,05/13/1823,1823-05-13,NULL,"10661, 10662, 10663, 10664",NULL
S4847E,Ann,Brig,India,05/20/1823,1823-05-20,NULL,"10665, 10666, 10667, 10668",One hand [unnamed] discharged and two [unnamed] shipped in his place
S4848E,Argo,Brig,Matanzas,11/22/1823,1823-11-22,NULL,"10669, 10670",NULL
S4849E,Augusta,Brig,Brazil and a Market,09/18/1823,1823-09-18,NULL,"10671, 10672",NULL
S4850E,Aurora,Ship,Europe,02/22/1823,1823-02-22,NULL,"10673, 10674, 10675, 10676",NULL
S4851E,Aurora,Schooner,Gibraltar and a market,10/17/1823,1823-10-17,NULL,"10677, 10678",NULL
S4852E,Bengal,Ship,Calcutta,04/30/1823,1823-04-30,304,"10679, 10680",NULL
S4853E,Betsey,Brig,West Indies,01/10/1823,1823-01-10,NULL,"10681, 10682, 10683, 10684",NULL
S4854E,Betsey,Brig,West Indies,07/09/1823,1823-07-09,NULL,"10685, 10686",NULL
S4855E,Cambrian,Brig,Marseilles,07/01/1823,1823-07-01,NULL,"10687, 10688, 10689, 10690",NULL
S4856E,Camel,Brig,Martinico and a Market,10/13/1823,1823-10-13,NULL,"10691, 10692, 10693, 10694",NULL
S4857E,Caroline,Ship,Cowes and a Market,06/11/1823,1823-06-11,NULL,"10695, 10696",NULL
S4858E,Caroline,Ship,South America,12/20/1823,1823-12-20,NULL,"10697, 10698, 10699, 10700",NULL
S4859E,Catharine,Ship,Europe and India,08/28/1823,1823-08-28,NULL,"10701, 10702, 10703, 10704, 10705",NULL
S4860E,Centurion,Brig,Antwerp,03/01/1823,1823-03-01,NULL,"10706, 10707",NULL
S4861E,Centurion,Brig,South America,09/25/1823,1823-09-25,NULL,"10708, 10709, 10710, 10711",NULL
S4862E,Ceres,Ship,Liverpool,03/29/1823,1823-03-29,NULL,"10712, 10713",NULL
S4863E,Chase,Brig,South America and a Market,12/22/1823,1823-12-22,NULL,"10714, 10715",NULL
S4864E,China,Ship,South America,09/13/1823,1823-09-13,NULL,"10716, 10717, 10718, 10719",NULL
S4865E,Collectors,Brig,South America,05/09/1823,1823-05-09,NULL,"10720, 10721",NULL
S4866E,Comet,Brig,From Leghorn back to Salem,09/10/1823,1823-09-10,NULL,"10722, 10723","Five hands [unnamed] runaway, and five shipped in their stead."
S4867E,Coromandel,Brig,Rio de Janeiro and a Market,12/29/1823,1823-12-29,NULL,"10724, 10725",NULL
S4868E,Cygnet,Brig,Europe,02/11/1823,1823-02-11,NULL,"10726, 10727, 10728, 10729",NULL
S4869E,Cygnet,Brig,Marseilles,08/11/1823,1823-08-11,NULL,"10730, 10731",NULL
S4870E,Cynthia,Brig,Cayenne,05/14/1823,1823-05-14,NULL,"10732, 10733, 10734, 10735, 10736",NULL
S4871E,Cynthia,Brig,Cayenne,11/18/1823,1823-11-18,NULL,"10737, 10738, 10739, 10740",NULL
S4872E,Cyrus,Schooner,Brazil and a Market,01/13/1823,1823-01-13,NULL,"10741, 10742",NULL
S4873E,Dawn,Brig,Matanzas,03/11/1823,1823-03-11,NULL,"10743, 10744, 10745, 10746",NULL
S4874E,Dawn,Brig,Europe,10/23/1823,1823-10-23,NULL,"10747, 10748, 10749, 10750",NULL
S4875E,Dennis,Schooner,Africa,08/29/1823,1823-08-29,NULL,"10751, 10752, 10753, 10754",Arrived at Goree 6 Nov. 1823
S4876E,Dispatch Packet,Schooner,Brazil and a Market,05/10/1823,1823-05-10,NULL,"10755, 10756",NULL
S4877E,Edward,Brig,Brazil and a Market,04/08/1823,1823-04-08,NULL,"10757, 10758, 10759, 10760, 10761",NULL
S4878E,Elder Brewster,Brig,Leghorn and a Market,01/15/1823,1823-01-15,NULL,"10762, 10763",NULL
S4879E,Eliza,Ship,India,10/16/1823,1823-10-16,NULL,"10764, 10765, 10766, 10767",NULL
S4880E,Eliza,Bark,South America,10/30/1823,1823-10-30,NULL,"10768, 10769, 10770, 10771",NULL
S4881E,Eliza,Brig,Europe,07/21/1823,1823-07-21,NULL,"10772, 10773",NULL
S4882E,Eliza & Mary,Brig,Hamburg,04/25/1823,1823-04-25,NULL,"10774, 10775, 10776, 10777",NULL
S4883E,Eliza & Mary,Brig,West Indies,10/31/1823,1823-10-31,NULL,"10778, 10779",NULL
S4884E,Elizabeth,Brig,Gibraltar and a Market,05/07/1823,1823-05-07,NULL,"10780, 10781",NULL
S4885E,Emerald,Ship,Gibraltar and a Market,10/25/1823,1823-10-25,NULL,"10782, 10783",NULL
S4886E,Endeavour,Ship,South America and a Market,09/29/1823,1823-09-29,NULL,"10784, 10785",NULL
S4887E,Essex,Schooner,Cayenne,04/17/1823,1823-04-17,NULL,"10786, 10787",NULL
S4888E,Essex,Schooner,Cayenne,11/24/1823,1823-11-24,NULL,"10788, 10789, 10790, 10791, 10792",NULL
S4889E,Evergreen,Schooner,Matanzas,02/22/1823,1823-02-22,NULL,"10793, 10794",NULL
S4890E,Evergreen,Schooner,West Indies,07/05/1823,1823-07-05,NULL,"10795, 10796, 10800, 10801",NULL
S4891E,Evergreen,Schooner,Matanzas,02/22/1823,1823-02-22,NULL,"10797, 10798, 10799",NULL
S4892E,Evergreen,Schooner,"Brazil and a Market
Brazil and a Market",10/24/1823,1823-10-24,NULL,"10802, 10803, 10804, 10805",NULL
S4893E,Factor,Ship,Liverpool,06/16/1823,1823-06-16,NULL,"10806, 10807",NULL
S4894E,Fame,Schooner,Martinico,04/24/1823,1823-04-24,NULL,"10808, 10809, 10810, 10811",NULL
S4895E,Fame,Schooner,Hati,10/11/1823,1823-10-11,NULL,"10812, 10813",NULL
S4896E,Fame,Schooner,West Indies,1823,0000-00-00,95,"10814, 10815",NULL
S4897E,Fanny,Schooner,Havana,12/08/1823,1823-12-08,NULL,"10816, 10817, 10818, 10819",NULL
S4898E,Fanny,Schooner,Brazil and a Market,08/31/1823,1823-08-31,NULL,"10820, 10821",NULL
S4899E,Favorite,Schooner,Martinico,01/16/1823,1823-01-16,NULL,"10822, 10823, 10824, 10825, 10826",NULL
S4900E,Favorite,Schooner,West Indies,06/10/1823,1823-06-10,NULL,"10827, 10828, 10829, 10830",NULL
S4901E,Favorite,Schooner,West Indies,11/18/1823,1823-11-18,NULL,"10831, 10832",NULL
S4902E,Fawn,Brig,India,01/09/1823,1823-01-09,NULL,"10833, 10834, 10835, 10836",NULL
S4903E,Federal George,Brig,Marseilles and a Market,05/21/1823,1823-05-21,NULL,"10837, 10838",NULL
S4904E,Fenelon,Brig,Saint Iago de Cuba,05/08/1823,1823-05-08,NULL,"10839, 10840, 10841, 10842",NULL
S4905E,Fenelon,Brig,West Indies,08/25/1823,1823-08-25,NULL,"10843, 10844",NULL
S4906E,Four Sisters,Schooner,Africa,08/14/1823,1823-08-14,NULL,"10845, 10846, 10847, 10848, 10849, 10850, 10851","""This is to certify to whom it may concern. I, William Wallace, seaman on board the Schooner Four Sisters, Freeborn Woodberry master. Was called on by said Master to confine Edward B Stuart for his mutinous conduct I desired (?) to assist(?) for reason that I was afraid that said E. B. Stuart would stick a knife into me."" (His Mark) William Wallace -- Accra, Jan. 2, 1824"
S4907E,Franklin,Brig,Cowes and a Market,03/29/1823,1823-03-29,NULL,"10852, 10853, 10854, 10855",NULL
S4908E,General Brooks,Schooner,Saint Jago de Cuba,05/01/1823,1823-05-01,NULL,"10856, 10857, 10858, 10859, 10860, 10861",NULL
S4909E,General Brooks,Schooner,Saint Jago de Cuba,08/26/1823,1823-08-26,NULL,"10862, 10863, 10864, 10865, 10866",NULL
S4910E,George,Ship,Calcutta,06/20/1823,1823-06-20,NULL,"10867, 10868, 10869, 10870",NULL
S4911E,Glide,Ship,NULL,01/14/1823,1823-01-14,NULL,"10871, 10872",NULL
S4912E,Glide,Ship,Matanzas,12/24/1823,1823-12-24,NULL,"10873, 10874, 10875, 10876",NULL
S4913E,Governor Endicott,Brig,Havana and Europe,03/14/1823,1823-03-14,297,"10877, 10878",NULL
S4914E,Governor Endicott,Brig,Canton,11/28/1823,1823-11-28,NULL,"10879, 10880",NULL
S4915E,Greyhound,Schooner,Martinico and a Market,02/16/1823,1823-02-16,NULL,"10881, 10882, 10883, 10884",NULL
S4916E,Herald,Brig,South America and a Market,05/24/1825,1825-05-24,NULL,"15006, 15007",NULL
S4917E,Hercules,Ship,South America and Market,11/25/1823,1823-11-25,NULL,"15008, 15009",NULL
S4918E,Homer,Brig,Cuba and Europe,05/09/1823,1823-05-09,NULL,"15010, 15011",Ship of Beverly
S4919E,Hope,Ship,Sumatra,07/30/1823,1823-07-30,NULL,"15012, 15013, 15014, 15015",Date of 01/21/1824 on crew list possibly date of sailing from Sumatra back to Salem
S4920E,Jane,Brig,Marseilles,11/21/1823,1823-11-21,NULL,"15016, 15017",NULL
S4921E,Janus,Ship,Marseilles and a Market,02/14/1823,1823-02-14,NULL,"15018, 15019, 15020,",NULL
S4922E,Janus,Ship,Leghorn and a Market,08/28/1823,1823-08-28,NULL,"15021, 15022",NULL
S4923E,Janus,Ship,Gibraltar and Leghorn,05/06/1824,1824-05-06,277,"15023, 15024",NULL
S4924E,Janus,Ship,Leghorn and a market,08/28/1823,1823-08-28,277,"15025, 15026",NULL
S4925E,Jason,Brig,Leghorn,08/12/1823,1823-08-12,NULL,"15027, 15028, 15029,15030",NULL
S4926E,Java,Brig,"East Indies, India",11/18/1823,1823-11-18,NULL,"15031, 15032, 15033, 15034",NULL
S4927E,Jeremiah,Brig,Havanna,03/24/1823,1823-03-24,NULL,"15035, 15036",NULL
S4928E,Leander,Brig,India,10/20/1823,1823-10-20,NULL,"15037, 15038",NULL
S4929E,Malay,Brig,India,04/07/1823,1823-04-07,NULL,"15039, 15040",NULL
S4930E,Marcellus,Schooner,Aux Cayes,03/06/1823,1823-03-06,NULL,"15041, 15042, 15043",NULL
S4931E,Marcellus,Schooner,Matanzas,11/25/1823,1823-11-25,NULL,"15044, 15045",NULL
S4932E,Mercator,Brig,Antwerp,05/21/1823,1823-05-21,NULL,"15046, 15047",NULL
S4933E,Mermaid,Schooner,Brazil,11/01/1823,1823-11-01,NULL,"15048, 15049, 15050, 15051",NULL
S4934E,Messenger,Ship,Havanna,12/11/1823,1823-12-11,NULL,"15052, 15053",NULL
S4935E,Minerva,Ship,Havre,05/27/1823,1823-05-27,NULL,"15054, 15055, 15056",NULL
S4936E,Merrimack Packet,Schooner,Cape Haytien,05/06/1823,1823-05-06,NULL,"15057, 15058, 15059",NULL
S4937E,Merrimack Packet,Schooner,West Indies,09/11/1823,1823-09-11,NULL,"15061, 15062",NULL
S4938E,Monroe,Brig,Africa,09/15/1823,1823-09-15,NULL,"15063, 15064, 15065",Brig of Boston
S4939E,Nereus,Brig,India,01/03/1823,1823-01-03,NULL,"15066, 15067, 15068,15069",NULL
S4940E,Nereus,Brig,India,12/20/1823,1823-12-20,NULL,"15070, 15071",NULL
S4941E,Neutrality,Brig,Martinico,12/27/1823,1823-12-27,NULL,"15072, 15073, 15074, 15075",NULL
S4942E,Neva,Brig,Gibraltar to Market,12/05/1823,1823-12-05,NULL,"15076, 15077",NULL
S4943E,Niagara,Brig,Havanna,07/03/1823,1823-07-03,NULL,"15078, 15079, 15080, 15081",NULL
S4944E,Niagara,Brig,South America and a market,11/18/1823,1823-11-18,NULL,"15082, 15083, 15084, 15085, 15086",NULL
S4945E,Only Daughter,Schooner,Mattanzas,11/13/1823,1823-11-13,NULL,"15087, 15088, 15089, 15090",NULL
S4946E,Ontario,Brig,Havanna,04/14/1823,1823-04-14,NULL,"15091, 15092, 15093, 15094","""Port of Labrer, Oct. 16, 1823. ...Three men [unnamed] left in May and three [unnamed] shipped in their stead about the same time."""
S4947E,Ontario,Brig,Brazil and a market,10/24/1823,1823-10-24,NULL,"15095, 15096",NULL
S4948E,Orient,Brig,Havre,04/25/1823,1823-04-25,NULL,"15097, 15098, 15099",NULL
S4949E,Osgood,Brig,Liverpool,11/24/1823,1823-11-24,NULL,"15100, 15101",NULL
S4950E,Osgood,Brig,Liverpool,06/14/1823,1823-06-14,NULL,"15102, 15013, 15104",NULL
S4951E,Padang,Brig,South America and a market,04/15/1823,1823-04-15,NULL,"15105, 15106",NULL
S4952E,Palladium,Schooner,St. Michaels,10/24/1823,1823-10-24,NULL,"15107, 15108",Schooner of Manchester
S4953E,Patriot,Barque,Europe,09/27/1823,1823-09-27,NULL,"15109, 15110",NULL
S4954E,Penguin,Schooner,Aux Cayes,06/24/1823,1823-06-24,NULL,"15111, 15112, 15113, 15114",NULL
S4955E,Penguin,Schooner,Aux Cayes,11/13/1823,1823-11-13,NULL,"15115, 15116",NULL
S4956E,Perseverance,Ship,Bordeaux and a market,07/24/1823,1823-07-24,NULL,"15117, 15118, 15119, 15120",NULL
S4957E,Peru,Brig,South America and a market,11/27/1823,1823-11-27,NULL,"15121, 15122",NULL
S4958E,Phoebe,Brig,"Santiago, Cuba",05/02/1823,1823-05-02,NULL,"15123, 15124, 15125, 15126",NULL
S4959E,Phoebe,Brig,"Santiago, Cuba",07/29/1823,1823-07-29,NULL,"15127, 15128, 15129, 15130",NULL
S4960E,Phoebe,Brig,"Santiago, Cuba",12/23/1823,1823-12-23,NULL,"15131, 15132, 15133, 15134",NULL
S4961E,Phoenix,Brig,Havanna,04/12/1823,1823-04-12,NULL,"15135, 15136, 15137, 15138, 15139, 15140",NULL
S4962E,Pioneer,Brig,South America to market,09/19/1823,1823-09-19,NULL,"15141, 15142",NULL
S4963E,President,Brig,Trinidad de Cuba,05/14/1823,1823-05-14,NULL,"15143, 15144, 15145, 15146",Brig of Beverly
S4964E,Rajah,Brig,Europe and India,08/30/1823,1823-08-30,NULL,"15147, 15148, 15149, 15150",Brig of Beverly
S4965E,Rambler,Brig,Cayenne,02/08/1823,1823-02-08,NULL,"15151, 15152",NULL
S4966E,Rambler,Brig,Cayenne,10/28/1823,1823-10-28,NULL,"15153, 15154",NULL
S4967E,Reaper,Brig,Havanna,04/18/1823,1823-04-18,NULL,"15155, 15156",NULL
S4968E,Rebecca,Brig,South America,NULL,0000-00-00,NULL,"15157, 15158, 15159, 15160",NULL
S4969E,Rebecca,Schooner,St. Andrews,11/28/1823,1823-11-28,NULL,"15161, 15162",Schooner of Danvers
S4970E,Regulus,Schooner,Martinico,03/23/1823,1823-03-23,NULL,"15163, 15164, 15165, 15166, 15167",NULL
S4971E,Reporter,Schooner,St. Andrews,08/02/1823,1823-08-02,NULL,"15168, 15169",Schooner of Portland
S4972E,Restitution,Ship,India,05/30/1823,1823-05-30,NULL,"15170, 15171, 15170",NULL
S4973E,Rogue,Brig,North of Europe,06/14/1823,1823-06-14,NULL,"15173, 15174, 15175, 15176",NULL
S4974E,Roscius,Brig,Brazil and a market,07/07/1823,1823-07-07,NULL,"15177, 15178",NULL
S4975E,Roscoe,Brig,South America and a Market,12/23/1823,1823-12-23,NULL,"15179, 15180","Antwerp, 07/23/1825: ""Freeborn Woodbury having been discharged in Valpariaso, and the others with the exception of George Berry having deserted from on board said Brig -- and there being no remaining seamen in this post he was obliged to ship Foreigners"""
S4976E,Rotund,Brig,South America,10/17/1823,1823-10-17,NULL,"15181, 15182, 15183, 15184",NULL
S4977E,Sally,Ship,Antwerp,03/17/1823,1823-03-17,NULL,"15185, 15186",NULL
S4978E,Sally,Schooner,Havre de Grace,05/19/1823,1823-05-19,NULL,"15187, 15188, 15189",Schooner of Danvers
S4979E,Sally Barker,Brig,Martinico,05/14/1823,1823-05-14,NULL,"15190, 15191, 15192, 15193",NULL
S4980E,Sally Barker,Brig,Martinque,10/15/1823,1823-10-15,NULL,"15194, 15195",NULL
S4981E,Sarah,Brig,Brazil and a market,08/09/1823,1823-08-09,NULL,"15196, 15197",NULL
S4982E,Spy,Schooner,India,12/01/1823,1823-12-01,NULL,"15198, 15199, 15200, 15201",NULL
S4983E,Standard,Brig,Bremen,06/07/1823,1823-06-07,NULL,"15202, 15203, 15204",NULL
S4984E,Stork,Brig,Salem,03/08/1823,1823-03-08,NULL,"15205, 15205",NULL
S4985E,Suffolk,Ship,Europe and India,08/05/1823,1823-08-05,315,"15207, 15208",NULL
S4986E,Swan,Schooner,Martinico,07/20/1823,1823-07-20,NULL,"15209, 15210, 15211, 15212",Schooner of Beverly
S4987E,Texel,Brig,South America,08/21/1823,1823-08-21,NULL,"15213, 15214",NULL
S4988E,Thetis,Brig,India,02/15/1823,1823-02-15,NULL,"15215, 15216, 15217, 15218",NULL
S4989E,Triton,Brig,Copenhagen and Petersburg,07/05/1823,1823-07-05,NULL,"15219, 15220, 15225, 15226",NULL
S4990E,Triton,Brig,Pernambuco and a market,12/13/1823,1823-12-13,NULL,"15221, 15222",NULL
S4991E,Two Brothers,Ship,India,03/15/1823,1823-03-15,NULL,"15223, 15224",NULL
S4992E,Two Sisters,Schooner,Marseilles and a market,04/17/1823,1823-04-17,NULL,"15227, 15228, 15229, 15230, 15231",Schooner of Beverly
S4993E,Two Sisters,Schooner,Santiago de Cuba,10/25/1823,1823-10-25,NULL,"15232, 15233",Schooner of Beverly
S4994E,Union,Schooner,West Indies,12/25/1823,1823-12-25,NULL,"15234, 15235, 15251, 15252, 15251, 15252",Schooner of Essex
S4995E,Union,Brig,Surinam,06/10/1823,1823-06-10,NULL,"15236, 15237, 15238, 15239, 15240","""District of Salem and Beverly, Port of salem, June 17, 1823. This certifies that Timothy Ropes is at present master of the within named vessel in lieu of Francis G. Clark who has returned sick."""
S4996E,Union,Schooner,Martinico,03/10/1823,1823-03-10,NULL,"15241, 15242, 15243, 15244, 15245",NULL
S4997E,Union,Schooner,West Indies,06/24/1823,1823-06-24,NULL,"15246, 15247, 1524815249, 15250",Schooner of Essex
S4998E,Union,Schooner,Surinam,1823,0000-00-00,99,"15253, 15254",No master named
S4999E,Washington,Brig,Tranadad de Cuba,10/16/1823,1823-10-16,NULL,"15255, 15256",NULL
S5000E,Washington,Brig,West Indies,1823,0000-00-00,NULL,"15257, 15258, 15259",NULL
S5001E,Acorn,Brig,Marseilles,12/15/1824,1824-12-15,NULL,"15261, 15262, 15263",NULL
S5002E,Agenoria,Schooner,South America,11/13/1824,1824-11-13,NULL,"15264, 15265, 15266",NULL
S5003E,Alfred,Brig,Brazil,12/25/1824,1824-12-25,NULL,"15267, 15268, 15269, 15270, 15276, 15277",NULL
S5004E,Alfred,Brig,Maranham and a market,09/20/1824,1824-09-20,NULL,"15271, 15272, 15273, 15274",NULL
S5005E,Amazon,Brig,Brazil,06/16/1824,1824-06-16,NULL,"15278, 15279, 15282, 15283, 15284",NULL
S5006E,Ann,Brig,"Baltimore, Brazil, and elsewhere",09/28/1824,1824-09-28,NULL,"15280, 15281, 15285, 15286, 15287, 15288",NULL
S5007E,Argo,Brig,NULL,11/22/1824,1824-11-22,NULL,"15289, 15290",NULL
S5008E,Augusta,Brig,Havanna,05/03/1824,1824-05-03,127,"15291, 15292, 15301, 15302, 15303",NULL
S5009E,Augusta,Brig,Marseilles,10/17/1824,1824-10-17,127,"15293, 15294, 15295, 15296",NULL
S5010E,Augustus,Ship,n/a,04/17/1824,1824-04-17,NULL,"15297, 15298",May be the same voyage as in #15299 and #152300
S5011E,Augustus,Ship,South America and a market,05/07/1824,1824-05-07,NULL,"15299, 15300",May be same voyage as #15298 and #15297 (same crew).
S5012E,Augusta,Brig,Brazil and a market,09/18/1823,1823-09-18,NULL,"15304, 15305","""Salem March the 25, 1824. I have examined the within and find the Captain has left and the mate has the command in his stead one hand discharged and three shipt."""
S5013E,Aurora,Schooner,n/a,10/17/1823,1823-10-17,NULL,"15306, 15307",No crew list
S5014E,Bengal,Ship,Calcutta,06/12/1824,1824-06-12,NULL,"15308, 15309",NULL
S5015E,Betsey,Brig,Matanzas,01/16/1824,1824-01-16,NULL,"15310, 15311, 15314, 15315",NULL
S5016E,Betsey,Brig,West Indies,06/07/1824,1824-06-07,NULL,"15312, 15313, 15318, 15319",NULL
S5017E,Betsey,Brig,Havanna,10/30/1824,1824-10-30,NULL,"15316, 15317",NULL
S5018E,Franklin,Brig,South America,02/10/1824,1824-02-10,NULL,"15320, 15321",NULL
S5019E,Franklin,Brig,Brazil and a market,07/10/1824,1824-07-10,NULL,"15322, 15323",NULL
S5020E,Friendship,Ship,Havanna,01/23/1824,1824-01-23,NULL,"15324, 15325, 15326",NULL
S5021E,Friendship,Ship,South American and a market,12/02/1824,1824-12-02,NULL,"15327, 15328, 15329",NULL
S5022E,General Brooks,Schooner,Santiago de Cuba,07/16/1824,1824-07-16,NULL,"15330, 15331",NULL
S5023E,General Brooks,Schooner,Santiago de Cuba and a market,06/24/1824,1824-06-24,NULL,"15332, 15333, 15334, 15334",NULL
S5024E,General Brooks,Schooner,Santiago de Cuba,12/09/1824,1824-12-09,NULL,"15336, 15337, 15338, 15339",NULL
S5025E,General Warren,Brig,West Indies,11/19/1824,1824-11-19,NULL,"15340, 15341",NULL
S5026E,George,Ship,East Indies,06/26/1824,1824-06-26,NULL,"15342, 15343, 15344, 15345",NULL
S5027E,Glide,Ship,Marseilles,12/02/1824,1824-12-02,NULL,"15346, 15347",NULL
S5028E,Herald,Brig,South America and a market,11/15/1824,1824-11-15,NULL,"15348, 15349",NULL
S5029E,Homer,Brig,Gibralter,08/14/1824,1824-08-14,NULL,"15350, 15351",Brig of Beverly
S5030E,Herald,Brig,Havanna and a market,08/21/1824,1824-08-21,NULL,"15352, 15353",NULL
S5031E,Homer,Brig,South America and a market,01/10/1824,1824-01-10,NULL,"15354, 15355",NULL
S5032E,Hope,Ship,Leghorn,05/08/1824,1824-05-08,NULL,"15358, 15359, 15360, 15361",NULL
S5033E,Indus,Brig,East Indies,01/16/1824,1824-01-16,365,"15362, 15363, 15364, 15365, 15366","Entire remaining crew except John Fields and William Barnes were transferred to other vessels at Antwerp ca. 4 Mar 1825. The 'Master, now bound to Ba[tavia?] has been obliged to ship foreigners to complete the crew"""
S5034E,Jason,Brig,Europe,09/23/1824,1824-09-23,NULL,"15367, 15368, 15369, 15370",NULL
S5035E,Janus,Ship,Gibraltar and Leghorn,05/06/1824,1824-05-06,NULL,"15371, 15372",NULL
S5036E,Jeremiah,Brig,Havanna,03/08/1824,1824-03-08,NULL,"15373, 15374, 15379, 15380","""One hand died and two shipped in their stead"""
S5037E,Jeremiah,Brig,St. Petersburg,05/29/1824,1824-05-29,NULL,"15375, 15376, 15378","""William P. Endicott having produced to me regular proof of his being a citiizen of the United States of America, is now appointed Master of the within named Brig Jeremiah of Salem, the former master, William Duncan, having quitted the said vessel at Elsineur."""
S5038E,Laura,Brig,South America,06/09/1824,1824-06-09,NULL,"15381, 15382, 15385, 15386",NULL
S5039E,Laura,Brig,Manila,12/09/1824,1824-12-09,NULL,"15383, 15384",Brig of Beverly
S5040E,Lion,Brig,Antwerp,07/09/1824,1824-07-09,NULL,"15387, 15388",NULL
S5041E,Malabar,Ship,Havre de Grace,08/10/1824,1824-08-10,NULL,"15389, 15390, 15391",NULL
S5042E,Malay,Brig,Genoa and to India,05/02/1824,1824-05-02,NULL,"15392, 15393","Documents list both 05/02/1824 and 12/30/1825, neither specified as departure date. Documents are labeled ""Roll of the offerciers and Seamen"" ""bound from the Port of Leghorn"""
S5043E,Minerva,Ship,"Liverpool, England",05/10/1824,1824-05-10,NULL,"15395, 15396",NULL
S5044E,Margaret,Brig,South America,01/20/1824,1824-01-20,NULL,"15397, 15398",Brig of Duxbury
S5045E,Mercator,Brig,Bremen,04/01/1824,1824-04-01,NULL,"15399, 15300",NULL
S5046E,Mermaid,Brig,Gibralter and a market,10/18/1824,1824-10-18,NULL,"15401, 15402",NULL
S5047E,Merimack Packet,Schooner,Cape Haytien,04/07/1824,1824-04-07,NULL,"15403, 15404",NULL
S5048E,Merrimack Packet,Schooner,Hispaniola,10/23/1824,1824-10-23,NULL,"15405, 15406",NULL
S5049E,Mexican,Brig,India,10/09/1824,1824-10-09,NULL,"15407, 15408, 15409, 15410",NULL
S5050E,Nautilus,Brig,South America,05/28/1824,1824-05-28,NULL,"15411, 15412, 15413, 15414, 15415, 15416",NULL
S5051E,Nereus,Brig,India,12/20/1824,1824-12-20,NULL,"15417, 15418",NULL
S5052E,Nereus,Brig,India,12/01/1824,1824-12-01,183,"15419, 15420, 15423, 15424",NULL
S5053E,Neva,Brig,n/a,11/00/1824?,1824-11-00,NULL,"15421, 15422","Only document for return, no crew list included."
S5054E,Neutrality,Brig,West Indies,06/26/1824,1824-06-26,NULL,"15425, 15426",NULL
S5055E,Niagara,Brig,Marseilles,08/23/1824,1824-08-23,NULL,"15427, 15428, 15429, 15430, 15431, 15432",NULL
S5056E,Only Daughter,Schooner,"West Indies, Cuba",10/27/1824,1824-10-27,NULL,"15433, 15434, 15435, 15436",NULL
S5057E,Padang,Brig,South America,03/06/1824,1824-03-06,NULL,"15437, 15438, 15439, 15440",NULL
S5058E,Palladium,Schooner,St. Michaels and a market,03/09/1824,1824-03-09,NULL,"15441, 15442",Schooner of Manchester
S5059E,Panther,Ship,South America,09/22/1824,1824-09-22,NULL,"15443, 15444","Ship of Boston, ""Two have died eight discharged and five shipt in their stead"""
S5060E,Penguin,Schooner,Aux Cayes,01/26/1824,1824-01-26,NULL,"15445, 15446",NULL
S5061E,Penguin,Schooner,Aux Cayes,05/18/1824,1824-05-18,NULL,"15447, 15448",NULL
S5062E,Penguin,Schooner,Aux Cayes,09/26/1824,1824-09-26,NULL,"15449, 15450",NULL
S5063E,Penguin,Schooner,Aux Cayes,05/18/1824,1824-05-18,NULL,"15451, 15452",NULL
S5064E,Penguin,Schooner,Aux Cayes,09/28/1824,1824-09-28,NULL,"15453, 15354",NULL
S5065E,Perseverence,Ship,East Indies,11/13/1824,1824-11-13,NULL,"15455, 15456, 15457, 15458",NULL
S5066E,Persia,Brig,South America,09/12/1824,1824-09-12,NULL,"15459, 15460, 15461, 15462, 15463",NULL
S5067E,Philaeni,Brig,"South America, Buenos Aires",01/23/1824,1824-01-23,NULL,"15464, 15465, 15466, 15467",NULL
S5068E,Philaeni,Brig,South America,08/04/1824,1824-08-04,NULL,"15468, 15469",NULL
S5069E,Phoebe,Brig,Santiago de Cuba,05/01/1824,1824-05-01,NULL,"15470, 15471, 15472, 15473",NULL
S5070E,Phoebe,Brig,Brazil and a market,08/05/1824,1824-08-05,NULL,"15474, 15475, 15476, 15477",NULL
S5071E,Pioneer,Brig,South America and a market,06/16/1824,1824-06-16,NULL,"15478, 15479",NULL
S5072E,Plato,Schooner,Brazil and a market,03/13/1824,1824-03-13,NULL,"15480, 15481, 15482, 15483",NULL
S5073E,Rambler,Brig,Cayenne,06/04/1824,1824-06-04,NULL,"15484, 15485, 15486, 15487",NULL
S5074E,Rambler,Brig,Cayenne,10/28/1824,1824-10-28,NULL,"15488, 15489, 15490",NULL
S5075E,Reaper,Brig,India,02/02/1824,1824-02-02,NULL,"15491, 15492, 15493, 15494",NULL
S5076E,Rebecca,Brig,Marseilles,12/05/1824,1824-12-05,NULL,"15495, 15496, 11690, 11691, 11692",NULL
S5077E,Regulus,Schooner,Nice,01/31/1824,1824-01-31,NULL,"15497, 15498, 15501, 15502",NULL
S5078E,Regulus,Schooner,Malta,11/13/1824,1824-11-13,NULL,"15499, 15500, 15503, 15504",NULL
S5079E,Restitution,Ship,Gibralter,04/22/1824,1824-04-22,NULL,"15505, 15506",NULL
S5080E,Rogue,Brig,Havanna,03/30/1824,1824-03-30,NULL,"15507, 15508",NULL
S5081E,Rogue,Brig,South America,11/24/1824,1824-11-24,NULL,"15509, 15510, 15513, 15514, 15515",NULL
S5082E,Rogue,Brig,Havanna,03/30/1824,1824-03-30,NULL,"15511, 15512, 15516, 15517",NULL
S5083E,Roscius,Brig,Brazil and a market,04/13/1824,1824-04-13,NULL,"15518, 15519, 15520, 15521",NULL
S5084E,Rotund,Brig,Cayenne,12/07/1824,1824-12-07,NULL,"15522, 15523, 15524, 15525",NULL
S5085E,Sally Barker,Brig,West Indies,03/09/1824,1824-03-09,NULL,"15526, 15527, 15528, 15529, 15532, 15533",NULL
S5086E,Sally Barker,Brig,Martinico,07/13/1824,1824-07-13,NULL,"15530, 15531, 15534, 15535",NULL
S5087E,Sicily,Brig,Rio de Janeiro and a market,11/02/1824,1824-11-02,NULL,"15536, 15537, 15538, 15539, 15540",NULL
S5088E,Spy,Schooner,River Plate,10/26/1824,1824-10-26,NULL,"15541, 15542, 15543, 15544",NULL
S5089E,Speedwell,Schooner,Matanzas,01/21/1824,1824-01-21,NULL,"15545, 15546",NULL
S5090E,Speedwell,Schooner,Havanna,05/03/1824,1824-05-03,NULL,"15547, 15548",NULL
S5091E,Stork,Brig,Bremen,03/03/1824,1824-03-03,NULL,"15549, 15550, 15551, 15552","Mate discharged 'and another employed in his place"" but no names given (#15551)"
S5092E,Swan,Schooner,Cape Haytien,04/19/1824,1824-04-19,NULL,"15553, 15554",Schooner of Beverly
S5093E,Thetes,Brig,India,03/10/1824,1824-03-10,NULL,"15555, 15556, 15557, 15560, 15561",NULL
S5094E,Triton,Brig,St. Thomas,11/23/1824,1824-11-23,NULL,"15558, 15559, 165562, 15563",NULL
S5095E,Two Brothers,Ship,n/a,n/d,0000-00-00,NULL,"15564, 15565","No actual list, Date on documents is for return on 01/20/1824"
S5096E,Two Sisters,Schooner,Santiago de Cuba,02/17/1824,1824-02-17,NULL,"15566, 15567",Schooner of Beverly
S5097E,Two Sisters,Schooner,n/a,n/a,0000-00-00,NULL,"15568, 15569","Schooner of Beverly, No actual list, just documents of return, Return date 03/04/1824"
S5098E,Union,Schooner,West Indies,10/04/1824,1824-10-04,NULL,"15570, 15571, 15576, 15577",Schooner of Essex
S5099E,Union,Brig,Cayenne,10/11/1824,1824-10-11,NULL,"15572, 15573, 15581, 15582",NULL
S5100E,Union,Schooner,Martinico,05/20/1824,1824-05-20,NULL,"15574, 15575",Schooner of Essex
S5101E,Union,Brig,Surinam,01/15/1824,1824-01-15,NULL,"15578, 15579, 15580",NULL
S5102E,Washington,Brig,South America,03/09/1824,1824-03-09,NULL,"15585, 15586, 15592, 15593",NULL
S5103E,Washington,Brig,Trinidad,03/08/1824,1824-03-08,NULL,"15587, 15588",Brig of Danvers
S5104E,Washington,Brig,Brazil,10/20/1824,1824-10-20,NULL,"15589, 15590, 15591, 15596, 15597",NULL
S5105E,Washington,Brig,Havanna,02/14/1824,1824-02-14,NULL,"15594, 15595",NULL
S5106E,Washington,Brig,South America,09/18/1824,1824-09-18,NULL,"15598, 15599, 15600, 15601",NULL
S5107E,William,Brig,Copenhagen,05/06/1824,1824-05-06,NULL,"15602, 15603",Brig of Beverly
S5108E,Woolwich,Schooner,Halifax,07/08/1824,1824-07-08,NULL,"15604, 15605",Crew list dated in Philadelphia.
S5109E,Woolwich,Schooner,"St. Andrews, Nova Scotia",10/19/1824,1824-10-19,NULL,"15606, 15607, 15608, 15609",NULL
S5110E,Woolwich,Schooner,St. Andrews,08/12/1824,1824-08-12,NULL,"15610, 15611",NULL
S5111E,Woolwich,Schooner,St. Andrews,06/04/1824,1824-06-04,NULL,"15612, 15613",NULL
S5112E,Zephyr,Ship,South America and a market,10/20/1823,1823-10-20,NULL,"15614, 15615, 15616",NULL
S5113E,Abby,Brig,South America,02/05/1825,1825-02-05,NULL,"15618, 15619",NULL
S5114E,Abby,Brig,Brazil and a market,08/02/1825,1825-08-02,NULL,"15620, 15621, 15622","Brig sold in Pernambuco and all seamen discharged there, 12/14/1825."
S5115E,Acorn,Brig,Havanna,10/25/1825,1825-10-25,NULL,"15623, 15624, 15625, 15526",NULL
S5116E,Agawam,Schooner,Santiago de Cuba,09/30/1825,1825-09-30,NULL,"15627, 15628",Schooner of Beverly
S5117E,Alfred,Brig,Maranham and a market,05/31/1825,1825-05-31,NULL,"15629, 15630, 15631, 1562, 15633",NULL
S5118E,Alfred,Brig,Brazil and a market,10/05/1825,1825-10-05,NULL,"15634, 15635, 15636, 15637, 15638",NULL
S5119E,Almira,Schooner,"Cumana, South America",10/21/1825,1825-10-21,NULL,"15639, 15640",Schooner of Beverly
S5120E,Amazon,Brig,Havanna,06/27/1825,1825-06-27,NULL,"15641, 15642, 15643, 15644, 15645, 15646",NULL
S5121E,Amazon,Brig,Antwerp,08/30/1825,1825-08-30,NULL,"15647, 15648, 15649, 15650",NULL
S5122E,Andes,Brig,Brazil and a market via Philadelphia,11/09/1825,1825-11-09,NULL,"15651, 15652, 15653, 15654",NULL
S5123E,Anne,Brig,Havre,06/08/1825,1825-06-08,NULL,"15655, 15656, 15657",Brig of Danvers
S5124E,Augusta,Brig,Marseilles,07/20/1825,1825-07-20,127,"15658, 15659, 15660",NULL
S5125E,Augustus,Ship,Europe,06/01/1825,1825-06-01,NULL,"15662, 15663, 15664, 15665",NULL
S5126E,Bengal,Ship,Batavia and a market,08/16/1828,1828-08-16,205,"15666, 15667, 15668, 15669, 15670","Birth and residence places are off by one line between #15667 and #15669, ""Now bound to the East of Cape of Good Hope"" after leaving Antwerp 06/27/1826."
S5127E,Boxer,Schooner,"Cumana, South America",12/21/1825,1825-12-21,NULL,"15671, 15672",Schooner of Beverly
S5128E,Buck,Brig,"India, East Indies",06/09/1825,1825-06-09,NULL,"15673, 15674, 15675, 15676",NULL
S5129E,Columbian,Brig,Europe,05/30/1825,1825-05-30,NULL,"15677, 15678, 15679, 15680",NULL
S5130E,Camel,Brig,West Indies,12/14/1825,1825-12-14,NULL,"15681, 15682, 15683, 15684",NULL
S5131E,Camel,Brig,Havre,03/08/1825,1825-03-08,NULL,"15685, 15686, 15687",NULL
S5132E,Centurion,Brig,Copenhagen,01/01/1825,1825-01-01,NULL,"15688, 15689",NULL
S5133E,Cepheus,Schooner,Brazil and a market,09/01/1825,1825-09-01,NULL,"15690, 15691, 15697, 15698",NULL
S5134E,Cepheus,Schooner,South America,01/14/1825,1825-01-14,NULL,"15692, 15693, 15694, 15695, 15696",NULL
S5135E,Ceres,Brig,Campeache,08/18/1825,1825-08-18,NULL,"15699, 15700",NULL
S5136E,Ceres,Schooner,South America and India,09/05/1825,1825-09-05,NULL,"15701, 15702, 15703, 15704, 15705",NULL
S5137E,Ceres,Schooner,Buenos Ayres,02/18/1825,1825-02-18,NULL,"15706, 15707",NULL
S5138E,Charles Amburger,Brig,Hamburgh,05/13/1824,1824-05-13,NULL,"15708, 15709",NULL
S5139E,China,Ship,South America,11/02/1825,1825-11-02,NULL,"15710, 15711, 15712, 15713",Also dated 12/02/1825
S5140E,China,Ship,Antwerp,04/29/1825,1825-04-29,NULL,"15714, 15715, 15716, 15717, 15718",NULL
S5141E,Cynthia,Brig,Cayenne,03/24/1825,1825-03-24,NULL,"15719, 15720, 15726, 15727",Three unidentified passengers (#15720)
S5142E,Cynthia,Brig,South America,10/10/1825,1825-10-10,NULL,"15721, 15722, 15723, 15724, 15725",NULL
S5143E,Dawn,Brig,Gibralter and Marseilles,11/28/1825,1825-11-28,NULL,"15728, 15729, 15730, 15731",NULL
S5144E,Dawn,Brig,Leghorn,05/23/1825,1825-05-23,NULL,"15732, 15733, 15734, 15735",NULL
S5145E,Derby,Barque,East Indies,12/10/1825,1825-12-10,NULL,"15736, 15737, 15738, 15739",NULL
S5146E,Dispatch Packet,Brig,Brazil and a market,08/29/1825,1825-08-29,NULL,"15740, 15741, 15742, 15743, 15744",NULL
S5147E,Dispatch Packet,Brig,Brazil and a market,03/18/1825,1825-03-18,NULL,"15745, 15746, 15747",NULL
S5148E,Dallas,Schooner,South America and a market,11/03/1825,1825-11-03,NULL,"15748, 15749, 15750",NULL
S5149E,Dollar,Schooner,South America and a market,11/03/1825,1825-11-03,NULL,"15751, 15752",NULL
S5150E,Dread-not,Schooner,Gorce and Cape de Verde,11/11/1825,1825-11-11,NULL,"15753, 15754",Schooner of Beverly
S5151E,Echo,Brig,Brazil and a market,11/25/1825,1825-11-25,NULL,"15755, 15756, 15757, 15758, 15759",NULL
S5152E,Edward,Brig,Brazil,06/21/1825,1825-06-21,NULL,"15760, 15761, 15762, 15763, 15764",NULL
S5153E,Effort,Brig,Antwerp,05/25/1825,1825-05-25,NULL,"15767, 15766",NULL
S5154E,Eliza,Brig,Havana,01/04/1825,1825-01-04,NULL,"15767, 15768",Brig of Boston
S5155E,Eliza,Ship,South America and a market,10/13/1825,1825-10-13,NULL,"15769, 15770",NULL
S5156E,Elizabeth,Brig,Malta and a market,10/04/1825,1825-10-04,NULL,"15771, 15772, 15773, 15774",NULL
S5157E,Essex,Schooner,Cayenne,12/21/1825,1825-12-21,NULL,"15775, 15776, 15778, 15780",NULL
S5158E,Essex,Schooner,Cayenne,06/01/1825,1825-06-01,NULL,"1577, 15778, 15781, 15782",NULL
S5159E,Export,Brig,Bordeaux,12/24/1825,1825-12-24,NULL,"15783, 15784, 15785",NULL
S5160E,James,Schooner,Marinico,05/28/1825,1825-05-28,NULL,"15786, 15787",NULL
S5161E,Fanny,Schooner,West Indies,01/10/1825,1825-01-10,NULL,"15788, 15789, 15792, 15793",NULL
S5162E,Fanny,Schooner,St. Andrews,07/19/1825,1825-07-19,NULL,"15790, 15791",NULL
S5163E,Favorite,Schooner,South America,08/09/1825,1825-08-09,NULL,"1579;4, 15795, 15796, 15797, 15798","Wrecked off of the coast of Maranham, ""the crew composing the annexed list was returned to the United States by"" Leonard Corning, U.S. Consul, 11/15/1825 (#15794)"
S5164E,Fawn,Brig,Brazil and a market,07/11/1825,1825-07-11,NULL,"15799, 15800, 15801, 15804, 15805",NULL
S5165E,Fenelon,Brig,Brazil,01/13/1825,1825-01-13,NULL,"15802, 15803, 15808, 15809",Brig of Beverly (15808 and 15809)
S5166E,Fenelon,Brig,Havana,10/25/1825,1825-10-25,NULL,"15806, 15807",Brig of Beverly
S5167E,First Attempt,Schooner,Matanzas,01/10/1825,1825-01-10,NULL,"15810, 15811",NULL
S5168E,Francis,Ship,India,01/06/1825,1825-01-06,NULL,"15812, 15813, 15814, 15815",NULL
S5169E,Franklin,Brig,South America and India,08/03/1825,1825-08-03,NULL,"15816, 15817",NULL
S5170E,General Brewer,Schooner,South America,08/27/1825,1825-08-27,NULL,"15818, 15819",NULL
S5171E,General Brewer,Schooner,"Maranham, Brazil",04/26/1825,1825-04-26,NULL,"15820, 15821, 15822",NULL
S5172E,General Brooks,Schooner,St. Domingo and a market,04/05/1825,1825-04-05,NULL,"15823, 15824",NULL
S5173E,General Brooks,Schooner,West Indies,08/15/1825,1825-08-15,NULL,"15825, 15826",NULL
S5174E,General Brooks,Schooner,West Indies,12/05/1825,1825-12-05,NULL,"15827, 15828, 15829, 15830",NULL
S5175E,General Jackson,Brig,Cayenne,07/27/1825,1825-07-27,NULL,"15831, 15832, 15833, 15834",NULL
S5176E,General Stark,Bark,Sumatra,05/11/1825,1825-05-11,NULL,"15835, 15836",NULL
S5177E,George,Ship,Calcutta,06/30/1825,1825-06-30,NULL,"15837, 15838, 15839, 15840",NULL
S5178E,Governor Winslow,Brig,Martinico,12/22/1825,1825-12-22,NULL,"15841, 15842, 15845, 15846",NULL
S5179E,Herald,Brig,South America and a market,01/01/1825,1825-01-01,NULL,"15843, 15844, 11693",NULL
S5180E,Hercules,Ship,"Rio deJaniero, Brazil and a market",03/28/1825,1825-03-28,220,"15848, 15849, 15850",NULL
S5181E,Homer,Brig,India,08/03/1825,1825-08-03,NULL,"15850, 15851, 15852, 15853",Brig of Beverly
S5182E,Hope,Ship,Madagascar,01/07/1825,1825-01-07,NULL,"15854, 15855, 15856, 15857",NULL
S5183E,Indus,Brig,East Indies,9/16/1826,1826-09-16,NULL,"11006, 11007","In Batavia Sept. 16, 1826"
S5184E,Jason,Brig,Marseilles,6/21/1825,1825-06-21,NULL,"11008, 11009, 11014, 11015","Left Vera Cruz Jan 27, 1826 for New Orleans
Port Salem March 22, 1826"
S5185E,Janus,Ship,South Amercia via Baltimore,9/26/1825,1825-09-26,NULL,"11010, 11011, 11012, 11013",Port of Salem 6/20/1827
S5186E,Java,Brig,India,7/29/1825,1825-07-29,NULL,"11016, 11017,11018, 11019, 11020","""One hand [unnamed] runaway"""
S5187E,Jeremiah,Brig,Cayenne and Surinam,12/3/1825,1825-12-03,NULL,"11021, 11022, 11023, 11024, 11025",NULL
S5188E,Lafayette,Schooner,Brazil,4/23/1825,1825-04-23,NULL,"11026, 11027",Sold in Bahia 1825
S5189E,Lama,Brig,Brazil,6/27/1825,1825-06-27,144,"11028, 11029, 11030",NULL
S5190E,Lama,Brig,Brazil,11/25/1825,1825-11-25,144,"11031, 11032",NULL
S5191E,Laurel,Brig,Brazil,1/4/1825,1825-01-04,256,"11033, 11034, 11035, 11036","Port Salem June 2, 1826"
S5192E,Leader,Schooner,Brazil,12/15/1825,1825-12-15,72,"11037, 11038, 11039, 11040, 11041",NULL
S5193E,Leander,Brig,Batavia,5/11/1825,1825-05-11,NULL,"11042, 11043, 11044, 11045",NULL
S5194E,Malabar,Ship,India and Europe,11/30/1825,1825-11-30,NULL,"11046, 11047",NULL
S5195E,Mechanic,Schooner,West Indies,2/22/1825,1825-02-22,NULL,"11048, 11049, 11050, 11051",NULL
S5196E,Merrimack Packet,Schooner,West Indies,4/23/1825,1825-04-23,NULL,"11052, 11053, 11056, 11057",NULL
S5197E,Merrimack Packet,Schooner,Port Au Prince,7/19/1825,1825-07-19,NULL,"11054, 11055, 11058, 11059",NULL
S5198E,Mexican,Brig,India,8/4/1825,1825-08-04,NULL,"11060, 11061, 11062, 11063",NULL
S5199E,Midas,Brig,Buenos Ayres,11/25/1825,1825-11-25,NULL,"11064, 11065",Lists also advanced wages and monthly wages
S5200E,Minerva,Ship,East Indies,11/2/1825,1825-11-02,NULL,"11066, 11067, 11068, 11069",NULL
S5201E,Minerva,Ship,Liverpool,6/11/1825,1825-06-11,NULL,"11070, 11071, 11072","July 29, 1825 the captain met with consul in Liverpool. Back in Salem Sept. 12, 1825. Sailed from Charleston."
S5202E,Neptune,Brig,Havre de Grace,12/15/1825,1825-12-15,NULL,"11073, 11074, 11075",In Havre 2/12/1826. In Salem 4/14/1826
S5203E,Olinda,Brig,Brazil,7/30/1825,1825-07-30,NULL,"11076, 11077, 11078, 11079, 11080",NULL
S5204E,Osprey,Brig,India,3/3/1825,1825-03-03,NULL,"11081, 11084, 11085",Reported back in Boston 6/20/1826
S5205E,Orator,Schooner,St. Andrews,11/12/1825,1825-11-12,143,"11082, 11083, 11638",Registered in Mount Desert
S5206E,Otter,Brig,NULL,8/29/1825,1825-08-29,NULL,"11086, 11087, 11088, 11089",NULL
S5207E,Patriot,Bark,East Indies,4/28/1825,1825-04-28,NULL,"11090, 11091, 11092, 11093",NULL
S5208E,Penguin,Schooner,West Indies,1/5/1825,1825-01-05,NULL,"11094, 11095, 11096, 11097",NULL
S5209E,Penguin,Schooner,West Indies,5/10/1825,1825-05-10,NULL,"11098, 11099, 11100, 11103, 11104",NULL
S5210E,Penguin,Schooner,West Indies,12/6/1825,1825-12-06,NULL,"11101, 11102, 11105, 11106",NULL
S5211E,Perseverance,Ship,Antwerp,9/15/1825,1825-09-15,NULL,"11107, 11108, 11109, 11110, 11111",NULL
S5212E,Peru,Bark,South America,6/25/1825,1825-06-25,NULL,"11112, 11113",In Salem 6/18/1827
S5213E,Phoebe,Brig,Para,7/?/1825,0000-00-00,105,"11114, 11115, 11120, 11121",NULL
S5214E,Phoebe,Brig,"St. Jago, Cuba",9/23/1825,1825-09-23,105,"11116, 11117",NULL
S5215E,Phoebe,Brig,"St. Jago de Cuba, St. Dominico",1/10/1825,1825-01-10,105,"11118, 11119",NULL
S5216E,Phoenix,Brig,South America,11/22/1825,1825-11-22,NULL,"1,112,211,123",NULL
S5217E,Plant,Brig,Santos and a market,4/30/1825,1825-04-30,NULL,"11124, 11125",NULL
S5218E,Polly,Sloop,Brazil,3/7/1825,1825-03-07,NULL,"11126, 11127, 11128, 11129 , 11130",NULL
S5219E,Rambler,Brig,Cayenne,4/20/1825,1825-04-20,NULL,"11131, 11132, 11137, 11138",NULL
S5220E,Reaper,Brig,India,1/20/1825,1825-01-20,NULL,"11133, 11134, 11135, 11136",NULL
S5221E,Regulus,Schooner,South America,8/29/1825,1825-08-29,NULL,"11139, 11140, 11141, 11142",NULL
S5222E,Restitution,Ship,South America & India,8/11/1825,1825-08-11,NULL,"11143, 11144, 11145, 11146",NULL
S5223E,Robert Patten,Brig,Cape Verde,8/25/1825,1825-08-25,NULL,"11147, 11148, 11701, 11703","In Boston 3/24/1826
All returned"
S5224E,Robert Patten,Brig,Cape de Verd,2/3/1825,1825-02-03,NULL,"11149, 11150",NULL
S5225E,Roscius,Brig,"St. Jago, Cuba",1/4/1825,1825-01-04,NULL,"11151, 11152, 11153, 11154",NULL
S5226E,Roscius,Brig,Gibralter,5/5/1825,1825-05-05,170,"11155, 11156, 11157, 11158",NULL
S5227E,Roscius,Brig,South America,10/12/1825,1825-10-12,NULL,"11159, 11160, 11161",NULL
S5228E,Roscoe,Brig,South America,12/20/1825,1825-12-20,NULL,"11162, 11163, 11164, 11165",NULL
S5229E,Rotund,Brig,Cayenne,11/21/1825,1825-11-21,NULL,"11166, 11167",NULL
S5230E,Sally,Ship,Havana,1/4/1825,1825-01-04,NULL,"11168, 11169","In Havana July 19, 1895"
S5231E,Sally Barker,Brig,Brazil,2/8/1825,1825-02-08,NULL,"11170, 11171, 11172, 11173, 11174",NULL
S5232E,Sally Barker,Brig,Brazil,8/10/1825,1825-08-10,NULL,"11175, 11176, 11177, 11178, 11179",NULL
S5233E,Scion,Brig,Matansas,1825,0000-00-00,NULL,"11180, 11181",In Matanzas 11/16/1825
S5234E,Shawmut,Brig,Trieste,7/8/1825,1825-07-08,NULL,"11182, 111183",NULL
S5235E,Shamrock,Ship,Cape Verde and Africa,12/28/1825,1825-12-28,NULL,"11184, 11185",NULL
S5236E,Shawmut,Brig,Marseilles,6/22/1825,1825-06-22,NULL,"11186, 11187",NULL
S5237E,Sicily,Brig,South America,9/6/1825,1825-09-06,163,"11188, 11189, 11190, 11191",NULL
S5238E,Spy,Schooner,Brazil,12/25/1825,1825-12-25,NULL,"11192, 11193, 11194, 11199, 11200",NULL
S5239E,Spy,Schooner,Brazil,7/19/1825,1825-07-19,92,"11195, 11196",NULL
S5240E,Spy,Schooner,Brazil,3/8/1825,1825-03-08,92,"11197, 11198, 11201, 11202, 11203",NULL
S5241E,Stork,Brig,Brazil,2/9/1825,1825-02-09,NULL,"11210, 11211, 11212, 11213",NULL
S5242E,Stork,Brig,North Coast of Brazil,7/14/1825,1825-07-14,NULL,"11215, 11216, 11217, 11218, 11219",NULL
S5243E,Suffolk,Ship,East Indies,1/1/1825,1825-01-01,NULL,"11220, 11221, 11222",NULL
S5244E,Susan,Brig,East Indies,10/15/1825,1825-10-15,138,"11223, 11224, 11225, 11226, 11227",NULL
S5245E,Susan & Sarah,Brig,Gibraltar,9/10/1825,1825-09-10,NULL,"11228, 11229","January 9, 1826 vessel was condemned due to damages sustained in port. All crew discharged to the consulate"
S5246E,Thetis,Brig,Madagascar,2/21/1825,1825-02-21,NULL,"11230, 11231, 11234, 11235",NULL
S5247E,Siren,Brig,East Indies,5/3/1825,1825-05-03,NULL,"11232, 11233",NULL
S5248E,Union,Brig,Surinam,5/21/1825,1825-05-21,NULL,"11236, 11237, 11248, 11249","In Gloucester 10/27/1825, all returned"
S5249E,Union,Brig,Surinam,12/2/1825,1825-12-02,NULL,"11238, 11239, 11766",NULL
S5250E,Union,Schooner,Aux Cayes,6/8/1825,1825-06-08,NULL,"11240, 11241, 11246, 11247",Home port Essex
S5251E,Union,Schooner,West Indies,9/30/1825,1825-09-30,NULL,"11242, 11243, 117780, 11781","Home port of Essex
In Edgartown 4/21/1826"
S5252E,Union,Schooner,West Indies,2/10/1825,1825-02-10,NULL,"11244, 11245, 11250, 11251",Home port Essex
S5253E,Virgina,Schooner,Brazil,4/1/1825,1825-04-01,140,"11252, 11253, 11254, 11255",NULL
S5254E,Zephyr,Ship,East Indies,4/12/1825,1825-04-12,NULL,"11256, 111257, 11258, 11259",NULL
S5255E,William & Nancy,Schooner,West Indies,7/4/1825,1825-07-04,NULL,"11260, 11261, 11262, 11263",NULL
S5256E,William,Ship,East Indies,11/17/1825,1825-11-17,NULL,"11264, 11265, 11266",NULL
S5257E,Washington,Brig,Marseilles,12/31/1825,1825-12-31,NULL,"11267, 11268","Vessel left from Charleston
""Certificate forwarded"" written on crew list
In Salem July 22, 1826 with all crew"
S5258E,Washington,Brig,St. Pierre Martinico,11/19./1825,0000-00-00,NULL,"11269, 11270, 11790, 11791",In Edgartown 4/1/1826
S5259E,Washington,Brig,Barbados,7/23/1825,1825-07-23,NULL,"11271, 11272",Registered in Danvers
S5260E,Washington,Brig,Sumatra,11/23/1825,1825-11-23,NULL,"11273, 11274, 11275","At Isle of France, foreign sailors brought on board ""on account of his crew being sick and unable to do duty"""
S5261E,Washington,Brig,Marseilles,5/31/1825,1825-05-31,NULL,"11276, 11277",NULL
S5262E,Acorn,Brig,Havana,3/20/1826,1826-03-20,NULL,"11279, 11280, 11281, 11282",NULL
S5263E,Acorn,Brig,Marseilles,5/29/1826,1826-05-29,NULL,"11283, 11284",NULL
S5264E,Agawam,Schooner,Cuba,7/11/1826,1826-07-11,NULL,"11285, 11286",NULL
S5265E,Alfred,Brig,Maranham,1/7/1826,1826-01-07,NULL,"11287, 11288",NULL
S5266E,Alfred,Brig,Brazil,5/27/1826,1826-05-27,NULL,"11289, 11290, 11291, 11292",NULL
S5267E,Amazon,Brig,Havana,12/16/1826,1826-12-16,NULL,"11293, 11294, 11303, 11304",In Salem 3/5/1827
S5268E,Amazon,Brig,Vera Cruz,2/8/1826,1826-02-08,NULL,"11295, 11296, 11297, 11298",NULL
S5269E,Amazon,Brig,St. Petersburg,5/29/1826,1826-05-29,NULL,"11299, 11300, 11301, 11302",NULL
S5270E,Andes,Brig,Brazil,5/19/1826,1826-05-19,NULL,"11305, 11306, 11307, 11308",NULL
S5271E,Angler,Schooner,Brazil,3/10/1826,1826-03-10,NULL,"11309, 11310, 11311, 11312, 11313",NULL
S5272E,Ann,Brig,India,3/4/1826,1826-03-04,NULL,"11314, 11315",NULL
S5273E,Ann,Brig,Europe,5/6/1826,1826-05-06,NULL,"11316, 11317",One passenger on return trip
S5274E,Augustus,Ship,South America,1/9/1826,1826-01-09,NULL,"11318, 11319, 11326, 11327",NULL
S5275E,Augusta,Brig,St. Helena,5/24/1826,1826-05-24,127,"11320, 11321, 11322, 11323",NULL
S5276E,Augustus,Ship,Montevidio,1/7/1826,1826-01-07,NULL,"11324, 11325",NULL
S5277E,Betsey,Schooner,St. Andrews,5/5/1826,1826-05-05,NULL,"11328, 11329",NULL
S5278E,Black Warrior,Ship,Matanzas and Europe,9/5/1826,1826-09-05,231,"11330, 11331",NULL
S5279E,Buck,Brig,Mediterranean,5/16/1826,1826-05-16,NULL,"11332, 11333",NULL
S5280E,Buck,Brig,India,12/20/1826,1826-12-20,NULL,"11334, 11335",NULL
S5281E,Bunker Hill,Schooner,West Indies,1/9/1826,1826-01-09,NULL,"11336, 11337, 11338, 11339",NULL
S5282E,Camberine,Schooner,St. Andrews,3/18/1826,1826-03-18,NULL,"11340, 11341",NULL
S5283E,Cambrian,NULL,Marseilles,7/24/1826,1826-07-24,NULL,"11342, 11343, 11344, 11345",NULL
S5284E,Camel,Brig,Haiti,6/12/1826,1826-06-12,NULL,"11346, 11347",NULL
S5285E,Canton Packet,Ship,Gibraltar,4/15/1826,1826-04-15,NULL,"11348, 11349",NULL
S5286E,Canton Packet,Ship,Cape of Good Hope,9/30/1826,1826-09-30,NULL,"11350, 11351, 11352, 11355, 11356",NULL
S5287E,Caroline,Ship,Europe and Indies,7/21/1826,1826-07-21,NULL,"11353, 11354, 11372, 11373",NULL
S5288E,Catherine,Ship,Matanzas,8/9/1826,1826-08-09,NULL,"11357, 11358, 11359, 11360, 11361, 11362",NULL
S5289E,Centurion,Brig,Antwerp,1/11/1826,1826-01-11,NULL,"11363, 11364, 11365",NULL
S5290E,Cepheus,Schooner,Brazil,5/6/1826,1826-05-06,NULL,"11366, 11367, 11368, 11369",NULL
S5291E,Cepheus,Schooner,Brazil,9/5/1826,1826-09-05,NULL,"11370, 11371, 11376, 11377",NULL
S5292E,Centurion,Brig,North of Europe,6/27/1826,1826-06-27,NULL,"11374, 11375",NULL
S5293E,Ceres,Brig,Cadiz,4/4/1826,1826-04-04,NULL,"11378, 11379",In Salem 8/8/1826
S5294E,Ceres,Schooner,Brazil and India,2/13/1826,1826-02-13,NULL,"11380, 11381",Sailed for Brazil and never heard from (Salem Ship Registers 1789-1900)
S5295E,Clay,Ship,Batavia,4/21/1826,1826-04-21,NULL,"11382, 11383",Sailed from Boston
S5296E,Cynthia,Brig,Europe,5/25/1826,1826-05-25,NULL,"11384, 11385, 11386, 11387",In Salem 10/15/1826
S5297E,Cynthia,Brig,South America,11/5/1826,1826-11-05,NULL,"11388, 11389",NULL
S5298E,Dawn,Brig,Leghorn,6/16/1826,1826-06-16,NULL,"11390, 11391, 11394, 11395","In Leghorn 9/29/1826
All returned"
S5299E,Dawn,Brig,Marseilles,12/26/1826,1826-12-26,NULL,"11392, 11393, 11396, 11397",NULL
S5300E,Delphos,Ship,East Indies,10/18/1826,1826-10-18,NULL,"11398, 11399, 11400, 11401, 11402","In Genoa 11/12/1826
In Leghorn 1/23/1829"
S5301E,Dispatch Packet,Brig,Brazil,4/14/1826,1826-04-14,135,"11403, 11404, 11405, 11408, 11409",NULL
S5302E,Dispatch Packet,Brig,Cuba,11/17/1826,1826-11-17,135,"11406, 11407, 11410, 11411",NULL
S5303E,Dollar,Schooner,South America,5/1/1826,1826-05-01,NULL,"11412, 11413, 11414, 11415",NULL
S5304E,Dollar,Schooner,Cayenne,9/7/1826,1826-09-07,NULL,"11416, 11417, 11418, 11419",In Edgartown 2/11/1827
S5305E,Echo,Brig,Maranham,5/24/1826,1826-05-24,NULL,"11420, 11421",In Edgartown 9/12/1826
S5306E,Echo,Brig,Brazil,10/7/1826,1826-10-07,100,"11422, 11423",NULL
S5307E,Economy,Schooner,St. Andrews,6/10/1826,1826-06-10,NULL,"11424, 11425, 11426, 11427",NULL
S5308E,Economy,Schooner,Pernambuco,12/12/1826,1826-12-12,NULL,"11428, 11429",NULL
S5309E,Edward,Brig,South America,1/7/1826,1826-01-07,NULL,"11430, 11431, 11432, 11433, 11434",NULL
S5310E,Edward,Brig,Brazil,7/14/1826,1826-07-14,NULL,"11435, 11436",NULL
S5311E,Eliza,Bark,India,1/9/1826,1826-01-09,NULL,"11437, 11438, 11441, 11442",NULL
S5312E,Eliza,Bark,Europe,9/29/1826,1826-09-29,NULL,"11439, 11440, 11441, 11442, 11443, 11444",NULL
S5313E,Elizabeth,Brig,Malta,9/2/1826,1826-09-02,NULL,"11445, 11446",NULL
S5314E,Emerald,Ship,Calcutta,8/30/1826,1826-08-30,NULL,"11447, 11448",NULL
S5315E,Endeavour,Ship,East Indies,10/7/1826,1826-10-07,NULL,"11449, 11450, 11451, 11452","In Marseilles 10/31/1827 (positions listed from consul's account in port)
In Salem 12/25/1827"
S5316E,Cynthia,Brig,South America,11/15/1826,1826-11-15,NULL,"11453, 11454, 11455",In Salem 4/8/1827. Arrived with full crew plus 2 passengers and 3 seaman from ship Beverly of Boston which burnt at sea
S5317E,Fawn,Brig,East Indies,7/22/1826,1826-07-22,NULL,"11456, 11457, 11458, 11459",NULL
S5318E,Fenelon,Brig,"St. Jago, Cuba",3/22/1826,1826-03-22,NULL,"11460, 1461, 11462, 11463",In Salem 6/42/1826
S5319E,Fenelon,Brig,"St. Jago, Cuba",7/8/1826,1826-07-08,NULL,"11464, 11465, 11466, 11467","In Salem 9/14/1826
One man left in St. Jago"
S5320E,Fenelon,Brig,West Indies,10/14/1826,1826-10-14,NULL,"11468, 11469, 11470, 11471",In Edgartown 12/11/1826
S5321E,Francis,Ship,Leghorn,12/9/1826,1826-12-09,NULL,"11472, 11473, 11474, 11475","In Leghorn 3/8/1827
In Gibralter 2/29/1827"
S5322E,General Brooks,Schooner,West Indies,4/12/1826,1826-04-12,NULL,"11476, 11477, 11482, 11484",In Boston 9/5/1826
S5323E,General Brooks,Schooner,"St. Jago, Cuba",8/5/1826,1826-08-05,NULL,"11478, 11479, 11480, 11481",In St. Jago on 10/5/1826
S5324E,General Brooks,Schooner,St. Jago,12/12/1826,1826-12-12,NULL,"11485, 11486",NULL
S5325E,General Jackson,Brig,Aux Cayes,6/3/1826,1826-06-03,NULL,"11487, 11488, 11489, 11490",In Salem 9/8/1826
S5326E,General Jackson,Brig,Cayenne,10/23/1826,1826-10-23,NULL,"11491, 11492",NULL
S5327E,General Stark,Barque,NULL,5/11/1826,1826-05-11,NULL,"11493, 11494",In New York 9/26/1826
S5328E,General Stark,Barque,India,11/3/1826,1826-11-03,NULL,"11495, 11496, 11497, 11498","In Salem 12/17/1827, mate [Kenny?] had been discharged"
S5329E,George,Ship,Calcutta,8/7/1826,1826-08-07,NULL,"11499, 11500, 11501, 11502",NULL
S5330E,Glide,Ship,Havana and Matanzas,2/7/1826,1826-02-07,NULL,"11503, 11504, 11507, 11508",In Salem 8/12/1826
S5331E,Glide,Ship,Marseilles,11/15/1826,1826-11-15,NULL,"11505, 11506",In Salem 9/30/1827
S5332E,Governor Endicott,Brig,East Indies,11/13/1826,1826-11-13,NULL,"11509, 11510, 11511",NULL
S5333E,Governor Winslow,Brig,Martinico,7/18/1826,1826-07-18,NULL,"11512, 11513, 11516, 11517",NULL
S5334E,Governor Winslow,Brig,Matinique,12/7/1826,1826-12-07,NULL,"11514, 11515, 11518, 11519",NULL
S5335E,Halsey,Brig,Pernambuco,10/21/1826,1826-10-21,NULL,"11520, 11521, 11522",In Pernambuco 1/27/1827
S5336E,Hardy,Brig,Havana and Europe,2/28/1826,1826-02-28,NULL,"11523, 11524",Registered in Boston
S5337E,Henry,Brig,Brazil,2/20/1826,1826-02-20,NULL,"11525, 11526",NULL
S5338E,Hercules,Ship,Brazil,6/30/1826,1826-06-30,NULL,"11527, 11528",NULL
S5339E,Homer,Brig,East Indies,12/1/1826,1826-12-01,NULL,"11529, 11530, 11531, 11534, 11535","In Gibraltar 10/4/1827
In Trieste 12/5/1827"
S5340E,Hope,Ship,Europe,9/1/1826,1826-09-01,NULL,"11532, 11533",NULL
S5341E,Hope,Schooner,NULL,7/7/1826,1826-07-07,NULL,"11536, 11537",NULL
S5342E,Hope,Schooner,NULL,11/21/1826,1826-11-21,NULL,"11538, 11539",NULL
S5343E,Indus,Brig,Batavia,9/16/1826,1826-09-16,NULL,"11540, 11541, 11542, 11543, 11544",In Antwerp ?/6/1827
S5344E,General Jackson,Brig,Cayenne,10/23/1826,1826-10-23,NULL,"11545, 11546",NULL
S5345E,Jason,Brig,St. Thomas,9/23/1826,1826-09-23,NULL,"11547, 11548, 11553, 11554",NULL
S5346E,Jason,Brig,Marseilles,3/31/1826,1826-03-31,NULL,"11549, 11550, 11551, 11552",NULL
S5347E,Java,Brig,Europe (East Indies crossed out),7/7/1826,1826-07-07,NULL,"11555, 11556, 11557","In Java 1/31/1827
In Antwerp 8/21/1827"
S5348E,Jeremiah,Brig,Cayennes and Surinam,5/9/1826,1826-05-09,NULL,"11558, 11559",In Salem 10/23/1826
S5349E,Jeremiah,Brig,St. Thomas,12/16/1826,1826-12-16,NULL,"11560, 11561, 11562, 11563",In Salem 6/19/1827
S5350E,Julia Ann,Schooner,St. Andrews,7/10/1826,1826-07-10,NULL,"11565, 11566, 11567, 11568",In Boston 9/2/1826
S5351E,Laura,Brig,Marseilles,6/20/1826,1826-06-20,NULL,"11569, 11570, 11575, 11576",In Salem 2/7/1827
S5352E,Lama,Brig,Marseilles,5/30/1826,1826-05-30,NULL,"11571, 11572",NULL
S5353E,Laurel,Brig,East Indies,9/23/1826,1826-09-23,NULL,"11573, 11574, 11577, 11578",Returned 9/22/1827
S5354E,Leander,Brig,Matanzas,5/8/1826,1826-05-08,NULL,"11579, 11580, 11583, 11584",NULL
S5355E,Leander,Brig,Gibralter,11/25/1826,1826-11-25,NULL,"11581, 11582, 11585, 11586",NULL
S5356E,Malay,Brig,East Indies,7/16/1826,1826-07-16,NULL,"11587, 11588, 11589, 11590, 11591",In a port 5/17/1827
S5357E,Malay,Brig,To Salem from Leghorn,2/28/1826,1826-02-28,NULL,"11592, 11593, 11594","In Salem 5/5/1826
In Leghorn, the consul certifies that there are no US mariners available in Leghorn and therefore Richardson hires foreigners"
S5358E,Mercator,Brig,South America,4/`7/1826,0000-00-00,NULL,"11595, 11596, 11597",NULL
S5359E,Mermaid,Brig,Gibraltar,4/24/1826,1826-04-24,NULL,"11598, 11599",NULL
S5360E,Merrimack Packet,Schooner,West Indies,1/11/1826,1826-01-11,NULL,"11600, 11601, 11767",NULL
S5361E,Merrimack Packet,Schooner,West Indies,7/29/1826,1826-07-29,NULL,"11602, 11603",NULL
S5362E,Messenger,Ship,East Indies,10/24/1826,1826-10-24,NULL,"11604, 11605, 11606, 11607",In Marseilles 11/2/1827
S5363E,Mexican,Brig,Trieste,9/19/1826,1826-09-19,NULL,"11608, 11609, 11610, 11611",In Trieste 12/13/1826
S5364E,Midas,Brig,St. Thomas via Portland,10/6/1826,1826-10-06,NULL,"11612, 11613",NULL
S5365E,Minerva,Ship,Genoa,10/17/1826,1826-10-17,NULL,"11614, 11615, 11616, 11617, 11618",In Marseilles 4/17/1828
S5366E,Monroe,Brig,Coast of Africa,3/7/1826,1826-03-07,NULL,"11619, 11620",NULL
S5367E,Nautilus,Brigantine,West Indies,4/15/1826,1826-04-15,NULL,"11621, 11622",NULL
S5368E,Nereus,Brig,Rio de Janero,2/25/1826,1826-02-25,NULL,"11623, 11624",NULL
S5369E,Niagara,Brig,South America,11/4/1826,1826-11-04,NULL,"11625, 11626, 11627, 11631, 11632",NULL
S5370E,Niagara,Brig,Marseilles,3/20/1826,1826-03-20,NULL,"11628, 11629, 11630",In Marseilles 6/23/1826
S5371E,Olinda,Brig,Brazil,1/17/1826,1826-01-17,178,"11633, 11634, 11635, 11636, 11637",In Salem 6/4/1826
S5372E,Rebecca,Brig,NULL,12/3/1824,1824-12-03,NULL,"11639, 11640",In Boston
S5373E,Osgood,Brig,Liverpool,3/11/1826,1826-03-11,NULL,"11641, 11642, 11643","In Liverpool 4/2/1826
In Salem 5/9/1826"
S5374E,Otter,Brig,East Indies,12/4/1826,1826-12-04,NULL,"11644, 11645, 11646",In Boston 5/27/1829
S5375E,Otter,Schooner,St. Andrews,4/28/1826,1826-04-28,NULL,"11648, 11649",NULL
S5376E,Pactolus,Brig,Brazil & a market,5/11/1826,1826-05-11,NULL,"11650, 11651, 11652, 11653, 11654",In Salem 9/16/1826
S5377E,Paragon,Schooner,West Indies,7/20/1826,1826-07-20,NULL,"11655, 11656",NULL
S5378E,Patriot,Bark,East Indies,12/7/1826,1826-12-07,NULL,"11657, 11658, 11661, 11662, 11663","In Genoa, bound for Gibraltar 12/5/1927
In Marseilles, bound for Salem 11/17/1828"
S5379E,Patriot,Bark,Europe,2/27/1826,1826-02-27,NULL,"11659, 11660, 11664, 11665","In Leghorn 6/24/1826
In Salem 8/22/1826"
S5380E,Penguin,Schooner,Brazil,5/15/1826,1826-05-15,NULL,"11666, 11667",NULL
S5381E,Persia,Brig,East Indies,12/2/1826,1826-12-02,NULL,"11668, 11669",NULL
S5382E,Phoebe,Brig,St. Domingo,1/10/1826,1826-01-10,NULL,"11670, 11671",In Salem 4/19/1826
S5383E,Phoebe,Brig,NULL,5/23/1826,1826-05-23,NULL,11483,"In Boston 9/5/1826
No crew list available"
S5384E,Phoebe,Brig,St. Thomas,9/12/1826,1826-09-12,NULL,"11672, 11673, 11674, 11675",In Edgartown 12/14/1826
S5385E,Pioneer,Brig,Havana,4/18/1826,1826-04-18,200,"11676, 11677",NULL
S5386E,Rajah,Brig,India,1/5/1826,1826-01-05,NULL,"11678, 11679, 11680, 11681",In Marseilles 1/20/1827
S5387E,Rambler,Brig,Antwerp,6/13/1826,1826-06-13,NULL,"11682, 11683",Registered in Kingston
S5388E,Rambler,Brig,Cayenne,8/19/1826,1826-08-19,NULL,"11684, 11685",NULL
S5389E,Ranger,Schooner,NULL,5/19/1826,1826-05-19,NULL,"11686, 11687","Registered in Boston
In Salem 8/31/1826"
S5390E,Reaper,Brig,Cuba,5/3/1826,1826-05-03,NULL,"11688, 11689",NULL
S5391E,Rebecca,Schooner,West Indies,12/18/1826,1826-12-18,NULL,"11694, 11695",NULL
S5392E,Restitution,Ship,NULL,NULL,0000-00-00,NULL,"11696, 11697, 11698",In Antwerp 10/24/1826
S5393E,Richmond,Brig,St. Andrews,8/30/1826,1826-08-30,NULL,"11699, 11700",NULL
S5394E,Boxer,Schooner,NULL,12/21/1826,1826-12-21,NULL,11702,"In Boston 3/24/1826
All returned"
S5395E,Romp,Brig,Port-au-Prince,4/19/1826,1826-04-19,NULL,"11704, 11705, 11706, 11707",NULL
S5396E,Roque,Brig,Marseilles,1/19/1826,1826-01-19,NULL,"11708, 11709, 11710, 11711","In Salem 9/26/1826
All returned"
S5397E,Roscius,Brig,Gibraltar,5/25/1826,1826-05-25,170,"11712, 11713, 11714, 11715",NULL
S5398E,Rotund,Brig,Cayenne,3/18/1826,1826-03-18,NULL,"11716, 11717",In Provincetown 11/13/1826
S5399E,Sally,Schooner,St. Andrews,5/13/1826,1826-05-13,NULL,"11718, 11719",NULL
S5400E,Sally Barker,Schooner,Brazil,1/17/1826,1826-01-17,NULL,"11720, 11721, 11722, 11723, 11724",NULL
S5401E,Sally Barker,Schooner,St. Andrews,7/27/1826,1826-07-27,NULL,"11725, 11726",NULL
S5402E,Scion,Brig,Matanzas,5/24/1826,1826-05-24,NULL,"11727, 11728",In Salem 7/4/1826
S5403E,Scion,Brig,West Indies via Portland,10/18/1826,1826-10-18,NULL,"11729, 11730",NULL
S5404E,Shawmut,Brig,Marseilles,9/20/1826,1826-09-20,NULL,"11731, 11732","In Marseilles 12/1?/1826
In Salem 3/25/1827"
S5405E,Shawmut,Brig,South America,5/3/1826,1826-05-03,NULL,"11733, 11734",NULL
S5406E,Sicily,Brig,Marseilles,7/18/1826,1826-07-18,163,"11735, 11736",NULL
S5407E,Spy,Schooner,India,5/19/1826,1826-05-19,92,"11737, 11738, 11739, 11740",NULL
S5408E,Standard,Brig,Havana,3/27/1826,1826-03-27,NULL,"11741, 11742",NULL
S5409E,Stork,Brig,Brazil,3/3/1826,1826-03-03,NULL,"11743, 11744, 11745, 11746, 11747",In Salem 7/24/1826
S5410E,Hercules,Ship,Brazil,6/30/1826,1826-06-30,NULL,"11748, 11749",NULL
S5411E,Susan,Brig,East Indies,9/21/1826,1826-09-21,NULL,"11750, 11751, 11752, 11753",NULL
S5412E,Texel,Brig,Hamburg,1/27/1826,1826-01-27,NULL,"11564, 11754, 11755",In Boston 9/2/1826
S5413E,Tryon,Schooner,St. Andrews,8/22/1826,1826-08-22,NULL,"11756, 11757, 11762, 11763",NULL
S5414E,Triton,Brig,Marseilles,12/13/1826,1826-12-13,NULL,"11758, 11759",NULL
S5415E,Triton,Brig,St. Thomas,5/8/1826,1826-05-08,NULL,"11760, 11761",NULL
S5416E,Two Brothers,Ship,East Indies,11/16/1826,1826-11-16,NULL,"11764, 11765",In Antwerp 2/18/1826
S5417E,Union,Brig,St. Andrews,5/4/1826,1826-05-04,NULL,"11769, 11770, 11771, 11772, 11773",NULL
S5418E,Union,Brig,St. Andrews,5/26/1826,1826-05-26,NULL,"11774, 11775, 11776, 11777",NULL
S5419E,Union,Brig,St. Andrews,7/19/1826,1826-07-19,NULL,"11778, 11779",NULL
S5420E,Velocity,Brig,St. Helena,9/29/1826,1826-09-29,NULL,"11782, 11783",NULL
S5421E,Virginia,Schooner,South America,7/27/1826,1826-07-27,137,"11784, 11785, 11786, 11787",In Edgartown 12/9/1827
S5422E,Washington,Brig,NULL,2/14/1824,1824-02-14,NULL,"11788, 11789",In Boston 1/5/1826
S5423E,Washington,Brig,West Indies,5/1/1826,1826-05-01,NULL,"11792, 11793, 11794, 11795",NULL
S5424E,Washington,Brig,West Indies,11/10/1826,1826-11-10,NULL,"11796, 11797, 11798, 11799",In Salem 2/8/1827
S5425E,William,Ship,East Indies,12/7/1826,1826-12-07,NULL,"11800, 11801",NULL
S5426E,Zephyr,Ship,India,3/6/1826,1826-03-06,NULL,"11802, 11803, 11804, 11805, 11806",In Antwerp 12/30/1826
S5427E,Abby M,Brig,Isle of May and Brazil,8/9/1827,1827-08-09,NULL,"11808, 11809, 11810","In Rio Grande 12/12/1827
In Salem 3/7/1828"
S5428E,Acorn,Brig,Matanzas,3/19/1827,1827-03-19,NULL,"11811, 11812, 11813, 11814, 11815",In Salem 5/20/1827
S5429E,Acorn,Brig,Matanzas,6/6/1827,1827-06-06,NULL,"11816, 11817, 11818, 11819, 11820",In Salem 7/28/1827
S5430E,Acorn,Brig,Matanzas,8/12/1827,1827-08-12,NULL,"11821, 11822, 11826, 11827",NULL
S5431E,Acorn,Brig,Matanzas,12/26/1827,1827-12-26,NULL,"11823, 11824, 11825, 11828, 11829",In Salem 3/7/1828
S5432E,Amazon,Brig,Havana,3/22/1827,1827-03-22,NULL,"11830, 11831, 11832, 11833",In Salem 5/10/1827
S5433E,Amazon,Brig,St. Petersburg,5/31/1827,1827-05-31,NULL,"11834, 11835, 11836, 11837, 11838",In Salem 11/3/1827
S5434E,Amazon,Brig,Havana,12/15/1827,1827-12-15,NULL,"11839, 11840, 11841, 11842",NULL
S5435E,Amethyst,Brig,Para and a market,12/4/1827,1827-12-04,NULL,"11843, 11844, 11845, 11846, 11847",In Edgartown 3/28/1828
S5436E,Ann,Brig,Havre,6/1/1827,1827-06-01,NULL,"11848, 11849, 11850","Registered in Danvers
In Havre 7/14/1827"
S5437E,Ann,Brig,India,8/7/1827,1827-08-07,NULL,"11851, 11852",NULL
S5438E,Augustus,Ship,Marseilles,11/19/1827,1827-11-19,NULL,"11853, 11854, 11855, 11856, 11857","In Marseilles1/19/1828
In Salem 5/24/1828"
S5439E,Bengal,Ship,East Indies,8/21/1827?,1827-08-21,NULL,"11858, 11859",NULL
S5440E,Betsy,Schooner,Halifax,7/10/1827,1827-07-10,NULL,"11860, 11861",NULL
S5441E,Cambrian,Brig,Leghorn,5/18/1827,1827-05-18,NULL,"11862, 11863, 11864, 11865",NULL
S5442E,Cambridge,Brig,St. Thomas,10/15/1827,1827-10-15,NULL,"11866, 11867",NULL
S5443E,Camel,Brig,West Indies,4/9/1827,1827-04-09,NULL,"11868, 11869, 11870, 11871",NULL
S5444E,Canton Packet,Ship,Matanzas,6/23/1827,1827-06-23,NULL,"11872, 11973, 11874, 11875, 11876, 11877","In Trieste 11/21/1827
In Gibraltar 1/7/1828"
S5445E,Centurion,Brig,South America,1/5/1827,1827-01-05,NULL,"11878, 11879",NULL
S5446E,Cepheus,Schooner,Pernambuco,1/18/1827,1827-01-18,NULL,"11880, 11881, 11882","In Salvidor, Brazil 9/15/1827"
S5447E,General Brooks,Schooner,West Indies,9/13/1829,1829-09-13,NULL,"13005, 13006",NULL
S5448E,General Brooks,Schooner,St Jago de Cuba,12/19/1829,1829-12-19,NULL,"13007, 13008",NULL
S5449E,General Brooks,Schooner,West Indies,5/13/1829,1829-05-13,NULL,"13009, 13010",NULL
S5450E,General Jackson,Brig,West Indies,4/4/1829,1829-04-04,NULL,"13011, 13012, 13017, 13018",NULL
S5451E,General Jackson,Brig,West Indies,10/31/1829,1829-10-31,NULL,"13013, 13014, 13015, 13016",NULL
S5452E,General Jackson,Brig,West Indies,7/18/1829,1829-07-18,NULL,"13019, 13020",NULL
S5453E,General Jackson,Brig,West Indies,7/8/1829,1829-07-08,NULL,"13021, 13022",NULL
S5454E,General Warren,Brig,West Indies,9/21/1829,1829-09-21,NULL,"13023, 13024",NULL
S5455E,George,Ship,Calcutta,8/11/1829,1829-08-11,NULL,"13025, 13026, 13027, 13028",NULL
S5456E,Glide,Ship,one or more Ports in the Pacific Ocean,5/20/1829,1829-05-20,NULL,"13029, 13030",NULL
S5457E,Governor Winslow,Brig,West Indies,7/3/1829,1829-07-03,NULL,"13031, 13032, 13039, 13040",NULL
S5458E,Governor Winslow,Brig,West Indies,3/24/1829,1829-03-24,NULL,"13033, 13034, 13035, 13036",NULL
S5459E,Governor Winslow,Brig,West Indies,10/21/1829,1829-10-21,NULL,"13037, 13038",NULL
S5460E,Hazard,Schooner,West Indies,10/12/1829,1829-10-12,NULL,"13046, 13047",NULL
S5461E,Hazard,Schooner,St. Bartholomews,5/19/1829,1829-05-19,NULL,"13048, 13049",NULL
S5462E,Helen,Brig,Havana,4/20/1829,1829-04-20,NULL,"13050, 13051",Vessel of Portland
S5463E,Henry,Brig,St. Jago,2/15/1829,1829-02-15,NULL,"13052, 13053, 13054, 13055",NULL
S5464E,Herald,Brig,Antwerp,1/4/1829,1829-01-04,NULL,"13056, 13057",of Duxbury
S5465E,Homer,Brig,East Indies,4/17/1829,1829-04-17,NULL,"13058, 13059, 13062, 13063",NULL
S5466E,Homer,Brig,Gibraltar,[No Date],0000-00-00,NULL,"13060, 13061",NULL
S5467E,Hope,Brig,Malta & a market,2/17/1829,1829-02-17,NULL,"13064, 13065, 13066, 13067",NULL
S5468E,Indus,Brig,Havana,3/13/1829,1829-03-13,263,"13068, 13069",NULL
S5469E,James,Schooner,Cape de Verds & market,12/4/1829,1829-12-04,NULL,"13070, 13071, 13072, 13073",NULL
S5470E,Jones,Brig,Montevideo,10/5/1829,1829-10-05,NULL,"13074, 13075, 13083, 13084",NULL
S5471E,Jones,Brig,Antwerp,2/26/1829,1829-02-26,NULL,"13076, 13077, 13078","West Luce, master, died in port of Havana and was replaced by John McCullum."
S5472E,John D. Adams,Schooner,Cayenne,12/21/1829,1829-12-21,NULL,"13079, 13080, 13081, 13082",NULL
S5473E,Joppa,Schooner,Ceara & a market,5/17/1829,1829-05-17,NULL,"13085, 13086",NULL
S5474E,Lady Sarah,Schooner,Maranham & a market,8/7/1829,1829-08-07,NULL,"13089, 13090, 13093, 13094, 13095",NULL
S5475E,Lady Sarah,Schooner,Maranham & a market,11/17/1829,1829-11-17,NULL,"13091, 13092",NULL
S5476E,Lady Sarah,Schooner,Paita & a market,3/26/1829,1829-03-26,NULL,"13087, 13088, 13096, 13097",NULL
S5477E,Leader,Schooner,Pernambuco & a market,7/10/1829,1829-07-10,NULL,"13098, 13099, 13102, 13103",NULL
S5478E,Leader,Schooner,Pernambuco,1/16/1829,1829-01-16,NULL,"13100, 13101",NULL
S5479E,Leander,Brig,Malta,8/31/1829,1829-08-31,NULL,"13104, 13105, 13106, 13107",NULL
S5480E,Leon,Brig,Martinque,2/3/1829,1829-02-03,NULL,"13108, 13109",from Bath
S5481E,Leon,Brig,Maranham? & a market,9/11/1829,1829-09-11,NULL,"13110, 13111",NULL
S5482E,Leon,Brig,Matanzas,6/2/1829,1829-06-02,NULL,"13112, 13113",NULL
S5483E,Lunar,Brig,Dowes,6/11/1829,1829-06-11,NULL,"13114, 13115",NULL
S5484E,Lunar,Brig,St. Thomas,12/21/1829,1829-12-21,281 24/95,"13116, 13117",NULL
S5485E,Margaret,Brig,Antwerp,9/16/1829,1829-09-16,NULL,"13118, 13119",of Duxbury
S5486E,Marengo,Brig,Havana,3/13/1829,1829-03-13,NULL,"13120, 13121, 13122, 13123",NULL
S5487E,Mermaid,Brig,Cayenne,11/19/1829,1829-11-19,NULL,"13124, 13125",NULL
S5488E,Mexican,Brig,Marseilles,7/13/1829,1829-07-13,NULL,"13126, 13127, 13128, 13129",NULL
S5489E,Monticello,Brig,Havana,11/7/1829,1829-11-07,NULL,"13130, 13131",NULL
S5490E,Nereus,Brig,India,4/25/1829,1829-04-25,NULL,"13132, 13133, 13134, 13135",NULL
S5491E,Niagara,Brig,Antwerp,3/31/1829,1829-03-31,NULL,"13136, 13137",NULL
S5492E,Niagara,Brig,Havanna,10/1/1832,1832-10-01,NULL,"13138, 13139, 13140, 13141","Sept 1, 1829 also used."
S5493E,Olinda,Brig,Pernambuco & a market,4/4/1829,1829-04-04,NULL,"13141, 13142, 13143, 13144, 13145, 13146",NULL
S5494E,Olinda,Brig,South America,10/9/1829,1829-10-09,NULL,"13147, 13148, 13149, 13150",NULL
S5495E,Otter,Brig,"Porto Rico, in the West Indies",7/21/1829,1829-07-21,NULL,"13151, 13152",NULL
S5496E,Pactolus,Brig,Cape de Verds,1/23/1829,1829-01-23,NULL,"13153, 13154",NULL
S5497E,Pallas,Bark,Hamburg,8/21/1829,1829-08-21,NULL,"13155, 13156",of Duxbury
S5498E,Pioneer,Brig,Antwerp,9/1/1829,1829-09-01,NULL,"13157, 13158",NULL
S5499E,Plato,Schooner,West Indies,10/3/1829,1829-10-03,NULL,"13159, 13160",NULL
S5500E,Plato,Brig,Maranham,5/8/1829,1829-05-08,NULL,"13161, 13162, 13163",of Boston
S5501E,Plato,Brig,Maranham & a market,9/2/1829,1829-09-02,NULL,"13164, 13165, 13166, 13167, 13168",NULL
S5502E,Prudent,Bark,Havre de Grace,5/19/1829,1829-05-19,NULL,"13169, 13170, 13171",NULL
S5503E,Rajah,Brig,Cadiz? & a market,7/21/1829,1829-07-21,NULL,"13172, 13173",NULL
S5504E,Rambler,Brig,Cayenne & Surinam,9/22/1829,1829-09-22,NULL,"13174, 13175",NULL
S5505E,Rambler,Brig,Cayenne & Surinam,4/22/1829,1829-04-22,NULL,"13176, 13177, 13178, 13179",NULL
S5506E,Rebecca,Brigantine,?,?,0000-00-00,NULL,"13180, 13181","Homeport, destination, departure date and crew list missing."
S5507E,Reliance,Schooner,West Indies,8/7/1829,1829-08-07,NULL,"13182, 13183, 13184, 13185",NULL
S5508E,Restitution,Ship,East Indies,2/10/1829,1829-02-10,NULL,"13186, 13187",NULL
S5509E,Richard,Bark,Rio de Janeiro & a market,9/18/1829,1829-09-18,NULL,"13188, 13189, 13190",NULL
S5510E,Rome,Ship,Calcutta,10/16/1829,1829-10-16,344,"13191, 13192, 13193, 13194, 13195",NULL
S5511E,Romp,Brig,St. Jago & Cuba & a market,7/9/1829,1829-07-09,NULL,"13196, 13197",NULL
S5512E,Romp,Brig,St. Michaels & market,1/7/1829,1829-01-07,NULL,"13198, 13199, 13202, 13203",NULL
S5513E,Romp,Brig,St. Jago & Cuba & a market,10/9/1829,1829-10-09,NULL,"13200, 13201",NULL
S5514E,Rogue,Brig,Antwerp,6/4/1829,1829-06-04,NULL,"13204, 13205",NULL
S5515E,Rotund,Brig,Cayenne & Surinam,6/7/1829,1829-06-07,NULL,"13206, 13207, 13208, 13209, 13210",NULL
S5516E,St. Joseph,Brig,Havana,9/5/1829,1829-09-05,180,"13211, 13212",NULL
S5517E,St. Michaels,Brig,South America,3/31/1829,1829-03-31,NULL,"13213, 13214",NULL
S5518E,Sally Ann,Brig,St. Thomas,8/3/1829,1829-08-03,NULL,"13215, 13216",NULL
S5519E,Sally Ann,Brig,West Indies,4/2/1829,1829-04-02,NULL,"13217,13218, 13221, 13222",NULL
S5520E,Sally Ann,Brig,West Indies,12/10/1829,1829-12-10,NULL,"13219, 13220",NULL
S5521E,Scion,Brig,Havana,10/9/1832,1832-10-09,145 17/19,"13223, 13224",NULL
S5522E,Scion,Brig,West Indies,7/13/1829,1829-07-13,NULL,"13225, 13226, 13227",NULL
S5523E,Shawmut,Brig,East Indies,1/7/1829,1829-01-07,NULL,"13228, 13229",NULL
S5524E,Sumatra,Ship,Canton,5/23/1829,1829-05-23,NULL,"13230, 13231, 13232, 13233",NULL
S5525E,Susan,Brig,Africa,9/15/1829,1829-09-15,NULL,"13234, 13235, 13236, 13237",NULL
S5526E,Talent,Brig,Batavia,11/10/1829,1829-11-10,NULL,"13238, 13239, 13240, 13241",Discrepancy in dating of crew lists.
S5527E,Triton,Brig,West Indies,1/24/1829,1829-01-24,NULL,"13242, 13243, 13248, 13249",NULL
S5528E,Triton,Brig,West Indies,5/18/1832,1832-05-18,NULL,"13244, 13245, 13250, 13251",NULL
S5529E,Triton,Brig,Martinico,9/15/1832,1832-09-15,NULL,"13246, 13247",NULL
S5530E,Two Brothers,Ship,St. Jago,10/28/1829,1829-10-28,288,"13252, 13253",NULL
S5531E,Velocity,Brig,Cape de Verds,10/8/1829,1829-10-08,NULL,"13256, 13257",NULL
S5532E,Vine,Brig,Buenos Ayres,6/27/1829,1829-06-27,NULL,"13258, 13259",NULL
S5533E,Virginia,Brig,Brazil & A market,8/28/1829,1829-08-28,NULL,"13260, 13261, 13262, 13263, 13264",NULL
S5534E,Washington,Brig,Marseilles,2/17/1829,1829-02-17,NULL,"13265, 13266, 13267",NULL
S5535E,Adams,Brig,South America,1/2/1830,1830-01-02,NULL,"13269, 13270, 13271, 13272, 13278, 13279",NULL
S5536E,Adams,Brig,Brazil & a market via Richmond,9/18/1830,1830-09-18,NULL,"13273, 13274, 13275, 13276, 13277",NULL
S5537E,Amanda,Schooner,St. Andrews,9/30/1830,1830-09-30,NULL,"13280, 13281",of Beverly
S5538E,Amazon,Brig,Antwerp,3/1/1830,1830-03-01,NULL,"13282, 13283",NULL
S5539E,Amazon,Brig,Antwerp,7/10/1830,1830-07-10,NULL,"13284, 13285, 13286, 13287, 13288",NULL
S5540E,Amethyst,Brig,Para & a market,4/19/1830,1830-04-19,NULL,"13289, 13290, 13291, 13292, 13293",NULL
S5541E,Amethyst,Brig,Maranham,8/14/1830,1830-08-14,109,"13294, 13295",NULL
S5542E,Arcade,Schooner,West Indies,11/3/1830,1830-11-03,NULL,"13296, 13297, 13805, 13806",NULL
S5543E,Arcade,Schooner,Martinica,7/17/1830,1830-07-17,NULL,"13298, 13299, 13304, 13305",10/15/1830. Hospital Money paid to Officer.
S5544E,Arcade,Schooner,Martinque,4/19/1830,1830-04-19,NULL,"13300, 13301, 13302, 13303","Crew list inscribed ""Cancelled J. S. M?, U. S. Consul, Martinque"
S5545E,Augustus,Ship,St. Peterburg,6/1/1830,1830-06-01,NULL,"13306, 13307, 13308, 13309",NULL
S5546E,Augustus,Ship,St. Thomas & a market,12/8/1830,1830-12-08,NULL,"13310, 13311, 13312, 13313",NULL
S5547E,Baltimore,Brig,Maranham,12/18/1830,1830-12-18,NULL,"13314, 13315, 13316, 13317, 13318",NULL
S5548E,Bengal,Ship,East Indies,9/24/1830,1830-09-24,305,"13319, 13320, 13321, 13322",NULL
S5549E,Black Warrior,Ship,Mocha,12/1/1830,1830-12-01,232,"13323, 13324, 13325, 13326, 13327",NULL
S5550E,Bolivar Liberator,Brig,River ?,6/8/1830,1830-06-08,NULL,"13328, 13329, 13330",NULL
S5551E,Cambrian,Brig,Cuba (Matanzas),6/25/1830,1830-06-25,NULL,"13331, 13332, 13333, 13334, 13335",NULL
S5552E,Caroline,Brig,Rio Grande,10/9/1830,1830-10-09,NULL,"13336, 13337, 13338, 13339, 13340, 13341",NULL
S5553E,Centurion,Brig,Havanna,1/21/1830,1830-01-21,NULL,"13342, 13343, 13346, 13347, 13348",NULL
S5554E,Centurion,Brig,Trieste,12/2/1830,1830-12-02,NULL,"13344, 13345",NULL
S5555E,Ceres,Brig,East Indies,2/25/1830,1830-02-25,NULL,"13349, 13350, 13351, 13352, 13353",NULL
S5556E,Cipher,Brig,Cayenne,8/26/1830,1830-08-26,NULL,"13354, 13355, 13360",NULL
S5557E,Cipher,Brig,Cayenne,2/25/1830,1830-02-25,NULL,"13356, 13357, 13358, 13359",NULL
S5558E,Complex,Schooner,India,9/1/1830,1830-09-01,97,"13361, 13362, 13363, 13364","one lost overboard, three others left schooner at Madagascar, three Negros [unnamed] and an American seaman [unnamed] came home in place of those that left."
S5559E,Cynthia,Brig,Cayenne,8/6/1830,1830-08-06,NULL,"13365, 13366",NULL
S5560E,Dawn,Brig,South America & market,1/7/1830,1830-01-07,NULL,"13369, 13370, 13371, 13374, 13375",NULL
S5561E,Dawn,Brig,Montevideo,9/4/1830,1830-09-04,NULL,"13367, 13368, 13372, 13373",NULL
S5562E,Delphos,Ship,Sumatra,10/15/1830,1830-10-15,NULL,"13376, 13377, 13378, 13379, 13380",NULL
S5563E,Derby,Bark,Valparaiso and a market,10/13/1830,1830-10-13,NULL,"13381, 13382",NULL
S5564E,Dollar,Schooner,Havanna,7/3/1830,1830-07-03,NULL,"13383, 13384",NULL
S5565E,Dollar,Schooner,Africa,10/6/1830,1830-10-06,NULL,"13385, 13386, 13389, 13390, 13391",NULL
S5566E,Dollar,Schooner,Havanna,4/21/1830,1830-04-21,NULL,"13387, 13388",NULL
S5567E,Edward,Brig,Cayenne,10/23/1830,1830-10-23,NULL,"13393, 13394",NULL
S5568E,Edward,Brig,Cayenne,7/26/1830,1830-07-26,NULL,"13395, 13396, 13397, 13400, 13401",One passenger [unnamed]
S5569E,Edward,Brig,West Indies,4/17/1830,1830-04-17,NULL,"13398, 13399",NULL
S5570E,Eliza,Schooner,St. Andrews,9/14/1830,1830-09-14,127,"13402, 13403, 13404, 13405, 13408, 13412, 13413",NULL
S5571E,Eliza,Ship,London,6/30/1830,1830-06-30,NULL,"13409, 13410, 13411",NULL
S5572E,Emerald,Ship,Calcutta,12/3/1830,1830-12-03,NULL,"13414, 13415",NULL
S5573E,Governor Winslow,Brig,Pernambuco,6/17/1830,1830-06-17,NULL,"13416, 13417, 13418, 13419, 13420, 13421",NULL
S5574E,Governor Endicott,Brig,East Indies,5/15/1830,1830-05-15,297,"13422, 13423",NULL
S5575E,George,Ship,One or more Ports of the East Indies at,8/19/1830,1830-08-19,NULL,"13424, 13425, 13426, 13427, 13428",NULL
S5576E,General Warren,Brig,West Indies,1/7/1830,1830-01-07,NULL,"13429, 13430, 13431",NULL
S5577E,General Warren,Brig,Martinico,10/2/1830,1830-10-02,NULL,"13432, 13433, 13434",NULL
S5578E,General Jackson,Brig,Guadaloupe,1/18/1830,1830-01-18,NULL,"13435, 13436, 13437, 13450, 13451",NULL
S5579E,General Jackson,Brig,Guadaloupe,9/24/1830,1830-09-24,NULL,"13438, 13439, 13440, 13446, 13447",NULL
S5580E,General Jackson,Brig,Guadaloupe,12/28/1830,1830-12-28,NULL,"13441, 13442, 13443, 13444, 13445",NULL
S5581E,General Jackson,Brig,Guadaloupe,5/5/1830,1830-05-05,NULL,"13448, 13449, 13452, 13453, 13454, 13455",NULL
S5582E,General Brooks,Schooner,Cuba,10/5/1830,1830-10-05,NULL,"13456, 13457, 13458, 13461, 13462",NULL
S5583E,General Brooks,Schooner,West Indies,4/29/1830,1830-04-29,NULL,"13459, 13460, 13463, 13464, 13465",NULL
S5584E,Gazelle,Schooner,Maranham & a market,4/3/1830,1830-04-03,NULL,"13466, 13467, 13468, 13474, 13475",NULL
S5585E,Gazelle,Schooner,Maranham & a market,9/6/1830,1830-09-06,NULL,"13469, 13470, 13471, 13472, 13473",NULL
S5586E,Friendship,Ship,No given,5/25/1830,1830-05-25,NULL,"13476, 13477",NULL
S5587E,Fredonia,Schooner,Cape de Verds & a market,5/15/1830,1830-05-15,NULL,"13478, 13479, 13480, 13481, 13482",NULL
S5588E,Francis,Ship,Sumatra,11/3/1830,1830-11-03,NULL,"13483, 13484, 13485, 13486, 13487",NULL
S5589E,First Attempt,Schooner,Angostura & a market,3/10/1830,1830-03-10,NULL,"13488, 13489, 13490, 13491, 13492",NULL
S5590E,Fides,Brig,St. Jago de Cuba,8/4/1830,1830-08-04,NULL,"13493, 13494",NULL
S5591E,Fides,Brig,West Indies,4/3/1830,1830-04-03,NULL,"13495, 13496",NULL
S5592E,Fenelon,Brig,St Jago de Cuba,6/15/1830,1830-06-15,NULL,"13497, 13498",NULL
S5593E,Fenelon,Brig,West Indies,10/11/1830,1830-10-11,NULL,"13499, 13500",NULL
S5594E,Felicity,Schooner,Africa,7/16/1830,1830-07-16,NULL,"13501, 13502",Portions of image unreadable.
S5595E,Fair American,Brig,Para & a market,2/17/1830,1830-02-17,NULL,"13503, 13504, 13505, 13506, 13509, 13510",NULL
S5596E,Fair American,Brig,Para & a market,4-Jun,0000-06-04,130,"13511, 13512",NULL
S5597E,Fair American,Brig,Para & a market,10/5/1830,1830-10-05,130,"13507, 13508, 13513, 13514",NULL
S5598E,Hazard,Schooner,Martinque,1/7/1830,1830-01-07,NULL,"13515, 13516, 13517",NULL
S5599E,Henry,Brig,St. Jago,1/9/1830,1830-01-09,NULL,"13518, 13519",NULL
S5600E,James,Schooner,Cape de Verds & a market,8/30/1830,1830-08-30,NULL,"13520, 13521",NULL
S5601E,Janus,Ship,Havana,7/20/1830,1830-07-20,NULL,"13522, 13523, 13524, 13525, 13526",NULL
S5602E,Joppa,Schooner,South America,6/24/1830,1830-06-24,NULL,"13527, 13528, 13829, 13535, 13536",NULL
S5603E,Joppa,Schooner,Paraiba,11/11/1830,1830-11-11,NULL,"13530, 13531, 13532, 13533, 13534",NULL
S5604E,Joppa,Schooner,Pariaba & a market,1/12/1830,1830-01-12,NULL,"13537, 13538, 13539, 13540, 13541, 13542",NULL
S5605E,Lady Sarah,Schooner,Para,10/30/1830,1830-10-30,NULL,"13543, 13544, 13545, 13546, 13551, 13552",NULL
S5606E,Lady Sarah,Schooner,? And a market,6/12/1830,1830-06-12,NULL,"13547, 13548, 13553, 13554, 13555",NULL
S5607E,Lady Sarah,Schooner,St. Jago & Cuba,2/10/1830,1830-02-10,NULL,"13549, 13550, 13556, 13557",NULL
S5608E,Leander,Brig,Malta,6/23/1830,1830-06-23,NULL,"13558, 13559, 13560, 13561, 13562",NULL
S5609E,Leander,Brig,Matanzas,?,0000-00-00,NULL,"13563, 13564, 13565, 13566, 13567, 13560?",NULL
S5610E,Lotos,Ship,East Indies,4/20/1830,1830-04-20,NULL,"13568, 13569, 13570, 13571, 13572",NULL
S5611E,Manderin,Ship,Europe & India,4/17/1830,1830-04-17,NULL,"13573, 13574, 13575, 13576, 13577",NULL
S5612E,Mexican,Brig,Antwerp,7/14/1830,1830-07-14,NULL,"13578, 13579, 13580, 13581",NULL
S5613E,Nereus,Brig,India,5/20/1830,1830-05-20,180,"13582, 13583, 13584, 13585",NULL
S5614E,Niagara,Brig,Montevideo,8/4/1830,1830-08-04,NULL,"13586, 13587",NULL
S5615E,Olinda,Brig,Brazils,7/2/1830,1830-07-02,NULL,"13588, 13589, 13590, 13591",NULL
S5616E,Osprey,Brig,East Indies,3/11/1830,1830-03-11,NULL,"13592, 13593",NULL
S5617E,Pactolus,Brig,Cayenne,11/3/1830,1830-11-03,NULL,"13594, 13595, 13596, 13597, 13598",NULL
S5618E,Peru,Bark,Manila,9/29/1830,1830-09-29,NULL,"13599, 13600",NULL
S5619E,Phoenix,Brig,St Jago de Cuba,1/5/1830,1830-01-05,NULL,"13601, 13602",NULL
S5620E,Pioneer,Brig,Marseilles,12/1/1830,1830-12-01,NULL,"13603, 13604, 13608, 13609",NULL
S5621E,Pioneer,Brig,Marseilles,3/31/1830,1830-03-31,NULL,"13605, 13606, 13607",NULL
S5622E,Plato,Brig,Para & a market,9/15/1830,1830-09-15,NULL,"13610, 13611, 13612, 13619, 13620",NULL
S5623E,Plato,Brig,Maranham & a market,5/6/1830,1830-05-06,NULL,"13613, 13614, 13625, 13626, 13627, 13628",NULL
S5624E,Plato,Brig,St. Andrews,7/13/1830,1830-07-13,NULL,"13623, 13624",NULL
S5625E,Plato,Brig,So. America,1/11/1830,1830-01-11,NULL,"13615, 13616, 13629, 13630, 13631",NULL
S5626E,Plato,Brig,West Indies,11/9/1830,1830-11-09,NULL,"13617, 13618",NULL
S5627E,Plato,Brig,St. Andrews,8/24/1830,1830-08-24,NULL,"13621, 13622",NULL
S5628E,Prudent,Bark,NULL,8/3/1830,1830-08-03,NULL,"13632, 13633",Destination not given.
S5629E,Prudent,Bark,Liverpool,1/2/1830,1830-01-02,NULL,"13634, 13635, 13636",NULL
S5630E,Quill,Brig,Rio Grande,10/25/1830,1830-10-25,180,"13637, 13638, 13639, 13640",NULL
S5631E,Rambler,Brig,Cayenne & Surinam,5/26/1830,1830-05-26,NULL,"13641, 13642",NULL
S5632E,Rambler,Brig,Cayenne,4/14/1829,1829-04-14,NULL,"13643, 13644, 13647, 13648",NULL
S5633E,Rambler,Brig,Cayenne,10/20/1830,1830-10-20,NULL,"13645, 13646, 13649, 13650",NULL
S5634E,Reaper,Brig,Africa,5/26/1830,1830-05-26,229,"13651, 13652, 13653, 13654",NULL
S5635E,Rebecca,Schooner,Martinico & a market,11/22/1830,1830-11-22,NULL,"13655, 13656, 13657, 13658",NULL
S5636E,Rebecca,Brig,Havana,9/22/1830,1830-09-22,NULL,"13659, 13660, 13661, 13662, 13663",7/16/1830. Two men left & two [names not given] shipped in their place.
S5637E,Rebecca,Brig,Brazil & a market,1/9/1830,1830-01-09,NULL,"13664, 13665, 13666, 13667",NULL
S5638E,Richmond,Brig,W. Indies,1/2/1830,1830-01-02,NULL,"13668, 13669",NULL
S5639E,Rising Sun,Schooner,Maranahm & a market,11/18/1830,1830-11-18,NULL,"13670, 13671, 13672, 13673, 13674",NULL
S5640E,Romp,Brig,St. Jago & Cuba & a market,2/19/1830,1830-02-19,NULL,"13675, 13676, 13679, 13680",NULL
S5641E,Romp,Brig,St. Jago & Cuba & a market,9/18/1830,1830-09-18,NULL,"13677, 13678",NULL
S5642E,Romp,Brig,St. Jago & Cuba & a market,5/13/1830,1830-05-13,NULL,"13681, 13682, 13683",One crew member [unidentified] dead.
S5643E,Rogue,Brig,Marseilles,7/14/1830,1830-07-14,NULL,"13684, 13685",NULL
S5644E,Roscoe,Brig,South America,7/21/1830,1830-07-21,NULL,"13686, 13687, 13688, 13689, 13690",NULL
S5645E,Rotund,Brig,Cayenne,6/29/1830,1830-06-29,NULL,"13691, 13692",NULL
S5646E,Savannah,Brig,Halifax,3/10/1830,1830-03-10,NULL,"13693, 13694",of Providence
S5647E,Scion,Brig,Havana,9/15/1830,1830-09-15,NULL,"13695, 13696",NULL
S5648E,Selina & Jane,Schooner,W. Indies,12/23/1830,1830-12-23,NULL,"13697, 13698",NULL
S5649E,Shawmut,Brig,East Indies,5/8/1830,1830-05-08,NULL,"13699, 13700, 13701, 13702",NULL
S5650E,Shawmut,Brig,East Indies,1/1/1829,1829-01-01,NULL,"13703, 13704",NULL
S5651E,Stork,Brig,Montevideo,9/30/1830,1830-09-30,NULL,"13705, 13706, 13707, 13708",NULL
S5652E,Sumatra,Ship,Canton,5/13/1830,1830-05-13,NULL,"13709, 13710, 13711, 13712, 13713","Man lost, James Fisher, does not agree with crew list."
S5653E,Susan,Brig,St. Helena & a market,4/29/1830,1830-04-29,NULL,"13714, 13715, 13716, 13717",NULL
S5654E,Tatler,Schooner,Cayanne,6/28/1830,1830-06-28,NULL,"13718, 13719",NULL
S5655E,Temperance,Schooner,Gibralter,7/10/1830,1830-07-10,NULL,"13720, 13721",NULL
S5656E,Velocity,Brig,Bombay,10/14/1830,1830-10-14,119,"13722, 13723, 13724, 13725",NULL
S5657E,Vine,Brig,So America,1/30/1830,1830-01-30,NULL,"13726, 13727, 13728, 13729",Buenos Ayres
S5658E,Vine,Brig,Montevideo & Buenos Ayres,7/19/1830,1830-07-19,NULL,"13730, 13731, 13732, 13733",NULL
S5659E,Virginia,Brig,Rio Grande,6/15/1830,1830-06-15,NULL,"13734, 13735, 13736, 13737, 13738",NULL
S5660E,Washington,Brig,Maranham,5/31/1830,1830-05-31,NULL,"13739, 13740, 13741, 13744, 13745","Crew was legally discharged in Maranham as attested 30 August 1830 by Charles B. Allen, U. S. Consular Agent."
S5661E,Washington,Brig,Cuba,8/26/1830,1830-08-26,NULL,"13742, 13743",of Portland
S5662E,Abby M,Brig,St. Eustatia & a market,1/1/1831,1831-01-01,NULL,"13747, 13748, 13754, 13755, 13756",NULL
S5663E,Abby M,Brig,Haiti,9/26/1831,1831-09-26,NULL,"13749, 13750, 13751, 13760, 13761",NULL
S5664E,Abby M,Brig,West Indies,5/12/1831,1831-05-12,NULL,"13752, 13753, 13757, 13758, 13759",NULL
S5665E,Albion,Schooner,Martinico,5/20/1831,1831-05-20,107,"13762, 13763, 13764, 13765",Crew list also dated 4/20/1831.
S5666E,Albion,Schooner,Martinico,7/14/1831,1831-07-14,NULL,"13766, 13767, 13768","Salem. Oct 1 1831. List examined and found to be correct except ""A Mate [unnamed] on board instead of former one."""
S5667E,Amazon,Brig,Matanzas,8/5/1831,1831-08-05,NULL,"13769, 13770, 13771, 13772",NULL
S5668E,Amazon,Brig,NULL,1/21/1831,1831-01-21,NULL,"13773, 13774",Destination not given.
S5669E,America,Schooner,Buenos Ayres,12/7/1831,1831-12-07,NULL,"13775, 13776, 13782, 13783",NULL
S5670E,America,Schooner,Para & a market,8/6/1831,1831-08-06,69,"13777, 13778, 13779, 13780, 13781",NULL
S5671E,Amethyst,Brig,Para & a market,NULL,0000-00-00,109,"13784, 13785, 13786, 13787",Departure date unclear but most likely 1/5/1831.
S5672E,Amethyst,Brig,Maranham & a market,3/31/1831,1831-03-31,109,"13788, 13789, 13790, 13791, 13792",NULL
S5673E,Amethyst,Brig,Maranham & a market,11/28/1831,1831-11-28,109,"13793, 13794",NULL
S5674E,Amethyst,Brig,Maranham & a market,7/13/1831,1831-07-13,109,"13795, 13796",NULL
S5675E,Arcade,Schooner,West Indies,1/8/1831,1831-01-08,NULL,"13797, 13798, 13799, 13800",NULL
S5676E,Arcade,Schooner,Martinico,4/9/1831,1831-04-09,NULL,"13801, 13802, 13803, 13804, 13807, 13808",NULL
S5677E,Arcade,Schooner,West Indies,7/1/1831,1831-07-01,NULL,"13809, 13810, 13811, 13812",St. Pierre Mart[inique]: 9th Augt 1831.
S5678E,Arcade,Schooner,Martinico,11/29/1831,1831-11-29,NULL,"13813, 13814, 13815, 13816",NULL
S5679E,Baltimore,Brig,Maranham & a market,4/14/1831,1831-04-14,NULL,"13817, 13818, 13819, 13820, 13821",NULL
S5680E,Baltimore,Brig,Para & a market,8/10/1831,1831-08-10,NULL,"13822, 13823, 13824, 13825, 13826, 13827, 13828",NULL
S5681E,Bolivar Liberator,Brig,Buenos Ayers,5/5/1831,1831-05-05,NULL,"13829, 13930, 13831, 13832",NULL
S5682E,Borneo,Ship,East Indies,12/3/1831,1831-12-03,NULL,"13833, 13834",NULL
S5683E,Camberine,Schooner,Matunza,6/18/1831,1831-06-18,NULL,"13835, 13836, 13837, 13838",NULL
S5684E,Cambrian,Brig,Havana,5/9/1831,1831-05-09,NULL,"13839, 13840, 13843, 13844",NULL
S5685E,Camberine,Schooner,Ponce,9/10/1831,1831-09-10,NULL,"13841, 13842, 13845, 13846",NULL
S5686E,Centurion,Brig,"Rio Janeiro & a market, via Norfolk",7/23/1831,1831-07-23,NULL,"13847, 13848, 13849, 13850, 13851",NULL
S5687E,Ceres,Brig,Gibralter,8/11/1832,1832-08-11,NULL,"13852, 13853, 13854, 13855",NULL
S5688E,Charles Doggett,Brig,the Pacific Ocean,1/13/1831,1831-01-13,110,"13856, 13857, 13858, 13859",NULL
S5689E,Cipher,Brig,Cayene & Surinam,3/3/1831,1831-03-03,NULL,"13860, 13861, 13862, 13863, 13864",NULL
S5690E,Cipher,Brig,Cayene,10/13/1831,1831-10-13,NULL,"13865, 13866, 13867, 13868",NULL
S5691E,Clio,Brig,Brazils & a market,9/26/1831,1831-09-26,NULL,"13869, 13870, 13871, 13872, 13873, 13874",NULL
S5692E,Crescent,Schooner,Maranham & a market,9/30/1831,1831-09-30,NULL,"13875, 13876, 13877, 13878, 13879",NULL
S5693E,Dawn,Brig,Havana,7/28/1831,1831-07-28,NULL,"13880, 13881, 13882, 13883",NULL
S5694E,Deborah,Brig,West Indies,11/4/1831,1831-11-04,NULL,"13884, 13885",NULL
S5695E,Delphos,Ship,Triste,10/20/1831,1831-10-20,NULL,"13886, 13887, 13888, 13889",NULL
S5696E,Delphos,Ship,Triste,10/20/1831,1831-10-20,NULL,"13890, 13891, 13892",NULL
S5697E,Dollar,Schooner,Africa,5/31/1831,1831-05-31,NULL,"13893, 13894, 13895, 13896",NULL
S5698E,Eclipse,Ship,Batavia,6/30/1831,1831-06-30,NULL,"13897, 13898, 13899, 13900",NULL
S5699E,Edward,Brig,Martinco & Santa Eustacia,01/10/1831,1831-01-10,NULL,"13901, 13902, 13903, 13904","Crew list ""Cancelled by John S. Marcilton[?], Consul of the U. States for the Island of Martinico"""
S5700E,Enterprise,Schooner,Africa,8/30/1831,1831-08-30,NULL,"13905, 13906, 13907, 13908, 13909",NULL
S5701E,Fair American,Brig,Para & a market,2/25/1831,1831-02-25,NULL,"13910, 13911, 13912, 13929, 13930",NULL
S5702E,Fair American,Brig,Maranham & a market,12/28/1831,1831-12-28,132,"13913, 13914, 13915, 13916, 13917, 13923, 13924",NULL
S5703E,Fair American,Brig,Maranham & a market,9/8/1831,1831-09-08,130,"13918, 13919, 13920, 13921, 13922",NULL
S5704E,Fair American,Brig,Maranham,6/2/1831,1831-06-02,130,"13923, 13924, 13925, 13926, 13927, 13928",NULL
S5705E,Fides,Brig,West Indies,11/25/1831,1831-11-25,NULL,"13931, 13932, 13947, 13948",NULL
S5706E,Fenelon,Brig,St. Jago de Cuba,8/8/1831,1831-08-08,NULL,"13933, 13934, 13935, 13936, 13937",Last crew on image #13935 illegible.
S5707E,Fenelon,Brig,St. Jago de Cuba,6/17/1831,1831-06-17,NULL,"13938, 13939, 13940, 13941, 13942",NULL
S5708E,Fenelon,Brig,West Indies,3/4/1831,1831-03-04,NULL,"13943, 13944, 13945, 13946",NULL
S5709E,Francis,Ship,East India,12/3/1831,1831-12-03,NULL,"13949, 13950, 13951, 13952, 13953",NULL
S5710E,Friendship,Schooner,Africa,8/27/1831,1831-08-27,NULL,"13954, 13955, 13956, 13957, 13958",NULL
S5711E,Fredonia,Schooner,Cape de Verds & a market,11/5/1831,1831-11-05,NULL,"13959, 13960, 13061, 13962, 13963",NULL
S5712E,Fredonia,Schooner,Ponce,6/24/1831,1831-06-24,NULL,"13964, 13965, 13966, 13967, 13968",NULL
S5713E,Fredonia,Schooner,Ponce,1/6/1831,1831-01-06,NULL,"13969, 13970",NULL
S5714E,Harbinger,Brig,India,1/2/1829,1829-01-02,NULL,"13041, 13042, 13043, 13044, 13045",NULL
S5715E,Gazelle,Schooner,Maranham and a market,03/16/1831,1831-03-16,NULL,"14006, 14007, 14008, 14009, 14010",Certified in Maranham
S5716E,Falcon,Brig,East Indies,09/26/1831,1831-09-26,NULL,"14011, 14012",Certified returned 10/02/1832
S5717E,Gazelle,Brig,East Indies,09/26/1831,1831-09-26,NULL,"14013, 14014, 14015",NULL
S5718E,General Brooks,Schooner,St. Jago,06/25/1831,1831-06-25,NULL,"14016, 14017, 14018, 14019, 14020",Certified all returned
S5719E,General Brooks,Schooner,St. Jago de Cuba,09/02/1831,1831-09-02,NULL,"14021, 14022",NULL
S5720E,General Jackson,Brig,Guadalupe,04/14/1831,1831-04-14,NULL,"14023, 14024, 14025, 14026, 14027, 14028, 10429",Certified returned intact 07/15/1831
S5721E,General Jackson,Brig,Point Petre Guadaloupe,07/15/1831,1831-07-15,NULL,"14030, 14031",NULL
S5722E,General Warren,Brig,Martinico,05/12/1831,1831-05-12,NULL,"14032, 14033, 14034",initialed 07/04/1831(return?)
S5723E,General Warren,Brig,Martinique,01/20/1831,1831-01-20,NULL,"14035, 14036, 14037",NULL
S5724E,General Warren,Brig,West Indies,05/12/1831,1831-05-12,NULL,"14038, 14039",NULL
S5725E,General Warren,Brig,West Indies,09/06/1831,1831-09-06,NULL,"14040, 14041, 14042, 14043, 14044",certified returned intact Jan 1832
S5726E,Generous,Schooner,Buenos Ayres,04/27/1831,1831-04-27,NULL,"14045, 14046, 14047",Returned 08/26/1831
S5727E,Generous,Schooner,Paraiba,04/24/1831,1831-04-24,NULL,"14048, 14049",NULL
S5728E,Generous,Schooner,South America,09/05/1831,1831-09-05,NULL,"14050, 14051, 14052, 14053, 14054",Certified returned Jan 1832
S5729E,George,Ship,Calcutta,08/09/1831,1831-08-09,NULL,"14055, 14056, 14057, 14060, 14061,","
** addt'l info. In ""Salem Ship Registers 1789-1900"""
S5730E,Governor Winslow,Brig,St. Helens and a market,11/29/1831,1831-11-29,NULL,"14058, 14059",NULL
S5731E,Hazard,Schooner,Cayenne and Surinam,04/18/1831,1831-04-18,NULL,"14062, 14063",NULL
S5732E,Homer,Brig,Sumatra,04/18/1831,1831-04-18,NULL,"14064, 14065, 14066, 14067",NULL
S5733E,Hope,Brig,West Indies,04/20/1831,1831-04-20,NULL,"14068, 14069",NULL
S5734E,Izette,Ship,Delago Bay,03/10/1831,1831-03-10,NULL,"14070, 14071, 14072, 14073, 14074",NULL
S5735E,James Lawrence,Brig,West Indies,07/23/1831,1831-07-23,NULL,"14075, 14076, 14077, 14078",NULL
S5736E,Janus,Ship,Havana,05/09/1831,1831-05-09,NULL,"14079, 14080, 14081, 14082, 14083",NULL
S5737E,Lady Sarah,Schooner,Para and a market,02/23/1831,1831-02-23,NULL,"14084, 14085, 14086, 14087, 14088, 14089",Certified all crew returned 05/15/1831
S5738E,Lady Sarah,Schooner,Para and a Market,05/26/1831,1831-05-26,NULL,"14090, 14091, 14092, 14093, 14094",NULL
S5739E,Lady Sarah,Schooner,India,09/20/1831,1831-09-20,106,"14095, 14096, 14097, 14098, 14099",NULL
S5740E,Laurel,Brig,Hamburg,08/04/1831,1831-08-04,NULL,"14100, 14101",NULL
S5741E,Generous,Schooner,NULL,01/19/1831,1831-01-19,NULL,14102,"no crew list attached, verified 09/05/1831"
S5742E,Laurel,Brig,NULL,07/31/1831?,1831-07-31,NULL,"14103, 14104",no crew list attached. Verified in Salem 07/31/1832
S5743E,Leander,Brig,Marseilles,12/31/1831,1831-12-31,NULL,"14105, 4106, 14107",note all returned
S5744E,Leander,Brig,Matanzas,03/26/1831,1831-03-26,NULL,"14108, 14109, 14110, 14111, 14112",NULL
S5745E,Lotos,Ship,Liverpool,05/07/1831,1831-05-07,NULL,"14113, 14114, 14115, 14116",07/09/1831 certified in Liverpool with crew change.
S5746E,Mala,Brig,East Indies,09/10/1831,1831-09-10,NULL,"14117, 14118",NULL
S5747E,Mandarin,Ship,Calcutta,08/24/1831,1831-08-24,296,"14119, 14120, 14121, 14122, 14123",returned 6/13/1831?
S5748E,Maranhas,Brig,Maranham and a market,04/08/1831,1831-04-08,NULL,"14124, 14125",Vessel of Brazil
S5749E,Mercator,Brig,Trinidad de Cuba,03/17/1831,1831-03-17,NULL,"14126, 14127, 14128",all crew certified arrived in Girgenti 09/09/1831
S5750E,Neptune,Brig,East Indies,09/29/1831,1831-09-29,NULL,"14129, 14130, 14131",NULL
S5751E,Nereus,Brig,India,04/23/1831,1831-04-23,NULL,"14132, 14133, 14134, 14135, 14136","Certified roll, Port of Salem 09/15/1832"
S5752E,Pactolis,Brig,West Indies,03/29/1831,1831-03-29,NULL,"14137, 14138, 14139, 14140, 14141",Certified all returned 05/11/1831
S5753E,Pactolis,Brig,Cayenne,09/01/1831,1831-09-01,NULL,"14144, 14145, 14146",NULL
S5754E,Pioneer,Brig,St. Petersburg,06/03/1831,1831-06-03,NULL,"14147, 14148, 14149, 14150, 14151",returned June 3 ?
S5755E,Plato,Brig,Maranham and a market,01/08/1831,1831-01-08,NULL,"14142, 14143, 14152, 14153",NULL
S5756E,Prudent,Bark,Liverpool,06/21/1831,1831-06-21,NULL,"14154, 14155","certified al present in Liverpool 09/01/1831
returned Oct.16"
S5757E,Quill,Brig,East Indies,12/05/1831,1831-12-05,NULL,"14156, 14157, 14158, 14159, 14160, 14161",NULL
S5758E,Rambler,Brig,Cayenne and Surinam,06/23/1831,1831-06-23,NULL,"14162, 14163, 14166",NULL
S5759E,Reaper,Brig,Africa,05/18/1831,1831-05-18,NULL,"14164, 14165, 14167, 14168",NULL
S5760E,Rebecca,Schooner,Martinique,03/05/1831,1831-03-05,NULL,"14169, 14170, 14171","Certified returned 06/13/1831; ""one colored passenger worked his passage"""
S5761E,Rebecca,Schooner,Martinique and a market,07/18/1831,1831-07-18,NULL,"14172, 14173, 14174, 14175, 14576,",District of Egartown 10/26/1831 certified all returned except John Boston
S5762E,Rebecca,Schooner,Martinique and a market,11/28/1831,1831-11-28,NULL,"14177, 14178, 14179, 14180, 14181",NULL
S5763E,Richard,Bark,Rio de Janeiro and a market,09/03/1831,1831-09-03,NULL,"14182, 14183, 14184, 14185",NULL
S5764E,Richmond Packet,Schooner,Cayenne,12/03/1831,1831-12-03,NULL,"14186, 14187, 14188, 14193, 14194",NULL
S5765E,Richmond,Brig,Cayenne,12/10/1831,1831-12-10,NULL,"14189, 14190, 14191, 14192",NULL
S5766E,Rising Sun,Schooner,Maranham and a market,04/27/1831,1831-04-27,NULL,"14195, 14196, 14197, 14198, 14199",NULL
S5767E,Rising Sun,Schooner,Para and a market,10/05/1831,1831-10-05,NULL,"14200, 14201, 14202, 14203, 14204",Certified all returned 01/21/1832
S5768E,Rogue,Brig,Marseilles,04/22/1831,1831-04-22,NULL,"14205, 14206",returned Sept. 1831
S5769E,Rogue,Brig,Marseilles,09/23/1831,1831-09-23,NULL,"14207, 14208",NULL
S5770E,Romp,Brig,Ft. Iago de Cuba,19/23/1831,0000-00-00,NULL,"14209, 14210, 14211, 14212,",Certified returned 01/06/1831
S5771E,Romp,Brig,Guadaloupe,05/12/1831,1831-05-12,NULL,"14213, 14214, 14215, 14216",certified returned 08/23/1831
S5772E,Romp,Brig,Cuba,10/15/1831,1831-10-15,NULL,"14217, 14218, 14219, 14220",certified returned 12/29/1831
S5773E,Rotund,Brig,Cayenne and Surinam,01/11/1831,1831-01-11,NULL,"14221, 14222, 14223, 14224, 14225, 14226, 14227",NULL
S5774E,Rotund,Brig,Havana and a port,06/09/1831,1831-06-09,NULL,"14228, 14229",NULL
S5775E,Rover,Brig,Buenos Aures and a market,06/06/1831,1831-06-06,NULL,"14230, 14231, 14232, 14233",NULL
S5776E,Rover,Brig,Pernambuco and a market,10/22/1831,1831-10-22,NULL,"14234, 14235, 14236, 14237, 14238",NULL
S5777E,Sally Ann,Brig,West Indies,05/27/1831,1831-05-27,NULL,"14239, 14240, 14241, 14242, 14243",Certified returned 09/22/1831
S5778E,Sally Ann,Brig,St. Thomas,10/13/1831,1831-10-13,NULL,"14244, 14245, 14246, 14247",NULL
S5779E,Sapphire,Ship,East Indies,11/31/1831,0000-00-00,NULL,"14248, 14249, 14250",certified returned 03/11/1832
S5780E,Science,Ship,Liverpool,07/20/1831,1831-07-20,NULL,"14251, 14252",from Newbury Port
S5781E,Scion,Brig,Matanzas,06/09/1831,1831-06-09,NULL,"14253, 14254",NULL
S5782E,Scion,Brig,Havana,01/15/1831,1831-01-15,NULL,"14255, 14256, 14257",NULL
S5783E,Scion,Brig,Africa,03/21/1831,1831-03-21,NULL,"14258, 14259",Certified returned January 1832
S5784E,Selina & Jane,Schooner,Cape de Verds,09/05/1831,1831-09-05,NULL,"14260, 14261",NULL
S5785E,Shawmut,Brig,East Indies,09/22/1831,1831-09-22,NULL,"14262, 14263, 14264, 14266",NULL
S5786E,Shawmut,Brig,East Indies,NULL,0000-00-00,NULL,14265,crew list only
S5787E,Sumatra,Ship,India,11/25/1831,1831-11-25,NULL,"14267, 14268",NULL
S5788E,Susan,Brig,Maranham and a market,06/12/1831,1831-06-12,NULL,"14269, 14270, 14271, 14772, 14273, 14274",NULL
S5789E,Tattler,Brig,Cayenne,01/31/1831,1831-01-31,NULL,"14275, 14276, 14277, 14278",NULL
S5790E,Tattler,Brig,Cayenne,06/27/1831,1831-06-27,NULL,"14279, 14280",NULL
S5791E,Thomas Perkins,Brig,Pernambuco and a market,03/19/1831,1831-03-19,NULL,"14281, 14282",NULL
S5792E,Velocity,Brig,St Helena,06/16/1831,1831-06-16,NULL,"14283, 14284, 14285",NULL
S5793E,Velocity,Brig,Cape de Verds,10/19/1831,1831-10-19,NULL,"14286, 14287",NULL
S5794E,Vine,Brig,St. Helena,04/14/1831,1831-04-14,NULL,"14288, 14289",NULL
S5795E,William,Brig,Maranham and a market,9/15/1831,1831-09-15,NULL,"14290, 14291, 14292",NULL
S5796E,Sullivan,Brig,Maranham and a market in Brazil,09/15/1831,1831-09-15,NULL,"14293, 14294",NULL
S5797E,Abby-M,Brig,Porto Rico,05/18/1832,1832-05-18,NULL,"14296, 14297, 14298, 14299",NULL
S5798E,Abby M,Brig,Matanzas and a market,09/15/1832,1832-09-15,NULL,"14300, 14301",NULL
S5799E,Abby M,Brig,Ponce Porto Rico,9/15/1832,1832-09-15,NULL,"14302, 14303, 14304, 14305",NULL
S5800E,Amazon,Brig,Marseilles,12/07/1832,1832-12-07,NULL,"14306, 14307, 14308, 14309, 14310, 14311, 14312",certified returned 11/25/1832
S5801E,American,Schooner,St. Pierre and a market,08/31/1832,1832-08-31,NULL,"14313, 14314, 14315, 14316, 14317","written on back: ""Brig Ann of (?) bound for St. Jose de Cuba - upset at sea: the creew and passangers were picked up from the bottom by us and Brig from Tooy? Bound to Port au Prince - out of 13 on board only 2 mates, 2 men & 1 passenger (Mr. Forrest) were saved - the Brig stopt off Turks Isalnds to deliver them over to the American Counsul - one mans leg broken and all very ill & emaciated. (?) Nov.5th 1832."""
S5802E,Amazon,Brig,Maranham and a market,12/31/1832,1832-12-31,NULL,"14318, 14319",NULL
S5803E,Amethyst,Brig,Maranham and a market,2/23/1832,1832-02-23,NULL,"14320, 14321, 14334, 14335, 14336",NULL
S5804E,Amethyst,Brig,Maranham and a market,06/13/1832,1832-06-13,NULL,"14322, 14323, 14326, 14327, 14328",NULL
S5805E,Amethyst,Brig,Maranham and a market,09/26/1832,1832-09-26,NULL,"14324, 14325, 14329, 14330",NULL
S5806E,Amethyst,Brig,Maranham and a market,12/31/1832,1832-12-31,NULL,"14331, 14332, 14333",certified in Maranham and that crew returned to Salem 3/20/1833
S5807E,Angelina,Brig,Ponce Puerto Rico,12/19/1832,1832-12-19,NULL,"14337, 14338, 14339, 14340",NULL
S5808E,Arcade,Schooner,Martinique,2/11/2832,2/11/2832,NULL,"14341, 14342, 14343",NULL
S5809E,Augustus,Schooner,Havana,05/08/1832,1832-05-08,NULL,"14344, 14345, 14346, 14347",NULL
S5810E,Baltimore,Brig,Maranham and a market in Brazil,10/29/1832,1832-10-29,NULL,"14348, 14349, 14352, 14355",certified returned with crew intact 1/31/1833
S5811E,Baltimore,Brig,Maranham and a market in Brazil,03/13/1832,1832-03-13,NULL,"14350, 14351, 14360, 14361",certified returned 08/28/1832
S5812E,Baltimore,Brig,Maranham and a market in Brazil,10/20/1832,1832-10-20,NULL,"14353, 14354, 14356, 14357",certified all returned 06/19/1833
S5813E,Baltimore,Brig,St. Iago de Cuba and a market,06/19/1832,1832-06-19,NULL,"14358, 14359",NULL
S5814E,Baltimore,Brig,Macaber? And a market,08/20/1832,1832-08-20,NULL,"14362, 14363",NULL
S5815E,Bengal,Ship,Pacific Ocean,3/23/1832,1832-03-23,NULL,"14364, 14365, 14366, 14367",NULL
S5816E,Black Warrior,Ship,India,05/25/1832,1832-05-25,NULL,"14368, 14369, 14370, 14371, 14372",certified returned Massachusetts 4/20/1833
S5817E,Cambrian,Brig,Matanzas,05/16/1832,1832-05-16,NULL,"14375, 14376, 14379, 14380",NULL
S5818E,Camberine,Schooner,Havana,03/12/1832,1832-03-12,NULL,"14373, 14374, 14377, 14378",NULL
S5819E,Catharine,Ship,Pacific Ocean,3/23/1832,1832-03-23,NULL,"14381, 14382",NULL
S5820E,Catharine,Schooner,West Indies,09/11/1832,1832-09-11,NULL,"14383, 14384, 14385, 14386, 14387",NULL
S5821E,Cherokee,Brig,E.India,03/22/1832,1832-03-22,NULL,"14388, 14389, 14390, 14391",NULL
S5822E,Cipher,Brig,West Indies,09/01/1832,1832-09-01,NULL,"14392, 14393, 14404, 14405",(image 14405: certified return? Nov. 12 1832)
S5823E,Cipher,Brig,West Indies,03/31/1832,1832-03-31,NULL,"14394, 14395, 14408, 14409, 14410",(image 14408: certified return? May 8 1833
S5824E,Cipher,Brig,West Indies,06/16/1832,1832-06-16,NULL,"14396, 14397, 14400, 14401, 14402, 14403, 14440",(Image 14402: certified return? Aug. 15)
S5825E,Cipher,Brig,Cayenne,11/24/1832,1832-11-24,NULL,"14406, 14407, 14398, 14399",NULL
S5826E,Clio,Brig,Rio Grande,10/24/1832,1832-10-24,NULL,"14411, 14412, 14416, 14417, 14418",NULL
S5827E,Clio,Brig,Ponce Puerto Rico,05/26/1832,1832-05-26,NULL,"14413, 14414, 14415",crew list certified July 30
S5828E,Cohassett,Schooner,Gibralter and a market,06/23/1832,1832-06-23,NULL,"14419, 14420, 14421","of Boston
certified in Portugal"
S5829E,Colma,Schooner,Porto Rico and a market,12/26/1832,1832-12-26,NULL,"14422, 14423, 14438, 14439, 14440",NULL
S5830E,Colma,Schooner,West Indies,01/10/1832,1832-01-10,NULL,"14424, 14425, 14436, 14437",NULL
S5831E,Colma,Schooner,Porto Rico,07/14/1832,1832-07-14,NULL,"14426, 14427, 14428, 14429, 14430",NULL
S5832E,Colma,Schooner,West Indies,04/20/1832,1832-04-20,NULL,"14431, 14432, 14433, 14434, 14435",NULL
S5833E,Consul,Brig,Brazil and a market,03/03/1832,1832-03-03,NULL,"14441, 14442, 14443",of New York
S5834E,Crescent,Schooner,Maranham and a market,03/07/1832,1832-03-07,NULL,"14444, 14445, 14446, 14447",NULL
S5835E,Crescent,Schooner,Havana and a market,03/28/1832,1832-03-28,NULL,"14448, 14449",NULL
S5836E,Crescent,Schooner,Maranham and a market,09/12/1832,1832-09-12,NULL,"14450, 14451",NULL
S5837E,Curtis,Brig,Havana,12/14/1832,1832-12-14,NULL,"14452, 14453, 14454, 14455, 14456",of Bath
S5838E,Dawn,Brig,St. Catherines and Buenos Ayres,08/01/1832,1832-08-01,NULL,"14457, 14458, 14459, 14460",NULL
S5839E,Deborah,Brig,Cape de Verde and a market,08/30/1832,1832-08-30,NULL,"14461, 14462, 14472, 14473, 14474, 14475",In Goree 13 Feb 1833; returned to Salem 28 April 1833
S5840E,Deborah,Brig,West Indies,06/15/1832,1832-06-15,NULL,"14463, 14464, 14467, 14468",NULL
S5841E,Deborah,Brig,Porto Rico,01/11/1832,1832-01-11,NULL,"14465, 14466",NULL
S5842E,Deborah,Brig,West Indies,03/23/1832,1832-03-23,NULL,"14469, 14470, 14471, 14476, 14477",NULL
S5843E,Delphos,Ship,NULL,09/12/1832,1832-09-12,NULL,"14478, 14479","isolated records, return certification sent to Salem from Boston May 1836 regarding earlier voyage."
S5844E,Defiance,Schooner,Para and a Market in Brazil,12/25/1832,1832-12-25,NULL,"14480, 14481",NULL
S5845E,Derby,Bark,South America,09/15/1832,1832-09-15,NULL,"14482, 14483",NULL
S5846E,Dollar,Schooner,Africa,06/06/1832,1832-06-06,NULL,"14484, 14485, 14486, 14487",return certified 04/14/1833
S5847E,Eclipse,Ship,India,09/18/1832,1832-09-18,NULL,"14488, 14489, 14490, 14491",NULL
S5848E,Edwin,Brig,Cape of Good Hope,09/17/1832,1832-09-17,NULL,"14492, 14493",NULL
S5849E,Eliza,Bark,Muscat,10/18/1832,1832-10-18,NULL,"14494, 14495",NULL
S5850E,Eliza,Ship,East Indies,02/28/1832,1832-02-28,NULL,"14496, 14497",NULL
S5851E,Eliza,Bark,Surinam,05/09/1832,1832-05-09,NULL,"14498, 14499, 14500, 14501, 14502",returned 09/24/0832?
S5852E,Eliza,Bark,Muscat,10/18/1832,1832-10-18,NULL,"14503, 14504",returned 04/15/1833
S5853E,Eliza,Bark,East Indies,02/28/1832,1832-02-28,NULL,"14505, 14506, 14507",NULL
S5854E,Emeline,Schooner,Havana,12/28/1832,1832-12-28,NULL,"14508, 14509",of Boston
S5855E,Enterprise,Schooner,Africa,09/13/1832,1832-09-13,NULL,"14510, 14511",returned Dec. 31 1833
S5856E,Exeter,Ship,East Indies,?/1832,0000-00-00,NULL,"14512, 14513",NULL
S5857E,Fair American,Brig,Para and a market,07/03/1832,1832-07-03,NULL,"14514, 14515",NULL
S5858E,Fair American,Brig,Para,10/10/1832,1832-10-10,NULL,"14516, 14517",NULL
S5859E,Fair American,Brig,Para and a market,03/30/1832,1832-03-30,NULL,"14518, 14519",NULL
S5860E,Fair American,Brig,Para and a market,07/03/1832,1832-07-03,NULL,"14520, 14521, 14522",returned Oct. 5
S5861E,Fair American,Brig,Para,10/13/1832,1832-10-13,NULL,"14523, 14524, 14525",returned Jan 10 1833
S5862E,Fair American,Brig,Para and a market,03/30/1832,1832-03-30,NULL,"14526, 14527, 14538",certified return 6/17/1832
S5863E,Fides,Brig,St. Iago de Cuba,07/25/1832,1832-07-25,NULL,"14529, 14530, 14531",NULL
S5864E,Fides,Brig,South America,11/13/1832,1832-11-13,NULL,"14532, 14533, 14534, 14535","certified returned March 27, 1833"
S5865E,Francis,Ship,India,11/01/1832,1832-11-01,NULL,"14536, 14537, 14538, 14539",certified returned 19/26/1833
S5866E,Fredonia,Schooner,Cape de Verde and a market,12/08/1832,1832-12-08,NULL,"14540, 14541","returned Salem Sept 26, 1833"
S5867E,Fredonia,Brig,Pernambuca and a market,04/02/1832,1832-04-02,NULL,"14542, 14543",NULL
S5868E,Fredonia,Brig,Pernambuca and a market,16/19/1832,0000-00-00,NULL,"14544, 14545",NULL
S5869E,Fredonia,Brig,Para,09/21/1832,1832-09-21,NULL,"14546, 14547",NULL
S5870E,Fredonia,Brig,Pernambuca and a Market,04/02/1832,1832-04-02,NULL,"14548, 14549, 14550, 14551",NULL
S5871E,Fredonia,Schooner,Cape de Verde,06/17/1832,1832-06-17,NULL,"14452, 14453",NULL
S5872E,Fredonia,Schooner,Cape de Verde and a market,12/08/1832,1832-12-08,NULL,"14554, 14555, 14556","certified arrival in Gore' Feb. 26, 1833, certified return June 3, 1833"
S5873E,Fredonia,Brig,Para,09/20/1832,1832-09-20,NULL,"14557, 14558, 14559",certified returned 1/5/1833
S5874E,Ganges,Brig,Rio Grande and a market,04/27/1832,1832-04-27,NULL,"14560, 14561, 14562",certified return 08/15/1833
S5875E,Ganges,Brig,Rio Grande and a market,03/08/1832,1832-03-08,NULL,"14563, 14564",returned Nov * 1883
S5876E,Gazelle,Brig,Para,10/24/1832,1832-10-24,NULL,"14565, 14566, 14567",returned Feb 16 1833
S5877E,Gazelle,Brig,Para,10/24/1832,1832-10-24,NULL,"14568, 14569",NULL
S5878E,General Brooks,Schooner,West Indies,04/12/1832,1832-04-12,NULL,"14570, 14571, 14572, 14573, 14574, 14575","certified return June 26, 1832"
S5879E,General Brooks,Schooner,West Indies,07/06/1832,1832-07-06,NULL,"14576, 14577, 14578, 14579",certified returned Boston Nov. 20 1832
S5880E,General Brooks,Brig,St. Jago de Cuba,11/20/1832,1832-11-20,NULL,"14580, 14581",NULL
S5881E,General Warren,Brig,St. Salvadore,02/05/1833,1833-02-05,NULL,"14582, 14583, 14584",certified returned 06/21/1833
S5882E,General Warren,Brig,St. Jago de Cuba,08/16/1832,1832-08-16,NULL,"14585, 14586, 14593, 14594",certified returned 10/19/1832
S5883E,General Warren,Brig,Fort Royal Martenique,03/21/1832,1832-03-21,NULL,"14587, 14588, 14595, 14596, 14597","certified returned May 24, 1832"
S5884E,General Warren,Brig,West Indies,06/05/1832,1832-06-05,NULL,"14589, 14590, 14591, 14592",NULL
S5885E,Generous,Schooner,Paraiba and a market,10/30/1832,1832-10-30,NULL,"14598, 14599",NULL
S5886E,Generous,Schooner,Paraiba,06/21/1832,1832-06-21,NULL,"14600, 14601, 14602",returned 10/19/1832
S5887E,Generous,Schooner,Brazil &,02/18/1832,1832-02-18,NULL,"14603, 14604",of New York
S5888E,Generous,Schooner,Paraiba Brazil,06/21/1832,1832-06-21,NULL,"14605, 14606",NULL
S5889E,Generous,Schooner,Paraiba and a market,10/31/1832,1832-10-31,NULL,"14607, 14608",NULL
S5890E,George,Ship,East Indies,08/04/1832,1832-08-04,NULL,"14609, 14610, 14611, 14612",returned 05/23/1833
S5891E,Eleaner,Brig,Africa,10/24/1832,1832-10-24,NULL,"14613, 14614, 14615, 14616",NULL
S5892E,Governor Winslow,Brig,Africa,08/15/1832,1832-08-15,NULL,"14617, 14618, 14619, 14620",NULL
S5893E,Hope,Brig,India,03/30/1832,1832-03-30,NULL,"14621, 14622, 14623, 14624",returned to Salem 05/23/1833
S5894E,James Lawrence,Brig,Maranham and market,09/18/1832,1832-09-18,NULL,"14625, 14626, 14627, 14630, 14631","Certified in Para Brazil
Returned Feb.4, 1833
""The Brig James Lawrence having been condemned and sold at this port, her crew has been discharged. Para Dec.29,183(3)?"""
S5895E,Izette,Ship,South Atlantic,06/07/1832,1832-06-07,NULL,"14628, 14629","returned 03/01/1834
[The Izette was the first whaler fitted out in the effort to establish the whale fishery in Salem. She made five whaling voyages, 1831-1842, and was finally sold at Boston in 1847] -Salem Ship Registers 1789-1900"
S5896E,Janus,Ship,Havana and Europe,05/09/1832,1832-05-09,NULL,"14632, 14633, 14634, 14635, 14636, 14637","returned intact May 24,1833
discharge certificate: Punchard (14635)"
S5897E,Lady Sarah,Brig,East Indies,09/01/1832,1832-09-01,NULL,"14638, 14639, 14640, 14641",NULL
S5898E,Leander,Brig,India,09/26/1832,1832-09-26,NULL,"14642, 14643, 14644, 14645",returned 2/21/1832
S5899E,Sotos,Brig,East Indies,07/13/1832,1832-07-13,NULL,"14646, 14647, 14648, 14649","
returned Salem 06/12/1833"
S5900E,Malaga,Brig,Guadaloupe,03/14/1832,1832-03-14,NULL,"14650, 14651, 14652, 14653, 14654",returned Salem 6/01/1832
S5901E,Malaga,Brig,Cayenne,07/20/1832,1832-07-20,NULL,"14655, 14656, 14657, 14658","certified returned to Salem, no date"
S5902E,Malay,Brig,East Indies,09/24/1832,1832-09-24,NULL,"14659, 14660, 14661, 14662, 14663",certified returned 2/28/1834
S5903E,Mandarin,Ship,East Indies,07/21/1832,1832-07-21,NULL,"14664, 14665",NULL
S5904E,Mercator,Brig,Port Louis and a market,08/08/1832,1832-08-08,NULL,"14666, 14667,14668, 14669, 14670, 14671",NULL
S5905E,Mercator,Brig,St. Jago,02/03/1834,1834-02-03,NULL,"14672, 14673, 14674",NULL
S5906E,Mexican,Brig,Europe,02/27/1832,1832-02-27,NULL,"14675, 14676, 14677, 14678, 14679, 14680",returned 07/11/1832
S5907E,Mexican,Brig,Rio Janiero and a market,08/27/1832,1832-08-27,NULL,"14681, 14682, 14683, 14684, 14685, 14686","Note:""In Sept.,1832, the Mexican, while on a voyage to Rio Janiero, was captured by pirates, robbed and set on fire. The crew succeeded in putting out the flames and saving their vessel. The pirates were afterwards captured, brought to Salem, tried and several of them hanged. This was probably the last case of piracy on the Atlantic Ocean, at least in which Salem vessels were sufferers."" + ref to full account by a survivor, see E.I. Hist. Coll.,XXIV, 42""
Salem Ship Registers 1789-1900."
S5908E,Moro,Schooner,"Bridgeport, NJ",08/31/1832,1832-08-31,NULL,"14687, 14688, 14689,14690",NULL
S5909E,Neptune,Brig,India,10/26/1832,1832-10-26,NULL,"14691, 14692, 14693, 14694",NULL
S5910E,Nereus,Brig,India,07/05/1832,1832-07-05,183,"14695, 14696, 14697, 14698",certified returned 04/29/1832
S5911E,Numa,Brig,Para and a market,12/07/1832,1832-12-07,NULL,"14699, 14700, 14701",NULL
S5912E,Numa,Brig,Para and a Market,01/13/1832,1832-01-13,NULL,"14702, 14703, 14704",NULL
S5913E,Numa,Brig,Para and a market,08/13/1832,1832-08-13,NULL,"14705, 14706, 14707, 14715, 14716",NULL
S5914E,Numa,Brig,Maranham and a market,05/04/1832,1832-05-04,NULL,"14708, 14709, 14710, 14711, 14712",NULL
S5915E,Numa,Brig,Para and a market,12/07/1832,1832-12-07,NULL,"14713, 14714",NULL
S5916E,Olinda,Brig,Brazil,03/30/1832,1832-03-30,NULL,"14717, 14718",NULL
S5917E,Olinda,Brig,Rio Grande,07/10/1832?,1832-07-10,NULL,"14719, 14720",NULL
S5918E,Olinda,Brig,South America,12/24/1832,1832-12-24,NULL,"14721, 14722, 14723, 14724, 14725",NULL
S5919E,Oscar,Schooner,St. Pierres in Martinique,10/01/1832,1832-10-01,NULL,"14726, 14727, 14728, 14729",NULL
S5920E,Ottoman,Brig,"St. Jago de Cuba, -?-",12/19/1832,1832-12-19,NULL,"14730, 14731, 14732, 14733",of Boston
S5921E,Pactolus,Brig,Cayenne and Surinam,09/01/1832,1832-09-01,NULL,"14734, 14735",NULL
S5922E,Pactolus,Brig,Cayenne,02/25/1832,1832-02-25,NULL,"14736, 14737, 14738, 14739, 14740",NULL
S5923E,Pallas,Bark,Pacific Ocean,07/19/1832,1832-07-19,NULL,"14741, 14742, 14743, 14744","returned June 20, 1834"
S5924E,Pioneer,Brig,Marseilles,01/28/1832,1832-01-28,NULL,"14745, 14746","certified all returned, Dec. 17 (no year)
with note regarding Thomas Richards, Seaman (not on list) died on board at Eseneure-??"
S5925E,Ploughboy,Schooner,St. Jago de Cuba,12/29/1832,1832-12-29,NULL,"14747, 14748, 14751, 14752",NULL
S5926E,Ploughboy,Schooner,St. Peter and a market,09/11/1832,1832-09-11,NULL,"14749, 14750, 14753, 14754, 14755","Certified returned Salem, Nov. 26, 1832"
S5927E,Quill,Brig,East Indies,10/18/1832,1832-10-18,NULL,"14756, 14757, 14758, 14759, 14760",NULL
S5928E,Rambler,Brig,Cayenne and Surinam,04/07/1832,1832-04-07,NULL,"14761, 14762, 14763, 14764",NULL
S5929E,Reaper,Brig,Africa,05/26/1832,1832-05-26,NULL,"14765, 14766, 14767, 14768","certified arrived in Goree 06/30/1832
certified returned intact 04/23/1833"
S5930E,Rebecca,Schooner,Martinique and a market,03/17/1832,1832-03-17,NULL,"14769, 14770, 14773",NULL
S5931E,Rebecca,Brig,Surinam,10/04/1832,1832-10-04,NULL,"14771, 14774, 14775",This crew list probably supersedes the list dated 09/29/1832
S5932E,Rebecca,Brig,Surinam,09/29/1832,1832-09-29,NULL,"14776, 14777",This crew list apparently was superseded by the list dated 10/05/1832
S5933E,Rebecca,Schooner,Martinique and a market,07/09/1832,1832-07-09,NULL,"14778, 14779, 14780, 14785, 14786",NULL
S5934E,Rebecca,Schooner,Martinique,03/17/1832,1832-03-17,NULL,"14781, 14782",NULL
S5935E,Rebecca,Schooner,Porto Rico,10/26/1832,1832-10-26,NULL,"14772, 14773, 14783, 14784",NULL
S5936E,Restitution,Ship,Mocha,05/28/1832,1832-05-28,NULL,"14787, 14788,14789, 14790",NULL
S5937E,Rising Sun,Schooner,Maranham and a market,11/14/1832,1832-11-14,NULL,"14791, 14792, 14804, 14805",NULL
S5938E,Rising Sun,Schooner,Maranham and a market,02/08/1832,1832-02-08,NULL,"14793, 14794, 14800, 14801, 14802, 14803",NULL
S5939E,Rising Sun,Schooner,Para and a market,06/21/1832,1832-06-21,NULL,"14795, 14796, 14797, 14798, 14799",NULL
S5940E,Romp,Brig,Guadaloupe,01/11/1832,1832-01-11,NULL,"14806, 14807",certified all returned 05/09/1833
S5941E,Romp,Brig,"Pt. Petre (Pointe a Pitre), Guadaloupe",09/14/1832,1832-09-14,NULL,"14808, 14809, 14812, 14813",NULL
S5942E,Romp,Brig,"Pt. Petre (Pointe a Pitre), Guadaloupe",06/05/1832,1832-06-05,NULL,"14810, 14811, 14814, 14815",NULL
S5943E,Romp,Brig,"Pt. Petre (Pointe a Pitre), Guadaloupe",01/11/1832,1832-01-11,NULL,"14816, 14817",NULL
S5944E,Rogue,Brig,Marseilles,09/06/1832,1832-09-06,NULL,"14818, 14819, 14820",certified at Marseilles (14820) 12/19/1832 - slightly different crew
S5945E,Roscoe,Brig,India,07/14/1832,1832-07-14,NULL,"14821, 14822, 14823, 14824",NULL
S5946E,River,Brig,Pernambuco and a market,05/15/1832,1832-05-15,NULL,"14825, 14826, 14827, 14828",NULL
S5947E,Salem,Brig,West Indies,07/26/1832,1832-07-26,NULL,"14829, 14830",NULL
S5948E,Salem,Brig,West Indies,02/29/1832,1832-02-29,NULL,"14831, 14832, 14833, 14834",certified in Norfolk
S5949E,Salem,Brig,West Indies,10/20/1832,1832-10-20,NULL,"14835, 14836",NULL
S5950E,Sally Ann,Brig,West Indies,03/17/1832,1832-03-17,NULL,"14837, 14838, 14839, 14840",NULL
S5951E,Sally Ann,Brig,West Indies,10/17/1832,1832-10-17,NULL,"14841, 14842, 14843, 14844","returned Edgartown, March 20,1833 ?(14843)"
S5952E,Sciot,Brig,Havana,04/26/1832,1832-04-26,NULL,"14845, 14846",NULL
S5953E,Sciot,Brig,Africa,02/29/1832,1832-02-29,NULL,"14847, 14848, 14849, 14850","Certified all returned except Stanley; Dec. 4, 1832"
S5954E,Selina & Jane,Schooner,Africa,04/13/1832,1832-04-13,NULL,"14851, 14852, 14856","Certified arrived in Goree June 2, 1832
returned Sept. 20?"
S5955E,Selina & Jane,Brig,Cape de Verde,10/27/1832,1832-10-27,NULL,"14853, 14854, 14857, 14858","Certified in Portugal
Certified returned Salem June 1, 1833"
S5956E,Selina & Jane,Schooner,NULL,?,0000-00-00,NULL,14855,isolated (and short) crew list- partial list for 4/13/1832 voyage?
S5957E,Shawmut,Brig,Maranham and a market,07/02/1832,1832-07-02,NULL,"14859, 14860, 14865, 14866, 14867",Certified in Brazil
S5958E,Shawmut,Brig,Maranham and a market in Brazil,03/30/1832,1832-03-30,NULL,"14861, 14862, 14868, 14869, 14870",NULL
S5959E,Shawmut,Brig,Maranham and a market in Brazil,11/28/1832,1832-11-28,NULL,"14863, 14864, 14871, 14872, 14873","""the cook left at Para and shipped another in his -?-"""
S5960E,Sheperdess,Ship,East Indies,09/25/1823,1823-09-25,NULL,"14874, 14875, 14876, 14877",NULL
S5961E,Solon,Brig,Havana,09/05/1832,1832-09-05,NULL,"14878, 14879, 14880, 14881",NULL
S5962E,Spy,Brig,East Indies,08/07/1832,1832-08-07,NULL,"14882, 14883, 14884, 14885, 14886",NULL
S5963E,Statesman,Brig,Brazin and Europe via Salem,09/19/1832,1832-09-19,NULL,"14887, 14888, 14889, 14890","of Boston
(hard to read)"
S5964E,Susan,Brig,Para and a market,01/24/1832,1832-01-24,NULL,"14891, 14892, 14893, 14894",NULL
S5965E,Susan,Brig,Cayenne,06/29/1832,1832-06-29,NULL,"14895, 14896, 14897, 14898",NULL
S5966E,Tattler,Brig,Cayenne,02/13/1832,1832-02-13,NULL,"14899, 14900, 14905, 14906, 14907, 14908",NULL
S5967E,Tattler,Brig,Cayenne,10/10/1832,1832-10-10,NULL,"149001,14902, 14903, 14904",NULL
S5968E,Thomas Perkins,Brig,Muscat,10/15/1832,1832-10-15,NULL,"14909, 14910, 14914, 14915",NULL
S5969E,Thomas Perkins,Brig,Pernambuco and a market,03/09/1832,1832-03-09,NULL,"14911, 14912, 14913",NULL
S5970E,Tigris,Brig,Cape Verde Islands and Africa,08/11/1832,1832-08-11,NULL,"14916, 14917, 14921, 14922","returned April 13, 1833?"
S5971E,Tigris,Brig,Cape Verde Islands,02/23/1832,1832-02-23,NULL,"14918, 14919, 14920","Certified in Portugal
Certified returned Salem, July 23 1832"
S5972E,Tybee,Ship,East Indies,04/27/1832,1832-04-27,NULL,"14923, 14924, 14925, 14926","Certified returned Salem,10/20/1833"
S5973E,Velocity,Brig,South America,07/19/1832,1832-07-19,NULL,"14927, 14928, 14929, 14930",NULL
S5974E,William,Brig,Pernambuco and a market in Islands,01/20/1832,1832-01-20,NULL,"14931, 14932, 14936, 14937","
note:""one more seaman to be added making 10 altogether""
Certified returned Salem 05/22/1832"
S5975E,William,Brig,St. Thomas,02/03/1832,1832-02-03,NULL,"14933, 14934",of Bath
S5976E,Abby M,Brig,St. Thomas & a market,4/19/1833,1833-04-19,NULL,"16005, 16006, 16007, 16008",NULL
S5977E,Abby,Brig,South America,10/28/1833,1833-10-28,NULL,"16009, 16010, 16011, 16012",NULL
S5978E,Active,Bark,East Indies,7/31/1833,1833-07-31,212,"16013, 16014, 16015, 16016",NULL
S5979E,Amethyst,Brig,Para & a market,11/18/1833,1833-11-18,110,"16017, 16018, 16019, 16931, 16032",NULL
S5980E,Amethyst,Brig,Maranham & a market,4/16/1833,1833-04-16,110,"16020, 16021, 16022, 16023, 16024, 16025",NULL
S5981E,Amethyst,Brig,Para & a market,7/23/`833,0000-00-00,110,"16026, 16027, 16028, 16029, 16030",NULL
S5982E,Angelina,Brig,"Ponce, Puerto Rico",2/25/1833,1833-02-25,168,"16033, 16034",Arrives in Edgartown 4/30/1833
S5983E,Angelina,Brig,Buenos Ayres,11/7/1833,1833-11-07,168,"16035, 16036, 16037, 16038",NULL
S5984E,Ann,Brig,Cuba,8/22/1833,1833-08-22,NULL,"16039, 16040",Registered in Portland
S5985E,Augustus,Ship,Havana,5/6/1833,1833-05-06,NULL,"16041, 16042, 16043, 16044",In Salem 10/12/1833
S5986E,Augustus,Ship,Pacific Ocean,12/7/1833,1833-12-07,246,"16045, 16046, 16047, 16048",In Salem 5/5/1837
S5987E,Baltimore,Brig,Maranham & a market in Brazil,7/15/1833,1833-07-15,NULL,"16049, 16050",NULL
S5988E,Baltimore,Brig,Para & a market in Brazil,2/12/1833,1833-02-12,NULL,"16051, 16052",NULL
S5989E,Baltimore,Brig,Maranham & a market,11/4/1833,1833-11-04,NULL,"16053, 16054, 16055, 16056, 16057",NULL
S5990E,Baron,Brig,"St John, New Brunswick",10/1/1833,1833-10-01,NULL,"16058, 16059",Ship registered in Beverly
S5991E,Black Warrior,Ship,East Indies,5/30/1833,1833-05-30,231,"16060, 16061",NULL
S5992E,Borneo,Ship,Ports in India,4/25/1833,1833-04-25,NULL,"16062, 16063, 16064","In Rotterdam 3/15/1834
In Salem 5/13/1834
crew lists eye color (listed in other here)"
S5993E,Brookline,Ship,East Indies,7/1/1833,1833-07-01,NULL,"16065, 16966, 16067, 16068","In New York March, 1836"
S5994E,Cambrian,Brig,South America,5/8/1833,1833-05-08,NULL,"16069, 16070, 16071, 16072",NULL
S5995E,Cavalier,Bark,Cronstadt,7/16/1833,1833-07-16,NULL,"16073, 16074, 16075, 16076","In Boston May, 1836
All crew returned"
S5996E,Charles Doggett,Brig,Pacific Ocean,1/9/1833,1833-01-09,NULL,"16077, 16078, 16079, 16080",Vessel attacked in Fiji
S5997E,Cipher,Brig,India,7/27/1833,1833-07-27,NULL,"16081, 16082, 16083, 16084",Returned 3/19/1836
S5998E,Clio,Brig,Rio Grand,5/22/1833,1833-05-22,NULL,"16085, 16086, 16087, 16088, 16089",NULL
S5999E,Colma,Schooner,St. Thomas & a market,5/10/1833,1833-05-10,NULL,"16090, 16091, 16092, 16093","In Salem 8/6/1833
All crew returned"
S6000E,Consul,Brig,Havana,9/3/1833,1833-09-03,NULL,"16094, 16095",NULL
S6001E,Crescent,Schooner,Fort Royal,2/22/1833,1833-02-22,NULL,"16096, 16097",NULL
S6002E,Dawn,Brig,Cape de Verdis,4/30/1833,1833-04-30,NULL,"16098, 16099, 16100, 16101",NULL
S6003E,Deborah,Brig,Cayenne,9/25/1833,1833-09-25,NULL,"16102, 16103, 16109, 16110","In Salem 3/11/1834
All crew returned"
S6004E,Deborah,Brig,"Ponce, Puerto Rico",5/3/1833,1833-05-03,NULL,"16104, 16105, 16106, 16107, 16108","In Ponce 7/13/1833
In Salem 8/4/1833"
S6005E,Derby,Bark,East Indies,12/14/1833,1833-12-14,NULL,"16111, 16112",NULL
S6006E,Dollar,Schooner,Africa,7/6/1833,1833-07-06,NULL,"16113, 16114, 16115, 16116",NULL
S6007E,Eclipse,Ship,India,11/2/1833,1833-11-02,NULL,"16117, 16118, 16119, 16120",NULL
S6008E,Edwin,Brig,Brazil & a market,10/1/1833,1833-10-01,NULL,"16121, 16122, 16123, 16124, 16125",NULL
S6009E,Eliza,Ship,Pacific Ocean,5/23/1833,1833-05-23,NULL,"16126, 16127, 16128, 16129, 16130",NULL
S6010E,Eliza,Bark,South America & India,5/24/1833,1833-05-24,NULL,"16131, 16132, 16133, 16134, 16135",NULL
S6011E,Emerald,Ship,Pacific Ocean,5/24/1833,1833-05-24,NULL,"16136, 16137, 16138, 16139",Illegible note writtin on 16137
S6012E,Enterprise,Schooner,Cape du Verds & a market,9/14/1833,1833-09-14,NULL,"16140, 16141, 16142, 16143",NULL
S6013E,Fair American,Brig,Maranham & a market,1/31/1833,1833-01-31,NULL,"16144, 16145, 16146",NULL
S6014E,Fair American,Brig,Maranham & a market,6/3/1833,1833-06-03,NULL,"16147, 16148, 16149, 16152, 16153",NULL
S6015E,Fair American,Brig,Maranham & a market,10/10/1833,1833-10-10,NULL,"16150, 16151",NULL
S6016E,Favorite,Brig,Africa,3/16/1833,1833-03-16,NULL,"16154, 16155",NULL
S6017E,Fides,Brig,Cuba,5/1/1833,1833-05-01,NULL,"16156, 16157",NULL
S6018E,Fides,Brig,Brazil,9/6/1833,1833-09-06,NULL,"16158, 16159, 16160, 16161, 16162",NULL
S6019E,Francis,Ship,Sumatra,11/7/1833,1833-11-07,NULL,"16163, 16164,, 16165, 16166",NULL
S6020E,Fredonia,Brig,Para,1/14/1833,1833-01-14,NULL,"16167, 16168, 16169, 16170, 16171",NULL
S6021E,Fredonia,Brig,Para,5/4/1833,1833-05-04,NULL,"16172, 16173, 16174, 16175, 16176",In Salem 8/15/1833
S6022E,Fredonia,Brig,Para,8/29/1833,1833-08-29,NULL,"16177, 16178, 16179, 16180",All returned
S6023E,Fredonia,Brig,West Indies,12/11/1833,1833-12-11,NULL,"16181, 16182, 16183, 16184",NULL
S6024E,Ganges,Brig,South America,12/27/1833,1833-12-27,NULL,"16185, 16186, 16189, 16190, 16191",In Salem 7/28/1834
S6025E,Ganges,Brig,Havana,7/13/1833,1833-07-13,NULL,"16187, 16188, 16192, 16193",NULL
S6026E,Gazelle,Brig,West Indies,5/25/1833,1833-05-25,NULL,"16194, 16195",NULL
S6027E,Gazelle,Brig,"St. Jago, Cuba",7/15/1833,1833-07-15,NULL,"16196, 16197",NULL
S6028E,General Brooks,Brig,"St. Jago, Cuba",4/11/1833,1833-04-11,NULL,"16198, 16199",NULL
S6029E,General Brooks,Brig,"St. Jago, Cuba",8/13/1833,1833-08-13,NULL,"16200, 16201, 16202, 16203",NULL
S6030E,General Warren,Brig,St. Salvador,2/5/1833,1833-02-05,NULL,"16204, 16205",NULL
S6031E,General Warren,Brig,West Indies,7/13/1833,1833-07-13,NULL,"16206, 16207",NULL
S6032E,Generous,Schooner,Paraiba,5/30/1833,1833-05-30,NULL,"16208, 16209, 16210, 16211","In Salem 8/1/1833
All crew returned"
S6033E,Generous,Schooner,Paraiba & a market,8/23/1833,1833-08-23,NULL,"16212, 16213, 16214, 16215, 16216",In Salem 11/30/1833
S6034E,Generous,Schooner,Paraiba & a market,11/13/1833,1833-11-13,NULL,"16217, 16218, 16219, 16220, 16221",In Salem 6/10/1834
S6035E,George,Ship,India,7/5/1833,1833-07-05,NULL,"16222, 16223, 16224, 16225, 16226",NULL
S6036E,Gleaner,Brig,Africa,9/5/1833,1833-09-05,NULL,"16227, 16228, 16229, 16230, 16231","3 men died on the voyage, and 3 replaced them"
S6037E,Governor Endicott,Brig,Batavia & a market,1/16/1833,1833-01-16,NULL,"16232, 16233, 16234",NULL
S6038E,Governor Winslow,Brig,Africa,6/29/1833,1833-06-29,NULL,"16235, 16236, 16237, 16238",NULL
S6039E,Homer,Brig,Sumatra,8/6/1833,1833-08-06,NULL,"16239, 16240",NULL
S6040E,Hope,Brig,South America,6/4/1833,1833-06-04,NULL,"16241, 16242, 16243, 16244, 16245",NULL
S6041E,Lady Sarah,Brig,East Indies,9/10/1833,1833-09-10,106,"16246, 16247, 16248, 16249",NULL
S6042E,Leander,Brig,Amsterdam,3/19/1833,1833-03-19,NULL,"16250, 16251","Registered in Duxbury
In Amsterdam 5/25/1833"
S6043E,Lotos,Ship,Sumatra,10/17/1833,1833-10-17,NULL,"16252, 16253, 16254, 16255",NULL
S6044E,Malaga,Brig,Cayenne,1/20/1833,1833-01-20,NULL,"16256, 16257",NULL
S6045E,Malaga,Brig,Cayenne,4/6/1833,1833-04-06,NULL,"16258, 16259",NULL
S6046E,Malaga,Brig,Cayenne,7/29/1833,1833-07-29,NULL,"16260, 16261",NULL
S6047E,Mercator,Brig,Parambuco & a market,7/6/1833,1833-07-06,NULL,"16262, 16263",NULL
S6048E,Mexican,Brig,South America,9/10/1833,1833-09-10,NULL,"16264, 16265, 16266, 16267",In Salem 6/11/1834
S6049E,Naples,Ship,Batavia,8/17/1833,1833-08-17,NULL,"16268, 16269, 16270, 16271","In Boston May, 1836"
S6050E,Neptune,Brig,Cowes & a market,10/1/1833,1833-10-01,NULL,"16272, 16273, 16274, 16275","In London, England 12/11/1833, stated the vessel was headed for Sumatra
In Salem 3/25/1835"
S6051E,Nereus,Brig,East Indies,7/10/1833,1833-07-10,NULL,"16276, 16277, 16280, 16281",In Salem 7/29/1834
S6052E,Numa,Brig,Maranham & a market,5/3/1833,1833-05-03,110,"16278, 16279",NULL
S6053E,Ocollo,Brig,Martinique,1/16/1833,1833-01-16,NULL,"16282, 16283",NULL
S6054E,Oscar,Schooner,"St. Johns, P.R.",2/6/1833,1833-02-06,NULL,"16284, 16285, 16286, 16287",In New York 7/26/1833
S6055E,Pactolus,Brig,West Indies,2/18/1833,1833-02-18,NULL,"16288, 16289, 12690, 16291",In New York 7/26/1833
S6056E,Pactolus,Brig,Cayenne,6/14/1833,1833-06-14,NULL,"16292, 16293, 16294, 16295, 16296",NULL
S6057E,Pactolus,Brig,Cayenne,12/12/1833,1833-12-12,NULL,"16297, 16298, 16299, 16300",NULL
S6058E,Patriot,Brig,Martinique & a market,4/3/1833,1833-04-03,NULL,"16301, 16302, 16303, 16304",NULL
S6059E,Patriot,Brig,St.Pierre & a market,9/10/1833,1833-09-10,NULL,"16305, 16306",NULL
S6060E,Pelican,Schooner,Goree & a market,11/18/1833,1833-11-18,NULL,"16307, 16308, 16309, 16310","In Goree 1/6/1834
In Gambia 2/1/1834"
S6061E,Plato,Schooner,West Indies,2/16/1833,1833-02-16,NULL,"16311, 16312, 16313, 16314","In Boston June, 1836"
S6062E,Quill,Brig,East India,9/26/1833,1833-09-26,NULL,"16315, 16316",NULL
S6063E,Reaper,Bark,Indian Ocean,9/7/1833,1833-09-07,NULL,"16317, 16318, 16319, 16320",Job C. Clark's name is crossed out as Master
S6064E,Rebecca,Brig,West Indies,4/12/1833,1833-04-12,NULL,"16321, 16322, 16323, 16324",NULL
S6065E,Rebecca,Schooner,St. Domingo & a market,10/15/1833,1833-10-15,NULL,"16325, 16326, 16335, 16336",NULL
S6066E,Rebecca,Brig,Cayenne & Surinam,9/5/1833,1833-09-05,NULL,"16327, 16328, 16329, 16330",NULL
S6067E,Rebecca,Schooner,St. Thomas & a market,4/15/1833,1833-04-15,NULL,"16331, 16332, 16333, 16334",NULL
S6068E,Richmond,Brig,Para & a market,2/21/1833,1833-02-21,NULL,"16337, 16338, 16339, 16340, 16341, 16342",NULL
S6069E,Romp,Brig,Guadaloupe,2/18/1833,1833-02-18,NULL,"16343, 16344",NULL
S6070E,Romp,Brig,Guadaloupe,6/8/1833,1833-06-08,NULL,"16345, 16346, 16347, 16348, 16349",In Salem 8/20/1833
S6071E,Romp,Brig,Guadaloupe,11/20/1833,1833-11-20,NULL,"16350, 16351, 16352, 16353, 16354",NULL
S6072E,Rogue,Brig,Marseille,5/27/1833,1833-05-27,NULL,"16355, 16356, 16357",In Salem 11/2/1833
S6073E,Rogue,Brig,Marseille,11/30/1833,1833-11-30,NULL,"16358, 16359",NULL
S6074E,Sally Ann,Brig,St. Thomas,4/3/1833,1833-04-03,NULL,"16360, 16361",NULL
S6075E,Sally Ann,Brig,St. Thomas,7/27/1833,1833-07-27,NULL,"16362, 16363, 16364, 16365, 16366",NULL
S6076E,Sally Ann,Brig,St. Thomas & a market,11/27/1833,1833-11-27,NULL,"16367, 16368, 16369, 16370","In St. Thomas 3/21/1834
""One run a way Negro found on board after leaving port""
Joseph Thomas came from NY Schooner Golden Swan, abandoned at sea. Passage was paid."
S6077E,Samuel Wright,Ship,Pacific Ocean,6/14/1833,1833-06-14,NULL,"16371, 16372, 16373, 16374",In Salem 8/30/1836
S6078E,Sapphire,Ship,Liverpool,2/15/1833,1833-02-15,NULL,"16375, 16376, 16377","In Liverpool 5/18/1833
In Manila 11/7/1833"
S6079E,Sciot,Brig,Africa,1/4/1833,1833-01-04,NULL,"16378, 16379, 16380, 16381",NULL
S6080E,Selina & Jane,Brig,Africa,10/21/1833,1833-10-21,NULL,"16382, 16382, 16383, 16384, 16385",In Salem 7/8/1834
S6081E,Shawmut,Brig,Gibraltar & a market,4/8/1833,1833-04-08,NULL,"16386, 16387, 16388, 16389, 16390",NULL
S6082E,Shawmut,Brig,Africa,8/25/1833,1833-08-25,NULL,"16391, 16392, 16393, 19394, 16395","Cleared custom House in Gambia 2/14/1834
""2 natives of Africa"" shipped to replace crew members
In Salem 6/18/1834"
S6083E,Shawmut,Brig,Madagascar & a market in East Indies,12/10/1833,1833-12-10,NULL,"16396, 16397, 16398, 16399",In Salem 3/15/1835
S6084E,Shepardess,Ship,East Indies,10/28/1833,1833-10-28,NULL,"16400, 16401, 16402, 16403",In Salem 2/7/1835
S6085E,Sumatra,Ship,India,4/3/1833,1833-04-03,NULL,"16404, 16405, 16406, 16407",NULL
S6086E,Susan,Brig,Cayenne,2/20/1833,1833-02-20,NULL,"16408, 16409",NULL
S6087E,Susan,Brig,Cayenne,7/31/1833,1833-07-31,NULL,"16410, 16411",NULL
S6088E,Tattler,Brig,West Indies,3/26/1833,1833-03-26,NULL,"16412, 16413, 16414, 16415, 16416",NULL
S6089E,Tattler,Brig,Martinico,6/19/1833,1833-06-19,NULL,"16417, 16418, 16419, 16420, 16421",NULL
S6090E,Tigris,Brig,Mocha,4/24/1833,1833-04-24,NULL,"16422, 16423, 16424, 16425, 16426",In Salem 7/7/1834
S6091E,Tybee,Ship,East Indies,12/20/1833,1833-12-20,NULL,"16427, 16428, 16429, 16430, 16431, 16432","One sheet declares a 12/12/departure, but doesn't leave. Changes to the crew are noted.
In Salem 1/19/1835, four of the crew returned"
S6092E,Ulysses,Brig,St. Jago,1/23/1833,1833-01-23,NULL,"16433, 16434",NULL
S6093E,Ulysses,Brig,South America & a market,7/1/1833,1833-07-01,NULL,"16435, 16436, 16437, 16438","In Montevideo 11/16/1833
In St. Salvador 1/10/1834
In St. Salvador 6/23/1834"
S6094E,Virginia,Brig,Maranham & a market,5/18/1833,1833-05-18,NULL,"16439, 16440, 16441, 16442, 16443, 16444",In Marnham 6/13/1833
S6095E,Virginia,Brig,Maranham & a market,10/23/1833,1833-10-23,NULL,"16445, 16446, 16447, 16448, 16449",NULL
S6096E,Waverly,Brig,India,4/18/1833,1833-04-18,NULL,"16450, 16451",NULL
S6097E,William,Brig,Rio Grande,12/20/1833,1833-12-20,NULL,"16452, 16453",NULL
S6098E,Active,Bark,South America,22/10/1834,0000-00-00,NULL,"16455, 16456, 16457, 16458, 16459",In Valaparaiso 4/11/1835
S6099E,America,Brig,Portland & West Indies,4/25/1834,1834-04-25,NULL,"16460, 16461",NULL
S6100E,Amethyst,Brig,Para & a market,11/13/1834,1834-11-13,110,"16462, 16463, 16464, 16465, 16476, 16477, 16478",In Salem 2/21/1835
S6101E,Amethyst,Brig,Para & a market,4/11/1834,1834-04-11,109,"16466, 16467, 16468, 16472, 16473",NULL
S6102E,Amethyst,Brig,Para & a market,7/8/1834,1834-07-08,109,"16469, 16470, 16471, 16474, 16475",In Salem 11/6/1834
S6103E,Angelique,Brig,Buenos Ayres,9/18/1834,1834-09-18,168,"16479, 16480",NULL
S6104E,Baltimore,Brig,Maranham & a market in Brazil,9/29/1834,1834-09-29,NULL,"16481, 16482",NULL
S6105E,Baltimore,Brig,Maranham & a market,2/12/1834,1834-02-12,NULL,"16483, 16484, 16485, 16489, 16490",In Salem 5/24/1834
S6106E,Baltimore,Brig,Maranham & a market,6/3/1834,1834-06-03,NULL,"16486, 16487, 16488, 16491, 16492",In Salem 9/20/1834
S6107E,Borneo,Ship,East Indies,6/2/1834,1834-06-02,NULL,"16493, 16494",NULL
S6108E,Cherokee,Brig,Trieste,5/19/1834,1834-05-19,NULL,"16495, 16496","Registered in Boston
In Triest 9/19/1834
In Boston 10/10/1834"
S6109E,Cipher,Brig,India,6/12/1834,1834-06-12,NULL,"16497, 16498, 16499, 16500, 16501",In Salem 10/2/1835
S6110E,Clio,Brig,Havana,3/27/1834,1834-03-27,NULL,"16502, 16503",NULL
S6111E,Colma,Schooner,"St. Johns, Puerto Rico",12/2/1834,1834-12-02,NULL,"16504, 16505",NULL
S6112E,Crescent,Schooner,West Indies,3/28/1834,1834-03-28,NULL,"16506, 16507",NULL
S6113E,Curlew,Brig,Maranham & a market,12/9/1834,1834-12-09,NULL,"16508, 16509, 16510, 16511, 16518, 16519",NULL
S6114E,Curlew,Brig,Maranham & a market,6/23/1834,1834-06-23,NULL,"16512, 16513, 16514, 16515, 16516, 16517",NULL
S6115E,Dawn,Brig,Antwerp,7/26/1834,1834-07-26,NULL,"16520, 16521, 16524, 16525",In Salem 11/4/1834
S6116E,Dawn,Brig,Montevideo,12/?/1834,0000-00-00,NULL,"16522, 16523",NULL
S6117E,Deborah,Brig,Cayenne,6/27/1834,1834-06-27,NULL,"16526, 16527, 16528, 16529, 16530",NULL
S6118E,Dollar,Schooner,Africa,9/8/1834,1834-09-08,NULL,"16531, 16532, 16533, 16534",In Salem 9/11/1835
S6119E,Eclipse,Ship,India,10/27/1834,1834-10-27,NULL,"16535, 16536, 16537, 16538",NULL
S6120E,Edwin,Brig,India,9/23/1834,1834-09-23,NULL,"16539, 16540, 16541, 16542","In New York June, 1837"
S6121E,Eliza,Bark,Antwerp & India,8/30/1834,1834-08-30,NULL,"16543, 16544, 16545","In Antwerp 11/26/1834
In St. Helena 10/13/1835"
S6122E,Eliza,Bark,Europe,4/15/1834,1834-04-15,NULL,"16546, 16547, 16548, 16549, 16550",NULL
S6123E,Enterprise,Schooner,St. Thomas,6/16/1834,1834-06-16,NULL,"16551, 16552, 16553, 16554",In Salem 9/6/1834
S6124E,Fair American,Brig,Para & a market,5/17/1834,1834-05-17,NULL,"16555, 16556, 16562, 16563, 16564",NULL
S6125E,Fair American,Brig,Para & a market,10/1/1834,1834-10-01,NULL,"16557, 16558, 16559, 16565, 16566","In Holmes Hole 1/16/1835
All returned"
S6126E,Fair American,Brig,Para & a market,2/23/1834,1834-02-23,132,"16560, 16561",NULL
S6127E,Fides,Brig,West Indies,7/31/1834,1834-07-31,NULL,"16568, 16569, 16570, 16571","In Salem 10/7/1834
The cook left at St. Jago"
S6128E,Fides,Brig,St. Jago de Cuba,11/15/1834,1834-11-15,NULL,"16567, 16572, 16573","In Boston 5/1836
Fold in paper through heights"
S6129E,Francis,Ship,Marseilles,9/11/1834,1834-09-11,NULL,"16574, 16575",NULL
S6130E,Fredonia,Brig,Maranham & a market,12/2/1834,1834-12-02,NULL,"16576, 16577, 16578, 16579, 16580","Owned by Gilbert G. Newall, Benjamin Greeman & Caleb Smith
Sold in Para
In Para 3/4/1835"
S6131E,Fredonia,Schooner,West Indies,11/28/1834,1834-11-28,NULL,"16581, 16582, 16583, 16584",In Wilmington 7/19/1837
S6132E,Ganges,Brig,Mozambique,8/29/1834,1834-08-29,NULL,"16585, 16586, 16587, 16588",NULL
S6133E,Gazelle,Brig,St. Pierre,9/26/1834,1834-09-26,NULL,"16589, 16590, 16591, 16596, 16597",NULL
S6134E,Gazelle,Brig,West Indies,2/8/1834,1834-02-08,NULL,"16592, 16593, 16601, 16602, 16603","In Salem 5/7/1834
All crew returned"
S6135E,Gazelle,Brig,West Indies,6/10/1834,1834-06-10,NULL,"16594, 16595, 16598, 16599, 16600",NULL
S6136E,Gem,Schooner,Africa,12/11/1834,1834-12-11,NULL,"16604, 16605, 16606, 16607",NULL
S6137E,Generous,Schooner,Paraibo,6/25/1834,1834-06-25,NULL,"16608, 16609, 16616, 16617, 16618",NULL
S6138E,Generous,Schooner,"Paraiba, Brazil & a market",12/9/1834,1834-12-09,NULL,"16610, 16611, 16612, 16613, 16614, 16615, 16616",In Salem 3/12/1835
S6139E,General Brooks,Brig,St. Jago de Cuba,7/1/1834,1834-07-01,NULL,"16619, 16620, 16621, 16625, 16626",In Salem 9/5/1834
S6140E,General Brooks,Brig,St. Jago de Cuba,1/20/1834,1834-01-20,NULL,"16622, 16623, 16624, 16629, 16630","In Salem 4/16/1834
One seaman signed on abroad"
S6141E,General Brooks,Brig,St. Jago de Cuba,9/27/1834,1834-09-27,NULL,"16627, 16628, 16631, 16632",NULL
S6142E,General Warren,Brig,West Indies,10/21/1834,1834-10-21,NULL,"16633, 16634, 16635, 16636",NULL
S6143E,Gentleman,Brig,Para & a market,11/5/1834,1834-11-05,NULL,"16637, 16638, 16639",In Holmes Hole 2/20/1835
S6144E,George,Schooner,Para,10/28/1834,1834-10-28,NULL,"16643, 16644",NULL
S6145E,George,Ship,Calcutta,7/28/1834,1834-07-28,NULL,"16645, 16646, 16647, 16648, 16649",In Salem 5/25/1835
S6146E,George,Schooner,Para,6/10/1834,1834-06-10,68,"16640, 16641, 16642",NULL
S6147E,George Washington,Schooner,Maranham & a market,8/14/1834,1834-08-14,NULL,"16552, 16553, 16554","Registered in Alexandria
Sailed from Alexandria
Vessel sold at port
Entire crew discharged 10/17/1834"
S6148E,Gleaner,Brig,Africa,9/24/1834,1834-09-24,NULL,"16655, 16656, 16657, 16658, 16659",In Salem 8/12/1835
S6149E,Governor Endicott,Brig,Rio de Janiero & a market,4/9/1835,1835-04-09,NULL,"16660, 16661",NULL
S6150E,Governor Winslow,Brig,Africa,5/9/1834,1834-05-09,NULL,"16662, 16663, 16664, 16665",NULL
S6151E,Henry,Bark,Sumatra,11/8/1834,1834-11-08,263,"16666, 16667, 16668, 16669","In Batavia 7/15/1835 and 8/12/1835
In St. Helena 10/14/1835
In Gloucester 12/9/1835
12/11/1835"
S6152E,Hope,Brig,Cape du Verd,5/12/1834,1834-05-12,NULL,"16670, 16671, 16677, 16678",9/5/1834 (Returned?)
S6153E,Hope,Brig,Rio Grande,9/26/1834,1834-09-26,NULL,"16672, 16673, 16674, 16675, 16676",5/28/1835 (Returned?)
S6154E,Izette,Ship,"South Atlantic & elsewhere, a whaling voyage",5/19/1834,1834-05-19,NULL,"16679, 16680, 16681, 16682",4/22/1835 (Returned?)
S6155E,Leander,Brig,Copenhage,3/12/1834,1834-03-12,NULL,"16683, 16684, 16690, 16691",NULL
S6156E,Leander,Brig,Marseilles,7/16/1834,1834-07-16,NULL,"16685, 16686, 16687, 16688, 16689",In Buenos Ayres
S6157E,Malaga,Brig,Cayenne,8/5/1834,1834-08-05,NULL,"16692, 16693",NULL
S6158E,Mayflower,Schooner,West Indies,1/10/1834,1834-01-10,NULL,"16696, 16697",NULL
S6159E,Mayflower,Schooner,Monte Video,5/3/1834,1834-05-03,NULL,"16694, 16695, 16698, 16699","In Boston May, 1836"
S6160E,Mercator,Brig,Maranham & a market,10/15/1834,1834-10-15,NULL,"16700, 16701",NULL
S6161E,Mexican,Brig,Havan,8/27/1834,1834-08-27,NULL,"16702, 16703, 16704, 16705",In Boston May 1836
S6162E,Nereus,Brig,Sumatra,9/12/1834,1834-09-12,183,"16706, 16707",NULL
S6163E,Oceanus,Brig,Antwerp,8/16/1834,1834-08-16,NULL,"16708, 16709, 16710, 16711",NULL
S6164E,Ocollo,Brig,Martinique,6/21/1834,1834-06-21,NULL,"16712, 16713, 16714, 16717, 16718",In Salem 9/9/1834
S6165E,Ocollo,Brig,Martinique,3/8/1834,1834-03-08,NULL,"16715, 16716, 17619, 16720",NULL
S6166E,Pactolus,Brig,Cayenne,5/24/1834,1834-05-24,NULL,"16721, 16722, 16723, 16724, 16725",NULL
S6167E,Pactolus,Brig,Cayenne,9/9/1834,1834-09-09,NULL,"16726, 16727",NULL
S6168E,Pallas,Bark,Pacific Ocean,9/1/1834,1834-09-01,NULL,"16728, 16729",NULL
S6169E,Palm,Brig,India,11/18/1834,1834-11-18,NULL,"16730, 16731, 16732, 16733",NULL
S6170E,Pamelia,Brig,St. Thomas,12/31/1834,1834-12-31,NULL,"16734, 16735, 16736, 16737, 16738",In Salem 3/29/1835
S6171E,Patriot,Brig,West Coast of Africa,7/15/1834,1834-07-15,NULL,"16739, 16740",NULL
S6172E,Pelican,Schooner,Goree,9/3/1834,1834-09-03,NULL,"16741, 16742, 16743, 16744",In Goree 10/11/1834
S6173E,Quill,Brig,Madagascar/East Indies,10/15/1834,1834-10-15,NULL,"16745, 16746, 16747, 16748",In St. Helena 5/21/1835
S6174E,Rebecca,Brig,South America,5/14/1834,1834-05-14,NULL,"16749, 16750, 16751, 16752",NULL
S6175E,Richmond,Brig,West Indies,1/10/1834,1834-01-10,NULL,"16753, 16754, 16763, 16764",NULL
S6176E,Richmond,Brig,Madagascar,11/4/1834,1834-11-04,NULL,"16755, 16756, 16757, 16758, 16759, 16760",In Marblehead 3/17/1836
S6177E,Rogue,Brig,Leghorn,NULL,0000-00-00,NULL,"16761, 16762",In Marseilles ?/18/1834
S6178E,Rome,Ship,West Coast Sumatra,10/21/1834,1834-10-21,NULL,"16765, 16766, 16767, 16768","In New York May, 1836"
S6179E,Romp,Brig,West Indies,4/11/1834,1834-04-11,NULL,"16769, 16770, 16771, 16772, 16773",NULL
S6180E,Romp,Brig,West Indies,10/24/1834,1834-10-24,NULL,"16774, 16775, 16776, 16777",In Gloucester 2/8/1835
S6181E,Rogue,Brig,Cayenne,11/29/1834,1834-11-29,NULL,"16778, 16779, 16780, 16781, 16782",In Salem 4/6/1835
S6182E,Sally Ann,Brig,St. Thomas & a market,5/15/1835,1835-05-15,NULL,"16783, 16784, 16785, 16786",In Salem 8/9/1834
S6183E,Sally Ann,Brig,St. Thomas,9/26/1834,1834-09-26,NULL,"16787, 16788",NULL
S6184E,Sciot,Brig,Africa,4/29/1834,1834-04-29,NULL,"16789, 16790, 16791, 16792",In Salem 12/12/1834
S6185E,Selina & Jane,Brig,Cape de Verd Islands,10/22/1834,1834-10-22,NULL,"16793, 16794, 16795, 16796",In Salem 5/8/1835
S6186E,Shawmut,Brig,West Coast of Africa,8/26/1834,1834-08-26,NULL,"16797, 16798, 16799, 16800, 16801",In Salem 7/15/1835
S6187E,Sumatra,Ship,India,7/15/1834,1834-07-15,NULL,"16802, 16803, 16804, 16805","In Boston May, 1836. Not all returned."
S6188E,Susan,Brig,Cayenne,9/15/1834,1834-09-15,NULL,"16806, 16807, 16808, 16809, 16810",In Holmes Hole 2/20/1835
S6189E,Susan,Brig,Cayenne,4/5/1834,1834-04-05,NULL,"16811, 16812",NULL
S6190E,Tattler,Brig,West Indies,1/15/1834,1834-01-15,NULL,"16813, 16814, 16815, 16816, 16817",In Salem 4/27/1834
S6191E,Thomas Perkins,Brig,East Indies,3/25/1835,1835-03-25,NULL,"16818, 16819, 16820, 16821",11/25 (Returned?)
S6192E,Tigris,Brig,Majunga,11/11/1834,1834-11-11,157,"16822, 16823, 16824, 16825",In Salem 8/17/1834
S6193E,Virginia,Brig,Para & a market,2/11/1834,1834-02-11,NULL,"16826, 16827, 16828, 16829, 16840, 16841",In Salem 5/10/1834
S6194E,Virginia,Brig,Para,5/24/1834,1834-05-24,NULL,"16830, 16831, 16832, 16838, 16839",9/18/1834 (Returned?)
S6195E,Virginia,Brig,Para & a market,9/23/1834,1834-09-23,NULL,"16833, 16834, 16835, 16836, 16837",1/13/1835 (Returned?)
S6196E,William & Henry,Ship,South America,10/29/1834,1834-10-29,NULL,"16842, 16843",NULL
S6197E,Abby M,Brig,Ponce,11/25/1835,1835-11-25,NULL,"16849, 16850",April 1836 (Returned?)
S6198E,America,Brig,NULL,5/2/1835,1835-05-02,NULL,"16851, 16852","Sailed from Mobile
In New York 6/1835
No crew list"
S6199E,Amethyst,Brig,Para & a market,2/26/1835,1835-02-26,NULL,"16853, 16854, 16855, 61856, 16857",5/20/1835 (Returned?)
S6200E,Amethyst,Brig,Para & a market,5/27/1835,1835-05-27,NULL,"16858, 16959, 16960, 16861, 16862, 16863","In Maranham 9/23/1835
In a port 10/5/1835
In Salem 11/2/1835"
S6201E,Amethyst,Brig,Maranham & a market,12/25/1835,1835-12-25,NULL,"16864, 16865, 16866, 16867, 16868","In Maranham 1/22/1836
In Salem 3/1/1836"
S6202E,Baltimore,Brig,Maranham & a market,2/2/1835,1835-02-02,NULL,"16869, 16870, 16871",4/28/1835 (Returned?)
S6203E,Aurora,Brig,"Pictou, Nova Scotia",4/4/1835,1835-04-04,NULL,"16872, 16873","Registered in Boston
6/4/1835 (Returned?)"
S6204E,Baltimore,Brig,Para & a market,8/13/1835,1835-08-13,NULL,"16874, 16875, 16879, 16880, 16881","In a port 9/28/1835
In Maranham 11/5/1835
In Salem 12/5/1835"
S6205E,Baltimore,Brig,Para & a market,5/1/1835,1835-05-01,NULL,"16876, 16877, 16878, 16887, 16888",In Salem 8/6/1835
S6206E,Baltimore,Brig,Maranham & a market,12/26/1834,1834-12-26,NULL,"16882, 16883, 16884, 16885, 16886","In Maranham 1/23/1836
In Maranham 3/14/1836
4/25/1836 (Returned?)"
S6207E,Belvidera,Brig,Africa,2/4/1835,1835-02-04,NULL,"16889, 16890",NULL
S6208E,Bengal,Ship,"South Atlantic, a whaling voyage",7/9/1835,1835-07-09,NULL,"16891, 16892, 16893, 16894",3/29/1837 (Returned?)
S6209E,Black Warrior,Ship,Cape of Good Hope,11/18/1835,1835-11-18,NULL,"16895, 16896",10/23/1836 (Returned?)
S6210E,Borneo,Ship,East Indies,10/22/1835,1835-10-22,NULL,"16897, 16898, 16899, 16900",In Boston 2/5/1839
S6211E,Cavalier,Bark,South Atlantic Ocean on a whaling voyage,10/21/1835,1835-10-21,NULL,"16901, 16902, 16903, 16904",In Salem 7/22/1837
S6212E,Charlestown,Schooner,Pernambuco & a market,9/26/1835,1835-09-26,NULL,"16905, 16906, 16907","Registered in Lynn
In Maranham 11/14/1835. Sold in Maranham and crew dismissed.
12/11/1835"
S6213E,Cipher,Brig,West Coast of Africa,11/14/1835,1835-11-14,NULL,"16908, 16909, 16910, 16911",In Salem 10/11/1836
S6214E,Crescent,Schooner,Porto Rico,1/23/1835,1835-01-23,128,"16912, 16913",NULL
S6215E,Curlew,Brig,Maranham & a market,4/21/1835,1835-04-21,NULL,"16914, 16915, 16916, 16917, 16927, 16928","In Maranham 6/16/1835
In Salem 7/13/1835"
S6216E,Curlew,Brig,Maranham & a market,7/24/1835,1835-07-24,NULL,"16918, 16919, 16920, 16921, 16922","In Maranham 8/31/1835
10/21/1835 (Returned?)"
S6217E,Curlew,Brig,Europe & South America,10/29/1835,1835-10-29,NULL,"16923, 16924, 16925, 16926, 16929, 16930",10/3/1836 (Returned?)
S6218E,Deborah,Brig,Cayenne,1/22/1835,1835-01-22,NULL,"16931, 16932",6/8/1835 (Returned?)
S6219E,Deborah,Brig,Cayenne,8/14/1835,1835-08-14,NULL,"16933, 16934, 16935, 16936",In Edgartown 12/31/1835
S6220E,Derby,Bark,South America,7/9/1835,1835-07-09,NULL,"16937, 16938, 16939, 16940",In Salem 4/27/1837
S6221E,Dollar,Schooner,"Pictou, Nova Scotia",10/31/1835,1835-10-31,NULL,"16941, 16942, 16943, 16944",12/22/1835 (Returned?)
S6222E,Eclipse,Ship,Calcutta,11/11/1835,1835-11-11,NULL,"16945, 16946, 16947, 16948, 16949",In Salem 10/29/1836
S6223E,Eliza,Ship,NULL,7/21/1835,1835-07-21,NULL,"16950, 16951","In New York November 1837
No crew list"
S6224E,Ellen,Schooner,"Pictou, Nova Scotia",8/3/1835,1835-08-03,NULL,"16952, 16953","Registered in Newburyport
9/1/1835 (returned?)"
S6225E,Ellen,Schooner,"Pictou, Nova Scotia",9/8/1831,1831-09-08,NULL,"16954, 16955",Registered in Lynn
S6226E,Emeline,Brig,the Brazils,9/2/1835,1835-09-02,NULL,"16956, 16957, 16958, 16959, 16960",NULL
S6227E,Enterprise,Schooner,Martinique,1/20/1835,1835-01-20,104,"16961, 16962",NULL
S6228E,Palm,Brig,Maranham and a market in S. America,05/30/1837,1837-05-30,NULL,"18006, 18007, 18014, 18015",NULL
S6229E,Palm,Brig,Para and a market,02/22/1837,1837-02-22,NULL,"18008, 18009, 18010, 18011","Certified Port of Salem, 5/18/1837"
S6230E,Palm,Brig,Para and a market,10/05/1837,1837-10-05,NULL,"18012, 18013, 18016, 18017","Certified in Para 01/09/1838, returned to Salem 09/14/1838"
S6231E,Pamelia,Brig,St. Jago,07/10/1837,1837-07-10,NULL,"18018, 18019, 18022, 18023","Certified in St. Jago 8/8/1837
2 seamen deserted their vessel and duties, unable to procure replacements."
S6232E,Pamelia,Brig,St. Jago de Cuba and a market,03/18/1837,1837-03-18,NULL,"18020, 18021",NULL
S6233E,Pamelia,Brig,St. Jago de Cuba and a market,10/10/1837,1837-10-10,NULL,"18024, 18025",NULL
S6234E,Patriot,Brig,Para and a market,07/07/1837,1837-07-07,NULL,"18026, 18027, 18034, 18035",Certified Para 09/09/1837 - 1 deserter
S6235E,Patriot,Brig,Maranham and a market,10/20/1837,1837-10-20,NULL,"18028, 18029, 18030, 18038, 18039","Certified Maranham 12/20/1837 - 2 deserters, Certified returned Salem 3/12/1837"
S6236E,Patriot,Brig,Para and a market,03/03/1837,1837-03-03,NULL,"18031, 18032, 18033, 18036, 18037","Certified in Brazil
returned June 22 1837"
S6237E,Plato,Schooner,West Indies,05/10/1837,1837-05-10,NULL,"18040, 18041","Returned Aug. 9, 1837?"
S6238E,Pilgrim,Schooner,Pictou,05/20/1837,1837-05-20,NULL,"18042, 18043, 18044, 18045",Certified Charlestown 7/20/1837
S6239E,Pocasset,Schooner,Bridgeport,09/25/1837,1837-09-25,NULL,"18046, 18047, 18052, 18053",NULL
S6240E,Pocasset,Schooner,Sydney,07/05/1837,1837-07-05,NULL,"18048, 18049, 18054, 18055",Returned Aug. 6.1837
S6241E,Pocasset,Schooner,Pictou,08/04/1837,1837-08-04,NULL,"18050, 18051, 18056, 18057",NULL
S6242E,Quill,Brig,Bridge,08/24/1837,1837-08-24,NULL,"18058, 18059, 18060, 18061",NULL
S6243E,Reaper,Bark,Atlantic and Indian Ocean on a whaling voyage,08/20/1837,1837-08-20,NULL,"18062, 18063, 18064, 18065",NULL
S6244E,Richmond,Brig,Mozambique and amarket,11/04/1837,1837-11-04,NULL,"18066, 18067, 18068, 18069",NULL
S6245E,Rolla,Brig,India,11/23/1837,1837-11-23,NULL,"18070, 18071, 18072, 18073",NULL
S6246E,Romp,Brig,Cayenne,10/21/1837,1837-10-21,NULL,"18074, 18075, 18076, 18077, 18078",returned 3/28/1838
S6247E,St. Paul,Ship,Liverpool,4/29/1837,1837-04-29,NULL,"18079, 18080, 18081","certified Liverpool, 5/16/1837; foreigners shipped in place of deserted seamen"
S6248E,Salem,Brig,Sydney,07/01/1837,1837-07-01,NULL,"18082, 18083, 18086, 18087, 18088","Certified Salem July 9, 1887"
S6249E,Salem,Brig,Sydney,08/12/1837,1837-08-12,NULL,"18084, 18085, 18089, 18090","Certified returned, Salem Sept. 13 1837
2 men boarded in Sydney"
S6250E,Salem,Brig,Surinam,10/19/1837,1837-10-19,NULL,"18091, 18092",NULL
S6251E,Sarah Ann,Brig,Surinam,11/20/1837,1837-11-20,NULL,"18093, 18094","of Gloucester
Certified Wilmington, N.C., 11/2/1837
Certified Paramaribo, 01/23/1838
Certified all returned, Salem 03/14/1838"
S6252E,Sarah Elizabeth,Brig,Africa,03/06/1837,1837-03-06,NULL,"18095, 18096",of New York
S6253E,Sarah Elizabeth,Brig,Africa,03/06/1837,1837-03-06,NULL,"18097, 18098",NULL
S6254E,Scion,Brig,Africa,06/14/1837,1837-06-14,NULL,"18099, 18100, 18101, 18102",NULL
S6255E,Sea Mew,Ship,Africa,09/20/1837,1837-09-20,NULL,"18103, 18104",NULL
S6256E,Shawmut,Brig,Maranham and a market,04/26/1837,1837-04-26,NULL,"18105, 18106, 18107","Certified Maranham, 07/08/1837
Returned 9/13/1837"
S6257E,Shawmut,Brig,Pernambuco and a market,05/11/1837,1837-05-11,NULL,"18108, 18109, 18110, 18111, 18112","3 deserted 7/6/1837, Pernambuco
3 discharged 8/4/1837, Pernambuco
returned 09/30/1837"
S6258E,Shepardess,Ship,Bombay,06/07/1837,1837-06-07,NULL,"18113, 18114, 18115, 18116",NULL
S6259E,Shepardess,Ship,Turks Island,07/26/1837,1837-07-26,274,"18117, 18118, 18119, 18120",NULL
S6260E,Shepardess,Bark,Cape de Verds Islands,10/17/1837,1837-10-17,274,"18121, 18122",NULL
S6261E,Sumatra,Ship,Sumatra,01/10/1837,1837-01-10,NULL,"18123, 18124, 18125, 18126",NULL
S6262E,Susan,Brig,Cayenne,12/02/1837,1837-12-02,NULL,"18127, 18128",NULL
S6263E,Susan,Brig,Sydney,07/15/1837,1837-07-15,NULL,"18129, 18130, 18131, 18132",NULL
S6264E,Susan,Brig,Cayenne,12/02/1837,1837-12-02,NULL,"18133, 18134",NULL
S6265E,Tiberias,Schooner,NULL,06/21/1837,1837-06-21,NULL,"18135, 18136",of Wiscasset
S6266E,Tybee,Ship,Sydney,12/01/1837,1837-12-01,298,"18137, 18138, 18139, 18140",NULL
S6267E,Volant,Brig,Amsterdam,04/22/1837,1837-04-22,NULL,"18141, 18142, 18143, 18144",of Plymouth
S6268E,Waverly,Brig,Antwerp,07/19/1837,1837-07-19,NULL,"18145, 18146, 18147, 18148",NULL
S6269E,William Penn,Brig,Maranham and a market in S. America,03/21/1837,1837-03-21,NULL,"18149, 18150, 18156, 18157, 18158, 18161, 18162, 18163","""8 men all told - no guns no passengers,"".. List of goods
Certified, Brazil
Certified all returned 07/18/1837, Salem (except William Webb??)"
S6270E,William Penn,Brig,Rio Janeiro and a market via Cape de Verds,09/14/1837,1837-09-14,NULL,"18151, 18152, 18153, 18154, 18155",Certified Brazil
S6271E,William & Henry,Ship,Surinam,09/09/1837,1837-09-09,NULL,"18159, 18160, 18164, 18165",Returned intact Jan 27 1838 ?
S6272E,Active,Bark,Africa,11/24/1838,1838-11-24,NULL,"18169, 18170",NULL
S6273E,Active,Bark,Rio de la Plata,02/06/1838,1838-02-06,NULL,"18167, 18168, 18171, 18172",NULL
S6274E,Amethyst,Brig,Maranham and a market,05/02/1838,1838-05-02,NULL,"18173, 18174",NULL
S6275E,America,Brig,Liverpool,04/10/1838,1838-04-10,NULL,"18175, 18176, 18177, 18178","Certified Liverpool, 3 deserted and 3 shipped in their place, June 7, 1838
Certified Return to Sale, 7/25/1838"
S6276E,Augustus,Ship,East Indies,11/20/1838,1838-11-20,242,"18179, 18180, 18181, 18182",Certified all returned Salem 11/20/1839
S6277E,Black Warror,Ship,East Indies,07/31/1838,1838-07-31,230,"18183, 18184, 18185, 18186","3 deserted, 3 shipped 04/13/1839, N.A.
Certified returned Salme 06/12/1839"
S6278E,Black Warror,Ship,Rotterdam,03/20/1838,1838-03-20,NULL,"18189, 18190",Certified in St. Ubes 05/23/1838
S6279E,Brazil,Bark,Havre,03/26/1838,1838-03-26,NULL,"18187, 18188, 18191, 18192, 18193","Certified in New Orleans
Certified in Lavre 06/16/1838
Certified Returned Salem 08/26/1838"
S6280E,Brazil,Bark,Sydney,09/07/1838,1838-09-07,NULL,"18194, 18195",NULL
S6281E,Brenda,Ship,East Indies,02/10/1838,1838-02-10,NULL,"18196, 18197","Certified at Dutch speaking port
Certified at Salem w/ one seaman deceased, 9/19/1838"
S6282E,Chalcedony,Brig,Monte Video and a market,12/16/1838,1838-12-16,NULL,"18198, 18199, 18200, 18201",NULL
S6283E,Chalcedony,Brig,Buenos Ayres,05/14/1838,1838-05-14,NULL,"18202, 18203, 18204, 18205",NULL
S6284E,Cherokee,Brig,Zanzibar,05/22/1838,1838-05-22,NULL,"18206, 18207, 18208, 18209",NULL
S6285E,Cipher,Brig,Cape de Verds and a market,08/23/1838,1838-08-23,NULL,"18210, 18211, 18216, 18217",NULL
S6286E,Cipher,Brig,Cape de Verds and a market,03/20/1838,1838-03-20,NULL,"18212, 18213, 18214, 18215",NULL
S6287E,Clio,Brig,St. Helena,01/27/1838,1838-01-27,NULL,"18218, 18219",NULL
S6288E,Criterion,Brig,Para and a market,11/20/1838,1838-11-20,NULL,"18220, 18221, 18225, 18226",Roll Salem 3/26/1839
S6289E,Criterion,Brig,Maranham and a market,05/28/1838,1838-05-28,NULL,"18222, 18223, 18224, 18227, 18228",NULL
S6290E,Criterion,Brig,Para and a market,01/12/1838,1838-01-12,NULL,"18229, 18230, 18231, 18232, 18233","Salem roll May 2, 1838"
S6291E,Cynthia,Bark,Batavia & Canton,10/26/1836,1836-10-26,NULL,"18234, 18235",NULL
S6292E,Cynthia,Bark,Liverpool,05/10/1838,1838-05-10,NULL,"18236, 18237, 18238",Certified Liverpool 06/30/2838
S6293E,Deborah,Brig,Cayenne,05/31/1838,1838-05-31,NULL,"18239, 18240, 18241, 18242",NULL
S6294E,Deborah,Brig,Cayenne,12/27/1838,1838-12-27,NULL,"18243, 18244, 18245",NULL
S6295E,Derby,Bark,NULL,08/00/1838,1838-08-00,NULL,18246,"District & port of New London:
note to Salem Customs: certified returned 07/12/1838 all crew (no list) except John J. Waters, John Raynes, John Havin(?) who went on board the Brig. Columbus on a farther whaling voyage by their own free will."
S6296E,Duxbury,Ship,Matanzas,03/27/1838,1838-03-27,NULL,"18247, 18248, 18249, 18250",Certified Boston 01/1839 return
S6297E,Echo,Schooner,Sydney,10/22/1838,1838-10-22,NULL,"18251, 18252","of Marblehead
Certified Marblehead 12/04/1838"
S6298E,Edwin,Schooner,Pictou,08/08/1838,1838-08-08,NULL,"18253, 18254",NULL
S6299E,Edwin,Schooner,Pictou,05/26/1838,1838-05-26,NULL,"18255, 18256",NULL
S6300E,Eliza,Bark,East Indies,12/08/1838,1838-12-08,NULL,"18257, 18258",Salem 09/18/1839
S6301E,Eliza,Bark,on a whaling voyage,11/21/1838,1838-11-21,NULL,"18259, 18260, 18263, 18264, 18265","Notes, Salem 05/09/1841 ""all returned but the following"" (*). However, many were not in the original crew."
S6302E,Eliza,Ship,Antwerp,05/25/1838,1838-05-25,NULL,"18261, 18262",NULL
S6303E,Elizabeth,Brig,Africa,11/13/1838,1838-11-13,NULL,"18266, 18267, 18270, 18271",NULL
S6304E,Elizabeth,Brig,Africa,02/02/1838,1838-02-02,NULL,"18272, 18273, 18274, 18275",NULL
S6305E,Elizabeth,Brig,Africa,06/06/1838,1838-06-06,NULL,"18268, 18269, 18276, 18277, 18278",NULL
S6306E,Emerald,Bark,the Indian Ocean Whaling,05/23/1835,1835-05-23,NULL,"18279, 18280, 18281, 18282, 18183, 18284","Whaling voyage
certified all returned 2/25/1840"
S6307E,Envoy,Schooner,NULL,06/16/1838,1838-06-16,NULL,"18285, 18286,","of Boston
certified returned Fall River 07/30/1838
(no crew list)"
S6308E,Envoy,Schooner,Pictou,06/16/1838,1838-06-16,NULL,"18287, 18288",of Boston
S6309E,Fair American,Brig,Para and a market,05/22/1838,1838-05-22,NULL,"18289, 18290",NULL
S6310E,Fair American,Brig,Maranham and a market,10/02/1838,1838-10-02,NULL,"18291, 19292",NULL
S6311E,Gambia,Brig,Cuba,11/30/1838,1838-11-30,NULL,"18293, 18294, 18295, 18296",NULL
S6312E,Gambia,Brig,St. Jago de Cuba,8/04/1838,1838-08-04,NULL,"18297, 18298, 18299, 18300",NULL
S6313E,Gazelle,Brig,Martinico,06/26/1838,1838-06-26,NULL,"18301, 18302, 18303, 18304",NULL
S6314E,Gazelle,Brig,Martinique,04/12/1838,1838-04-12,NULL,"18305, 18306, 18313, 18314",Salem 06/15/1838
S6315E,Gazelle,Brig,West Coast of Africa,09/05/1838,1838-09-05,NULL,"18307, 18308",NULL
S6316E,Gazelle,Brig,Martinico,10/13/1838,1838-10-13,NULL,"18309, 18310, 18315, 18316","Dec. 21, 1838"
S6317E,Gazelle,Brig,Africa,06/08/1838,1838-06-08,NULL,"18311, 18312","Virtually illegible
1 seaman descharged and an African shipped in his place"
S6318E,General Brooks,Brig,Jago de Cuba,06/22/1838,1838-06-22,NULL,"18317, 18318","Salem Roll, none missing, 08/24/1838"
S6319E,General Brooks,Brig,St Jago de Cuba,03/13/1838,1838-03-13,NULL,"18319, 18320, 18325, 18326",Salem May 21 1838
S6320E,General Brooks,Brig,St Jago de Cuba,06/22/1838,1838-06-22,NULL,"18321, 18322",NULL
S6321E,General Brooks,Brig,St Jago de Cuba,09/10/1838,1838-09-10,NULL,"18323, 18324",NULL
S6322E,Heber,Brig,Para,09/05/1838,1838-09-05,NULL,"18327, 18328, 18329, 18332, 18333",Certified Para 11/06/1838
S6323E,Heber,Brig,Para and a market,04/09/1838,1838-04-09,NULL,"18330, 18331, 18334, 18335, 18336",NULL
S6324E,Herald,Brig,Africa,08/14/1838,1838-08-14,NULL,"18337, 18338, 18339, 18340","Certified Salem, 01/31/1839"
S6325E,Hope,Brig,Africa,03/13/1838,1838-03-13,NULL,"18341, 18342","Note: ""Captain left on the Coast of Africa""
Salem Role - 07/25/1838

3 added crew"
S6326E,Hope,Brig,Cayenne,09/14/1838,1838-09-14,NULL,"18343, 18344",NULL
S6327E,Hope,Brig,Africa,03/30/1838,1838-03-30,NULL,"18345, 18346",NULL
S6328E,New Union,Schooner,St. Jago,09/08/1838,1838-09-08,NULL,"18347, 18348",Of Harwich
S6329E,Potos,Ship,East Indies,06/13/1838,1838-06-13,NULL,"18349, 18350","Of New York
Certified Salem 05/14/1839"
S6330E,Lubec,Brig,St. Thomas,05/21/1838,1838-05-21,NULL,"18351, 18352, 18353, 18354",NULL
S6331E,Mac,Schooner,St. Thomas,08/18/1838,1838-08-18,NULL,"18355, 18356, 18357, 18358, 18359, 18360","Certified all present New Orleans 04/30/1839
Salem Nov. 21 1838"
S6332E,Mac,Schooner,"Galveston, Texas",12/08/1838,1838-12-08,NULL,"18361, 18362",NULL
S6333E,Mac,Schooner,St. Jago de Cuba,05/23/1838,1838-05-23,80,"18363, 18364, 18365, 18366",Aug 1838
S6334E,Malaga,Brig,Cayenne,10/22/1838,1838-10-22,NULL,"18367, 18368, 18371, 18372","Certified returned 02/21/1839, 03/02/0839, 04/02/1839"
S6335E,Malaga,Brig,St. Jago de Cuba,04/24/1838,1838-04-24,NULL,"18369, 18370",NULL
S6336E,Malaga,Brig,West Indies,01/20/1838,1838-01-20,NULL,"18373, 18374",NULL
S6337E,Mary,Brig,Bridgeport,07/11/1838,1838-07-11,NULL,"18375, 18376, 18377, 18378","of Newburyport
Certified Salem Aug. 7 1838"
S6338E,Mary Dacre,Brig,NULL,08/29/1838,1838-08-29,NULL,"18379, 18380",Isolated return record (no crew list)
S6339E,Mexican,Brig,Matanzas,04/24/1838,1838-04-24,NULL,"18383, 18384 ,18385, 18386","October 17, 1838"
S6340E,Mary,Brig,Bridgeport,08/16/1838,1838-08-16,NULL,"18381, 18382",NULL
S6341E,Naumkeag,Schooner,Pictou,05/15/1838,1838-05-15,NULL,"18389, 18390, 18391, 18392",NULL
S6342E,Neptune,Bark,Bahia and a market,01/02/1838,1838-01-02,NULL,"18393, 18394",NULL
S6343E,Nereus,Brig,Rotterdam,10/08/1838,1838-10-08,183,"18395, 18396, 18397, 18398",NULL
S6344E,Nereus,Brig,Antwerp,04/17/1838,1838-04-17,NULL,"18399, 18400, 18401","
Of new Bedford
Certified in St. Urbis (deserters)- shipped replacements
Crew (return) List September 1, 1838"
S6345E,New Union,Schooner,St. Jago de Cuba,09/18/1838,1838-09-18,NULL,"18402, 18403","Salem Dec.1, 1838"
S6346E,Old Colony,Brig,Antwerp,01/25/1838,1838-01-25,NULL,"18404, 18405, 18406, 18407, 18408","Of Boston
one seaman left on shore due to illness, 2 boys shipped in his place (no proof)."
S6347E,Olinda,Brig,Pernambuco and a market,09/18/1838,1838-09-18,NULL,"18411, 18412, 18413","Feb.25, 1839 (return?)"
S6348E,Olinda,Brig,Sydney M.S.,07/24/1838,1838-07-24,NULL,"18414, 18415","of New York
Aug. 19 1838 (return?)"
S6349E,Oregon,Brig,Africa,04/18/1838,1838-04-18,NULL,"18416, 18417",NULL
S6350E,Pactolus,Brig,Cayenne,11/22/1838,1838-11-22,NULL,"18418, 18419, 18422, 18423, 18424, 18425",NULL
S6351E,Pactolus,Brig,Cayenne,06/05/1838,1838-06-05,NULL,"18420, 18421, 18426, 18427",NULL
S6352E,Palm,Brig,Para and a market,06/29/1838,1838-06-29,NULL,"18428, 18429, 18430, 18431","Certified Roll, Palm Oct. 13, 1838"
S6353E,Palm,Brig,Para and a market in S. America,10/27/1838,1838-10-27,NULL,"18432, 18433, 18436, 18437","Certified all returned Salem except Tuck, 2/18/1839"
S6354E,Palm,Brig,Maranham and a market in Brazil,03/20/1838,1838-03-20,NULL,"18434, 18435, 18438, 18439, 18440","Certified Maranham
Certified all returned Salem 06/22/1838"
S6355E,Pamelia,Brig,St. Jago de Cuba and a market,10/19/1838,1838-10-19,NULL,"18441, 18442, 18443, 18444, 18445, 18446",Certified Edgartown return 1/28/1839 all returned except Somes
S6356E,Pamelia,Brig,St. Jago de Cuba,01/18/1838,1838-01-18,NULL,"18447, 18448","
Crew list Salem April 21, 1838"
S6357E,Patriot,Brig,Para and a market,04/09/1838,1838-04-09,NULL,"18449, 18450, 18451, 18454, 18455","Certified Salem July 3, 1838"
S6358E,Patriot,Brig,Para and a market,07/11/1838,1838-07-11,NULL,"18452, 18453, 18462, 18463",NULL
S6359E,Patriot,Brig,Maranham and a market,11/21/1838,1838-11-21,NULL,"18456, 18457, 18458, 18459, 18460",Certified Maranham
S6360E,Pocasset,Schooner,Sydney,07/14/1838,1838-07-14,NULL,"18464, 18465",NULL
S6361E,Patriot,Brig,Maranham and a market,07/11/1839,1839-07-11,NULL,"18461, 18462, 18463",NULL
S6362E,Pocasset,Schooner,NYC,08/20/1838,1838-08-20,NULL,"18466, 18467",Certification letter from New York Customs to Salem - no crew list or voyage info.
S6363E,Pocasset,Schooner,Bridgeport,06/14/1838,1838-06-14,NULL,"18468, 18469, 18472, 18473",NULL
S6364E,Pocasset,Schooner,Pictou,08/26/1838,1838-08-26,NULL,"18470, 18471",NULL
S6365E,Pocasset,Schooner,Pictou,07/14/1838,1838-07-14,NULL,"18474, 18475",NULL
S6366E,Pocasset,Schooner,Pictou,11/15/1838,1838-11-15,NULL,"18476, 18477",NULL
S6367E,Quill,Brig,Africa,06/20/1838,1838-06-20,NULL,"18478, 18479, 18780, 18781","March 19, 1839 (return?)"
S6368E,Rolla,Brig,India,12/25/1838,1838-12-25,NULL,"18482, 18483",NULL
S6369E,Ralley,Brig,NULL,NULL,0000-00-00,NULL,18484,"Single page of certification delivery from Portland & Falmouth, ME to Salem"
S6370E,Romp,Brig,Cayenne,10/24/1838,1838-10-24,NULL,"18485, 18486, 18487, 18488","Certified returned Edgartown, Feb. 19, 1839"
S6371E,Roxana,Brig,Para and a market,12/31/1838,1838-12-31,NULL,"18489, 18490, 18491, 18492","Salem Roll April 20, 1839 certified all returned but 2"
S6372E,St. George,Schooner,Bridgeport,08/16/1838,1838-08-16,NULL,"18493, 18494","of St. George
Sept. 15, 1838"
S6373E,St. Paul,Ship,Manilla,06/02/1838,1838-06-02,NULL,"18495, 18496, 18497, 18498","Certified Salem April 8, 1839"
S6374E,Salem,Brig,Surinam,06/16/1838,1838-06-16,NULL,"18499, 18500, 18501, 18502","Certified Paramaibo Oct. 19,1938
Certified Wilmington NC Jan 16 1838 (?)
Certified Salem Dec. 7, 1838
Certified Salem March 1838 (prior voyage? image:18499, 18500)"
S6375E,Scion,Brig,Africa,04/13/1838,1838-04-13,NULL,"18503, 18504",NULL
S6376E,Sea Mew,Ship,Africa,09/20/ 1838,1838-09-20,NULL,"18505, 18506",NULL
S6377E,Splendid,Brig,Pictou,06/20/1838,1838-06-20,NULL,"18507, 18508",of Mt. Desert
S6378E,Star,Bark,Zanzibar,07/19/1838,1838-07-19,NULL,"18509, 18510, 18511, 18512","2 died, 1 deserted, 1 discharged
Certified Salem Nov.26, 1839"
S6379E,Statesman,Bark,Atlantic Indian & Pacific Oceans on a whaling voya,04/25/1838,1838-04-25,NULL,"18513, 18514",NULL
S6380E,Sumatra,Ship,Sumatra,08/24/1838,1838-08-24,NULL,"18515, 18516",NULL
S6381E,Susan,Brig,Para & Cayenne,07/21/1838,1838-07-21,NULL,"18517, 18518, 18519, 18520, 18521","jan. 30, 1839"
S6382E,Thomas Perkins,Brig,Africa,07/07/1838,1838-07-07,NULL,"18522, 18523, 18524, 18525","Dec. 15, 1838 (return?)"
S6383E,Tigris,Brig,Africa,08/24/1838,1838-08-24,NULL,"18526, 18527, 18528, 18529","Certified Salem return 09/05/1839, 2 discharged, 1 dead"
S6384E,Two Sisters,Brig,Havana,02/22/1838,1838-02-22,NULL,"18530, 18531, 18532, 18533",NULL
S6385E,Van Buren,Schooner,Pictou,07/14/1838,1838-07-14,NULL,"18534, 18535",of Manchester
S6386E,William D. Henry,Ship,East Indies,07/02/1838,1838-07-02,NULL,"18536, 18537",NULL
S6387E,Mount Wollaston,Ship,"Atlantic, Indian & Pacific Oceans",06/01/1838,1838-06-01,NULL,"18538, 18539, 18540, 18541","""on a whaling voyage""
4 discharged, 1 dead
Certified Salem April 19, 1840"
S6388E,Active,Bark,Africa,09/04/1839,1839-09-04,NULL,"18543, 18544, 18545, 18546","Certified Salem all present except deceased Acres
Aug. 13, 1840
4 passengers"
S6389E,America,Brig,Pictou,08/09/1839,1839-08-09,NULL,"18547, 18548",NULL
S6390E,Ann,Schooner,Fishing Voyage,05/01/1838,1838-05-01,NULL,"18549, 18550, 18551","
""The schooner Ann was employed in the fishing business four months and twenty seven days and there was caught and landed eighteen thousand and fifty four Cod & Hake fish.""
Sailed 05/01/1838 returned 06/21/1838
"" 06/21/1838 "" 08/04/1838
"" 08/07/1838 "" 09/27/1838
total 4 months 21 days and 6 laydays"
S6391E,Augustus,Bark,East Indies,11/30/1839,1839-11-30,NULL,"18552, 18553, 18554, 18555","Certified Salem all returned except 2, 10/01/1840"
S6392E,Black Warrior,Ship,Pernambuco,04/13/1839,1839-04-13,NULL,18556,"
Isolated record, no papers from Salem.
Certified Pernambuco at U.S. consulate, all twelve crew."
S6393E,Brazil,Bark,?,03/20/1839,1839-03-20,NULL,"18557, 18558, 18559","impossible to read
Certified London
Oct.20 1839 (return?)"
S6394E,Brenda,Ship,Bombay,12/04/1839,1839-12-04,NULL,"18560, 18561","April 24, 1841 (return?)"
S6395E,Brookline,Ship,Manila,08/25/1839,1839-08-25,NULL,"18562, 18563, 18564, 18565","Certified Salem July 1, 1840"
S6396E,Cadmus,Brig,"Pictou, NS ?",07/16/1839,1839-07-16,NULL,"18566, 18567","of Marblehead
Certified Marblehead Aug. 13, 1839"
S6397E,Cadmus,Brig,NULL,06/10/1839,1839-06-10,NULL,"18568, 18569",of Marblehead
S6398E,Cassius,Schooner,Havana,10/03/1839,1839-10-03,NULL,"18570, 18571",of Gloucester
S6399E,Carthage,Ship,East Indies,05/27./1839,0000-00-00,NULL,"18572, 18573, 18574, 18575","4 absconded/ran, 1 died
Certified returned Salem May 9, 1840"
S6400E,Cavalier,Bark,Madagascar/Zanzibar,05/11/1839,1839-05-11,NULL,"18576, 18577, 18578, 18579",certified Salem with note
S6401E,Chalcedony,Bark,Montevideo and a market,06/04/1839,1839-06-04,NULL,"18580, 18581",NULL
S6402E,Champion,Schooner,Pictou,09/09/1839,1839-09-09,NULL,"18582, 18583, 18584, 18585","
Oct. 1869 (return?)"
S6403E,Cherokee,Brig,Zanzibar,04/13/1839,1839-04-13,NULL,"18586, 18587, 18588, 18589","certified all returned
Feb.1840 (return?)"
S6404E,Cipher,Brig,Cape de Verds,04/20/1839,1839-04-20,NULL,"18590, 18591","Certifield all returned Salem Aug. 3, 1839"
S6405E,Cipher,Brig,Cape de Verds Islands,09/18/1839,1839-09-18,NULL,"18592, 18593, 18594, 18595, 18596","Certified NY, April 1, 1840"
S6406E,Cipher,Brig,Cape de Verds Islands,04/20/1839,1839-04-20,146,"18597, 18598","April 20, 1839 (return?)"
S6407E,Criterion,Brig,Para & a market in S. America,04/10/1839,1839-04-10,NULL,"18599, 18600, 18603, 18604","Certified Retuned Salem July 12, 1839"
S6408E,Criterion,Brig,Para & a market in S. America,08/15/1839,1839-08-15,NULL,"18601, 18602",NULL
S6409E,Deborah,Brig,Cayenne,07/24/1839,1839-07-24,NULL,"18605, 18606",NULL
S6410E,Eagle,Brig,Para,04/11/1839,1839-04-11,NULL,"18607, 18608",NULL
S6411E,Eagle,Brig,Para & a market,12/26/1839,1839-12-26,NULL,"18609, 18610, 18613, 18614, 18615","Certified all returned Salem, April15, 1840"
S6412E,Eagle,Brig,Para & a market,08/14/1839,1839-08-14,NULL,"18611, 18612, 18616, 18617",NULL
S6413E,Eclipse,Ship,Sumatra,03/04/1839,1839-03-04,NULL,"18618, 18619, 18620, 18621","Certified all returned Edgartown Feb.12, 1840 except R.S. Morgan, deserted.
[While on the coast of Sumatra, in 1837, the Eclipse was boarded by Malays who robbed her of specie and opium and murdered the captain and one of the crew. See Historical sketch of Salem, P.156. Sailed from Sumatra in July, 1849 and never heard from.]-Salem Ship Registers 1789-1900"
S6414E,Eliza,Bark,Sumatra,10/12/1839,1839-10-12,NULL,"18622, 18623, 18624, 18625, 18626",includes Boston certification for prior ('38) voyage under C.H. Allen
S6415E,Elizabeth,Brig,River La Plata,08/06/1839,1839-08-06,NULL,"18627, 18628, 18629",NULL
S6416E,Emerald,Brig,Pictou,08/06/1839,1839-08-06,NULL,"18630, 18631",NULL
S6417E,Fair American,Brig,Maranham & a market,02/14/1839,1839-02-14,NULL,"18632, 18633, 18634, 18635, 18636",NULL
S6418E,Fair American,Brig,Maranham & a market,06/27/1839,1839-06-27,NULL,"18637, 18638, 18639, 18640, 18641","Certified Salem, all returned Oct. 29, 1839"
S6419E,Fair American,Brig,Maranham & a market,11/09/1839,1839-11-09,NULL,"18642, 18643, 18644, 18645, 18646","Certified Salem, all returned March 18, 1840"
S6420E,Fame,Brig,Havre/Cadiz,09/12/1839,1839-09-12,NULL,"18647, 18648, 18649, 18650",of Boston
S6421E,Frederick Pearl,Brig,Pictou,05/25/1839[?],1839-05-25,NULL,"18651, 18652",of Thomaston
S6422E,Gambia,Brig,St. Jago de Cuba,05/21839,0000-00-00,NULL,"18653, 18654, 18659, 18660",NULL
S6423E,Gambia,Brig,Cayenne,08/17/1839,1839-08-17,NULL,"18655, 18656",NULL
S6424E,Gambia,Brig,St. Jago de Cuba,12/24/1839,1839-12-24,NULL,"18657, 18658, 18661, 18662",NULL
S6425E,Ganges,Brig,Africa,10/05/1839,1839-10-05,NULL,"18663, 18664, 18665, 18666",NULL
S6426E,Gazelle,Brig,Africa,08/21/1839,1839-08-21,NULL,"18667, 18668","Certified returned July 12, 1840 except 3"
S6427E,Gazelle,Brig,Martinico,06/21/1839,1839-06-21,NULL,"18669, 18670, 18679, 18680","Certified return, Salem Aug. 9, 1839"
S6428E,Gazelle,Brig,St. Puns Martini,03/30/1839,1839-03-30,NULL,"18671, 18672, 18681, 18682","Certified Salem, June 16, 1839"
S6429E,Gazelle,Brig,Cayenne,08/21/1839,1839-08-21,NULL,"18673, 18674, 18675, 18676",NULL
S6430E,Gazelle,Brig,West Coast of Africa,08/21/1839,1839-08-21,NULL,"18677, 18678",NULL
S6431E,General Brooks,Brig,St. Jago de Cuba,01/19/1839,1839-01-19,NULL,"18683, 18684, 18691, 18692",NULL
S6432E,General Brooks,Brig,St. Jago de Cuba,04/20/1839,1839-04-20,NULL,"18685, 18686, 18689, 18690",NULL
S6433E,General Brooks,Brig,Cuba,08/17/1839,1839-08-17,NULL,"18687, 18688",NULL
S6434E,Gleaner,Brig,"Sidney, N.L.",08/12/1839,1839-08-12,NULL,"18693, 18694","of Mt. Desert
Cerrtified all returned, Salem, Sept. 11, 1839"
S6435E,Heber,Brig,Para,09/02/1839,1839-09-02,NULL,"18695, 18696, 18697, 18698",NULL
S6436E,Heber,Brig,Para,04/09/1839,1839-04-09,NULL,"18699, 18700, 18701",NULL
S6437E,Henry,Bark,Cape de Verds,01/18/1839,1839-01-18,NULL,"18702, 18703, 18704, 18705",NULL
S6438E,Herald,Brig,Africa,02/28/1839,1839-02-28,NULL,"18706, 18707, 18712, 18713","Certified returned Salem Aug.12, 1839"
S6439E,Herald,Brig,Africa,10/10/1839,1839-10-10,NULL,"18708, 18709, 18710, 18711","Certified April 21, 1840"
S6440E,Hope,Brig,West Coast of Africa,11/14/1839,1839-11-14,NULL,"18714, 18715, 18716, 18717","Certified all crew on board, Salem June 17, 1840"
S6441E,Hope,Brig,West Indies,03/14/1839,1839-03-14,NULL,"18718, 18719, 18720, 18721","Certified June 17, 1839"
S6442E,Izette,Ship,"Atlantic, Indian & Pacific Oceans - whaling voyage",10/14/1837,1837-10-14,NULL,"18722, 18723","Certified Salem Dec.21, 1839 all returned but 10
(return of whaling voyage)"
S6443E,King Phillip,Bark,Montevideo & a market,09/28/1839,1839-09-28,NULL,"18724, 18725",NULL
S6444E,Leonidas,Ship,The East Indies,08/07/1839,1839-08-07,NULL,"18726, 18727, 18730, 18731",NULL
S6445E,Leander,Brig,Rio Janero and a market,08/22/1839,1839-08-22,NULL,"18728, 18729",NULL
S6446E,Lotos,Ship,East Indies,06/21/1839,1839-06-21,NULL,"18732, 18733, 18734, 18735",certified Salem Sept.1840
S6447E,Mark,Brig,Cape de Vers & a market,02/16/1839,1839-02-16,NULL,"18736, 18737, 18738, 18739",NULL
S6448E,Malaga,Brig,West Coast of Africa,03/29/1839,1839-03-29,NULL,"18740, 18741, 18748, 18749",certified July 13
S6449E,Malaga,Brig,West Coast of Africa,12/17/1839,1839-12-17,151,"18742, 18743",certified Salem
S6450E,Malaga,Brig,West Coast of Africa,08/01/1839,1839-08-01,NULL,"18744, 18745, 18746, 18747","Certified all returned Salem Nov.19, 1839"
S6451E,Malay,Bark,Indian Ocean on a Whaling Voyage,07/03/1839,1839-07-03,NULL,"18750, 18751, 18752, 18753","Certified all returned Edgartown Jan 19, 1842 except 4"
S6452E,Malaga,Brig,NULL,12/18/1839,1839-12-18,NULL,"18754, 18755","Certified all returned New York March 1840
No crew list"
S6453E,Merchant,Ship,Liverpool,07/20/1839,1839-07-20,NULL,"18756, 18757, 18758, 18759, 18760","of New York
Certified in Charleston
(image 18757 ""Hospital Bill"" - blank)
Certification in Liverpool shows time on board & 3 deserters and 5 additional crew shipped"
S6454E,Mermaid,Brig,Brazil & a market,06/25/1839,1839-06-25,NULL,"18761, 18762, 18763, 18764, 18765",NULL
S6455E,Mexican,Brig,Leghorn,10/01/1839,1839-10-01,NULL,"18766, 18767, 18768, 18769","Certified all returned Salem, March 2, 1840"
S6456E,Mexican,Brig,Matanzas in the Island of Cuba,03/23/1839,1839-03-23,NULL,"18770, 18771",NULL
S6457E,Naumkeag,Schooner,Pictou,08/10/1839,1839-08-10,NULL,"18772, 18773, 18774, 18775",Aug. 10 1839 (return?)
S6458E,Nereus,Brig,East Indies,04/09/1839,1839-04-09,NULL,"18776, 18777","Certified Salem, Feb. 18, 1840"
S6459E,Olinda,Brig,"St. Johns, Newfoundland",03/29/1839,1839-03-29,NULL,"18778, 18779",NULL
S6460E,Olinda,Brig,Cape de Verds & Montevideo,08/12/1839,1839-08-12,NULL,"18780, 18781, 18782, 18783","Certified Montevideo, 1 deserted and a replacement shipped"
S6461E,Olinda,Brig,St. Thomas,03/29/1839,1839-03-29,NULL,"18784, 18785","July 20, 1839 (return?)"
S6462E,Oregon,Brig,Africa,10/18/1839,1839-10-18,NULL,"18786, 18787, 18788, 18789","Certified Goree Nov. 6, 1839 with 10 crew and 1 passenger
Certified all returned Salem, March 2, 1840"
S6463E,Oregon,Brig,Africa,04/18/1839,1839-04-18,NULL,"18790, 18791","Certified arrived Goree May 29, 1839 and departed for St. Marie on May 30 with 10 crew and no passengers
Certified all returned Salem except 1, and 2 passengers September 5, 1839"
S6464E,Pactolus,Brig,Cayenne,19/27/1839,0000-00-00,NULL,"18792, 18793",NULL
S6465E,Pactolus,Brig,Cayenne,04/12/1839,1839-04-12,NULL,"18794, 18795, 18796, 18797","Certified Nieuw Amsterdam May 26, 1839
Certified Salem Aug. 24, 1839"
S6466E,Palestine,Bark,Indian Ocean Whaling,05/17/1839,1839-05-17,NULL,"18798, 18799",NULL
S6467E,Palm,Brig,Parta and a market in S. America,06/26/0869,0869-06-26,NULL,"18800, 18801",NULL
S6468E,Palm,Brig,Para & a market,06/25/1839,1839-06-25,NULL,"18802, 18803, 18804","Certified Brazil
Certified Salem Oct.2, 1839 (return?)"
S6469E,Palm,Brig,Para & a market,02/27/1839,1839-02-27,NULL,"18805, 18806, 18807, 18808","Certified Salem June 11, 1869"
S6470E,Pamelia,Brig,West Indies/Cuba,09/30/1839,1839-09-30,NULL,"18809, 18810",NULL
S6471E,Pamelia,Brig,St. Jago de Cuba & a market in the W. Indies,03/01/1839,1839-03-01,NULL,"18811, 18812",NULL
S6472E,Pamelia,Brig,St. Jago de Cuba & a market in the W. Indies,06/17/1839,1839-06-17,NULL,"18813, 18814, 18815, 18816",Certified Salem Sept.
S6473E,Patriot,Brig,Maranhan & a market,05/18/1839,1839-05-18,NULL,"18817, 18818, 18821, 18822, 18823","Certified Brazil
Certified Salem July 31, 1839 (return?)"
S6474E,Patriot,Brig,Montevideo & a market,08/10/1839,1839-08-10,NULL,"18819, 18820",NULL
S6475E,Quill,Brig,Africa,04/23/1839,1839-04-23,NULL,"18824, 18825, 18826, 18827","Certified Africa July 3, 1839
Certified Salem Feb. 20, 1840 - all returned except the 2nd & 3rd mates and 1 seaman left and the boy is dead."
S6476E,Reaper,Brig,Indian Ocean Whaling,04/23/1839,1839-04-23,NULL,"18828, 18829, 18830, 18831","Certified Salem Sept. 14, 1842 - all returned except 8 crew left and drowned."
S6477E,Republic,Ship,Liverpool,04/22/1839,1839-04-22,NULL,"18832, 18833, 18834","of New York
Oct. 1839 (return?)"
S6478E,Richard,Bark,Montevideo & a market,04/10/1839,1839-04-10,NULL,"18835, 18836",NULL
S6479E,Richmond,Brig,East Indies,11/23/1839,1839-11-23,NULL,"18837, 18838, 18839, 18840","Certified Salem Oct. 14, 1840 - all returned but 1"
S6480E,Romp,Brig,Cayenne,03/26/1839,1839-03-26,NULL,"18841, 18842, 18845, 18846",NULL
S6481E,Romp,Brig,West Indies,12/14/1839,1839-12-14,NULL,"18843, 18844, 18847, 18848","Certified Salem- all returned March 13, 1840"
S6482E,Roxana,Brig,Maranham & a market,06/10/1839,1839-06-10,NULL,"18849, 18850, 18851, 18852, 18853",NULL
S6483E,Roxana,Brig,Maranham & a market,12/19/1839,1839-12-19,NULL,"18854, 18855, 18856, 18857, 18858","Certified Salem, April, 4 180"
S6484E,St. Paul,Ship,Manila,05/25/1839,1839-05-25,NULL,"18859, 18860, 18861, 18862",NULL
S6485E,Salem,Brig,Surinam,06/26/1839,1839-06-26,NULL,"18863, 18864","Certified Surinam Dec. 5, 1839
of New York?
Certified Wilmington N.C. June 26, 1839
Certified Nieuw Amsterdam July 27, 1839

Certified Salem Jan, 11, 1840"
S6486E,Salem,Brig,Surinam,01/21/1839,1839-01-21,NULL,"18865, 18866","Certified Surinam April 6, 1839
Certified Wilmington, NC Jan. 7, 1839
Certified Niew Amsterdam Feb. 16, 1839
Certified Salem May 7, 1839"
S6487E,Samuel Wright,Ship,Atlantic & Pacific Oceans on a whaling voyage,05/10/1839,1839-05-10,NULL,"18867, 18868","
[Used as a whaler, 1833-34. Cast away on New Holland, July 8 1840]-Salem Ship Registers 1789-1900"
S6488E,Sciot,Brig,Brazil & a market,01/23/1839,1839-01-23,NULL,"18869, 18870, 18871, 18872, 18873, 18874","Crew discharged at Montevideo May 28, 1839
[""Sold at Montivedeo, 1839""- Salem Ship Registers 1789-1900]"
S6489E,Sapphire,Ship,Pacific Ocean on a Whaling Voyage,11/27/1839,1839-11-27,NULL,"18875, 18876",NULL
S6490E,Sea Mew,Ship,Africa,02/15/1839,1839-02-15,NULL,"18877, 18878",NULL
S6491E,Sea Mew,Ship,Africa,11/15/1839,1839-11-15,NULL,"18879, 18880, 18881, 18882","Certified in Portugal
Certified Salem June 15, 1840 all returned but 2"
S6492E,Sea Mew,Ship,Buenos Ayres,02/13/1839,1839-02-13,NULL,"18883, 18884","Certified in Montevideo May 15, 1839 with 2 deserted and 3 shipped in their place.
Certified Salem June 30, 1839 all returned with exceptions"
S6493E,Susan,Brig,West Indies,03/26/1839,1839-03-26,NULL,"18885, 18886, 18887, 18888",NULL
S6494E,Susan,Brig,Cayenne,09/17/1839,1839-09-17,NULL,"18889, 18890",NULL
S6495E,Thetis,Schooner,Sydney,07/05/1839,1839-07-05,NULL,"18891, 18892",NULL
S6496E,Thetis,Schooner,Sydney,08/06/1839,1839-08-06,NULL,"18893, 18894","of Manchester
hard to read"
S6497E,Thetis,Schooner,Sydney,06/08/1839,1839-06-08,NULL,"18895, 18896",Certified Salem - all returned Sept. 5 1839
S6498E,Thetis,Schooner,Sydney,07/05/1839,1839-07-05,NULL,"18897, 18898",NULL
S6499E,Tigris,Brig,Africa,11/27/1839,1839-11-27,NULL,"18899, 18900, 18901, 18902",NULL
S6500E,Waverly,Brig,Bombay,03/29/1839,1839-03-29,NULL,"18903, 18904",NULL
S6501E,William Goddard,Ship,Liverpool,08/16/1839,1839-08-16,NULL,"18905, 18906, 18907, 18908","of Boston
Certified Liverpool Oct. 22 1839, all deserted(13) except 5*,was forced to ship part foreign crew in their places
Certified Liverpool Dec 13, 1839 that 3 of the remaining 5 deserted in Liverpool"
S6502E,William & Henry,Ship,Sumatra,11/30/1839,1839-11-30,NULL,"18909, 18910, 18911, 18912",NULL
S6503E,Active,Bark,Africa,09/07/1840,1840-09-07,NULL,"18914, 18915, 18916, 18917","Certified Salem May 31, 1840 all returned but 1"
S6504E,Angelia,Schooner,"Windsor, N.S.",04/24/1840,1840-04-24,NULL,"18918, 18919",of Portland
S6505E,Bengal,Ship,"Atlantic, Indian & Pacific Oceans on a Whaling vo",07/24/1840,1840-07-24,NULL,"18920, 18921",NULL
S6506E,Boxer,Brig,Para & a Market,11/11/1840,1840-11-11,NULL,"18925, 18926, 18927, 18928","Certified Para Jan 6, 1841 that 1 deserted
Certified Salem Jan. 31, 1841"
S6507E,Brazil,Bark,Matanzas,01/11/1840,1840-01-11,NULL,"18923, 18924, 18929, 18930",NULL
S6508E,Brookline,Ship,Manila,11/08/1840,1840-11-08,NULL,"18931, 18932, 18933, 18934","Certified Salem Nov. 22, 1842 all returned"
S6509E,Caroline Augusta,Ship,Sumatra,11/14/1840,1840-11-14,NULL,"18935, 18936",NULL
S6510E,Carthage,Ship,Calcutta,07/29/1840,1840-07-29,NULL,"18937, 18938, 18939, 18940","hard to read - ranks illegible
Certified Boston, June 1941"
S6511E,Cavalier,Bark,Zanzibar,09/09/1840,1840-09-09,NULL,"18941, 18942, 18943","Certified Salem,all returned Nov.26, 1841"
S6512E,Chalcedony,Bark,Montevideo & a market,07/31/1840,1840-07-31,NULL,"18944, 18945","Certified (Spanish/Portugese) Nov.14, 1840
Certified Salem April 11, 1841"
S6513E,Chalcedony,Bark,Montevideo & a market,07/04/1840,1840-07-04,NULL,"18946, 18947, 18948, 18949","Certified Salem,July 18 1841"
S6514E,Chalcedony,Bark,Montevideo & a market,07/31/1840,1840-07-31,NULL,"18950, 18951",NULL
S6515E,Charles,Brig,Pictou,07/06/1840,1840-07-06,NULL,"18952, 18953, 18954, 18955","
Certified Salem Aug. 9, 1840 with 3 added*"
S6516E,Charles,Brig,Pictou,08/27/1840,1840-08-27,216,"18956, 18957, 18958, 18959",NULL
S6517E,Cherokee,Brig,Zanzibar,02/20/1840,1840-02-20,NULL,"18960, 18961, 18962, 18663",NULL
S6518E,Cipher,Brig,Africa,05/05/1840,1840-05-05,NULL,"18964, 18965, 18966, 18967",NULL
S6519E,Cipher,Brig,Africa,12/26/1840,1840-12-26,NULL,"18968, 18969, 18970, 18971, 18972","""Ship sold in Africa 1941"" - Salem Ship Registers 1789-1900
Master Dayley and crew transferred April 14th 1841.
Additionl crew on another list (added)*"
S6520E,Constitution,Schooner,"Bridgeport, N.S.",07/17/1840,1840-07-17,NULL,"19006, 19007",NULL
S6521E,Cowper,Bark,Montevideo and a Market,09/05/1840,1840-09-05,NULL,"19008, 19009",NULL
